A1: mile | B1: leg | C1: KILL-O-METER ROUTE SHEET approximately 5000' of climbing | D1: KM | E1: delta
A2: 0 | B2: 0.0 | C2: CONTROL #1 Mark Thomas' House Open: 06:45 Close 07:45 | D2: =A2/0.621 -> 0.0 | E2: =B2/0.621 -> 0.0
A3: =SUM(A2+B3) -> 0.0 | B3: 0.0 | C3: 425-702-8880 13543 160th Ave NE, Redmond, WA 98052 | D3: =A3/0.621 -> 0.0 | E3: =B3/0.621 -> 0.0
A4: =SUM(A3+B4) -> 0.0 | B4: 0.0 | C4: Depart South on 160th Ave NE | D4: =A4/0.621 -> 0.0 | E4: =B4/0.621 -> 0.0
A5: =SUM(A4+B5) -> 00.2 | B5: 00.2 | C5: Bear RIGHT (West) onto NE 133rd St | D5: =A5/0.621 -> 0.32206119162640906 | E5: =B5/0.621 -> 0.32206119162640906
A6: =SUM(A5+B6) -> 00.3 | B6: 00.1 | C6: Turn LEFT (South) onto 158th Ave NE | D6: =A6/0.621 -> 0.48309178743961362 | E6: =B6/0.621 -> 0.16103059581320453
A7: =SUM(A6+B7) -> 00.3 | B7: 0.0 | C7: Turn RIGHT (West) onto NE 132nd St | D7: =A7/0.621 -> 0.48309178743961362 | E7: =B7/0.621 -> 0.0
A8: =SUM(A7+B8) -> 00.4 | B8: 00.1 | C8: Bear LEFT (West) onto 156th Ave NE | D8: =A8/0.621 -> 0.64412238325281812 | E8: =B8/0.621 -> 0.16103059581320453
A9: =SUM(A8+B9) -> 00.7 | B9: 00.3 | C9: LT (South) onto SR-202 [Woodinville Redmond Rd NE] | D9: =A9/0.621 -> 1.1272141706924315 | E9: =B9/0.621 -> 0.48309178743961351
A10: =SUM(A9+B10) -> 3.8 | B10: 3.1 | C10: LT (East) onto Cleveland St (SR-202 -- Redmond Way) (one way) | D10: =A10/0.621 -> 6.119162640901771 | E10: =B10/0.621 -> 4.9919484702093397
A11: =SUM(A10+B11) -> 4.0 | B11: 00.2 | C11: Bear RT Cleveland becomes Redmond Way (SR-202) | D11: =A11/0.621 -> 6.4412238325281805 | E11: =B11/0.621 -> 0.32206119162640906
A12: =SUM(A11+B12) -> 5.0 | B12: 1.0 | C12: RT (South-East) onto E Lake Sammamish Pky (NE) (Becomes E lk Sam. SE) | D12: =A12/0.621 -> 8.0515297906602257 | E12: =B12/0.621 -> 1.6103059581320451
A13: =SUM(A12+B13) -> 15.1 | B13: 10.1 | C13: LT (North-East) onto SE Issaquah Fall City Rd | D13: =A13/0.621 -> 24.315619967793879 | E13: =B13/0.621 -> 16.264090177133657
A14: =SUM(A13+B14) -> 15.1 | B14: 0.0 | C14: CONTROL #2 ISSAQUAH--OPEN OPEN: 07:27 CLOSE: 08:21 | D14: =A14/0.621 -> 24.315619967793879 | E14: =B14/0.621 -> 0.0
A15: =SUM(A14+B15) -> 16.2 | B15: 1.1 | C15: RT (Northeast) to continue on SE Issaquah-Fall City Rd | D15: =A15/0.621 -> 26.086956521739129 | E15: =B15/0.621 -> 1.7713365539452497
A16: =SUM(A15+B16) -> 18.1 | B16: 1.9 | C16: RT (East) to continue on SE Issaquah-Fall City Rd Just after Endeavor school | D16: =A16/0.621 -> 29.146537842190014 | E16: =B16/0.621 -> 3.0595813204508855
A17: =SUM(A16+B17) -> 20.8 | B17: 2.7 | C17: Straight thru to continue (East) on SE 40th St | D17: =A17/0.621 -> 33.49436392914653 | E17: =B17/0.621 -> 4.3478260869565224
A18: =SUM(A17+B18) -> 21.3 | B18: 0.5 | C18: Bear LEFT (North-East) onto 308th Ave SE | D18: =A18/0.621 -> 34.299516908212553 | E18: =B18/0.621 -> 0.80515297906602257
C19: Route Change Detour the Tolt River Bridge is closed | D19: =A19/0.621 -> 0.0 | E19: =B19/0.621 -> 0.0
A20: =SUM(A18+B20) -> 21.7 | B20: 00.4 | C20: RT onto SR-202 also named SE Redmond-Fall City Rd Se | D20: =A20/0.621 -> 34.943639291465374 | E20: =B20/0.621 -> 0.64412238325281812
A21: =SUM(A20+B21) -> 23.9 | B21: 2.2 | C21: BR LT and X Snoqualmie River to continue on SR-202 (at Fall City -services) | D21: =A21/0.621 -> 38.486312399355867 | E21: =B21/0.621 -> 3.5426731078904994
A22: =SUM(A21+B22) -> 24.0 | B22: 00.1 | C22: LT onto SR-203 also named Fall City-Carnation Rd SE | D22: =A22/0.621 -> 38.647342995169076 | E22: =B22/0.621 -> 0.16103059581320453
A23: =SUM(A22+B23) -> 24.1 | B23: 00.1 | C23: LT onto Neal Rd SE | D23: =A23/0.621 -> 38.808373590982285 | E23: =B23/0.621 -> 0.16103059581320453
A24: =SUM(A23+B24) -> 26.9 | B24: 2.8 | C24: LT onto SR-203 also named Fall City-Carnation Rd SE | D24: =A24/0.621 -> 43.31723027375201 | E24: =B24/0.621 -> 4.5088566827697258
A25: =SUM(A24+B25) -> 30.6 | B25: 3.7 | C25: CONTROL #3 CARNATION OPEN: 8:11 CLOSE: 10:01 | D25: =A25/0.621 -> 49.275362318840578 | E25: =B25/0.621 -> 5.9581320450885675
A26: =SUM(A25+B26) -> 30.6 | B26: 0.0 | C26: Sandy's Espresso | D26: =A26/0.621 -> 49.275362318840578 | E26: =B26/0.621 -> 0.0
A27: =SUM(A26+B27) -> 30.6 | B27: 0.0 | C27: RT out of Sandy's to continue North on SR-203 (Tolt Ave) | D27: =A27/0.621 -> 49.275362318840578 | E27: =B27/0.621 -> 0.0
A28: =SUM(A27+B28) -> 31.3 | B28: 00.7 | C28: LEFT (West) onto NE 60th St | D28: =A28/0.621 -> 50.402576489533004 | E28: =B28/0.621 -> 1.1272141706924315
A29: =SUM(A28+B29) -> 31.9 | B29: 00.6 | C29: Bear RT continue on 310th Ave NE | D29: =A29/0.621 -> 51.368760064412236 | E29: =B29/0.621 -> 0.96618357487922701
A30: =SUM(A29+B30) -> 32.3 | B30: 00.4 | C30: LT (West) onto NE Carnation Farm Rd | D30: =A30/0.621 -> 52.012882447665049 | E30: =B30/0.621 -> 0.64412238325281812
A31: =SUM(A30+B31) -> 34.4 | B31: 2.1 | C31: RIGHT (North) onto 284th Ave NE | D31: =A31/0.621 -> 55.394524959742348 | E31: =B31/0.621 -> 3.381642512077295
A32: =SUM(A31+B32) -> 34.9 | B32: 0.5 | C32: LT (West) onto NE 100th St | D32: =A32/0.621 -> 56.199677938808371 | E32: =B32/0.621 -> 0.80515297906602257
A33: =SUM(A32+B33) -> 36.3 | B33: 1.4 | C33: RT (North-West) onto W Snoqualmie Valley Rd NE | D33: =A33/0.621 -> 58.45410628019323 | E33: =B33/0.621 -> 2.2544283413848629
A34: =SUM(A33+B34) -> 37.8 | B34: 1.5 | C34: ST to continue W Snoqualmie Valley Rd NE X Novelty Hill Rd | D34: =A34/0.621 -> 60.869565217391298 | E34: =B34/0.621 -> 2.4154589371980677
A35: =SUM(A34+B35) -> 40.8 | B35: 3.0 | C35: ST to continue W Snoqualmie Valley Rd NE X Woodinville Duvall Rd | D35: =A35/0.621 -> 65.700483091787433 | E35: =B35/0.621 -> 4.8309178743961354
A36: =SUM(A35+B36) -> 43.1 | B36: 2.3 | C36: X King-Snohomish Co. line--W Snoqualmie Valley Rd becomes High Bridge Rd | D36: =A36/0.621 -> 69.404186795491128 | E36: =B36/0.621 -> 3.7037037037037033
A37: =SUM(A36+B37) -> 45.1 | B37: 2.0 | C37: RT (East) onto Crescent Lake Rd (and X Snoqualmie River) | D37: =A37/0.621 -> 72.624798711755219 | E37: =B37/0.621 -> 3.2206119162640903
A38: =SUM(A37+B38) -> 46.2 | B38: 1.1 | C38: Continue (North) Crecent Lake Rd becomes Tualco Rd | D38: =A38/0.621 -> 74.39613526570048 | E38: =B38/0.621 -> 1.7713365539452497
A39: =SUM(A38+B39) -> 48.2 | B39: 2.0 | C39: LT (North) onto SR-203 a 'T' intersection | D39: =A39/0.621 -> 77.61674718196457 | E39: =B39/0.621 -> 3.2206119162640903
A40: =SUM(A39+B40) -> 48.8 | B40: 00.6 | C40: RT (East) onto Ben Howard Rd | D40: =A40/0.621 -> 78.582930756843794 | E40: =B40/0.621 -> 0.96618357487922701
A41: =SUM(A40+B41) -> 57.1 | B41: 8.3 | C41: LT (North) onto 311th Ave SE at Stop Sign | D41: =A41/0.621 -> 91.94847020933976 | E41: =B41/0.621 -> 13.365539452495975
A42: =SUM(A41+B42) -> 57.9 | B42: 00.8 | C42: LT (West) onto US-2 | D42: =A42/0.621 -> 93.236714975845402 | E42: =B42/0.621 -> 1.2882447665056362
A43: =SUM(A42+B43) -> 58.7 | B43: 00.8 | C43: Rt (North) onto Old Owen Road At Stop Light | D43: =A43/0.621 -> 94.524959742351029 | E43: =B43/0.621 -> 1.2882447665056362
A44: =SUM(A43+B44) -> 58.7 | B44: 0.0 | C44: CONTROL #4 SULTAN-ARCO AM/PM OPEN: 09:31 CLOSE: 13:01 | D44: =A44/0.621 -> 94.524959742351029 | E44: =B44/0.621 -> 0.0
A45: =SUM(A44+B45) -> 58.7 | B45: 0.0 | C45: RT (North) onto Old Owen Rd out of control | D45: =A45/0.621 -> 94.524959742351029 | E45: =B45/0.621 -> 0.0
A46: =SUM(A45+B46) -> 59.3 | B46: 00.6 | C46: RT (North) onto Reiner Rd | D46: =A46/0.621 -> 95.491143317230254 | E46: =B46/0.621 -> 0.96618357487922701
A47: =SUM(A46+B47) -> 62.5 | B47: 3.2 | C47: Bear LT onto Old Pipeline Rd just after Top of Steep Hill | D47: =A47/0.621 -> 100.64412238325281 | E47: =B47/0.621 -> 5.152979066022545
A48: =SUM(A47+B48) -> 65.7 | B48: 3.2 | C48: RT (North-West) onto Bollenbaugh Hill Rd at "T" intersection | D48: =A48/0.621 -> 105.79710144927535 | E48: =B48/0.621 -> 5.152979066022545
A49: =SUM(A48+B49) -> 66.6 | B49: 00.9 | C49: RT (North) onto Woods Creek Rd at "T" intersection | D49: =A49/0.621 -> 107.24637681159419 | E49: =B49/0.621 -> 1.4492753623188406
A50: =SUM(A49+B50) -> 71.6 | B50: 5.0 | C50: RT (North) onto Lake Roesiger Rd | D50: =A50/0.621 -> 115.29790660225441 | E50: =B50/0.621 -> 8.0515297906602257
A51: =SUM(A50+B51) -> 71.6 | C51: 2001 route revision | D51: =A51/0.621 -> 115.29790660225441 | E51: =B51/0.621 -> 0.0
A52: =SUM(A51+B52) -> 71.8 | B52: 00.2 | C52: LT onto SW Lake Roesiger Rd (STAY on West side of Lake) | D52: =A52/0.621 -> 115.61996779388083 | E52: =B52/0.621 -> 0.32206119162640906
A53: =SUM(A52+B53) -> 74.7 | B53: 2.9 | C53: LT onto N Lake Roesiger Rd | D53: =A53/0.621 -> 120.28985507246378 | E53: =B53/0.621 -> 4.6698872785829311
A54: =SUM(A53+B54) -> 75.55 | B54: 00.85 | C54: Bear RT (north) Lake Roesiger Rd becomes Menzel Lake Rd | D54: =A54/0.621 -> 121.65861513687601 | E54: =B54/0.621 -> 1.3687600644122382
A55: =SUM(A54+B55) -> 81.45 | B55: 5.9 | C55: RT onto S Alder Ave (Mtn Loop Hwy) Immediately past Granite Falls City Limit Sign | D55: =A55/0.621 -> 131.15942028985509 | E55: =B55/0.621 -> 9.5008051529790674
A56: =SUM(A55+B56) -> 81.65 | B56: 00.2 | C56: LT (West) onto E Stanley St a four way stop | D56: =A56/0.621 -> 131.4814814814815 | E56: =B56/0.621 -> 0.32206119162640906
A57: =SUM(A56+B57) -> 81.65 | B57: 0.0 | C57: GRANITE FALLS--SERVICES | D57: =A57/0.621 -> 131.4814814814815 | E57: =B57/0.621 -> 0.0
A58: =SUM(A57+B58) -> 82.55 | B58: 00.9 | C58: RT (North) onto Jordan Rd At Stop Light just after Chevron/McDonalds | D58: =A58/0.621 -> 132.93075684380034 | E58: =B58/0.621 -> 1.4492753623188406
A59: =SUM(A58+B59) -> 82.85 | B59: 00.3 | C59: LT (West) onto 100th St NE -- Burn Rd | D59: =A59/0.621 -> 133.41384863123994 | E59: =B59/0.621 -> 0.48309178743961351
A60: =SUM(A59+B60) -> 85.35 | B60: 2.5 | C60: Bear LT onto 116th St NE (Burn Rd) | D60: =A60/0.621 -> 137.43961352657007 | E60: =B60/0.621 -> 4.0257648953301128
A61: =SUM(A60+B61) -> 92.05 | B61: 6.7 | C61: RT onto Burn Rd towards Arlington at "T" intersection | D61: =A61/0.621 -> 148.22866344605478 | E61: =B61/0.621 -> 10.789049919484702
A62: =SUM(A61+B62) -> 93.65 | B62: 1.6 | C62: LT onto 207th St NE at stop sign just after Arlington City Limit | D62: =A62/0.621 -> 150.80515297906604 | E62: =B62/0.621 -> 2.5764895330112725
A63: =SUM(A62+B63) -> 93.85 | B63: 00.2 | C63: continue 207th St NE becomes 204th St NE | D63: =A63/0.621 -> 151.12721417069244 | E63: =B63/0.621 -> 0.32206119162640906
A64: =SUM(A63+B64) -> 94.15 | B64: 00.3 | C64: CONTROL #5 - ARLINGTON -- CHEVRON-MCDONALDS | D64: =A64/0.621 -> 151.61030595813205 | E64: =B64/0.621 -> 0.48309178743961351
A65: =SUM(A64+B65) -> 94.15 | B65: 0.0 | C65: OPEN: 11:13 CLOSE: 16:53 | D65: =A65/0.621 -> 151.61030595813205 | E65: =B65/0.621 -> 0.0
A66: =SUM(A65+B66) -> 94.15 | B66: 0.0 | C66: RT out of control | D66: =A66/0.621 -> 151.61030595813205 | E66: =B66/0.621 -> 0.0
A67: =SUM(A66+B67) -> 94.15 | B67: 0.0 | C67: LT onto SR-9 | D67: =A67/0.621 -> 151.61030595813205 | E67: =B67/0.621 -> 0.0
A68: =SUM(A67+B68) -> 114.25 | B68: 20.1 | C68: LT (East) onto Airport Way at Stop Light (108th SE-- Marsh Rd) | D68: =A68/0.621 -> 183.97745571658615 | E68: =B68/0.621 -> 32.367149758454111
A69: =SUM(A68+B69) -> 114.25 | B69: 0.0 | C69: Turn RIGHT (South) onto Springhetti Rd | D69: =A69/0.621 -> 183.97745571658615 | E69: =B69/0.621 -> 0.0
A70: =SUM(A69+B70) -> 116.25 | B70: 2.0 | C70: LT (South) onto Broadway Ave at "T" intersection | D70: =A70/0.621 -> 187.19806763285024 | E70: =B70/0.621 -> 3.2206119162640903
A71: =SUM(A70+B71) -> 120.95 | B71: 4.7 | C71: Bear LT onto Yew Way | D71: =A71/0.621 -> 194.76650563607086 | E71: =B71/0.621 -> 7.5684380032206127
A72: =SUM(A71+B72) -> 120.95 | B72: 0.0 | C72: X BAD TRACKS to continue Yew Way (south) | D72: =A72/0.621 -> 194.76650563607086 | E72: =B72/0.621 -> 0.0
A73: =SUM(A72+B73) -> 121.25 | B73: 00.3 | C73: Continue ST (South) on SR-524 [Yew Way] at stop sign near Maltby | D73: =A73/0.621 -> 195.24959742351047 | E73: =B73/0.621 -> 0.48309178743961351
A74: =SUM(A73+B74) -> 121.45 | B74: 00.2 | C74: LT (East) onto Paradise Lake Rd At Stop Sign (unmarked due to construction) | D74: =A74/0.621 -> 195.57165861513687 | E74: =B74/0.621 -> 0.32206119162640906
A75: =SUM(A74+B75) -> 121.55 | B75: 00.1 | C75: X SR-522 at the light continue on Paradise Lake Rd (197th NE) | D75: =A75/0.621 -> 195.73268921095007 | E75: =B75/0.621 -> 0.16103059581320453
A76: =SUM(A75+B76) -> 121.55 | B76: 0.0 | C76: CONTROL #6 MALTBY--CHEVRON OPEN: 12:31 CLOSE: 19:49 | D76: =A76/0.621 -> 195.73268921095007 | E76: =B76/0.621 -> 0.0
A77: =SUM(A76+B77) -> 121.55 | B77: 0.0 | C77: RT out of control to continue (South) on Paradise Lake Rd | D77: =A77/0.621 -> 195.73268921095007 | E77: =B77/0.621 -> 0.0
A78: =SUM(A77+B78) -> 121.55 | B78: 0.0 | C78: Cont. Paradise Lake rd (also named 197th NE, NE 202nd pl, 194th Ave NE, 204th NE) | D78: =A78/0.621 -> 195.73268921095007 | E78: =B78/0.621 -> 0.0
A79: =SUM(A78+B79) -> 126.35 | B79: 4.8 | C79: RT (West) onto NE Woodinville Duvall Rd | D79: =A79/0.621 -> 203.46215780998389 | E79: =B79/0.621 -> 7.7294685990338161
A80: =SUM(A79+B80) -> 127.05 | B80: 00.7 | C80: LT (South) onto Avondale Rd NE | D80: =A80/0.621 -> 204.58937198067633 | E80: =B80/0.621 -> 1.1272141706924315
A81: =SUM(A80+B81) -> 127.55 | B81: 0.5 | C81: RT onto NE 165th Street at Signal Light | D81: =A81/0.621 -> 205.39452495974234 | E81: =B81/0.621 -> 0.80515297906602257
A82: =SUM(A81+B82) -> 128.85 | B82: 1.3 | C82: Bear RIGHT (North) onto 174th Ave NE | D82: =A82/0.621 -> 207.48792270531399 | E82: =B82/0.621 -> 2.0933977455716586
A83: =SUM(A82+B83) -> 128.95 | B83: 00.1 | C83: Continue (North) on 172nd Pl NE | D83: =A83/0.621 -> 207.64895330112719 | E83: =B83/0.621 -> 0.16103059581320453
A84: =SUM(A83+B84) -> 129.05 | B84: 00.1 | C84: LT (South-West) onto 171st Pl NE | D84: =A84/0.621 -> 207.80998389694039 | E84: =B84/0.621 -> 0.16103059581320453
A85: =SUM(A84+B85) -> 129.45 | B85: 00.4 | C85: RT (South-West) onto NE 163rd Pl | D85: =A85/0.621 -> 208.45410628019323 | E85: =B85/0.621 -> 0.64412238325281812
A86: =SUM(A85+B86) -> 129.55 | B86: 00.1 | C86: Continue (West) on NE 160th Pl | D86: =A86/0.621 -> 208.6151368760064 | E86: =B86/0.621 -> 0.16103059581320453
A87: =SUM(A86+B87) -> 129.75 | B87: 00.2 | C87: LT (South-East) onto NE 160th St @ "T" intersection @ top of very steep Hill | D87: =A87/0.621 -> 208.93719806763281 | E87: =B87/0.621 -> 0.32206119162640906
A88: =SUM(A87+B88) -> 129.75 | B88: 0.0 | C88: continue (south) NE 160th St becomes 168th Ave NE | D88: =A88/0.621 -> 208.93719806763281 | E88: =B88/0.621 -> 0.0
A89: =SUM(A88+B89) -> 130.75 | B89: 1.0 | C89: CONTINUE STRAIGHT THRU (South)168th Ave NE past "NO OUTLET SIGN" | D89: =A89/0.621 -> 210.54750402576485 | E89: =B89/0.621 -> 1.6103059581320451
A90: =SUM(A89+B90) -> 131.25 | B90: 0.5 | C90: go through Barrier | D90: =A90/0.621 -> 211.35265700483086 | E90: =B90/0.621 -> 0.80515297906602257
A91: =SUM(A90+B91) -> 131.35 | B91: 00.1 | C91: RT (West) onto NE 135th Place | D91: =A91/0.621 -> 211.51368760064406 | E91: =B91/0.621 -> 0.16103059581320453
A92: =SUM(A91+B92) -> 131.35 | B92: 0.0 | C92: RT (West) onto NE 135th Street "VERY EASY TO MISS" | D92: =A92/0.621 -> 211.51368760064406 | E92: =B92/0.621 -> 0.0
A93: =SUM(A92+B93) -> 131.75 | B93: 00.4 | C93: Turn RIGHT (North) onto 160th Ave NE | D93: =A93/0.621 -> 212.1578099838969 | E93: =B93/0.621 -> 0.64412238325281812
A94: =SUM(A93+B94) -> 131.75 | B94: 0.0 | C94: FINISH--CONTROL #7 OPEN: 12:38 CLOSE: 20:15 | D94: =A94/0.621 -> 212.1578099838969 | E94: =B94/0.621 -> 0.0
A95: =SUM(A94+B95) -> 131.75 | B95: 0.0 | C95: Arrive Mark's House 13543 160th Ave NE, Redmond, WA 98052 | D95: =A95/0.621 -> 212.1578099838969 | E95: =B95/0.621 -> 0.0
C96: Emergency Number Mark's Home (425) 702-8880
C97: Emergency Number Mark's Cell (206) 612-4700

B2: legend ST-Straight Through RT-Right Turn LT-Left Turn X -Cross Bold or Italic--helpful information (hopefully) St-Street Pl-Place