A1: Seattle Randonneurs 200 km Brevet
A2: Renton-Eatonville
A4: Created By: | D4: Greg Cox
A5: Verified By: | D5: Greg Cox
A6: Year(s) Used: | D6: 2000.0
A7: Conversion(Mi-Km) | D7: 1.609
A9: Miles | C9: Km
A10: Total | B10: Leg | C10: Total | D10: Leg | E10: Ctrl | F10: Instructions
A11: 0.0 | B11: 0.0 | C11: =+A11*$D$7 -> 0.0 | D11: =+B11*$D$7 -> 0.0 | E11: #1 | F11: Start at Greg Cox's house
A12: =+A11+B12 -> 0.0 | B12: 0.0 | C12: =+A12*$D$7 -> 0.0 | D12: =+B12*$D$7 -> 0.0 | F12: (N) 144th Ave SE
A13: =+A12+B13 -> 00.2 | B13: 00.2 | C13: =+A13*$D$7 -> 0.32180000000000003 | D13: =+B13*$D$7 -> 0.32180000000000003 | F13: R (E) SE 240th
A14: =+A13+B14 -> 0.5 | B14: 00.3 | C14: =+A14*$D$7 -> 0.80449999999999999 | D14: =+B14*$D$7 -> 0.48269999999999996 | F14: L (N) Hard left at the bottom of the hill onto 148th Ave SE
A15: =+A14+B15 -> 00.6 | B15: 00.1 | C15: =+A15*$D$7 -> 0.96539999999999992 | D15: =+B15*$D$7 -> 0.16090000000000002 | F15: R (W) Quick right onto the Soos Creek Trail
A16: =+A15+B16 -> 00.9 | B16: 00.3 | C16: =+A16*$D$7 -> 1.4480999999999999 | D16: =+B16*$D$7 -> 0.48269999999999996 | F16: ST Crosses SE 240th
A17: =+A16+B17 -> 2.8 | B17: 1.9 | C17: =+A17*$D$7 -> 4.5051999999999994 | D17: =+B17*$D$7 -> 3.0570999999999997 | F17: L(S) 148th Ave SE
A18: =+A17+B18 -> 3.3 | B18: 0.5 | C18: =+A18*$D$7 -> 5.3096999999999994 | D18: =+B18*$D$7 -> 0.80449999999999999 | F18: ST (S) 152nd Ave SE (Turns into Kent Black Diamond Road)
A19: =+A18+B19 -> 11.6 | B19: 8.3 | C19: =+A19*$D$7 -> 18.664400000000001 | D19: =+B19*$D$7 -> 13.354700000000001 | F19: R (SE) Morgan Street
A20: =+A19+B20 -> 12.3 | B20: 00.7 | C20: =+A20*$D$7 -> 19.790700000000001 | D20: =+B20*$D$7 -> 1.1262999999999999 | E20: #2 | F20: Black Diamond Bakery
A21: =+A20+B21 -> 12.3 | B21: 0.0 | C21: =+A21*$D$7 -> 19.790700000000001 | D21: =+B21*$D$7 -> 0.0 | F21: L(N) Re-trace on Railroad Ave
A22: =+A21+B22 -> 12.4 | B22: 00.1 | C22: =+A22*$D$7 -> 19.951599999999999 | D22: =+B22*$D$7 -> 0.16090000000000002 | F22: R(E) Baker St
A23: =+A22+B23 -> 12.5 | B23: 00.1 | C23: =+A23*$D$7 -> 20.112500000000001 | D23: =+B23*$D$7 -> 0.16090000000000002 | F23: L(N) 3rd Ave. (Hwy 169)
A24: =+A23+B24 -> 13.1 | B24: 00.6 | C24: =+A24*$D$7 -> 21.0779 | D24: =+B24*$D$7 -> 0.96539999999999992 | F24: R(NE) Black Diamond Ravensdale Rd
A25: =+A24+B25 -> 16.6 | B25: 3.5 | C25: =+A25*$D$7 -> 26.709400000000002 | D25: =+B25*$D$7 -> 5.6315 | F25: ST Onto Landsburg RD SE (Crosses SE Kent Kangly Rd.)
A26: =+A25+B26 -> 21.2 | B26: 4.6 | C26: =+A26*$D$7 -> 34.110800000000005 | D26: =+B26*$D$7 -> 7.4013999999999998 | E26: #3 | F26: R Hobart Market
A27: =+A26+B27 -> 21.2 | B27: 0.0 | C27: =+A27*$D$7 -> 34.110800000000005 | D27: =+B27*$D$7 -> 0.0 | F27: L Re-trace on 276th Ave SE
A28: =+A27+B28 -> 25.8 | B28: 4.6 | C28: =+A28*$D$7 -> 41.512200000000007 | D28: =+B28*$D$7 -> 7.4013999999999998 | F28: L (E) Kent Kangly Rd
A29: =+A28+B29 -> 26.9 | B29: 1.1 | C29: =+A29*$D$7 -> 43.282100000000007 | D29: =+B29*$D$7 -> 1.7699 | F29: R (S) Retreat Kanaskat RD
A30: =+A29+B30 -> 30.1 | B30: 3.2 | C30: =+A30*$D$7 -> 48.430900000000008 | D30: =+B30*$D$7 -> 5.1488000000000005 | F30: R (S) Cumberland Kanaskat RD
A31: =+A30+B31 -> 40.9 | B31: 10.8 | C31: =+A31*$D$7 -> 65.80810000000001 | D31: =+B31*$D$7 -> 17.377200000000002 | F31: ST Cross Hwy 410
A32: =+A31+B32 -> 41.0 | B32: 00.1 | C32: =+A32*$D$7 -> 65.969000000000008 | D32: =+B32*$D$7 -> 0.16090000000000002 | E32: #4 | F32: L Enumclaw
A33: =+A32+B33 -> 41.0 | B33: 0.0 | C33: =+A33*$D$7 -> 65.969000000000008 | D33: =+B33*$D$7 -> 0.0 | F33: L 284th Ave SE (Past King County Fairgrounds)
A34: =+A33+B34 -> 41.4 | B34: 00.4 | C34: =+A34*$D$7 -> 66.612600000000015 | D34: =+B34*$D$7 -> 0.64360000000000006 | F34: R (W) SE 456th St
A35: =+A34+B35 -> 43.2 | B35: 1.8 | C35: =+A35*$D$7 -> 69.508800000000008 | D35: =+B35*$D$7 -> 2.8961999999999999 | F35: L (S) Enumclaw-Buckley Rd (SR 410)
A36: =+A35+B36 -> 45.3 | B36: 2.1 | C36: =+A36*$D$7 -> 72.887700000000009 | D36: =+B36*$D$7 -> 3.3789000000000002 | F36: L (SW) Park Ave
A37: =+A36+B37 -> 45.4 | B37: 00.1 | C37: =+A37*$D$7 -> 73.048600000000008 | D37: =+B37*$D$7 -> 0.16090000000000002 | F37: R (S) River Ave
A38: =+A37+B38 -> 46.1 | B38: 00.7 | C38: =+A38*$D$7 -> 74.174900000000008 | D38: =+B38*$D$7 -> 1.1262999999999999 | F38: ST SR 165E
A39: =+A38+B39 -> 47.7 | B39: 1.6 | C39: =+A39*$D$7 -> 76.749300000000019 | D39: =+B39*$D$7 -> 2.5744000000000002 | F39: BR SR 162
A40: =+A39+B40 -> 49.8 | B40: 2.1 | C40: =+A40*$D$7 -> 80.128200000000021 | D40: =+B40*$D$7 -> 3.3789000000000002 | F40: BL SR 162
A41: =+A40+B41 -> 50.2 | B41: 00.4 | C41: =+A41*$D$7 -> 80.771800000000013 | D41: =+B41*$D$7 -> 0.64360000000000006 | F41: ST SR 162 (South Prairie)
A42: =+A41+B42 -> 56.6 | B42: 6.4 | C42: =+A42*$D$7 -> 91.069400000000016 | D42: =+B42*$D$7 -> 10.297600000000001 | F42: L (S) Orville Rd East (large sign says To Electron)
A43: =+A42+B43 -> 65.8 | B43: 9.2 | C43: =+A43*$D$7 -> 105.87220000000002 | D43: =+B43*$D$7 -> 14.8028 | F43: L (S) Orville Road East
A44: =+A43+B44 -> 74.7 | B44: 8.9 | C44: =+A44*$D$7 -> 120.19230000000003 | D44: =+B44*$D$7 -> 14.3201 | F44: L (S) SR 161
A45: =+A44+B45 -> 76.0 | B45: 1.3 | C45: =+A45*$D$7 -> 122.28400000000002 | D45: =+B45*$D$7 -> 2.0916999999999999 | E45: #5 | F45: Eatonville (Open)
A46: =+A45+B46 -> 76.0 | C46: =+A46*$D$7 -> 122.28400000000002 | D46: =+B46*$D$7 -> 0.0 | F46: Return on SR 161
A47: =+A46+B47 -> 77.3 | B47: 1.3 | C47: =+A47*$D$7 -> 124.37570000000002 | D47: =+B47*$D$7 -> 2.0916999999999999 | F47: R (N) Orville Road East
A48: =+A47+B48 -> 86.2 | B48: 8.9 | C48: =+A48*$D$7 -> 138.69580000000002 | D48: =+B48*$D$7 -> 14.3201 | F48: R (E) Orville Road East
A49: =+A48+B49 -> 95.4 | B49: 9.2 | C49: =+A49*$D$7 -> 153.49860000000004 | D49: =+B49*$D$7 -> 14.8028 | F49: R (E) SR 162 (S. Pioneer Way)
A50: =+A49+B50 -> 104.3 | B50: 8.9 | C50: =+A50*$D$7 -> 167.81870000000004 | D50: =+B50*$D$7 -> 14.3201 | F50: L SR 165
A51: =+A50+B51 -> 105.9 | B51: 1.6 | C51: =+A51*$D$7 -> 170.39310000000003 | D51: =+B51*$D$7 -> 2.5744000000000002 | F51: ST S. River Ave (Buckley)
A52: =+A51+B52 -> 106.6 | B52: 00.7 | C52: =+A52*$D$7 -> 171.51940000000005 | D52: =+B52*$D$7 -> 1.1262999999999999 | F52: L A Street (Buckly)
A53: =+A52+B53 -> 106.7 | B53: 00.1 | C53: =+A53*$D$7 -> 171.68030000000002 | D53: =+B53*$D$7 -> 0.16090000000000002 | F53: R (N) Enumclaw-Buckley Rd (SR 410)
A54: =+A53+B54 -> 107.8 | B54: 1.1 | C54: =+A54*$D$7 -> 173.45020000000002 | D54: =+B54*$D$7 -> 1.7699 | F54: L (N) 244th Ave SE (Careful at this intersection)
A55: =+A54+B55 -> 109.7 | B55: 1.9 | C55: =+A55*$D$7 -> 176.50730000000001 | D55: =+B55*$D$7 -> 3.0570999999999997 | F55: ST Cross Hwy 164
A56: =+A55+B56 -> 113.0 | B56: 3.3 | C56: =+A56*$D$7 -> 181.81700000000001 | D56: =+B56*$D$7 -> 5.3096999999999994 | F56: L (W) SE 384th St
A57: =+A56+B57 -> 113.5 | B57: 0.5 | C57: =+A57*$D$7 -> 182.62150000000003 | D57: =+B57*$D$7 -> 0.80449999999999999 | F57: BR (N) 236th Ave SE (Becomes Whitney Hill Rd)
A58: =+A57+B58 -> 115.8 | B58: 2.3 | C58: =+A58*$D$7 -> 186.32220000000001 | D58: =+B58*$D$7 -> 3.7006999999999999 | F58: R (N) 212th way SE
A59: =+A58+B59 -> 116.5 | B59: 00.7 | C59: =+A59*$D$7 -> 187.44850000000002 | D59: =+B59*$D$7 -> 1.1262999999999999 | F59: ST Cross SE Green Valley RD (Continue up 218th Ave SE)
A60: =+A59+B60 -> 117.9 | B60: 1.4 | C60: =+A60*$D$7 -> 189.70110000000003 | D60: =+B60*$D$7 -> 2.2525999999999997 | F60: L (W) Auburn Black Diamond Road
A61: =+A60+B61 -> 124.6 | B61: 6.7 | C61: =+A61*$D$7 -> 200.48140000000004 | D61: =+B61*$D$7 -> 10.7803 | F61: ST Cross Kent Kangly Road onto 152nd AVE SE
A62: =+A61+B62 -> 125.1 | B62: 0.5 | C62: =+A62*$D$7 -> 201.28590000000003 | D62: =+B62*$D$7 -> 0.80449999999999999 | F62: R (E) Onto Soos Creek Trail
A63: =+A62+B63 -> 127.0 | B63: 1.9 | C63: =+A63*$D$7 -> 204.34300000000005 | D63: =+B63*$D$7 -> 3.0570999999999997 | F63: ST Crosses SE 240th
A64: =+A63+B64 -> 127.3 | B64: 00.3 | C64: =+A64*$D$7 -> 204.82570000000004 | D64: =+B64*$D$7 -> 0.48269999999999996 | F64: L (S) 148th Ave SE
A65: =+A64+B65 -> 127.4 | B65: 00.1 | C65: =+A65*$D$7 -> 204.98660000000004 | D65: =+B65*$D$7 -> 0.16090000000000002 | F65: R (W) Hard Right to go up SE 240th
A66: =+A65+B66 -> 127.7 | B66: 00.3 | C66: =+A66*$D$7 -> 205.46930000000003 | D66: =+B66*$D$7 -> 0.48269999999999996 | F66: L (S) 144th Ave SE - Ridgefield
A67: =+A66+B67 -> 127.9 | B67: 00.2 | C67: =+A67*$D$7 -> 205.79110000000003 | D67: =+B67*$D$7 -> 0.32180000000000003 | F67: L (E) SE 243rd
A68: =+A67+B68 -> 128.0 | B68: 00.1 | C68: =+A68*$D$7 -> 205.95200000000006 | D68: =+B68*$D$7 -> 0.16090000000000002 | E68: #6 | F68: L (N) Finish Greg Cox's house