A1: Seattle Randonneurs 200 km Brevet
A2: Hood Canal - Bremerton to Bremerton
A4: Created By: | D4: John Wagner
A5: Verified By: | D5: John Wagner
A6: Year(s) Used: | D6: ???
A7: Conversion(Mi-Km) | D7: 1.609
A9: Miles | C9: Km
A10: Total | B10: Leg | C10: Total | D10: Leg | E10: Ctrl | F10: Instructions
A11: 0.0 | B11: 0.0 | C11: =+A11*$D$7 -> 0.0 | D11: =+B11*$D$7 -> 0.0 | E11: #1 | F11: Start - Bremerton Ferry Terminal turn r onto Washington Ave.
A12: =+A11+B12 -> 00.3 | B12: 00.3 | C12: =+A12*$D$7 -> 0.48269999999999996 | D12: =+B12*$D$7 -> 0.48269999999999996 | F12: L onto 6th St.
A13: =+A12+B13 -> 1.7 | B13: 1.4 | C13: =+A13*$D$7 -> 2.7353000000000001 | D13: =+B13*$D$7 -> 2.2525999999999997 | F13: BR, turns into Kitsap Way, SR 310 W
A14: =+A13+B14 -> 3.3 | B14: 1.6 | C14: =+A14*$D$7 -> 5.3096999999999994 | D14: =+B14*$D$7 -> 2.5744000000000002 | F14: R onto SR 3 N, head to Hood Canal Bridge
A15: =+A14+B15 -> 25.1 | B15: 21.8 | C15: =+A15*$D$7 -> 40.385899999999999 | D15: =+B15*$D$7 -> 35.0762 | F15: L onto SR 104 W, accross the bridge
A16: =+A15+B16 -> 36.3 | B16: 11.2 | C16: =+A16*$D$7 -> 58.406699999999994 | D16: =+B16*$D$7 -> 18.020799999999998 | F16: exit R - Quilcene
A17: =+A16+B17 -> 36.4 | B17: 00.1 | C17: =+A17*$D$7 -> 58.567599999999999 | D17: =+B17*$D$7 -> 0.16090000000000002 | F17: R onto Center Rd., head to Quilcene
A18: =+A17+B18 -> 44.6 | B18: 8.2 | C18: =+A18*$D$7 -> 71.761399999999995 | D18: =+B18*$D$7 -> 13.1938 | E18: #2 | F18: L onto SR101 S, Control - Peninuslia Food Store - Quilcene
A19: =+A18+B19 -> 82.2 | B19: 37.6 | C19: =+A19*$D$7 -> 132.25979999999998 | D19: =+B19*$D$7 -> 60.498400000000004 | E19: #3 | F19: Hood Canal Grocerie & BP Station - Hoodsport
A20: =+A19+B20 -> 87.4 | B20: 5.2 | C20: =+A20*$D$7 -> 140.6266 | D20: =+B20*$D$7 -> 8.3667999999999996 | F20: L onto SR 106 E
A21: =+A20+B21 -> 107.6 | B21: 20.2 | C21: =+A21*$D$7 -> 173.1284 | D21: =+B21*$D$7 -> 32.501799999999996 | F21: L onto SR 3 N
A22: =+A21+B22 -> 109.0 | B22: 1.4 | C22: =+A22*$D$7 -> 175.381 | D22: =+B22*$D$7 -> 2.2525999999999997 | F22: L onto Old Belfair Hwy
A23: =+A22+B23 -> 118.9 | B23: 9.9 | C23: =+A23*$D$7 -> 191.31010000000001 | D23: =+B23*$D$7 -> 15.9291 | F23: R to SR 3
A24: =+A23+B24 -> 119.1 | B24: 00.2 | C24: =+A24*$D$7 -> 191.6319 | D24: =+B24*$D$7 -> 0.32180000000000003 | F24: L onto SR 3, Head to Bremerton, BL onto Overpass
A25: =+A24+B25 -> 121.3 | B25: 2.2 | C25: =+A25*$D$7 -> 195.17170000000002 | D25: =+B25*$D$7 -> 3.5398000000000001 | F25: BR to Bremerton
A26: =+A25+B26 -> 122.7 | B26: 1.4 | C26: =+A26*$D$7 -> 197.42430000000002 | D26: =+B26*$D$7 -> 2.2525999999999997 | F26: R to City Center
A27: =+A26+B27 -> 123.2 | B27: 0.5 | C27: =+A27*$D$7 -> 198.22880000000004 | D27: =+B27*$D$7 -> 0.80449999999999999 | F27: L onto Calloway Ave., follow signs to ferry
A28: =+A27+B28 -> 123.6 | B28: 00.4 | C28: =+A28*$D$7 -> 198.87240000000003 | D28: =+B28*$D$7 -> 0.64360000000000006 | F28: R onto Burwell St.
A29: =+A28+B29 -> 124.6 | B29: 1.0 | C29: =+A29*$D$7 -> 200.48140000000004 | D29: =+B29*$D$7 -> 1.609 | F29: R onto Washington Ave.
A30: =+A29+B30 -> 124.7 | B30: 00.1 | C30: =+A30*$D$7 -> 200.64230000000003 | D30: =+B30*$D$7 -> 0.16090000000000002 | F30: L onto 1st St.
A31: =+A30+B31 -> 124.8 | B31: 00.1 | C31: =+A31*$D$7 -> 200.8032 | D31: =+B31*$D$7 -> 0.16090000000000002 | E31: #4 | F31: Finish -Topside Tavern