A1: Seattle Randonneurs 200 km Brevet
A2: Snohomish-Mountain Loop Hwy
A4: Created By: | D4: Pat Rodden
A5: Verified By: | D5: Pat Rodden
A6: Year(s) Used: | D6: ???
A7: Conversion(Mi-Km) | D7: 1.609
A9: Miles | C9: Km
A10: Total | B10: Leg | C10: Total | D10: Leg | E10: Ctrl | F10: Instructions
A11: 0.0 | B11: 0.0 | C11: =+A11*$D$7 -> 0.0 | D11: =+B11*$D$7 -> 0.0 | E11: #1 | F11: Start - R into Rodden Alley
A12: =+A11+B12 -> 00.1 | B12: 00.1 | C12: =+A12*$D$7 -> 0.16090000000000002 | D12: =+B12*$D$7 -> 0.16090000000000002 | F12: L onto 4th St
A13: =+A12+B13 -> 0.5 | B13: 00.4 | C13: =+A13*$D$7 -> 0.80449999999999999 | D13: =+B13*$D$7 -> 0.64360000000000006 | F13: L onto Maple Ave.
A14: =+A13+B14 -> 00.9 | B14: 00.4 | C14: =+A14*$D$7 -> 1.4480999999999999 | D14: =+B14*$D$7 -> 0.64360000000000006 | F14: Jog R onto Centenial Bike Trail
A15: =+A14+B15 -> 8.6 | B15: 7.7 | C15: =+A15*$D$7 -> 13.837399999999999 | D15: =+B15*$D$7 -> 12.3893 | F15: R then L onto Machians Rd.
A16: =+A15+B16 -> 10.0 | B16: 1.4 | C16: =+A16*$D$7 -> 16.09 | D16: =+B16*$D$7 -> 2.2525999999999997 | F16: R onto SR 92
A17: =+A16+B17 -> 15.2 | B17: 5.2 | C17: =+A17*$D$7 -> 24.456799999999998 | D17: =+B17*$D$7 -> 8.3667999999999996 | F17: L onto Jordan Rd.
A18: =+A17+B18 -> 27.3 | B18: 12.1 | C18: =+A18*$D$7 -> 43.925699999999992 | D18: =+B18*$D$7 -> 19.468899999999998 | F18: L Arlington Hts Rd
A19: =+A18+B19 -> 28.3 | B19: 1.0 | C19: =+A19*$D$7 -> 45.534699999999994 | D19: =+B19*$D$7 -> 1.609 | F19: R onto SR 530
A20: =+A19+B20 -> 33.3 | B20: 5.0 | C20: =+A20*$D$7 -> 53.579699999999995 | D20: =+B20*$D$7 -> 8.0449999999999999 | E20: #2 | F20: General store on left
A21: =+A20+B21 -> 55.6 | B21: 22.3 | C21: =+A21*$D$7 -> 89.460399999999993 | D21: =+B21*$D$7 -> 35.880699999999997 | F21: L then R - Texaco-Deli-Mart Darrington
A22: =+A21+B22 -> 55.6 | B22: 0.0 | C22: =+A22*$D$7 -> 89.460399999999993 | D22: =+B22*$D$7 -> 0.0 | F22: L onto Mountain Loop Hwy.
A23: =+A22+B23 -> 64.9 | B23: 9.3 | C23: =+A23*$D$7 -> 104.42409999999998 | D23: =+B23*$D$7 -> 14.963700000000001 | F23: Dirt Road Starts
A24: =+A23+B24 -> 78.9 | B24: 14.0 | C24: =+A24*$D$7 -> 126.95009999999999 | D24: =+B24*$D$7 -> 22.526 | F24: Dirt Road Ends - Barlow Pass
A25: =+A24+B25 -> 109.9 | B25: 31.0 | C25: =+A25*$D$7 -> 176.82909999999998 | D25: =+B25*$D$7 -> 49.878999999999998 | F25: R onto Stanley - Granit Falls
A26: =+A25+B26 -> 110.1 | B26: 00.2 | C26: =+A26*$D$7 -> 177.15089999999998 | D26: =+B26*$D$7 -> 0.32180000000000003 | E26: #3 | F26: Bob & Carol's Deli, on Left
A27: =+A26+B27 -> 110.1 | B27: 0.0 | C27: =+A27*$D$7 -> 177.15089999999998 | D27: =+B27*$D$7 -> 0.0 | F27: Straight onto SR92
A28: =+A27+B28 -> 115.3 | B28: 5.2 | C28: =+A28*$D$7 -> 185.51769999999999 | D28: =+B28*$D$7 -> 8.3667999999999996 | F28: R then L onto Machians Rd.
A29: =+A28+B29 -> 116.7 | B29: 1.4 | C29: =+A29*$D$7 -> 187.77029999999999 | D29: =+B29*$D$7 -> 2.2525999999999997 | F29: Jog R onto Centenial Bike Trail
A30: =+A29+B30 -> 124.4 | B30: 7.7 | C30: =+A30*$D$7 -> 200.15960000000001 | D30: =+B30*$D$7 -> 12.3893 | F30: L onto Maple Ave.
A31: =+A30+B31 -> 124.8 | B31: 00.4 | C31: =+A31*$D$7 -> 200.8032 | D31: =+B31*$D$7 -> 0.64360000000000006 | F31: L onto 4th St
A32: =+A31+B32 -> 125.2 | B32: 00.4 | C32: =+A32*$D$7 -> 201.44680000000002 | D32: =+B32*$D$7 -> 0.64360000000000006 | F32: R into Rodden Alley
A33: =+A32+B33 -> 125.3 | B33: 00.1 | C33: =+A33*$D$7 -> 201.60770000000002 | D33: =+B33*$D$7 -> 0.16090000000000002 | E33: #4 | F33: Finish - Pat's place