A1: Seattle Randonneurs 200 km Brevet
A2: Redmond/Arlington
A4: Created By: | D4: Wayne Methner
A5: Verified By: | D5: Wayne Methner
A6: Year(s) Used: | D6: 2000-01
A7: Conversion(Mi-Km) | D7: 1.609
A9: Miles | C9: Km
A10: Total | B10: Leg | C10: Total | D10: Leg | E10: Ctrl | F10: Instructions
A11: 0.0 | B11: 0 | C11: =+A11*$D$7 -> 0.0 | D11: =+B11*$D$7 -> 0.0 | E11: #1 | F11: Mark Thomas' House
A12: =+A11+B12 -> 0.0 | B12: 0 | C12: =+A12*$D$7 -> 0.0 | D12: =+B12*$D$7 -> 0.0 | F12: 13543 160th Ave NE, Redmond, WA 98052
A13: =+A12+B13 -> 0.0 | B13: 0 | C13: =+A13*$D$7 -> 0.0 | D13: =+B13*$D$7 -> 0.0 | F13: Depart South on 160th Ave NE
A14: =+A13+B14 -> 00.2 | B14: 00.2 | C14: =+A14*$D$7 -> 0.32180000000000003 | D14: =+B14*$D$7 -> 0.32180000000000003 | F14: Bear RIGHT (West) onto NE 133rd St
A15: =+A14+B15 -> 00.3 | B15: 00.1 | C15: =+A15*$D$7 -> 0.48270000000000007 | D15: =+B15*$D$7 -> 0.16090000000000002 | F15: Turn LEFT (South) onto 158th Ave NE
A16: =+A15+B16 -> 00.3 | B16: 0 | C16: =+A16*$D$7 -> 0.48270000000000007 | D16: =+B16*$D$7 -> 0.0 | F16: Turn RIGHT (West) onto NE 132nd St
A17: =+A16+B17 -> 00.4 | B17: 00.1 | C17: =+A17*$D$7 -> 0.64360000000000006 | D17: =+B17*$D$7 -> 0.16090000000000002 | F17: Bear LEFT (West) onto 156th Ave NE
A18: =+A17+B18 -> 00.7 | B18: 00.3 | C18: =+A18*$D$7 -> 1.1262999999999999 | D18: =+B18*$D$7 -> 0.48269999999999996 | F18: LT (South) onto SR-202 [Woodinville Redmond Rd NE]
A19: =+A18+B19 -> 4.3 | B19: 3.6 | C19: =+A19*$D$7 -> 6.9186999999999994 | D19: =+B19*$D$7 -> 5.7923999999999998 | F19: LT (East) onto Cleveland St (SR-202 -- Redmond Way) (one way)
A20: =+A19+B20 -> 4.5 | B20: 00.2 | C20: =+A20*$D$7 -> 7.2404999999999999 | D20: =+B20*$D$7 -> 0.32180000000000003 | F20: Bear RT Cleveland becomes Redmond Way (SR-202)
A21: =+A20+B21 -> 5.5 | B21: 1 | C21: =+A21*$D$7 -> 8.849499999999999 | D21: =+B21*$D$7 -> 1.609 | F21: RT (South-East) onto E Lake Sammamish Pky (NE)
A22: =+A21+B22 -> 5.5 | B22: 0 | C22: =+A22*$D$7 -> 8.849499999999999 | D22: =+B22*$D$7 -> 0.0 | F22: becomes E Lake Sammamish Pky SE
A23: =+A22+B23 -> 15.7 | B23: 10.2 | C23: =+A23*$D$7 -> 25.261299999999999 | D23: =+B23*$D$7 -> 16.411799999999999 | F23: LT (North-East) onto SE Issaquah Fall City Rd
A24: =+A23+B24 -> 15.7 | B24: 0 | C24: =+A24*$D$7 -> 25.261299999999999 | D24: =+B24*$D$7 -> 0.0 | E24: #2 | F24: ISSAQUAH
A25: =+A24+B25 -> 16.8 | B25: 1.1 | C25: =+A25*$D$7 -> 27.031200000000002 | D25: =+B25*$D$7 -> 1.7699 | F25: RT (Northeast) to continue on SE Issaquah-Fall City Rd
A26: =+A25+B26 -> 18.7 | B26: 1.9 | C26: =+A26*$D$7 -> 30.0883 | D26: =+B26*$D$7 -> 3.0570999999999997 | F26: RT (East) to continue on SE Issaquah-Fall City Rd Just after endeavor school
A27: =+A26+B27 -> 21.4 | B27: 2.7 | C27: =+A27*$D$7 -> 34.432600000000001 | D27: =+B27*$D$7 -> 4.3443000000000005 | F27: ST to continue (East) on SE 40th St
A28: =+A27+B28 -> 21.9 | B28: 0.5 | C28: =+A28*$D$7 -> 35.237099999999998 | D28: =+B28*$D$7 -> 0.80449999999999999 | F28: Bear LEFT (North-East) onto 308th Ave SE
A29: =+A28+B29 -> 22.3 | B29: 00.4 | C29: =+A29*$D$7 -> 35.880699999999997 | D29: =+B29*$D$7 -> 0.64360000000000006 | F29: X SR-202 Redmond-Fall City Rd
A30: =+A29+B30 -> 22.5 | B30: 00.2 | C30: =+A30*$D$7 -> 36.202500000000001 | D30: =+B30*$D$7 -> 0.32180000000000003 | F30: Bear RIGHT (North) onto 309th Ave SE
A31: =+A30+B31 -> 22.9 | B31: 00.4 | C31: =+A31*$D$7 -> 36.846099999999993 | D31: =+B31*$D$7 -> 0.64360000000000006 | F31: Bear RIGHT (East) onto SE 24th St
A32: =+A31+B32 -> 23.1 | B32: 00.2 | C32: =+A32*$D$7 -> 37.167899999999989 | D32: =+B32*$D$7 -> 0.32180000000000003 | F32: Turn LEFT (North) onto W Snoqualmie River Rd SE
A33: =+A32+B33 -> 27.3 | B33: 4.2 | C33: =+A33*$D$7 -> 43.925699999999992 | D33: =+B33*$D$7 -> 6.7578000000000005 | F33: Bear RIGHT (East) onto NE Tolt Hill Rd
A34: =+A33+B34 -> 28.0 | B34: 00.7 | C34: =+A34*$D$7 -> 45.051999999999985 | D34: =+B34*$D$7 -> 1.1262999999999999 | F34: Turn LEFT (North) onto SR-203 [Fall City-Carnation Rd]
A35: =+A34+B35 -> 28.8 | B35: 00.8 | C35: =+A35*$D$7 -> 46.339199999999991 | D35: =+B35*$D$7 -> 1.2872000000000001 | E35: #3 | F35: CARNATION
A36: =+A35+B36 -> 28.8 | B36: 0 | C36: =+A36*$D$7 -> 46.339199999999991 | D36: =+B36*$D$7 -> 0.0 | F36: Use Texaco-Starbucks-(or Sandy's Espresso .2mi further)
A37: =+A36+B37 -> 28.8 | B37: 0 | C37: =+A37*$D$7 -> 46.339199999999991 | D37: =+B37*$D$7 -> 0.0 | F37: LT out of control to Continue North on SR-203 (Tolt Ave)
A38: =+A37+B38 -> 29.7 | B38: 00.9 | C38: =+A38*$D$7 -> 47.787299999999988 | D38: =+B38*$D$7 -> 1.4480999999999999 | F38: LEFT (West) onto NE 60th St
A39: =+A38+B39 -> 30.3 | B39: 00.6 | C39: =+A39*$D$7 -> 48.75269999999999 | D39: =+B39*$D$7 -> 0.96539999999999992 | F39: Bear RT continue on 310th Ave NE
A40: =+A39+B40 -> 30.7 | B40: 00.4 | C40: =+A40*$D$7 -> 49.396299999999989 | D40: =+B40*$D$7 -> 0.64360000000000006 | F40: LT (West) onto NE Carnation Farm Rd
A41: =+A40+B41 -> 32.8 | B41: 2.1 | C41: =+A41*$D$7 -> 52.775199999999984 | D41: =+B41*$D$7 -> 3.3789000000000002 | F41: RIGHT (North) onto 284th Ave NE
A42: =+A41+B42 -> 33.3 | B42: 0.5 | C42: =+A42*$D$7 -> 53.579699999999981 | D42: =+B42*$D$7 -> 0.80449999999999999 | F42: LT (West) onto NE 100th St
A43: =+A42+B43 -> 34.7 | B43: 1.4 | C43: =+A43*$D$7 -> 55.832299999999982 | D43: =+B43*$D$7 -> 2.2525999999999997 | F43: RT (North-West) onto W Snoqualmie Valley Rd NE
A44: =+A43+B44 -> 36.2 | B44: 1.5 | C44: =+A44*$D$7 -> 58.245799999999981 | D44: =+B44*$D$7 -> 2.4135 | F44: ST to continue W Snoq Valley Rd NE X Novelty Hill Rd
A45: =+A44+B45 -> 39.2 | B45: 3 | C45: =+A45*$D$7 -> 63.07279999999998 | D45: =+B45*$D$7 -> 4.827 | F45: ST to continue W Snoq Valley Rd NE X Wdville Duvall Rd
A46: =+A45+B46 -> 41.5 | B46: 2.3 | C46: =+A46*$D$7 -> 66.77349999999997 | D46: =+B46*$D$7 -> 3.7006999999999999 | F46: Cross King Co-Snohomish County line
A47: =+A46+B47 -> 41.5 | B47: 0 | C47: =+A47*$D$7 -> 66.77349999999997 | D47: =+B47*$D$7 -> 0.0 | F47: W Snoqualmie Valley Rd becomes High Bridge Rd
A48: =+A47+B48 -> 43.5 | B48: 2 | C48: =+A48*$D$7 -> 69.991499999999974 | D48: =+B48*$D$7 -> 3.218 | F48: Turn RIGHT (East) onto Crescent Lake Rd
A49: =+A48+B49 -> 44.6 | B49: 1.1 | C49: =+A49*$D$7 -> 71.761399999999981 | D49: =+B49*$D$7 -> 1.7699 | F49: Continue (North) Crecent Lake Rd becomes Tualco Rd
A50: =+A49+B50 -> 46.6 | B50: 2 | C50: =+A50*$D$7 -> 74.979399999999984 | D50: =+B50*$D$7 -> 3.218 | F50: LT (North) onto SR-203
A51: =+A50+B51 -> 47.2 | B51: 00.6 | C51: =+A51*$D$7 -> 75.944799999999987 | D51: =+B51*$D$7 -> 0.96539999999999992 | F51: RT (East) onto Ben Howard Rd
A52: =+A51+B52 -> 55.5 | B52: 8.3 | C52: =+A52*$D$7 -> 89.299499999999981 | D52: =+B52*$D$7 -> 13.354700000000001 | F52: LT (North) onto 311th Ave SE at Stop Sign
A53: =+A52+B53 -> 56.3 | B53: 00.8 | C53: =+A53*$D$7 -> 90.586699999999965 | D53: =+B53*$D$7 -> 1.2872000000000001 | F53: LT (West) onto US-2
A54: =+A53+B54 -> 57.1 | B54: 00.8 | C54: =+A54*$D$7 -> 91.873899999999963 | D54: =+B54*$D$7 -> 1.2872000000000001 | F54: Rt (North) onto Old Owen Road At Stop Light
A55: =+A54+B55 -> 57.1 | B55: 0 | C55: =+A55*$D$7 -> 91.873899999999963 | D55: =+B55*$D$7 -> 0.0 | E55: #4 | F55: SULTAN-ARCO AM/PM
A56: =+A55+B56 -> 57.1 | B56: 0 | C56: =+A56*$D$7 -> 91.873899999999963 | D56: =+B56*$D$7 -> 0.0 | F56: RT (North) onto Old Owen Rd out of control
A57: =+A56+B57 -> 57.7 | B57: 00.6 | C57: =+A57*$D$7 -> 92.839299999999966 | D57: =+B57*$D$7 -> 0.96539999999999992 | F57: RT (North) onto Reiner Rd
A58: =+A57+B58 -> 60.9 | B58: 3.2 | C58: =+A58*$D$7 -> 97.988099999999974 | D58: =+B58*$D$7 -> 5.1488000000000005 | F58: Bear LT onto Old Pipeline Rd just after Top of Steep Hill
A59: =+A58+B59 -> 64.1 | B59: 3.2 | C59: =+A59*$D$7 -> 103.13689999999997 | D59: =+B59*$D$7 -> 5.1488000000000005 | F59: RT (North-West) onto Bollenbaugh Hill Rd at "T" intersection
A60: =+A59+B60 -> 65.0 | B60: 00.9 | C60: =+A60*$D$7 -> 104.58499999999999 | D60: =+B60*$D$7 -> 1.4480999999999999 | F60: RT (North) onto Woods Creek Rd at "T" intersection
A61: =+A60+B61 -> 70.0 | B61: 5 | C61: =+A61*$D$7 -> 112.63 | D61: =+B61*$D$7 -> 8.0449999999999999 | F61: RT (North) onto Lake Roesiger Rd BEAR and STAY on East (Right) side of Lake
A62: =+A61+B62 -> 75.0 | B62: 5 | C62: =+A62*$D$7 -> 120.675 | D62: =+B62*$D$7 -> 8.0449999999999999 | F62: Bear RT (North) Lake Rosinger Rd becomes Menzel Lake Rd
A63: =+A62+B63 -> 80.9 | B63: 5.9 | C63: =+A63*$D$7 -> 130.16809999999998 | D63: =+B63*$D$7 -> 9.4931000000000001 | F63: RT onto S Alder Ave Immediately past Granite Falls City Limit Sign
A64: =+A63+B64 -> 81.1 | B64: 00.2 | C64: =+A64*$D$7 -> 130.48989999999998 | D64: =+B64*$D$7 -> 0.32180000000000003 | F64: LT (West) onto E Stanley St a four way stop
A65: =+A64+B65 -> 81.1 | B65: 0 | C65: =+A65*$D$7 -> 130.48989999999998 | D65: =+B65*$D$7 -> 0.0 | F65: GRANITE FALLS--SERVICES
A66: =+A65+B66 -> 82.0 | B66: 00.9 | C66: =+A66*$D$7 -> 131.93799999999999 | D66: =+B66*$D$7 -> 1.4480999999999999 | F66: RT (North) onto Jordan Rd At Stop Light just after Chevron/McDonalds
A67: =+A66+B67 -> 82.3 | B67: 00.3 | C67: =+A67*$D$7 -> 132.42069999999998 | D67: =+B67*$D$7 -> 0.48269999999999996 | F67: LT (West) onto 100th St NE -- Burn Rd
A68: =+A67+B68 -> 84.8 | B68: 2.5 | C68: =+A68*$D$7 -> 136.44319999999999 | D68: =+B68*$D$7 -> 4.0225 | F68: Bear LT onto 116th St NE (Burn Rd)
A69: =+A68+B69 -> 94.0 | B69: 9.2 | C69: =+A69*$D$7 -> 151.24600000000001 | D69: =+B69*$D$7 -> 14.8028 | F69: RT onto Burn Rd towards Arlington at "T" intersection
A70: =+A69+B70 -> 95.6 | B70: 1.6 | C70: =+A70*$D$7 -> 153.82039999999998 | D70: =+B70*$D$7 -> 2.5744000000000002 | F70: LT onto 207th St NE at stop sign just after Arlington City Limit
A71: =+A70+B71 -> 95.8 | B71: 00.2 | C71: =+A71*$D$7 -> 154.1422 | D71: =+B71*$D$7 -> 0.32180000000000003 | F71: continue 207th St NE becomes 204th St NE
A72: =+A71+B72 -> 96.1 | B72: 00.3 | C72: =+A72*$D$7 -> 154.6249 | D72: =+B72*$D$7 -> 0.48269999999999996 | E72: #5 | F72: ARLINGTON -- CHEVRON/MCDONALDS
A73: =+A72+B73 -> 96.1 | B73: 0 | C73: =+A73*$D$7 -> 154.6249 | D73: =+B73*$D$7 -> 0.0 | F73: RT out of control
A74: =+A73+B74 -> 96.1 | B74: 0 | C74: =+A74*$D$7 -> 154.6249 | D74: =+B74*$D$7 -> 0.0 | F74: LT onto SR-9
A75: =+A74+B75 -> 96.1 | B75: 0 | C75: =+A75*$D$7 -> 154.6249 | D75: =+B75*$D$7 -> 0.0 | F75: MAYBE BEST TO EXIT INTO SNOHOMISH AND CURL AROUND AIRPORT
A76: =+A75+B76 -> 96.1 | B76: 0 | C76: =+A76*$D$7 -> 154.6249 | D76: =+B76*$D$7 -> 0.0 | F76: YOU AVOID TWO NARROW BRIDGES
A77: =+A76+B77 -> 116.6 | B77: 20.5 | C77: =+A77*$D$7 -> 187.60939999999999 | D77: =+B77*$D$7 -> 32.984499999999997 | F77: LT (East) onto Airport Way at Stop Light (108th SE-- Marsh Rd)
A78: =+A77+B78 -> 116.6 | B78: 0 | C78: =+A78*$D$7 -> 187.60939999999999 | D78: =+B78*$D$7 -> 0.0 | F78: Turn RIGHT (South) onto Springhetti Rd
A79: =+A78+B79 -> 118.6 | B79: 2 | C79: =+A79*$D$7 -> 190.82739999999998 | D79: =+B79*$D$7 -> 3.218 | F79: LT (South) onto Broadway Ave at "T" intersection
A80: =+A79+B80 -> 123.3 | B80: 4.7 | C80: =+A80*$D$7 -> 198.3897 | D80: =+B80*$D$7 -> 7.5623000000000005 | F80: Bear LT onto Yew Way
A81: =+A80+B81 -> 123.3 | B81: 0 | C81: =+A81*$D$7 -> 198.3897 | D81: =+B81*$D$7 -> 0.0 | F81: X BAD TRACKS
A82: =+A81+B82 -> 123.6 | B82: 00.3 | C82: =+A82*$D$7 -> 198.8724 | D82: =+B82*$D$7 -> 0.48269999999999996 | F82: Continue ST (South) on SR-524 [Yew Way] at stop sign near Maltby
A83: =+A82+B83 -> 123.8 | B83: 00.2 | C83: =+A83*$D$7 -> 199.1942 | D83: =+B83*$D$7 -> 0.32180000000000003 | F83: LT (East) onto Paradise Lake Rd (unmarked due to construction
A84: =+A83+B84 -> 123.9 | B84: 00.1 | C84: =+A84*$D$7 -> 199.35509999999999 | D84: =+B84*$D$7 -> 0.16090000000000002 | F84: X SR-522 at the light continue on Paradise Lake Rd (197th NE)
A85: =+A84+B85 -> 123.9 | B85: 0 | C85: =+A85*$D$7 -> 199.35509999999999 | D85: =+B85*$D$7 -> 0.0 | F85: Continue Paradise Lake rd (goes by 197th NE, NE 202nd pl, 194th Ave NE
A86: =+A85+B86 -> 128.9 | B86: 5 | C86: =+A86*$D$7 -> 207.40009999999995 | D86: =+B86*$D$7 -> 8.0449999999999999 | F86: Turn RIGHT (West) onto NE Woodinville Duvall Rd
A87: =+A86+B87 -> 129.4 | B87: 0.5 | C87: =+A87*$D$7 -> 208.20459999999997 | D87: =+B87*$D$7 -> 0.80449999999999999 | F87: LT (South) onto Avondale Rd NE
A88: =+A87+B88 -> 129.4 | B88: 0 | C88: =+A88*$D$7 -> 208.20459999999997 | D88: =+B88*$D$7 -> 0.0 | E88: #6 | F88: ZIP MARKET
A89: =+A88+B89 -> 129.4 | B89: 0 | C89: =+A89*$D$7 -> 208.20459999999997 | D89: =+B89*$D$7 -> 0.0 | F89: RT out of control to continue South on Avondale
A90: =+A89+B90 -> 129.7 | B90: 00.3 | C90: =+A90*$D$7 -> 208.68729999999999 | D90: =+B90*$D$7 -> 0.48269999999999996 | F90: RT onto NE 165th Place
A91: =+A90+B91 -> 131.0 | B91: 1.3 | C91: =+A91*$D$7 -> 210.779 | D91: =+B91*$D$7 -> 2.0916999999999999 | F91: Bear RIGHT (North) onto 174th Ave NE
A92: =+A91+B92 -> 131.1 | B92: 00.1 | C92: =+A92*$D$7 -> 210.93989999999999 | D92: =+B92*$D$7 -> 0.16090000000000002 | F92: Continue (North) on 172nd Pl NE
A93: =+A92+B93 -> 131.2 | B93: 00.1 | C93: =+A93*$D$7 -> 211.10079999999999 | D93: =+B93*$D$7 -> 0.16090000000000002 | F93: Turn LEFT (South-West) onto 171st Pl NE
A94: =+A93+B94 -> 131.6 | B94: 00.4 | C94: =+A94*$D$7 -> 211.74439999999998 | D94: =+B94*$D$7 -> 0.64360000000000006 | F94: Turn RIGHT (South-West) onto NE 163rd Pl
A95: =+A94+B95 -> 131.7 | B95: 00.1 | C95: =+A95*$D$7 -> 211.90529999999998 | D95: =+B95*$D$7 -> 0.16090000000000002 | F95: Continue (West) on NE 160th Pl
A96: =+A95+B96 -> 131.9 | B96: 00.2 | C96: =+A96*$D$7 -> 212.22709999999995 | D96: =+B96*$D$7 -> 0.32180000000000003 | F96: Turn LEFT (South-East) onto NE 160th St
A97: =+A96+B97 -> 131.9 | B97: 0 | C97: =+A97*$D$7 -> 212.22709999999995 | D97: =+B97*$D$7 -> 0.0 | F97: Bear RIGHT (South) onto 168th Ave NE
A98: =+A97+B98 -> 133.0 | B98: 1.1 | C98: =+A98*$D$7 -> 213.99699999999996 | D98: =+B98*$D$7 -> 1.7699 | F98: continue ST (South) on168th Ave NE
A99: =+A98+B99 -> 133.4 | B99: 00.4 | C99: =+A99*$D$7 -> 214.64059999999995 | D99: =+B99*$D$7 -> 0.64360000000000006 | F99: go through Barrier
A100: =+A99+B100 -> 133.5 | B100: 00.1 | C100: =+A100*$D$7 -> 214.80149999999995 | D100: =+B100*$D$7 -> 0.16090000000000002 | F100: Turn RIGHT (West) onto NE 135th St
A101: =+A100+B101 -> 134.0 | B101: 0.5 | C101: =+A101*$D$7 -> 215.60599999999997 | D101: =+B101*$D$7 -> 0.80449999999999999 | F101: Turn RIGHT (North) onto 160th Ave NE
A102: =+A101+B102 -> 134.0 | B102: 0 | C102: =+A102*$D$7 -> 215.60599999999997 | D102: =+B102*$D$7 -> 0.0 | E102: #7 | F102: FINISH
A103: =+A102+B103 -> 134.0 | B103: 0 | C103: =+A103*$D$7 -> 215.60599999999997 | D103: =+B103*$D$7 -> 0.0 | F103: Arrive Mark's House 13543 160th Ave NE, Redmond, WA 98052