A1: Seattle Randonneurs 200 km Brevet
A2: Hippe-Snoqualmie Valley
A4: Created By: | D4: Rick Hippe
A5: Verified By: | D5: Rick Hippe
A6: Year(s) Used:
A7: Conversion(Mi-Km) | D7: 1.609
A9: Miles | C9: Km
A10: Total | B10: Leg | C10: Total | D10: Leg | E10: Ctrl | F10: Instructions
A11: 0.0 | B11: 0.0 | C11: =+A11*$D$7 -> 0.0 | D11: =+B11*$D$7 -> 0.0 | E11: #1 | F11: Follow 132nd /134th out of Falls
A12: =+A11+B12 -> 1.4 | B12: 1.4 | C12: =+A12*$D$7 -> 2.2525999999999997 | D12: =+B12*$D$7 -> 2.2525999999999997 | F12: R - Seattle Hill Road
A13: =+A12+B13 -> 2.9 | B13: 1.5 | C13: =+A13*$D$7 -> 4.6661000000000001 | D13: =+B13*$D$7 -> 2.4135 | F13: L - Lowell Larimar / Straight on Marsh
A14: =+A13+B14 -> 4.9 | B14: 2.0 | C14: =+A14*$D$7 -> 7.8841000000000001 | D14: =+B14*$D$7 -> 3.218 | F14: L - Highway 9
A15: =+A14+B15 -> 14.0 | B15: 9.1 | C15: =+A15*$D$7 -> 22.526 | D15: =+B15*$D$7 -> 14.6419 | F15: R - Highway 92
A16: =+A15+B16 -> 19.6 | B16: 5.6 | C16: =+A16*$D$7 -> 31.5364 | D16: =+B16*$D$7 -> 9.0103999999999989 | F16: L - 161 Ave. NE
A17: =+A16+B17 -> 19.9 | B17: 0.29999999999999716 | C17: =+A17*$D$7 -> 32.019099999999995 | D17: =+B17*$D$7 -> 0.48269999999999541 | F17: L - 163rd Ave. NE
A18: =+A17+B18 -> 21.0 | B18: 1.1 | C18: =+A18*$D$7 -> 33.789000000000001 | D18: =+B18*$D$7 -> 1.7699 | F18: L - Burn Road
A19: =+A18+B19 -> 22.3 | B19: 1.3 | C19: =+A19*$D$7 -> 35.880699999999997 | D19: =+B19*$D$7 -> 2.0916999999999999 | F19: L - 116 th NE
A20: =+A19+B20 -> 28.4 | B20: 6.1 | C20: =+A20*$D$7 -> 45.695599999999999 | D20: =+B20*$D$7 -> 9.8148999999999997 | F20: R - Kellogg / Sisco Hights Road (Arlington)
A21: =+A20+B21 -> 30.4 | B21: 2.0 | C21: =+A21*$D$7 -> 48.913599999999995 | D21: =+B21*$D$7 -> 3.218 | F21: L - Highland Drive
A22: =+A21+B22 -> 30.6 | B22: 0.20000000000000284 | C22: =+A22*$D$7 -> 49.235399999999998 | D22: =+B22*$D$7 -> 0.32180000000000458 | F22: R - S. French
A23: =+A22+B23 -> 31.1 | B23: 0.5 | C23: =+A23*$D$7 -> 50.039900000000003 | D23: =+B23*$D$7 -> 0.80449999999999999 | F23: L - Third
A24: =+A23+B24 -> 31.3 | B24: 0.19999999999999929 | C24: =+A24*$D$7 -> 50.361699999999999 | D24: =+B24*$D$7 -> 0.32179999999999886 | F24: R - N. Olympic
A25: =+A24+B25 -> 31.5 | B25: 0.19999999999999929 | C25: =+A25*$D$7 -> 50.683500000000002 | D25: =+B25*$D$7 -> 0.32179999999999886 | F25: R - Division
A26: =+A25+B26 -> 31.6 | B26: 0.10000000000000142 | C26: =+A26*$D$7 -> 50.8444 | D26: =+B26*$D$7 -> 0.16090000000000229 | F26: L - Broadway
A27: =+A26+B27 -> 31.7 | B27: 9.9999999999997868E-2 | C27: =+A27*$D$7 -> 51.005299999999998 | D27: =+B27*$D$7 -> 0.16089999999999657 | E27: #2 | F27: Thrifty Foods
A28: =+A27+B28 -> 31.7 | B28: 0.0 | C28: =+A28*$D$7 -> 51.005299999999998 | D28: =+B28*$D$7 -> 0.0 | F28: R - East on 530
A29: =+A28+B29 -> 32.5 | B29: 0.80000000000000071 | C29: =+A29*$D$7 -> 52.292499999999997 | D29: =+B29*$D$7 -> 1.2872000000000012 | F29: R - Jordan Road
A30: =+A29+B30 -> 33.5 | B30: 1.0 | C30: =+A30*$D$7 -> 53.901499999999999 | D30: =+B30*$D$7 -> 1.609 | F30: R - Jordan Road
A31: =+A30+B31 -> 45.4 | B31: 11.9 | C31: =+A31*$D$7 -> 73.048599999999993 | D31: =+B31*$D$7 -> 19.147100000000002 | F31: L - Highway 92
A32: =+A31+B32 -> 46.1 | B32: 0.70000000000000284 | C32: =+A32*$D$7 -> 74.174900000000008 | D32: =+B32*$D$7 -> 1.1263000000000045 | F32: R - Mt. Loop Highway
A33: =+A32+B33 -> 46.3 | B33: 0.19999999999999574 | C33: =+A33*$D$7 -> 74.49669999999999 | D33: =+B33*$D$7 -> 0.32179999999999315 | F33: L - Menzel Lake Road
A34: =+A33+B34 -> 56.9 | B34: 10.6 | C34: =+A34*$D$7 -> 91.552099999999996 | D34: =+B34*$D$7 -> 17.055399999999999 | F34: L - Woods Creek Road
A35: =+A34+B35 -> 64.3 | B35: 7.4 | C35: =+A35*$D$7 -> 103.45869999999999 | D35: =+B35*$D$7 -> 11.906600000000001 | F35: R - Stay right on Woods Creed Rd.
A36: =+A35+B36 -> 65.3 | B36: 1.0 | C36: =+A36*$D$7 -> 105.06769999999999 | D36: =+B36*$D$7 -> 1.609 | F36: L - Woods Creek Road
A37: =+A36+B37 -> 67.2 | B37: 1.9000000000000057 | C37: =+A37*$D$7 -> 108.12480000000001 | D37: =+B37*$D$7 -> 3.057100000000009 | F37: L - Oaks Street (0.1 mile before Highway 2)
A38: =+A37+B38 -> 67.4 | B38: 0.20000000000000284 | C38: =+A38*$D$7 -> 108.4466 | D38: =+B38*$D$7 -> 0.32180000000000458 | F38: R - Stop Sign
A39: =+A38+B39 -> 67.6 | B39: 0.19999999999998863 | C39: =+A39*$D$7 -> 108.76839999999999 | D39: =+B39*$D$7 -> 0.32179999999998171 | F39: L - Highway 2
A40: =+A39+B40 -> 73.9 | B40: 6.3000000000000114 | C40: =+A40*$D$7 -> 118.9051 | D40: =+B40*$D$7 -> 10.136700000000019 | E40: #3 | F40: Arco Gas / Mini Mart
A41: =+A40+B41 -> 74.7 | B41: 0.79999999999999716 | C41: =+A41*$D$7 -> 120.1923 | D41: =+B41*$D$7 -> 1.2871999999999955 | F41: R - 3ll th SE
A42: =+A41+B42 -> 75.5 | B42: 0.79999999999999716 | C42: =+A42*$D$7 -> 121.4795 | D42: =+B42*$D$7 -> 1.2871999999999955 | F42: R - Ben Howard Road
A43: =+A42+B43 -> 84.2 | B43: 8.7 | C43: =+A43*$D$7 -> 135.4778 | D43: =+B43*$D$7 -> 13.998299999999999 | F43: L - Highway 203
A44: =+A43+B44 -> 92.1 | B44: 7.8999999999999915 | C44: =+A44*$D$7 -> 148.18889999999999 | D44: =+B44*$D$7 -> 12.711099999999986 | F44: L - Cherry Valley Road
A45: =+A44+B45 -> 96.3 | B45: 4.2 | C45: =+A45*$D$7 -> 154.94669999999999 | D45: =+B45*$D$7 -> 6.7578000000000005 | E45: #4 | F45: Mt. View Road Sign - Hole Punch
A46: =+A45+B46 -> 96.3 | B46: 0.0 | C46: =+A46*$D$7 -> 154.94669999999999 | D46: =+B46*$D$7 -> 0.0 | F46: (Stay on Cherry Valley Road)
A47: =+A46+B47 -> 101.9 | B47: 5.6000000000000085 | C47: =+A47*$D$7 -> 163.9571 | D47: =+B47*$D$7 -> 9.0104000000000131 | F47: L - Highway 203
A48: =+A47+B48 -> 101.9 | B48: 0.0 | C48: =+A48*$D$7 -> 163.9571 | D48: =+B48*$D$7 -> 0.0 | F48: Stillwater Store - Control
A49: =+A48+B49 -> 103.7 | B49: 1.8 | C49: =+A49*$D$7 -> 166.85329999999999 | D49: =+B49*$D$7 -> 2.8961999999999999 | F49: R - Carnation Farm Road
A50: =+A49+B50 -> 106.6 | B50: 2.8999999999999915 | C50: =+A50*$D$7 -> 171.51939999999999 | D50: =+B50*$D$7 -> 4.6660999999999859 | F50: R - 284 th NE
A51: =+A50+B51 -> 108.5 | B51: 1.9000000000000057 | C51: =+A51*$D$7 -> 174.57650000000001 | D51: =+B51*$D$7 -> 3.057100000000009 | F51: R - West Snoqualimie Road
A52: =+A51+B52 -> 122.5 | B52: 14.0 | C52: =+A52*$D$7 -> 197.10249999999999 | D52: =+B52*$D$7 -> 22.526 | F52: S - Elliot
A53: =+A52+B53 -> 122.9 | B53: 0.40000000000000568 | C53: =+A53*$D$7 -> 197.74610000000001 | D53: =+B53*$D$7 -> 0.64360000000000916 | F53: R - Connelly
A54: =+A53+B54 -> 124.8 | B54: 1.8999999999999915 | C54: =+A54*$D$7 -> 200.8032 | D54: =+B54*$D$7 -> 3.0570999999999864 | F54: R - Broadway Ave.
A55: =+A54+B55 -> 125.7 | B55: 0.90000000000000568 | C55: =+A55*$D$7 -> 202.25130000000001 | D55: =+B55*$D$7 -> 1.448100000000009 | F55: S - Hwy 9 to 131 st Lowell Larimar
A56: =+A55+B56 -> 127.7 | B56: 2.0 | C56: =+A56*$D$7 -> 205.4693 | D56: =+B56*$D$7 -> 3.218 | F56: L - Lowell Larimar Road
A57: =+A56+B57 -> 128.4 | B57: 0.70000000000000284 | C57: =+A57*$D$7 -> 206.59560000000002 | D57: =+B57*$D$7 -> 1.1263000000000045 | F57: L - 56 th Ave. SE
A58: =+A57+B58 -> 129.8 | B58: 1.4000000000000057 | C58: =+A58*$D$7 -> 208.84820000000002 | D58: =+B58*$D$7 -> 2.252600000000009 | F58: R - Seattle Hill Road
A59: =+A58+B59 -> 130.0 | B59: 0.19999999999998863 | C59: =+A59*$D$7 -> 209.17 | D59: =+B59*$D$7 -> 0.32179999999998171 | F59: L - 132 nd
A60: =+A59+B60 -> 131.4 | B60: 1.4000000000000057 | C60: =+A60*$D$7 -> 211.42260000000002 | D60: =+B60*$D$7 -> 2.252600000000009 | F60: R - 142 nd Street
A61: =+A60+B61 -> 131.5 | B61: 9.9999999999994316E-2 | C61: =+A61*$D$7 -> 211.58349999999999 | D61: =+B61*$D$7 -> 0.16089999999999086 | E61: #5 | F61: R - 63 rd Drive SE