A1: Dist. (Miles) | B1: Leg (Miles) | C1: Turn (Dir) | D1: DRAFT Route | E1: Dist. (Km) | F1: Leg (Km) | G1: =1.609344 -> 1.6093440000000001 | H1: Mileage conversion to Km.
A2: 0.00 | B2: =A3-A2 -> 0.00 | D2: CONTROL #1. Start at Greg Cox's house Open 7:00 AM Close 8:00 AM | E2: =A2*$G$1 -> 0.00 | F2: =B2*$G$1 -> 0.00
A3: =A2+B3 -> 0.00 | B3: 0.00 | C3: (N) | D3: 144th Ave SE | E3: =A3*$G$1 -> 0.00 | F3: =B3*$G$1 -> 0.00
A4: =A3+B4 -> 00.2 | B4: 00.2 | C4: R (E) | D4: SE 240th | E4: =A4*$G$1 -> 0.32186880000000007 | F4: =B4*$G$1 -> 0.32186880000000007
A5: =A4+B5 -> 0.50 | B5: 00.3 | C5: L (N) | D5: Hard left at the bottom of the hill onto 148th Ave SE | E5: =A5*$G$1 -> 0.80467200000000005 | F5: =B5*$G$1 -> 0.48280319999999999
A6: =A5+B6 -> 00.6 | B6: 00.1 | C6: R (W) | D6: Quick right onto the Soos Creek Trail | E6: =A6*$G$1 -> 0.96560639999999998 | F6: =B6*$G$1 -> 0.16093440000000003
A7: =A6+B7 -> 00.9 | B7: 00.3 | C7: ST | D7: Crosses SE 240th
A8: =A7+B8 -> 2.80 | B8: 1.90 | C8: L(S) | D8: 148th Ave SE | E8: =A8*$G$1 -> 4.5061631999999996 | F8: =B8*$G$1 -> 3.0577535999999998
A9: =A8+B9 -> 3.30 | B9: 0.50 | C9: ST (S) | D9: 152nd Ave SE (Turns into Kent Black Diamond Road) | E9: =A9*$G$1 -> 5.3108351999999996 | F9: =B9*$G$1 -> 0.80467200000000005
A10: =A9+B10 -> 11.90 | B10: 8.60 | C10: R (SE) | D10: Morgan Street | E10: =A10*$G$1 -> 19.151193599999999 | F10: =B10*$G$1 -> 13.8403584
A11: =A10+B11 -> 12.60 | B11: 00.7 | D11: Control #2. Black Diamond Bakery Open 7:35 AM Close 8:20 AM | E11: =A11*$G$1 -> 20.277734399999996 | F11: =B11*$G$1 -> 1.1265407999999999
A12: =A11+B12 -> 12.60 | B12: 0.00 | C12: L(N) | D12: Re-trace on Railroad Ave | E12: =A12*$G$1 -> 20.277734399999996 | F12: =B12*$G$1 -> 0.00
A13: =A12+B13 -> 12.80 | B13: 00.2 | C13: R(E) | D13: Baker St | E13: =A13*$G$1 -> 20.599603199999997 | F13: =B13*$G$1 -> 0.32186880000000007
A14: =A13+B14 -> 13.00 | B14: 00.2 | C14: L(N) | D14: 3rd Ave. (Hwy 169) | E14: =A14*$G$1 -> 20.921471999999994 | F14: =B14*$G$1 -> 0.32186880000000007
A15: =A14+B15 -> 13.50 | B15: 0.50 | C15: R(NE) | D15: Black Diamond Ravensdale Rd | E15: =A15*$G$1 -> 21.726143999999994 | F15: =B15*$G$1 -> 0.80467200000000005
A16: =A15+B16 -> 17.10 | B16: 3.60 | C16: ST | D16: Onto Landsburg RD SE (Crosses SE Kent Kangly Rd.) | E16: =A16*$G$1 -> 27.519782399999997 | F16: =B16*$G$1 -> 5.7936384000000007
A17: =A16+B17 -> 21.70 | B17: 4.60 | C17: R | D17: Control #3. Hobart Market Open 8:02 AM Close 9:20 AM | E17: =A17*$G$1 -> 34.922764799999996 | F17: =B17*$G$1 -> 7.4029824
A18: =A17+B18 -> 21.70 | B18: 0.00 | C18: L | D18: Re-trace on 276th Ave SE | E18: =A18*$G$1 -> 34.922764799999996 | F18: =B18*$G$1 -> 0.00
A19: =A18+B19 -> 26.30 | B19: 4.60 | C19: L (E) | D19: Kent Kangly Rd | E19: =A19*$G$1 -> 42.325747199999995 | F19: =B19*$G$1 -> 7.4029824
A20: =A19+B20 -> 27.40 | B20: 1.10 | C20: R (S) | D20: Retreat Kanaskat RD | E20: =A20*$G$1 -> 44.096025599999997 | F20: =B20*$G$1 -> 1.7702784000000003
A21: =A20+B21 -> 30.60 | B21: 3.20 | C21: R (S) | D21: Cumberland Kanaskat RD | E21: =A21*$G$1 -> 49.245926400000002 | F21: =B21*$G$1 -> 5.1499008000000011
A22: =A21+B22 -> 40.30 | B22: 9.70 | C22: ST | D22: Cross Hwy 410 | E22: =A22*$G$1 -> 64.856563199999997 | F22: =B22*$G$1 -> 15.6106368
A23: =A22+B23 -> 40.40 | B23: 00.1 | C23: L | D23: Control #4. Enumclaw Open 8:55 AM Close 11:20 AM | E23: =A23*$G$1 -> 65.017497599999999 | F23: =B23*$G$1 -> 0.16093440000000003
A24: =A23+B24 -> 40.40 | B24: 0.00 | C24: L | D24: 284th Ave SE (Past King County Fairgrounds) | E24: =A24*$G$1 -> 65.017497599999999 | F24: =B24*$G$1 -> 0.00
A25: =A24+B25 -> 40.44 | B25: 00.04 | C25: R (W) | D25: SE 456th St | E25: =A25*$G$1 -> 65.081871359999994 | F25: =B25*$G$1 -> 6.4373760000000002E-2
A26: =A25+B26 -> 42.24 | B26: 1.80 | C26: L (S) | D26: Enumclaw-Buckley Rd (SR 410) | E26: =A26*$G$1 -> 67.97869055999999 | F26: =B26*$G$1 -> 2.8968192000000004
A27: =A26+B27 -> 44.34 | B27: 2.10 | C27: L (SW) | D27: Park Ave | E27: =A27*$G$1 -> 71.358312959999992 | F27: =B27*$G$1 -> 3.3796224000000006
A28: =A27+B28 -> 44.44 | B28: 00.1 | C28: R (S) | D28: River Ave | E28: =A28*$G$1 -> 71.519247359999994 | F28: =B28*$G$1 -> 0.16093440000000003
A29: =A28+B29 -> 45.14 | B29: 00.7 | C29: ST | D29: SR 165E | E29: =A29*$G$1 -> 72.645788160000009 | F29: =B29*$G$1 -> 1.1265407999999999
A30: =A29+B30 -> 46.74 | B30: 1.60 | C30: BR | D30: SR 162 | E30: =A30*$G$1 -> 75.220738560000015 | F30: =B30*$G$1 -> 2.5749504000000005
A31: =A30+B31 -> 48.84 | B31: 2.10 | C31: BL | D31: SR 162 | E31: =A31*$G$1 -> 78.600360960000017 | F31: =B31*$G$1 -> 3.3796224000000006
A32: =A31+B32 -> 49.24 | B32: 00.4 | C32: ST | D32: SR 162 (South Prairie) | E32: =A32*$G$1 -> 79.244098560000012 | F32: =B32*$G$1 -> 0.64373760000000013
A33: =A32+B33 -> 55.64 | B33: 6.40 | C33: L (S) | D33: Orville Road East | E33: =A33*$G$1 -> 89.543900160000007 | F33: =B33*$G$1 -> 10.299801600000002
A34: =A33+B34 -> 64.84 | B34: 9.20 | C34: L (S) | D34: Orville Road East | E34: =A34*$G$1 -> 104.34986496000002 | F34: =B34*$G$1 -> 14.8059648
A35: =A34+B35 -> 73.74 | B35: 8.90 | C35: L (S) | D35: SR 161 | E35: =A35*$G$1 -> 118.67302656000003 | F35: =B35*$G$1 -> 14.323161600000002
A36: =A35+B36 -> 75.04 | B36: 1.30 | D36: Control #5. Eatonville (Open) Open 10:34 AM Close 3:04 AM | E36: =A36*$G$1 -> 120.76517376000002 | F36: =B36*$G$1 -> 2.0921472000000003
A37: =A36+B37 -> 75.04 | D37: Return on SR 161 | E37: =A37*$G$1 -> 120.76517376000002 | F37: =B37*$G$1 -> 0.00
A38: =A37+B38 -> 76.34 | B38: 1.30 | C38: R (N) | D38: Orville Road East | E38: =A38*$G$1 -> 122.85732096000001 | F38: =B38*$G$1 -> 2.0921472000000003
A39: =A38+B39 -> 85.24 | B39: 8.90 | C39: R (E) | D39: Orville Road East | E39: =A39*$G$1 -> 137.18048256000003 | F39: =B39*$G$1 -> 14.323161600000002
A40: =A39+B40 -> 94.44 | B40: 9.20 | C40: R (E) | D40: SR 162 (S. Pioneer Way) | E40: =A40*$G$1 -> 151.98644736000003 | F40: =B40*$G$1 -> 14.8059648
A41: =A40+B41 -> 104.94 | B41: 10.50 | C41: BR | D41: S. River Ave (Buckley) | E41: =A41*$G$1 -> 168.88455936000003 | F41: =B41*$G$1 -> 16.898112000000001
A42: =A41+B42 -> 105.64 | B42: 00.7 | C42: L | D42: Park Ave | E42: =A42*$G$1 -> 170.01110016000004 | F42: =B42*$G$1 -> 1.1265407999999999
A43: =A42+B43 -> 105.74 | B43: 00.1 | C43: R (N) | D43: Enumclaw-Buckley Rd (SR 410) | E43: =A43*$G$1 -> 170.17203456000001 | F43: =B43*$G$1 -> 0.16093440000000003
A44: =A43+B44 -> 106.54 | B44: 00.8 | C44: L (N) | D44: 244th Ave SE (Careful at this intersection) | E44: =A44*$G$1 -> 171.45950976000003 | F44: =B44*$G$1 -> 1.2874752000000003
A45: =A44+B45 -> 112.04 | B45: 5.50 | C45: L (W) | D45: SE 384th St | E45: =A45*$G$1 -> 180.31090176000004 | F45: =B45*$G$1 -> 8.8513920000000006
A46: =A45+B46 -> 112.54 | B46: 0.50 | C46: R (N) | D46: 236th Ave SE (Becomes Whitney Hill Rd) | E46: =A46*$G$1 -> 181.11557376000002 | F46: =B46*$G$1 -> 0.80467200000000005
A47: =A46+B47 -> 115.04 | B47: 2.50 | C47: R (N) | D47: 212th way SE | E47: =A47*$G$1 -> 185.13893376000001 | F47: =B47*$G$1 -> 4.0233600000000003
A48: =A47+B48 -> 115.64 | B48: 00.6 | C48: ST | D48: Continue up 218th Ave SE (Cross SE Green Valley RD) | E48: =A48*$G$1 -> 186.10454016000003 | F48: =B48*$G$1 -> 0.96560639999999998
A49: =A48+B49 -> 116.84 | B49: 1.20 | C49: L (W) | D49: Auburn Black Diamond Road | E49: =A49*$G$1 -> 188.03575296000002 | F49: =B49*$G$1 -> 1.9312128
A50: =A49+B50 -> 123.44 | B50: 6.60 | C50: ST | D50: Cross Kent Kangly Road onto 152nd AVE SE | E50: =A50*$G$1 -> 198.65742336 | F50: =B50*$G$1 -> 10.621670399999999
A51: =A50+B51 -> 123.94 | B51: 0.50 | C51: R (E) | D51: Onto Soos Creek Trail | E51: =A51*$G$1 -> 199.46209536000001 | F51: =B51*$G$1 -> 0.80467200000000005
A52: =A51+B52 -> 125.84 | B52: 1.90 | C52: ST | D52: Crosses SE 240th | E52: =A52*$G$1 -> 202.51984896000002 | F52: =B52*$G$1 -> 3.0577535999999998
A53: =A52+B53 -> 126.14 | B53: 00.3 | C53: L (S) | D53: 148th Ave SE | E53: =A53*$G$1 -> 203.00265216000003 | F53: =B53*$G$1 -> 0.48280319999999999
A54: =A53+B54 -> 126.24 | B54: 00.1 | C54: R (W) | D54: Hard Right to go up SE 240th | E54: =A54*$G$1 -> 203.16358656 | F54: =B54*$G$1 -> 0.16093440000000003
A55: =A54+B55 -> 126.54 | B55: 00.3 | C55: L (S) | D55: 144th Ave SE - Ridgefield | E55: =A55*$G$1 -> 203.64638976000001 | F55: =B55*$G$1 -> 0.48280319999999999
A56: =A55+B56 -> 126.74 | B56: 00.2 | C56: L (E) | D56: SE 243rd | E56: =A56*$G$1 -> 203.96825856000001 | F56: =B56*$G$1 -> 0.32186880000000007
A57: =A56+B57 -> 126.84 | B57: 00.1 | C57: L (N) | D57: Finish Greg Cox's house Open 12:53 PM Close 8:30 PM | E57: =A57*$G$1 -> 204.12919295999998 | F57: =B57*$G$1 -> 0.16093440000000003
D59: Greg & Mary Cox 24308 147th Ave SE Kent 98042
D60: Home: 253-639-2928 Cell: 206-459-3530
D61: Bill Dussler - Cell: 206-713-7550
D63: Join us for Barbecue, Chile, Munchies and Drinks after the ride.