C1: Seattle International Randonneurs 200 km Brevet - March 13th, 1999
C2: status: all verified by bicycle | D2: 1.609 | F2: Unoffical
A3: Miles | B3: Leg | C3: Control# & Instructions | D3: Km | E3: Leg | F3: Mi. | G3: km
B4: 0.0 | C4: #1 START - Marymoor Pk; west, Marymoor Way | D4: =$D$2*A4 -> 0.0 | E4: =$D$2*B4 -> 0.0 | F4: 0 | G4: =$D$2*F4 -> 0
B5: 00.3 | C5: L - West LK Sammamish NE | D5: =$D$2*A5 -> 0.0 | E5: =$D$2*B5 -> 0.48269999999999996 | F5: =F4+B5 -> 00.3 | G5: =$D$2*F5 -> 0.48269999999999996
B6: 00.9 | C6: L - West LK Sammamish NE at stop light | D6: =$D$2*A6 -> 0.0 | E6: =$D$2*B6 -> 1.4481 | F6: =F5+B6 -> 1.2 | G6: =$D$2*F6 -> 1.9307999999999998
A7: 0.0 | B7: 00.3 | C7: ST - X 172ND AVE NE (official distance starts) | D7: =$D$2*A7 -> 0.0 | E7: =$D$2*B7 -> 0.48269999999999996 | F7: =F6+B7 -> 1.5 | G7: =$D$2*F7 -> 2.4135
A8: =A7+B8 -> 7.2 | B8: 7.2 | C8: L - (roundabout) W. LK Sammamish Parkway SE | D8: =$D$2*A8 -> 11.5848 | E8: =$D$2*B8 -> 11.5848 | F8: =$F$7+A8 -> 8.7 | G8: =$D$2*F8 -> 13.998299999999999
A9: =A8+B9 -> 9.5 | B9: 2.3 | C9: L - NW Sammamish Rd, at stop light | D9: =$D$2*A9 -> 15.285499999999999 | E9: =$D$2*B9 -> 3.7007 | F9: =$F$7+A9 -> 11.0 | G9: =$D$2*F9 -> 17.698999999999998
A10: =A9+B10 -> 10.1 | B10: 00.6 | C10: R - 221st PL (small road) | D10: =$D$2*A10 -> 16.250899999999998 | E10: =$D$2*B10 -> 0.96539999999999992 | F10: =$F$7+A10 -> 11.6 | G10: =$D$2*F10 -> 18.6644
A11: =A10+B11 -> 10.5 | B11: 00.4 | C11: L - Follow road, no choice. RR after left turn. | D11: =$D$2*A11 -> 16.8945 | E11: =$D$2*B11 -> 0.64360000000000006 | F11: =$F$7+A11 -> 12.0 | G11: =$D$2*F11 -> 19.308
A12: =A11+B12 -> 10.6 | B12: 00.1 | C12: R - East LK Sammamish Parkway SE | D12: =$D$2*A12 -> 17.0554 | E12: =$D$2*B12 -> 0.16090000000000002 | F12: =$F$7+A12 -> 12.1 | G12: =$D$2*F12 -> 19.468899999999998
A13: =A12+B13 -> 10.8 | B13: 00.2 | C13: L - Issaquah Fall City Rd (climb) | D13: =$D$2*A13 -> 17.3772 | E13: =$D$2*B13 -> 0.32180000000000003 | F13: =$F$7+A13 -> 12.3 | G13: =$D$2*F13 -> 19.790699999999998
A14: =A13+B14 -> 11.9 | B14: 1.1 | C14: R - Issaquah Fall City Rd at stop light | D14: =$D$2*A14 -> 19.1471 | E14: =$D$2*B14 -> 1.7699 | F14: =$F$7+A14 -> 13.4 | G14: =$D$2*F14 -> 21.560599999999997
A15: =A14+B15 -> 13.7 | B15: 1.8 | C15: R - Issaquah Fall City Rd (just beyond school) | D15: =$D$2*A15 -> 22.0433 | E15: =$D$2*B15 -> 2.8962 | F15: =$F$7+A15 -> 15.2 | G15: =$D$2*F15 -> 24.456799999999998
A16: =A15+B16 -> 16.3 | B16: 2.6 | C16: R - Issaquah Fall City Rd (use brakes hard) | D16: =$D$2*A16 -> 26.2267 | E16: =$D$2*B16 -> 4.1834 | F16: =$F$7+A16 -> 17.8 | G16: =$D$2*F16 -> 28.6402
A17: =A16+B17 -> 18.6 | B17: 2.3 | C17: L - 332nd | D17: =$D$2*A17 -> 29.927400000000002 | E17: =$D$2*B17 -> 3.7007 | F17: =$F$7+A17 -> 20.1 | G17: =$D$2*F17 -> 32.340900000000005
A18: =A17+B18 -> 19.2 | B18: 00.6 | C18: R - SE 42nd | D18: =$D$2*A18 -> 30.892800000000005 | E18: =$D$2*B18 -> 0.96539999999999992 | F18: =$F$7+A18 -> 20.7 | G18: =$D$2*F18 -> 33.306300000000007
A19: =A18+B19 -> 19.4 | B19: 00.2 | C19: BR - Redmond-Fall City Rd (at Fall City totem pole) | D19: =$D$2*A19 -> 31.214600000000004 | E19: =$D$2*B19 -> 0.32180000000000003 | F19: =$F$7+A19 -> 20.9 | G19: =$D$2*F19 -> 33.6281
A20: =A19+B20 -> 19.7 | B20: 00.3 | C20: BL - Follow Highway 202 toward Snoqualmie Falls | D20: =$D$2*A20 -> 31.697300000000006 | E20: =$D$2*B20 -> 0.48269999999999996 | F20: =$F$7+A20 -> 21.2 | G20: =$D$2*F20 -> 34.110800000000005
A21: =A20+B21 -> 19.8 | B21: 00.1 | C21: BR - Follow 202 toward Snoqualmie Falls | D21: =$D$2*A21 -> 31.858200000000007 | E21: =$D$2*B21 -> 0.16090000000000002 | F21: =$F$7+A21 -> 21.3 | G21: =$D$2*F21 -> 34.27170000000001
A22: =A21+B22 -> 23.6 | B22: 3.8 | C22: ST - Snoq. Falls Overlook (restrooms on right) | D22: =$D$2*A22 -> 37.972400000000007 | E22: =$D$2*B22 -> 6.1141999999999994 | F22: =$F$7+A22 -> 25.1 | G22: =$D$2*F22 -> 40.385900000000007
A23: =A22+B23 -> 23.9 | B23: 00.3 | C23: L Millpond Rd | D23: =$D$2*A23 -> 38.455100000000009 | E23: =$D$2*B23 -> 0.48269999999999996 | F23: =$F$7+A23 -> 25.4 | G23: =$D$2*F23 -> 40.868600000000008
A24: =A23+B24 -> 25.3 | B24: 1.4 | C24: R SE Reinig Rd | D24: =$D$2*A24 -> 40.70770000000001 | E24: =$D$2*B24 -> 2.2525999999999997 | F24: =$F$7+A24 -> 26.8 | G24: =$D$2*F24 -> 43.121200000000009
A25: =A24+B25 -> 25.5 | B25: 00.2 | C25: L Park St | D25: =$D$2*A25 -> 41.029500000000006 | E25: =$D$2*B25 -> 0.32180000000000003 | F25: =$F$7+A25 -> 27.0 | G25: =$D$2*F25 -> 43.443000000000005
A26: =A25+B26 -> 26.2 | B26: 00.7 | C26: #2 Control at Mt Si Golf course, continue ST | D26: =$D$2*A26 -> 42.155800000000006 | E26: =$D$2*B26 -> 1.1262999999999999 | F26: =$F$7+A26 -> 27.7 | G26: =$D$2*F26 -> 44.569300000000005
A27: =A26+B27 -> 27.4 | B27: 1.2 | C27: R onto Bendigo Blvd | D27: =$D$2*A27 -> 44.086600000000004 | E27: =$D$2*B27 -> 1.9307999999999998 | F27: =$F$7+A27 -> 28.9 | G27: =$D$2*F27 -> 46.5001
A28: =A27+B28 -> 34.5 | B28: 7.1 | C28: BL - Follow Highway 202 toward into Fall City | D28: =$D$2*A28 -> 55.5105 | E28: =$D$2*B28 -> 11.4239 | F28: =$F$7+A28 -> 36.0 | G28: =$D$2*F28 -> 57.924
A29: =A28+B29 -> 34.6 | B29: 00.1 | C29: BR - Follow Redmond-Fall City Rd toward Redmond. | D29: =$D$2*A29 -> 55.6714 | E29: =$D$2*B29 -> 0.16090000000000002 | F29: =$F$7+A29 -> 36.1 | G29: =$D$2*F29 -> 58.084900000000005
A30: =A29+B30 -> 35.7 | B30: 1.1 | C30: R - 324th AVE SE | D30: =$D$2*A30 -> 57.441300000000005 | E30: =$D$2*B30 -> 1.7699 | F30: =$F$7+A30 -> 37.2 | G30: =$D$2*F30 -> 59.854800000000004
A31: =A30+B31 -> 36.9 | B31: 1.2 | C31: R - 316th SE | D31: =$D$2*A31 -> 59.37210000000001 | E31: =$D$2*B31 -> 1.9307999999999998 | F31: =$F$7+A31 -> 38.4 | G31: =$D$2*F31 -> 61.785600000000009
A32: =A31+B32 -> 37.4 | B32: 0.5 | C32: R - West Snoqualmie River Rd SE | D32: =$D$2*A32 -> 60.176600000000008 | E32: =$D$2*B32 -> 0.8045 | F32: =$F$7+A32 -> 38.9 | G32: =$D$2*F32 -> 62.590100000000007
A33: =A32+B33 -> 41.3 | B33: 3.9 | C33: R - Tolt Hill Rd (cross bridge) | D33: =$D$2*A33 -> 66.4517 | E33: =$D$2*B33 -> 6.2751 | F33: =$F$7+A33 -> 42.8 | G33: =$D$2*F33 -> 68.8652
A34: =A33+B34 -> 42.0 | B34: 00.7 | C34: L - Fall City-Carnation Rd toward Carnation | D34: =$D$2*A34 -> 67.578000000000017 | E34: =$D$2*B34 -> 1.1262999999999999 | F34: =$F$7+A34 -> 43.5 | G34: =$D$2*F34 -> 69.991500000000016
A35: =A34+B35 -> 43.5 | B35: 1.5 | C35: L - NE Carnation Farm Rd | D35: =$D$2*A35 -> 69.991500000000016 | E35: =$D$2*B35 -> 2.4135 | F35: =$F$7+A35 -> 45.0 | G35: =$D$2*F35 -> 72.405
A36: =A35+B36 -> 46.2 | B36: 2.7 | C36: R - 284th AVE NE | D36: =$D$2*A36 -> 74.33580000000002 | E36: =$D$2*B36 -> 4.3443000000000005 | F36: =$F$7+A36 -> 47.7 | G36: =$D$2*F36 -> 76.749300000000019
A37: =A36+B37 -> 48.1 | B37: 1.9 | C37: R - West Snoq. Valley Rd | D37: =$D$2*A37 -> 77.392900000000012 | E37: =$D$2*B37 -> 3.0570999999999997 | F37: =$F$7+A37 -> 49.6 | G37: =$D$2*F37 -> 79.806400000000011
A38: =A37+B38 -> 57.2 | B38: 9.1 | C38: R - Crescent LK Rd (cross bridge) | D38: =$D$2*A38 -> 92.034800000000018 | E38: =$D$2*B38 -> 14.6419 | F38: =$F$7+A38 -> 58.7 | G38: =$D$2*F38 -> 94.448300000000017
A39: =A38+B39 -> 58.3 | B39: 1.1 | C39: ST - pass 203rd | D39: =$D$2*A39 -> 93.804700000000011 | E39: =$D$2*B39 -> 1.7699 | F39: =$F$7+A39 -> 59.8 | G39: =$D$2*F39 -> 96.218200000000024
A40: =A39+B40 -> 58.6 | B40: 00.3 | C40: BR - Tualco Rd | D40: =$D$2*A40 -> 94.287400000000019 | E40: =$D$2*B40 -> 0.48269999999999996 | F40: =$F$7+A40 -> 60.1 | G40: =$D$2*F40 -> 96.700900000000019
A41: =A40+B41 -> 59.6 | B41: 1.0 | C41: R - follow Tualco Rd not Loop Rd | D41: =$D$2*A41 -> 95.896400000000014 | E41: =$D$2*B41 -> 1.609 | F41: =$F$7+A41 -> 61.1 | G41: =$D$2*F41 -> 98.309900000000013
A42: =A41+B42 -> 60.4 | B42: 00.8 | C42: L - SR 203N (unmarked highway) | D42: =$D$2*A42 -> 97.183600000000013 | E42: =$D$2*B42 -> 1.2872000000000001 | F42: =$F$7+A42 -> 61.9 | G42: =$D$2*F42 -> 99.597100000000012
A43: =A42+B43 -> 61.5 | B43: 1.1 | C43: ST - public rest rooms (after bridge) | D43: =$D$2*A43 -> 98.9535 | E43: =$D$2*B43 -> 1.7699 | F43: =$F$7+A43 -> 63.0 | G43: =$D$2*F43 -> 101.367
A44: =A43+B44 -> 62.3 | B44: 00.8 | C44: X - US2 | D44: =$D$2*A44 -> 100.2407 | E44: =$D$2*B44 -> 1.2872000000000001 | F44: =$F$7+A44 -> 63.8 | G44: =$D$2*F44 -> 102.6542
A45: =A44+B45 -> 62.4 | B45: 00.1 | C45: R - Into shopping mall along front of Ben Franklin | D45: =$D$2*A45 -> 100.4016 | E45: =$D$2*B45 -> 0.16090000000000002 | F45: =$F$7+A45 -> 63.9 | G45: =$D$2*F45 -> 102.81510000000002
A46: =A45+B46 -> 62.6 | B46: 00.2 | C46: L - Woods Cr Rd, unmarked stop sign | D46: =$D$2*A46 -> 100.72340000000001 | E46: =$D$2*B46 -> 0.32180000000000003 | F46: =$F$7+A46 -> 64.1 | G46: =$D$2*F46 -> 103.13690000000001
A47: =A46+B47 -> 62.7 | B47: 00.1 | C47: ST X Oak St. (Pass sign for Woods Cr Rd on right). | D47: =$D$2*A47 -> 100.88430000000001 | E47: =$D$2*B47 -> 0.16090000000000002 | F47: =$F$7+A47 -> 64.2 | G47: =$D$2*F47 -> 103.29780000000002
A48: =A47+B48 -> 64.2 | B48: 1.5 | C48: BR - Yeagar Rd | D48: =$D$2*A48 -> 103.29780000000002 | E48: =$D$2*B48 -> 2.4135 | F48: =$F$7+A48 -> 65.7 | G48: =$D$2*F48 -> 105.71130000000002
A49: =A48+B49 -> 66.0 | B49: 1.8 | C49: R - Woods Cr Rd | D49: =$D$2*A49 -> 106.19400000000002 | E49: =$D$2*B49 -> 2.8962 | F49: =$F$7+A49 -> 67.5 | G49: =$D$2*F49 -> 108.6075
A50: =A49+B50 -> 73.5 | B50: 7.5 | C50: R - S. LK Roesiger Rd (take East side of lake) | D50: =$D$2*A50 -> 118.26150000000003 | E50: =$D$2*B50 -> 12.0675 | F50: =$F$7+A50 -> 75.0 | G50: =$D$2*F50 -> 120.675
A51: =A50+B51 -> 74.6 | B51: 1.1 | C51: ST - Lake Roesiger Park (possible rest rooms) | D51: =$D$2*A51 -> 120.03140000000002 | E51: =$D$2*B51 -> 1.7699 | F51: =$F$7+A51 -> 76.1 | G51: =$D$2*F51 -> 122.44490000000002
A52: =A51+B52 -> 75.9 | B52: 1.3 | C52: ST - Lake Roesiger Store (possible rest rooms) | D52: =$D$2*A52 -> 122.12310000000001 | E52: =$D$2*B52 -> 2.0917 | F52: =$F$7+A52 -> 77.4 | G52: =$D$2*F52 -> 124.5366
A53: =A52+B53 -> 79.1 | B53: 3.2 | C53: ST - pass N. Carpenter Rd - stay on Menzel Lake Rd | D53: =$D$2*A53 -> 127.27190000000002 | E53: =$D$2*B53 -> 5.1488000000000005 | F53: =$F$7+A53 -> 80.6 | G53: =$D$2*F53 -> 129.68540000000002
A54: =A53+B54 -> 85.1 | B54: 6.0 | C54: R - S Alder Ave, just past the Granite Falls sign | D54: =$D$2*A54 -> 136.9259 | E54: =$D$2*B54 -> 9.654 | F54: =$F$7+A54 -> 86.6 | G54: =$D$2*F54 -> 139.3394
A55: =A54+B55 -> 85.4 | B55: 00.3 | C55: L - E. Stanley St | D55: =$D$2*A55 -> 137.4086 | E55: =$D$2*B55 -> 0.48269999999999996 | F55: =$F$7+A55 -> 86.9 | G55: =$D$2*F55 -> 139.8221
A56: =A55+B56 -> 86.0 | B56: 00.6 | C56: Control #3 - Granite Falls Chevron/McDonalds | D56: =$D$2*A56 -> 138.374 | E56: =$D$2*B56 -> 0.96539999999999992 | F56: =$F$7+A56 -> 87.5 | G56: =$D$2*F56 -> 140.7875
A57: =A56+B57 -> 86.0 | B57: 0.0 | C57: L - Stanley St | D57: =$D$2*A57 -> 138.374 | E57: =$D$2*B57 -> 0.0 | F57: =$F$7+A57 -> 87.5 | G57: =$D$2*F57 -> 140.7875
A58: =A57+B58 -> 91.3 | B58: 5.3 | C58: L - Machias Rd | D58: =$D$2*A58 -> 146.9017 | E58: =$D$2*B58 -> 8.5277 | F58: =$F$7+A58 -> 92.8 | G58: =$D$2*F58 -> 149.3152
A59: =A58+B59 -> 92.6 | B59: 1.3 | C59: JR - Centennial Trail, unmarked multi-use path | D59: =$D$2*A59 -> 148.99339999999998 | E59: =$D$2*B59 -> 2.0917 | F59: =$F$7+A59 -> 94.1 | G59: =$D$2*F59 -> 151.40689999999998
A60: =A59+B60 -> 99.9 | B60: 7.3 | C60: End trail - Jog Right onto Maple St. heading South | D60: =$D$2*A60 -> 160.73909999999998 | E60: =$D$2*B60 -> 11.7457 | F60: =$F$7+A60 -> 101.4 | G60: =$D$2*F60 -> 163.15259999999998
A61: =A60+B61 -> 100.8 | B61: 00.9 | C61: R - 1st Street onto waterfront district of Snohomish | D61: =$D$2*A61 -> 162.1872 | E61: =$D$2*B61 -> 1.4481 | F61: =$F$7+A61 -> 102.3 | G61: =$D$2*F61 -> 164.6007
A62: =A61+B62 -> 101.0 | B62: 00.2 | C62: ST - public rest rooms on left | D62: =$D$2*A62 -> 162.509 | E62: =$D$2*B62 -> 0.32180000000000003 | F62: =$F$7+A62 -> 102.5 | G62: =$D$2*F62 -> 164.9225
A63: =A62+B63 -> 101.1 | B63: 00.1 | C63: L - Avenue D (cross bridge) | D63: =$D$2*A63 -> 162.66989999999998 | E63: =$D$2*B63 -> 0.16090000000000002 | F63: =$F$7+A63 -> 102.6 | G63: =$D$2*F63 -> 165.08339999999998
A64: =A63+B64 -> 102.4 | B64: 1.3 | C64: JR - SR9 S. | D64: =$D$2*A64 -> 164.7616 | E64: =$D$2*B64 -> 2.0917 | F64: =$F$7+A64 -> 103.9 | G64: =$D$2*F64 -> 167.1751
A65: =A64+B65 -> 113.3 | B65: 10.9 | C65: L - NE Woodinville Way (at stop light, climbs big hill) | D65: =$D$2*A65 -> 182.2997 | E65: =$D$2*B65 -> 17.5381 | F65: =$F$7+A65 -> 114.8 | G65: =$D$2*F65 -> 184.7132
A66: =A65+B66 -> 114.1 | B66: 00.8 | C66: ST - becomes Woodinville-Duvall Rd, continue up | D66: =$D$2*A66 -> 183.58689999999999 | E66: =$D$2*B66 -> 1.2872000000000001 | F66: =$F$7+A66 -> 115.6 | G66: =$D$2*F66 -> 186.00039999999998
A67: =A66+B67 -> 117.0 | B67: 2.9 | C67: Control #4 Zip Mini-Market on right | D67: =$D$2*A67 -> 188.253 | E67: =$D$2*B67 -> 4.6661 | F67: =$F$7+A67 -> 118.5 | G67: =$D$2*F67 -> 190.66649999999998
A68: =A67+B68 -> 117.1 | B68: 00.1 | C68: R - Avondale Rd, heading south at stop light | D68: =$D$2*A68 -> 188.41389999999998 | E68: =$D$2*B68 -> 0.16090000000000002 | F68: =$F$7+A68 -> 118.6 | G68: =$D$2*F68 -> 190.82739999999998
A69: =A68+B69 -> 122.9 | B69: 5.8 | C69: BR - Avondale Way | D69: =$D$2*A69 -> 197.74609999999998 | E69: =$D$2*B69 -> 9.3322 | F69: =$F$7+A69 -> 124.4 | G69: =$D$2*F69 -> 200.15959999999998
A70: =A69+B70 -> 123.3 | B70: 00.4 | C70: L - 170th PL | D70: =$D$2*A70 -> 198.3897 | E70: =$D$2*B70 -> 0.64360000000000006 | F70: =$F$7+A70 -> 124.8 | G70: =$D$2*F70 -> 200.8032
A71: =A70+B71 -> 123.4 | B71: 00.1 | C71: ST - X Redmond Way, becomes Bear Cr Pkwy | D71: =$D$2*A71 -> 198.55059999999997 | E71: =$D$2*B71 -> 0.16090000000000002 | F71: =$F$7+A71 -> 124.9 | G71: =$D$2*F71 -> 200.96409999999997
A72: =A71+B72 -> 124.3 | B72: 00.9 | C72: L - Leary Way | D72: =$D$2*A72 -> 199.99869999999999 | E72: =$D$2*B72 -> 1.4481 | F72: =$F$7+A72 -> 125.8 | G72: =$D$2*F72 -> 202.41219999999998
A73: =A72+B73 -> 124.5 | B73: 00.2 | C73: L - W. LK Sammamish Pkwy | D73: =$D$2*A73 -> 200.3205 | E73: =$D$2*B73 -> 0.32180000000000003 | F73: =$F$7+A73 -> 126.0 | G73: =$D$2*F73 -> 202.734
A74: =A73+B74 -> 125.1 | B74: 00.6 | C74: ST - pass NE Marymoor Way | D74: =$D$2*A74 -> 201.2859 | E74: =$D$2*B74 -> 0.96539999999999992 | F74: =$F$7+A74 -> 126.6 | G74: =$D$2*F74 -> 203.6994
A75: =A74+B75 -> 126.0 | B75: 00.9 | C75: L - West LK Sammamish NE at light | D75: =$D$2*A75 -> 202.734 | E75: =$D$2*B75 -> 1.4481 | F75: =$F$7+A75 -> 127.5 | G75: =$D$2*F75 -> 205.1475
A76: =A75+B76 -> 126.3 | B76: 00.3 | C76: R - 172ND AVE NE | D76: =$D$2*A76 -> 203.2167 | E76: =$D$2*B76 -> 0.48269999999999996 | F76: =$F$7+A76 -> 127.8 | G76: =$D$2*F76 -> 205.6302
A77: =A76+B77 -> 126.7 | B77: 00.4 | C77: R - NE 37TH PL (Devonridge) | D77: =$D$2*A77 -> 203.8603 | E77: =$D$2*B77 -> 0.64360000000000006 | F77: =$F$7+A77 -> 128.2 | G77: =$D$2*F77 -> 206.27379999999997
A78: =A77+B78 -> 126.9 | B78: 00.2 | C78: L - 169TH AVE NE | D78: =$D$2*A78 -> 204.18210000000002 | E78: =$D$2*B78 -> 0.32180000000000003 | F78: =$F$7+A78 -> 128.4 | G78: =$D$2*F78 -> 206.59560000000002
A79: =A78+B79 -> 127.0 | B79: 00.1 | C79: #5 Finish - The Demaree's 3590 169TH AVE NE | D79: =$D$2*A79 -> 204.343 | E79: =$D$2*B79 -> 0.16090000000000002 | F79: =$F$7+A79 -> 128.5 | G79: =$D$2*F79 -> 206.7565
A80: Kendall: mobile 425 466 7724, home 425 869 2088; Mark Thomas: mobile 206 612 4700
A81: L = left, R = right, BR = bear right, BL = bear left, ST = straight, TA = turn around, X = cross
A82: JR = jog right, JL = jog left, RR = railroad, SR = state route, US = US hwy
A83: N = north, S = south, E = east, W = west