C1: Seattle International Randonneurs 200 km Brevet - June 12th, 1999
C2: status: all verified by bicycle | D2: 1.609
A3: Miles | B3: Leg | C3: Control# & Instructions | D3: Km | E3: Leg
A4: 0 | B4: 0 | C4: Left from TZ house onto NE 140th St (West) | D4: =+A4 *1.609 -> 0.0 | E4: =+B4 *1.609 -> 0.0
A5: =+A4 + B5 -> 00.1 | B5: 00.1 | C5: R - 232nd St NE | D5: =+A5 *1.609 -> 0.16090000000000002 | E5: =+B5 *1.609 -> 0.16090000000000002
A6: =+A5 + B6 -> 2.2 | B6: 2.1 | C6: L - Old Woodinville-Duvall Rd | D6: =+A6 *1.609 -> 3.5398 | E6: =+B6 *1.609 -> 3.3789000000000002
A7: =+A6 + B7 -> 3.1 | B7: 00.9 | C7: L - Woodinville-Duvall Rd (SS) | D7: =+A7 *1.609 -> 4.9879 | E7: =+B7 *1.609 -> 1.4481
A8: =+A7 + B8 -> 4.5 | B8: 1.4 | C8: R - 204th NE/Paradise Lake Rd (TL) | D8: =+A8 *1.609 -> 7.2405 | E8: =+B8 *1.609 -> 2.2525999999999997
A9: =+A8 + B9 -> 9.3 | B9: 4.8 | C9: ST - Cross SR522 (TL) | D9: =+A9 *1.609 -> 14.963700000000001 | E9: =+B9 *1.609 -> 7.7231999999999994
A10: =+A9 + B10 -> 9.3 | B10: 0 | C10: R - T intersection (unmarked)/Yew Way | D10: =+A10 *1.609 -> 14.963700000000001 | E10: =+B10 *1.609 -> 0.0
A11: =+A10 + B11 -> 9.5 | B11: 00.2 | C11: ST/VR - Stop Sign (Yew Way) | D11: =+A11 *1.609 -> 15.285499999999999 | E11: =+B11 *1.609 -> 0.32180000000000003
A12: =+A11 + B12 -> 9.8 | B12: 00.3 | C12: VL over RR tracks onto Broadway | D12: =+A12 *1.609 -> 15.7682 | E12: =+B12 *1.609 -> 0.48269999999999996
A13: =+A12 + B13 -> 15 | B13: 5.2 | C13: R - Hwy 9 (TL) | D13: =+A13 *1.609 -> 24.135 | E13: =+B13 *1.609 -> 8.3668
A14: =+A13 + B14 -> 25.5 | B14: 10.5 | C14: R - Highway 92 (TL) | D14: =+A14 *1.609 -> 41.0295 | E14: =+B14 *1.609 -> 16.8945
A15: =+A14 + B15 -> 31.1 | B15: 5.6 | C15: L - 161 Ave. NE | D15: =+A15 *1.609 -> 50.0399 | E15: =+B15 *1.609 -> 9.0103999999999989
A16: =+A15 + B16 -> 31.4 | B16: 0.29999999999999716 | C16: L - 163rd Ave. NE | D16: =+A16 *1.609 -> 50.5226 | E16: =+B16 *1.609 -> 0.48269999999999541
A17: =+A16 + B17 -> 32.5 | B17: 1.1 | C17: L - Burn Road | D17: =+A17 *1.609 -> 52.2925 | E17: =+B17 *1.609 -> 1.7699
A18: =+A17 + B18 -> 33.8 | B18: 1.3 | C18: L - 116 th NE | D18: =+A18 *1.609 -> 54.384199999999993 | E18: =+B18 *1.609 -> 2.0917
A19: =+A18 + B19 -> 39.9 | B19: 6.1 | C19: R - Kellogg / Sisco Hights Road (Arlington) | D19: =+A19 *1.609 -> 64.1991 | E19: =+B19 *1.609 -> 9.8149
A20: =+A19 + B20 -> 41.9 | B20: 2.0 | C20: L - Highland Drive | D20: =+A20 *1.609 -> 67.417099999999991 | E20: =+B20 *1.609 -> 3.218
A21: =+A20 + B21 -> 42.1 | B21: 0.20000000000000284 | C21: R - S. French | D21: =+A21 *1.609 -> 67.7389 | E21: =+B21 *1.609 -> 0.32180000000000458
A22: =+A21 + B22 -> 42.6 | B22: 0.5 | C22: L - Third | D22: =+A22 *1.609 -> 68.5434 | E22: =+B22 *1.609 -> 0.8045
A23: =+A22 + B23 -> 42.8 | B23: 0.19999999999999929 | C23: R - N. Olympic | D23: =+A23 *1.609 -> 68.8652 | E23: =+B23 *1.609 -> 0.32179999999999886
A24: =+A23 + B24 -> 43 | B24: 0.19999999999999929 | C24: R - Division | D24: =+A24 *1.609 -> 69.187 | E24: =+B24 *1.609 -> 0.32179999999999886
A25: =+A24 + B25 -> 43.1 | B25: 0.10000000000000142 | C25: L - Broadway | D25: =+A25 *1.609 -> 69.3479 | E25: =+B25 *1.609 -> 0.16090000000000229
A26: =+A25 + B26 -> 43.2 | B26: 9.9999999999997868E-2 | C26: #1 - Thrifty Foods - CONTROL | D26: =+A26 *1.609 -> 69.508800000000008 | E26: =+B26 *1.609 -> 0.16089999999999657
A27: =+A26 + B27 -> 43.2 | B27: 0.0 | C27: R - East on 530 | D27: =+A27 *1.609 -> 69.508800000000008 | E27: =+B27 *1.609 -> 0.0
A28: =+A27 + B28 -> 44 | B28: 0.80000000000000071 | C28: R - Jordan Road | D28: =+A28 *1.609 -> 70.795999999999992 | E28: =+B28 *1.609 -> 1.2872000000000012
A29: =+A28 + B29 -> 45 | B29: 1.0 | C29: R - Jordan Road | D29: =+A29 *1.609 -> 72.405 | E29: =+B29 *1.609 -> 1.609
A30: =+A29 + B30 -> 56.9 | B30: 11.9 | C30: L - Highway 92 (TL) | D30: =+A30 *1.609 -> 91.5521 | E30: =+B30 *1.609 -> 19.147100000000002
A31: =+A30 + B31 -> 57.6 | B31: 0.70000000000000284 | C31: R - Mt. Loop Highway | D31: =+A31 *1.609 -> 92.6784 | E31: =+B31 *1.609 -> 1.1263000000000045
A32: =+A31 + B32 -> 57.8 | B32: 0.19999999999999574 | C32: L - Menzel Lake Road | D32: =+A32 *1.609 -> 93.000199999999992 | E32: =+B32 *1.609 -> 0.32179999999999315
A33: =+A32 + B33 -> 68.4 | B33: 10.6 | C33: L - Woods Creek Road | D33: =+A33 *1.609 -> 110.05559999999998 | E33: =+B33 *1.609 -> 17.0554
A34: =+A33 + B34 -> 75.8 | B34: 7.4 | C34: R - Stay right on Woods Creed Rd. | D34: =+A34 *1.609 -> 121.9622 | E34: =+B34 *1.609 -> 11.906600000000001
A35: =+A34 + B35 -> 76.8 | B35: 1.0 | C35: L - Woods Creek Road | D35: =+A35 *1.609 -> 123.57119999999999 | E35: =+B35 *1.609 -> 1.609
A36: =+A35 + B36 -> 78.7 | B36: 1.9000000000000057 | C36: L - Oaks Street (0.1 mile before Highway 2) | D36: =+A36 *1.609 -> 126.62830000000001 | E36: =+B36 *1.609 -> 3.057100000000009
A37: =+A36 + B37 -> 78.9 | B37: 0.20000000000000284 | C37: R - Stop Sign | D37: =+A37 *1.609 -> 126.9501 | E37: =+B37 *1.609 -> 0.32180000000000458
A38: =+A37 + B38 -> 79.1 | B38: 0.19999999999998863 | C38: ST - Cross Hwy 2 (TL) | D38: =+A38 *1.609 -> 127.27189999999999 | E38: =+B38 *1.609 -> 0.32179999999998171
A39: =+A38 + B39 -> 79.1 | B39: 0.0 | C39: #2 - Monroe - CONTROL (open) | D39: =+A39 *1.609 -> 127.27189999999999 | E39: =+B39 *1.609 -> 0.0
A40: =+A39 + B40 -> 79.5 | B40: 00.4 | C40: L - Lewis St/SR 203 (TL) | D40: =+A40 *1.609 -> 127.9155 | E40: =+B40 *1.609 -> 0.64360000000000006
A41: =+A40 + B41 -> 103.3 | B41: 23.8 | C41: R - SR 202 (SS/T-int) | D41: =+A41 *1.609 -> 166.2097 | E41: =+B41 *1.609 -> 38.294200000000004
A42: =+A41 + B42 -> 105.7 | B42: 2.4 | C42: L -308th Ave SE (at ballfields) | D42: =+A42 *1.609 -> 170.0713 | E42: =+B42 *1.609 -> 3.8615999999999997
A43: =+A42 + B43 -> 106 | B43: 00.3 | C43: R - SE 40th St/Issaquah Fall City Rd | D43: =+A43 *1.609 -> 170.554 | E43: =+B43 *1.609 -> 0.48269999999999996
A44: =+A43 + B44 -> 106.6 | B44: 00.6 | C44: ST - becomes Issaquah Fall City Rd | D44: =+A44 *1.609 -> 171.5194 | E44: =+B44 *1.609 -> 0.96539999999999992
A45: =+A44 + B45 -> 109.2 | B45: 2.6 | C45: L - Issaquah Fall City Rd (SS) | D45: =+A45 *1.609 -> 175.70279999999997 | E45: =+B45 *1.609 -> 4.1834
A46: =+A45 + B46 -> 111.1 | B46: 1.9 | C46: L - Issaquah Fall City Rd (TL) | D46: =+A46 *1.609 -> 178.7599 | E46: =+B46 *1.609 -> 3.0570999999999997
A47: =+A46 + B47 -> 112.2 | B47: 1.1 | C47: R - E Lake Sammamish Parkway SE (TL) | D47: =+A47 *1.609 -> 180.52979999999997 | E47: =+B47 *1.609 -> 1.7699
A48: =+A47 + B48 -> 112.9 | B48: 00.7 | C48: L - NW Sammamish Rd (TL) | D48: =+A48 *1.609 -> 181.65609999999998 | E48: =+B48 *1.609 -> 1.1262999999999999
A49: =+A48 + B49 -> 112.9 | B49: 0 | C49: #3 - Issaquah - CONTROL | D49: =+A49 *1.609 -> 181.65609999999998 | E49: =+B49 *1.609 -> 0.0
A50: =+A49 + B50 -> 113.6 | B50: 00.7 | C50: R - frontage Rd | D50: =+A50 *1.609 -> 182.7824 | E50: =+B50 *1.609 -> 1.1262999999999999
A51: =+A50 + B51 -> 115.9 | B51: 2.3 | C51: R (roundabout) W Lake Sammamish Parkway SE | D51: =+A51 *1.609 -> 186.48309999999998 | E51: =+B51 *1.609 -> 3.7007
A52: =+A51 + B52 -> 123.4 | B52: 7.5 | C52: R - W Lake Sammamish Parkway SE (TL) | D52: =+A52 *1.609 -> 198.55059999999997 | E52: =+B52 *1.609 -> 12.0675
A53: =+A52 + B53 -> 124.9 | B53: 1.5 | C53: R - Leary Way | D53: =+A53 *1.609 -> 200.96409999999997 | E53: =+B53 *1.609 -> 2.4135
A54: =+A53 + B54 -> 125.1 | B54: 00.2 | C54: R - Bear Creek Parkway | D54: =+A54 *1.609 -> 201.2859 | E54: =+B54 *1.609 -> 0.32180000000000003
A55: =+A54 + B55 -> 126 | B55: 00.9 | C55: ST - across Redmond Way (TL) | D55: =+A55 *1.609 -> 202.734 | E55: =+B55 *1.609 -> 1.4481
A56: =+A55 + B56 -> 126.1 | B56: 00.1 | C56: R - (at Qlube) | D56: =+A56 *1.609 -> 202.89489999999998 | E56: =+B56 *1.609 -> 0.16090000000000002
A57: =+A56 + B57 -> 126.6 | B57: 0.5 | C57: ST/VL - Avondale (TL) | D57: =+A57 *1.609 -> 203.6994 | E57: =+B57 *1.609 -> 0.8045
A58: =+A57 + B58 -> 129.9 | B58: 3.3 | C58: R - NE 132nd St | D58: =+A58 *1.609 -> 209.00910000000002 | E58: =+B58 *1.609 -> 5.3096999999999994
A59: =+A58 + B59 -> 130.2 | B59: 00.3 | C59: R - NE 133rd St | D59: =+A59 *1.609 -> 209.4918 | E59: =+B59 *1.609 -> 0.48269999999999996
A60: =+A59 + B60 -> 132.7 | B60: 2.5 | C60: L - 232nd Ave NE | D60: =+A60 *1.609 -> 213.51430000000002 | E60: =+B60 *1.609 -> 4.0225
A61: =+A60 + B61 -> 133.3 | B61: 00.6 | C61: R - NE 140th St (end of ride) | D61: =+A61 *1.609 -> 214.4797 | E61: =+B61 *1.609 -> 0.96539999999999992
C62: #4 FINISH - Zmrhal 23441 NE 140th St
A63: Zmrhal - home 425-844-8718
A64: L = left, R = right, BR = bear right, BL = bear left, ST = straight, TA = turn around, X = cross
A65: JR = jog right, JL = jog left, RR = railroad, SR = state route, US = US hwy
A66: N = north, S = south, E = east, W = west