A1: Seattle Randonneurs 300 km Brevet
A2: Snoqualmie Valley-Darrington
A4: Created By: | D4: Terry Zmrhal
A5: Verified By: | D5: Terry Zmrhal
A6: Year(s) Used: | D6: 1999.0
A7: Conversion(Mi-Km) | D7: 1.609
A9: Miles | C9: Km
A10: Total | B10: Leg | C10: Total | D10: Leg | E10: Ctrl | F10: Instructions
A11: 0.0 | B11: 0.0 | C11: =+A11*$D$7 -> 0.0 | D11: =+B11*$D$7 -> 0.0 | E11: #1 | F11: Left from TZ house onto NE 140th St (West)
A12: =+A11+B12 -> 00.1 | B12: 00.1 | C12: =+A12*$D$7 -> 0.16090000000000002 | D12: =+B12*$D$7 -> 0.16090000000000002 | F12: R - 232nd St NE
A13: =+A12+B13 -> 2.2 | B13: 2.1 | C13: =+A13*$D$7 -> 3.5398000000000001 | D13: =+B13*$D$7 -> 3.3789000000000002 | F13: L - Old Woodinville-Duvall Rd
A14: =+A13+B14 -> 3.1 | B14: 00.9 | C14: =+A14*$D$7 -> 4.9878999999999998 | D14: =+B14*$D$7 -> 1.4480999999999999 | F14: L - Woodinville-Duvall Rd (SS)
A15: =+A14+B15 -> 4.5 | B15: 1.4 | C15: =+A15*$D$7 -> 7.2404999999999999 | D15: =+B15*$D$7 -> 2.2525999999999997 | F15: R - 204th NE/Paradise Lake Rd (TL)
A16: =+A15+B16 -> 9.4 | B16: 4.9 | C16: =+A16*$D$7 -> 15.124600000000001 | D16: =+B16*$D$7 -> 7.8841000000000001 | F16: ST - Cross SR522 (TL)
A17: =+A16+B17 -> 9.4 | B17: 0.0 | C17: =+A17*$D$7 -> 15.124600000000001 | D17: =+B17*$D$7 -> 0.0 | F17: R - T intersection (unmarked)/Yew Way
A18: =+A17+B18 -> 9.6 | B18: 00.2 | C18: =+A18*$D$7 -> 15.446399999999999 | D18: =+B18*$D$7 -> 0.32180000000000003 | F18: ST/VR - Stop Sign (Yew Way)
A19: =+A18+B19 -> 9.9 | B19: 00.3 | C19: =+A19*$D$7 -> 15.9291 | D19: =+B19*$D$7 -> 0.48269999999999996 | F19: VL over RR tracks onto Broadway
A20: =+A19+B20 -> 15.1 | B20: 5.2 | C20: =+A20*$D$7 -> 24.295900000000003 | D20: =+B20*$D$7 -> 8.3667999999999996 | F20: R - Hwy 9 (TL)
A21: =+A20+B21 -> 25.6 | B21: 10.5 | C21: =+A21*$D$7 -> 41.190400000000004 | D21: =+B21*$D$7 -> 16.894500000000001 | F21: R - Highway 92 (TL)
A22: =+A21+B22 -> 31.3 | B22: 5.7 | C22: =+A22*$D$7 -> 50.361699999999999 | D22: =+B22*$D$7 -> 9.1713000000000005 | F22: L - 161 Ave. NE
A23: =+A22+B23 -> 31.6 | B23: 0.29999999999999716 | C23: =+A23*$D$7 -> 50.844399999999993 | D23: =+B23*$D$7 -> 0.48269999999999541 | F23: L - 163rd Ave. NE
A24: =+A23+B24 -> 32.7 | B24: 1.1 | C24: =+A24*$D$7 -> 52.614299999999993 | D24: =+B24*$D$7 -> 1.7699 | F24: L - Burn Road
A25: =+A24+B25 -> 34.0 | B25: 1.3 | C25: =+A25*$D$7 -> 54.705999999999989 | D25: =+B25*$D$7 -> 2.0916999999999999 | F25: L - 116 th NE
A26: =+A25+B26 -> 40.2 | B26: 6.2 | C26: =+A26*$D$7 -> 64.681799999999996 | D26: =+B26*$D$7 -> 9.9757999999999996 | F26: R - Kellogg / Sisco Hights Road (Arlington)
A27: =+A26+B27 -> 42.2 | B27: 2.0 | C27: =+A27*$D$7 -> 67.899799999999999 | D27: =+B27*$D$7 -> 3.218 | F27: L - Highland Drive
A28: =+A27+B28 -> 42.4 | B28: 0.20000000000000284 | C28: =+A28*$D$7 -> 68.221599999999995 | D28: =+B28*$D$7 -> 0.32180000000000458 | F28: R - S. French
A29: =+A28+B29 -> 42.9 | B29: 0.5 | C29: =+A29*$D$7 -> 69.0261 | D29: =+B29*$D$7 -> 0.80449999999999999 | F29: L - Third
A30: =+A29+B30 -> 43.1 | B30: 0.19999999999999929 | C30: =+A30*$D$7 -> 69.347899999999996 | D30: =+B30*$D$7 -> 0.32179999999999886 | F30: R - N. Olympic
A31: =+A30+B31 -> 43.3 | B31: 0.19999999999999929 | C31: =+A31*$D$7 -> 69.669699999999992 | D31: =+B31*$D$7 -> 0.32179999999999886 | F31: R - Division
A32: =+A31+B32 -> 43.4 | B32: 0.10000000000000142 | C32: =+A32*$D$7 -> 69.830600000000004 | D32: =+B32*$D$7 -> 0.16090000000000229 | F32: L - Broadway
A33: =+A32+B33 -> 43.5 | B33: 9.9999999999997868E-2 | C33: =+A33*$D$7 -> 69.991500000000002 | D33: =+B33*$D$7 -> 0.16089999999999657 | E33: #2 | F33: Thrifty Foods - CONTROL
A34: =+A33+B34 -> 43.5 | B34: 0.0 | C34: =+A34*$D$7 -> 69.991500000000002 | D34: =+B34*$D$7 -> 0.0 | F34: R - East on 530
A35: =+A34+B35 -> 72.0 | B35: 28.5 | C35: =+A35*$D$7 -> 115.848 | D35: =+B35*$D$7 -> 45.856499999999997 | E35: #3 | F35: Darrington
A36: =+A35+B36 -> 72.0 | B36: 0.0 | C36: =+A36*$D$7 -> 115.848 | D36: =+B36*$D$7 -> 0.0 | F36: U-Turn
A37: =+A36+B37 -> 100.5 | B37: 28.5 | C37: =+A37*$D$7 -> 161.7045 | D37: =+B37*$D$7 -> 45.856499999999997 | E37: #4 | F37: Thrifty Food
A38: =+A37+B38 -> 100.5 | B38: 0.0 | C38: =+A38*$D$7 -> 161.7045 | D38: =+B38*$D$7 -> 0.0 | F38: U-Turn
A39: =+A38+B39 -> 101.3 | B39: 00.8 | C39: =+A39*$D$7 -> 162.99169999999998 | D39: =+B39*$D$7 -> 1.2872000000000001 | F39: R - Jordan Road
A40: =+A39+B40 -> 102.3 | B40: 1.0 | C40: =+A40*$D$7 -> 164.60069999999999 | D40: =+B40*$D$7 -> 1.609 | F40: R - Jordan Road
A41: =+A40+B41 -> 114.3 | B41: 12.0 | C41: =+A41*$D$7 -> 183.90869999999998 | D41: =+B41*$D$7 -> 19.308 | F41: L - Highway 92 (TL)
A42: =+A41+B42 -> 115.0 | B42: 0.70000000000000284 | C42: =+A42*$D$7 -> 185.035 | D42: =+B42*$D$7 -> 1.1263000000000045 | F42: R - Mt. Loop Highway
A43: =+A42+B43 -> 115.2 | B43: 0.19999999999999574 | C43: =+A43*$D$7 -> 185.35679999999999 | D43: =+B43*$D$7 -> 0.32179999999999315 | F43: L - Menzel Lake Road
A44: =+A43+B44 -> 125.8 | B44: 10.6 | C44: =+A44*$D$7 -> 202.41219999999998 | D44: =+B44*$D$7 -> 17.055399999999999 | F44: L - Woods Creek Road
A45: =+A44+B45 -> 133.3 | B45: 7.5 | C45: =+A45*$D$7 -> 214.47969999999998 | D45: =+B45*$D$7 -> 12.067500000000001 | F45: L - Yaeger Rd
A46: =+A45+B46 -> 135.2 | B46: 1.9 | C46: =+A46*$D$7 -> 217.53679999999997 | D46: =+B46*$D$7 -> 3.0570999999999997 | F46: L - Woods Creek Road
A47: =+A46+B47 -> 136.5 | B47: 1.3 | C47: =+A47*$D$7 -> 219.6285 | D47: =+B47*$D$7 -> 2.0916999999999999 | F47: L - Oaks Street (0.1 mile before Highway 2)
A48: =+A47+B48 -> 136.7 | B48: 0.20000000000000284 | C48: =+A48*$D$7 -> 219.95029999999997 | D48: =+B48*$D$7 -> 0.32180000000000458 | F48: R - Stop Sign
A49: =+A48+B49 -> 136.9 | B49: 0.19999999999998863 | C49: =+A49*$D$7 -> 220.27209999999997 | D49: =+B49*$D$7 -> 0.32179999999998171 | F49: ST - Cross Hwy 2 (TL)
A50: =+A49+B50 -> 136.9 | B50: 0.0 | C50: =+A50*$D$7 -> 220.27209999999997 | D50: =+B50*$D$7 -> 0.0 | E50: #5 | F50: Monroe (open)
A51: =+A50+B51 -> 137.3 | B51: 00.4 | C51: =+A51*$D$7 -> 220.91569999999996 | D51: =+B51*$D$7 -> 0.64360000000000006 | F51: L - Lewis St/SR 203 (TL)
A52: =+A51+B52 -> 161.1 | B52: 23.8 | C52: =+A52*$D$7 -> 259.2099 | D52: =+B52*$D$7 -> 38.294200000000004 | F52: R - SR 202 (SS/T-int)
A53: =+A52+B53 -> 163.5 | B53: 2.4 | C53: =+A53*$D$7 -> 263.07150000000001 | D53: =+B53*$D$7 -> 3.8615999999999997 | F53: L -308th Ave SE (at ballfields)
A54: =+A53+B54 -> 163.8 | B54: 00.3 | C54: =+A54*$D$7 -> 263.55420000000004 | D54: =+B54*$D$7 -> 0.48269999999999996 | F54: R - SE 40th St/Issaquah Fall City Rd
A55: =+A54+B55 -> 164.4 | B55: 00.6 | C55: =+A55*$D$7 -> 264.51960000000003 | D55: =+B55*$D$7 -> 0.96539999999999992 | F55: ST - becomes Issaquah Fall City Rd
A56: =+A55+B56 -> 167.0 | B56: 2.6 | C56: =+A56*$D$7 -> 268.70299999999997 | D56: =+B56*$D$7 -> 4.1833999999999998 | F56: L - Issaquah Fall City Rd (SS)
A57: =+A56+B57 -> 168.9 | B57: 1.9 | C57: =+A57*$D$7 -> 271.76010000000002 | D57: =+B57*$D$7 -> 3.0570999999999997 | F57: L - Issaquah Fall City Rd (TL)
A58: =+A57+B58 -> 170.0 | B58: 1.1 | C58: =+A58*$D$7 -> 273.53 | D58: =+B58*$D$7 -> 1.7699 | F58: R - E Lake Sammamish Parkway SE (TL)
A59: =+A58+B59 -> 170.7 | B59: 00.7 | C59: =+A59*$D$7 -> 274.65629999999999 | D59: =+B59*$D$7 -> 1.1262999999999999 | E59: #6 | F59: Issaquah/Albertson's/McDonalds
A60: =+A59+B60 -> 180.0 | B60: 9.3 | C60: =+A60*$D$7 -> 289.62 | D60: =+B60*$D$7 -> 14.963700000000001 | F60: L - Redmond Way (TL)
A61: =+A60+B61 -> 180.0 | B61: 0.0 | C61: =+A61*$D$7 -> 289.62 | D61: =+B61*$D$7 -> 0.0 | F61: R - 180th Ave NE (TL)
A62: =+A61+B62 -> 180.7 | B62: 00.7 | C62: =+A62*$D$7 -> 290.74629999999996 | D62: =+B62*$D$7 -> 1.1262999999999999 | F62: L - Union Hill Rd (TL)
A63: =+A62+B63 -> 180.8 | B63: 00.1 | C63: =+A63*$D$7 -> 290.90719999999999 | D63: =+B63*$D$7 -> 0.16090000000000002 | F63: R - Avondale (TL)
A64: =+A63+B64 -> 184.1 | B64: 3.3 | C64: =+A64*$D$7 -> 296.21690000000001 | D64: =+B64*$D$7 -> 5.3096999999999994 | F64: R - NE 132nd St
A65: =+A64+B65 -> 184.4 | B65: 00.3 | C65: =+A65*$D$7 -> 296.69960000000003 | D65: =+B65*$D$7 -> 0.48269999999999996 | F65: R - NE 133rd St
A66: =+A65+B66 -> 186.9 | B66: 2.5 | C66: =+A66*$D$7 -> 300.72210000000001 | D66: =+B66*$D$7 -> 4.0225 | F66: L - 232nd Ave NE
A67: =+A66+B67 -> 187.5 | B67: 00.6 | C67: =+A67*$D$7 -> 301.6875 | D67: =+B67*$D$7 -> 0.96539999999999992 | F67: R - NE 140th St (end of ride)
A68: =+A67+B68 -> 187.5 | B68: 0.0 | C68: =+A68*$D$7 -> 301.6875 | D68: =+B68*$D$7 -> 0.0 | E68: #7 | F68: FINISH - Zmrhal 23441 NE 140th St