C1: SIR 300 Km Brevet
C2: START: 6:00AM Mukilteo Ferry, 5-13-00 (8500 ft gain)
A3: 0.0 | B3: 0.0 | C3: #1 Start - Clinton Ferry Terminal - ST on SR525 N | D3: 0 | E3: 0
A4: =B4+A3 -> 22.1 | B4: 22.1 | C4: ST (north) onto SR2O E | D4: =E4+D3 -> 35.581000000000003 | E4: =B4*1.61 -> 35.581000000000003
A5: =B5+A4 -> 37.1 | B5: 15.0 | C5: L @ light on SR20 E | D5: =E5+D4 -> 59.731000000000009 | E5: =B5*1.61 -> 24.15
A6: =B6+A5 -> 37.7 | B6: 00.6 | C6: #2 Control - Oak Harbor, ARCO AM/PM mini-mart | D6: =E6+D5 -> 60.69700000000001 | E6: =B6*1.61 -> 0.96599999999999997
A7: =B7+A6 -> 37.7 | B7: 0.0 | C7: continue N on SR20 | D7: =E7+D6 -> 60.69700000000001 | E7: =B7*1.61 -> 0.0
A8: =B8+A7 -> 47.9 | B8: 10.2 | C8: Deception Pass Bridge | D8: =E8+D7 -> 77.119000000000014 | E8: =B8*1.61 -> 16.422000000000001
A9: =B9+A8 -> 48.3 | B9: 00.4 | C9: L @ Rosario Rd | D9: =E9+D8 -> 77.763000000000019 | E9: =B9*1.61 -> 0.64400000000000013
A10: =B10+A9 -> 52.2 | B10: 3.9 | C10: R to stay on Rosario Rd | D10: =E10+D9 -> 84.042000000000016 | E10: =B10*1.61 -> 6.2789999999999999
A11: =B11+A10 -> 53.4 | B11: 1.2 | C11: Rosario Rd. merges into Campbell Lake Rd | D11: =E11+D10 -> 85.974000000000018 | E11: =B11*1.61 -> 1.9319999999999999
A12: =B12+A11 -> 54.7 | B12: 1.3 | C12: ST @ stop sign onto SR20 | D12: =E12+D11 -> 88.067000000000021 | E12: =B12*1.61 -> 2.0930000000000004
A13: =B13+A12 -> 56.4 | B13: 1.7 | C13: BR @ light onto SR20 E | D13: =E13+D12 -> 90.804000000000016 | E13: =B13*1.61 -> 2.7370000000000001
A14: =B14+A13 -> 61.8 | B14: 5.4 | C14: L @ light onto Bay View-Edison | D14: =E14+D13 -> 99.498000000000019 | E14: =B14*1.61 -> 8.6940000000000008
A15: =B15+A14 -> 70.0 | B15: 8.2 | C15: R @ "T" continue on Bay View-Edison Rd | D15: =E15+D14 -> 112.7 | E15: =B15*1.61 -> 13.202
A16: =B16+A15 -> 71.6 | B16: 1.6 | C16: L @ "T" continue on Bay View-Edison Rd | D16: =E16+D15 -> 115.27600000000001 | E16: =B16*1.61 -> 2.5760000000000005
A17: =B17+A16 -> 73.1 | B17: 1.5 | C17: L @ stop sign onto Chuckanut Dr | D17: =E17+D16 -> 117.69100000000002 | E17: =B17*1.61 -> 2.415
A18: =B18+A17 -> 84.8 | B18: 11.7 | C18: R onto Lake Samish Rd | D18: =E18+D17 -> 136.52800000000002 | E18: =B18*1.61 -> 18.837
A19: =B19+A18 -> 89.4 | B19: 4.6 | C19: R onto N. Lake Samish Rd - ( go past old Texaco) | D19: =E19+D18 -> 143.93400000000003 | E19: =B19*1.61 -> 7.4059999999999997
A20: =B20+A19 -> 90.2 | B20: 00.8 | C20: BL onto E. Lake Samish Rd | D20: =E20+D19 -> 145.22200000000004 | E20: =B20*1.61 -> 1.2880000000000003
A21: =B21+A20 -> 92.7 | B21: 2.5 | C21: R onto Nulle Rd | D21: =E21+D20 -> 149.24700000000004 | E21: =B21*1.61 -> 4.0250000000000004
A22: =B22+A21 -> 93.7 | B22: 1.0 | C22: L onto W. Lake Samish Rd | D22: =E22+D21 -> 150.85700000000006 | E22: =B22*1.61 -> 1.61
A23: =B23+A22 -> 95.2 | B23: 1.5 | C23: St on W. Lake Samish Rd | D23: =E23+D22 -> 153.27200000000005 | E23: =B23*1.61 -> 2.415
A24: =B24+A23 -> 95.8 | B24: 00.6 | C24: #3 Control - 24hr New Texaco, Lake Samish Rd. | D24: =E24+D22 -> 151.82300000000006 | E24: =B24*1.61 -> 0.96599999999999997
A25: =B25+A24 -> 95.8 | B25: 0.0 | C25: R out of Texaco onto W. Lake Samish Rd. | D25: =E25+D24 -> 151.82300000000006 | E25: =B25*1.61 -> 0.0
A26: =B26+A25 -> 96.0 | B26: 00.2 | C26: R onto Colony Rd. | D26: =E26+D25 -> 152.14500000000001 | E26: =B26*1.61 -> 0.32200000000000006
A27: =B27+A26 -> 100.0 | B27: 4.0 | C27: L onto Ershig Rd | D27: =E27+D26 -> 158.58500000000001 | E27: =B27*1.61 -> 6.44
A28: =B28+A27 -> 103.7 | B28: 3.7 | C28: L Hwy 11 over bridge R onto Avon Allen Rd | D28: =E28+D27 -> 164.54200000000006 | E28: =B28*1.61 -> 5.9570000000000007
A29: =B29+A28 -> 110.5 | B29: 6.8 | C29: L onto McLean Rd. | D29: =E29+D28 -> 175.49 | E29: =B29*1.61 -> 10.948
A30: =B30+A29 -> 111.9 | B30: 1.4 | C30: L to stay on McLean Rd | D30: =E30+D29 -> 177.74400000000006 | E30: =B30*1.61 -> 2.254
A31: =B31+A30 -> 112.0 | B31: 00.1 | C31: R onto W. Division St. | D31: =E31+D30 -> 177.905 | E31: =B31*1.61 -> 0.16100000000000003
A32: =B32+A31 -> 112.5 | B32: 0.5 | C32: R onto 1st St. | D32: =E32+D31 -> 178.71 | E32: =B32*1.61 -> 0.80500000000000005
A33: =B33+A32 -> 112.6 | B33: 00.1 | C33: L onto Montgomery | D33: =E33+D32 -> 178.87100000000007 | E33: =B33*1.61 -> 0.16100000000000003
A34: =B34+A33 -> 112.7 | B34: 00.1 | C34: R onto S. 2nd St. | D34: =E34+D33 -> 179.03200000000007 | E34: =B34*1.61 -> 0.16100000000000003
A35: =B35+A34 -> 113.4 | B35: 00.7 | C35: BL to stay on S. 2nd St. | D35: =E35+D34 -> 180.15900000000008 | E35: =B35*1.61 -> 1.127
A36: =B36+A35 -> 113.5 | B36: 00.1 | C36: X RR, L onto Blackburn Rd. | D36: =E36+D35 -> 180.32 | E36: =B36*1.61 -> 0.16100000000000003
A37: =B37+A36 -> 114.8 | B37: 1.3 | C37: R onto Little Mtn Rd. | D37: =E37+D36 -> 182.41300000000007 | E37: =B37*1.61 -> 2.0930000000000004
A38: =B38+A37 -> 118.2 | B38: 3.4 | C38: L onto Amick Rd. | D38: =E38+D37 -> 187.88700000000006 | E38: =B38*1.61 -> 5.4740000000000002
A39: =B39+A38 -> 118.6 | B39: 00.4 | C39: R onto W. Big Lake Blvd | D39: =E39+D38 -> 188.53100000000006 | E39: =B39*1.61 -> 0.64400000000000013
A40: =B40+A39 -> 122.1 | B40: 3.5 | C40: L onto SR 9 N | D40: =E40+D39 -> 194.16600000000005 | E40: =B40*1.61 -> 5.6349999999999998
A41: =B41+A40 -> 122.6 | B41: 0.5 | C41: R onto Lake Cavanaugh Rd. | D41: =E41+D40 -> 194.97100000000006 | E41: =B41*1.61 -> 0.80500000000000005
A42: =B42+A41 -> 126.2 | B42: 3.6 | C42: BL to stay on same road | D42: =E42+D41 -> 200.76700000000005 | E42: =B42*1.61 -> 5.7960000000000003
A43: =B43+A42 -> 132.9 | B43: 6.7 | C43: BL onto N. Shore Rd. | D43: =E43+D42 -> 211.55400000000006 | E43: =B43*1.61 -> 10.787000000000001
A44: =B44+A43 -> 133.0 | B44: 00.1 | C44: #4 Control @ Lake Cavanaugh, turn around point | D44: =E44+D43 -> 211.715 | E44: =B44*1.61 -> 0.16100000000000003
A45: =B45+A44 -> 139.5 | B45: 6.5 | C45: L onto Grandstrom Rd. | D45: =E45+D44 -> 222.18 | E45: =B45*1.61 -> 10.465
A46: =B46+A45 -> 144.6 | B46: 5.1 | C46: L onto SR9 S. | D46: =E46+D45 -> 230.39100000000008 | E46: =B46*1.61 -> 8.2110000000000003
A47: =B47+A46 -> 150.2 | B47: 5.6 | C47: L onto Hwy 530 - (Thriftway Store) | D47: =E47+D46 -> 239.40700000000007 | E47: =B47*1.61 -> 9.016
A48: =B48+A47 -> 151.2 | B48: 1.0 | C48: R onto Arlington Heights Rd. | D48: =E48+D47 -> 241.01700000000008 | E48: =B48*1.61 -> 1.61
A49: =B49+A48 -> 152.2 | B49: 1.0 | C49: R onto Jordan Rd | D49: =E49+D48 -> 242.62700000000009 | E49: =B49*1.61 -> 1.61
A50: =B50+A49 -> 162.2 | B50: 10.0 | C50: BL to stay on Jordan Rd. | D50: =E50+D49 -> 258.72700000000009 | E50: =B50*1.61 -> 16.1
A51: =B51+A50 -> 164.7 | B51: 2.5 | C51: ST on Jordan Rd | D51: =E51+D50 -> 262.75200000000007 | E51: =B51*1.61 -> 4.0250000000000004
A52: =B52+A51 -> 165.0 | B52: 00.3 | C52: L @ light onto SR 92 E. | D52: =E52+D51 -> 263.23500000000001 | E52: =B52*1.61 -> 0.48299999999999998
A53: =B53+A52 -> 165.1 | B53: 00.1 | C53: #5 Control - Granite Falls, Chevron / McDonalds | D53: =E53+D52 -> 263.39600000000007 | E53: =B53*1.61 -> 0.16100000000000003
A54: =B54+A53 -> 165.1 | B54: 0.0 | C54: L onto SR 92 W. | D54: =E54+D53 -> 263.39600000000007 | E54: =B54*1.61 -> 0.0
A55: =B55+A54 -> 172.0 | B55: 6.9 | C55: R @ light onto SR 9 N. | D55: =E55+D54 -> 274.505 | E55: =B55*1.61 -> 11.109000000000002
A56: =B56+A55 -> 173.8 | B56: 1.8 | C56: L onto Hwy 528 W. (also 64th st.) | D56: =E56+D55 -> 277.40300000000008 | E56: =B56*1.61 -> 2.8980000000000001
A57: =B57+A56 -> 176.8 | B57: 3.0 | C57: L @ light onto State Ave. (also Hwy 529 S.) | D57: =E57+D56 -> 282.23300000000006 | E57: =B57*1.61 -> 4.83
A58: =B58+A57 -> 177.2 | B58: 00.4 | C58: Narrow Bridge | D58: =E58+D57 -> 282.87700000000007 | E58: =B58*1.61 -> 0.64400000000000013
A59: =B59+A58 -> 177.9 | B59: 00.7 | C59: Narrow Bridge | D59: =E59+D58 -> 284.00400000000008 | E59: =B59*1.61 -> 1.127
A60: =B60+A59 -> 178.3 | B60: 00.4 | C60: Narrow Bridge | D60: =E60+D59 -> 284.64800000000008 | E60: =B60*1.61 -> 0.64400000000000013
A61: =B61+A60 -> 179.1 | B61: 00.8 | C61: Narrow Bridge | D61: =E61+D60 -> 285.93600000000009 | E61: =B61*1.61 -> 1.2880000000000003
A62: =B62+A61 -> 179.7 | B62: 00.6 | C62: R onto 10th St. | D62: =E62+D61 -> 286.9020000000001 | E62: =B62*1.61 -> 0.96599999999999997
A63: =B63+A62 -> 180.1 | B63: 00.4 | C63: L onto Rucker Ave | D63: =E63+D62 -> 287.54600000000011 | E63: =B63*1.61 -> 0.64400000000000013
A64: =B64+A63 -> 183.1 | B64: 3.0 | C64: R @ light onto 41st | D64: =E64+D63 -> 292.37600000000009 | E64: =B64*1.61 -> 4.83
A65: =B65+A64 -> 183.3 | B65: 00.2 | C65: BL and merge onto Mukilteo Blvd ( Bike Lane) | D65: =E65+D64 -> 292.69800000000009 | E65: =B65*1.61 -> 0.32200000000000006
A66: =B66+A65 -> 184.3 | B66: 1.0 | C66: ST @ light at intersection | D66: =E66+D65 -> 294.30800000000011 | E66: =B66*1.61 -> 1.61
A67: =B67+A66 -> 187.5 | B67: 3.2 | C67: Mukilteo Blvd merges into 5th St. | D67: =E67+D66 -> 299.46 | E67: =B67*1.61 -> 5.152000000000001
A68: =B68+A67 -> 188.2 | B68: 00.7 | C68: R onto Hwy 525 ( also Mukilteo Speedway) | D68: =E68+D67 -> 300.5870000000001 | E68: =B68*1.61 -> 1.127
A69: =B69+A68 -> 188.7 | B69: 0.5 | C69: L @ light to Cheers II,,,,,,,,,FINISH !!!!!!!!! | D69: =E69+D68 -> 301.39200000000011 | E69: =B69*1.61 -> 0.80500000000000005
C70: Ken Carter: 425-255-6031 hm
C71: Russ Carter 425-359-1723 cell phone
C72: L=left, R=right, BR=bear right, BL=bear left, ST=straight, X=cross
C73: RR=railroad tracks
C74: = shaded area indicates 2nd time on road but going opposite direction.