A1: Seattle Randonneurs 300 km Brevet
A2: Hood Canal including Port Hadlock
A4: Created By: | D4: Bill Dussler
A5: Verified By: | D5: Bill Dussler
A6: Year(s) Used: | D6: 2001
A7: Conversion(Mi-Km) | D7: 1.609
A9: Miles | C9: Km
A10: Total | B10: Leg | C10: Total | D10: Leg | E10: Ctrl | F10: Instructions
A11: 0.0 | B11: 0.0 | C11: =+A11*$D$7 -> 0.0 | D11: =+B11*$D$7 -> 0.0 | E11: #1 | F11: Start North on SR 305
A12: =+A11+B12 -> 6.8 | B12: 6.8 | C12: =+A12*$D$7 -> 10.9412 | D12: =+B12*$D$7 -> 10.9412 | F12: Caution! crossing Agate Pass bridge
A13: =+A12+B13 -> 12.4 | B13: 5.6 | C13: =+A13*$D$7 -> 19.951599999999999 | D13: =+B13*$D$7 -> 9.0103999999999989 | F13: R then L - Little Valley Road @ 4th lite in Poulsbo
A14: =+A13+B14 -> 13.6 | B14: 1.2 | C14: =+A14*$D$7 -> 21.882399999999997 | D14: =+B14*$D$7 -> 1.9307999999999998 | F14: Caution! X - @ stop Big valley Road
A15: =+A14+B15 -> 17.8 | B15: 4.2 | C15: =+A15*$D$7 -> 28.640199999999997 | D15: =+B15*$D$7 -> 6.7578000000000005 | F15: R - @ stop/Chevron - SR 3
A16: =+A15+B16 -> 20.7 | B16: 2.9 | C16: =+A16*$D$7 -> 33.306299999999993 | D16: =+B16*$D$7 -> 4.6661000000000001 | F16: L - SR 104 "Hood Canal Bridge"
A17: =+A16+B17 -> 22.5 | B17: 1.8 | C17: =+A17*$D$7 -> 36.202500000000001 | D17: =+B17*$D$7 -> 2.8961999999999999 | F17: R - Paradise Bay Rd
A18: =+A17+B18 -> 28.5 | B18: 6.0 | C18: =+A18*$D$7 -> 45.856499999999997 | D18: =+B18*$D$7 -> 9.6539999999999999 | F18: R - Oak Bay Rd
A19: =+A18+B19 -> 38.3 | B19: 9.8 | C19: =+A19*$D$7 -> 61.624699999999997 | D19: =+B19*$D$7 -> 15.7682 | F19: L - Chimacum Rd
A20: =+A19+B20 -> 38.3 | B20: 0.0 | C20: =+A20*$D$7 -> 61.624699999999997 | D20: =+B20*$D$7 -> 0.0 | E20: #2 | F20: Port Hadlock
A21: =+A20+B21 -> 40.3 | B21: 2.0 | C21: =+A21*$D$7 -> 64.842699999999994 | D21: =+B21*$D$7 -> 3.218 | F21: ST - Center St
A22: =+A21+B22 -> 55.4 | B22: 15.1 | C22: =+A22*$D$7 -> 89.138599999999997 | D22: =+B22*$D$7 -> 24.2959 | F22: L - US 101 - Quilcene
A23: =+A22+B23 -> 97.5 | B23: 42.1 | C23: =+A23*$D$7 -> 156.8775 | D23: =+B23*$D$7 -> 67.738900000000001 | F23: L - SR 106 "Union"
A24: =+A23+B24 -> 102.9 | B24: 5.3999999999999915 | C24: =+A24*$D$7 -> 165.56609999999998 | D24: =+B24*$D$7 -> 8.6885999999999868 | E24: #3 | F24: Union - Open
A25: =+A24+B25 -> 118.2 | B25: 15.3 | C25: =+A25*$D$7 -> 190.18379999999999 | D25: =+B25*$D$7 -> 24.617699999999999 | F25: BL - SR 3 "Belfair"
A26: =+A25+B26 -> 120.0 | B26: 1.8 | C26: =+A26*$D$7 -> 193.08 | D26: =+B26*$D$7 -> 2.8961999999999999 | F26: L (W) - NE Clifton Ln @ light (Safeway)
A27: =+A26+B27 -> 120.1 | B27: 00.1 | C27: =+A27*$D$7 -> 193.24089999999995 | D27: =+B27*$D$7 -> 0.16090000000000002 | F27: ST - SR-300 "Tahuya"
A28: =+A27+B28 -> 123.3 | B28: 3.2 | C28: =+A28*$D$7 -> 198.38969999999998 | D28: =+B28*$D$7 -> 5.1488000000000005 | F28: ST Becomes NE North Shore Rd DO NOT TURN RIGHT onto Belfair - Tahuya Rd
A29: =+A28+B29 -> 134.1 | B29: 10.8 | C29: =+A29*$D$7 -> 215.76689999999999 | D29: =+B29*$D$7 -> 17.377200000000002 | F29: ** R (N) Belfair - Tahuya Road ("Kay's Corner" sign) **
A30: =+A29+B30 -> 140.9 | B30: 6.8 | C30: =+A30*$D$7 -> 226.7081 | D30: =+B30*$D$7 -> 10.9412 | F30: L (W) NE Dewatto Road
A31: =+A30+B31 -> 155.2 | B31: 14.3 | C31: =+A31*$D$7 -> 249.71680000000003 | D31: =+B31*$D$7 -> 23.008700000000001 | F31: R (N) - Seabeck Holly Rd
A32: =+A31+B32 -> 165.4 | B32: 10.2 | C32: =+A32*$D$7 -> 266.12860000000001 | D32: =+B32*$D$7 -> 16.411799999999999 | E32: #4 | F32: Seabeck - Open
A33: =+A32+B33 -> 168.2 | B33: 2.8 | C33: =+A33*$D$7 -> 270.63380000000001 | D33: =+B33*$D$7 -> 4.5051999999999994 | F33: L - Anderson Hill Rd.
A34: =+A33+B34 -> 171.0 | B34: 2.8 | C34: =+A34*$D$7 -> 275.13900000000007 | D34: =+B34*$D$7 -> 4.5051999999999994 | F34: L - Olympic View Rd.
A35: =+A34+B35 -> 171.5 | B35: 0.5 | C35: =+A35*$D$7 -> 275.94350000000003 | D35: =+B35*$D$7 -> 0.80449999999999999 | F35: R - Westgate Rd.
A36: =+A35+B36 -> 172.5 | B36: 1.0 | C36: =+A36*$D$7 -> 277.55250000000001 | D36: =+B36*$D$7 -> 1.609 | F36: L - Old Frontier Rd.
A37: =+A36+B37 -> 173.0 | B37: 0.5 | C37: =+A37*$D$7 -> 278.35700000000003 | D37: =+B37*$D$7 -> 0.80449999999999999 | F37: R - NW Trigger Ave. to SR 3 (N)
A38: =+A37+B38 -> 173.5 | B38: 0.5 | C38: =+A38*$D$7 -> 279.16150000000005 | D38: =+B38*$D$7 -> 0.80449999999999999 | F38: L - SR 3 (N) Poulsbo
A39: =+A38+B39 -> 179.0 | B39: 5.5 | C39: =+A39*$D$7 -> 288.01100000000002 | D39: =+B39*$D$7 -> 8.849499999999999 | F39: EXIT - SR 305 Poulsbo
A40: =+A39+B40 -> 179.3 | B40: 00.3 | C40: =+A40*$D$7 -> 288.49370000000005 | D40: =+B40*$D$7 -> 0.48269999999999996 | F40: R - 305 Bainbridge Is.
A41: =+A40+B41 -> 185.9 | B41: 6.5999999999999943 | C41: =+A41*$D$7 -> 299.11310000000003 | D41: =+B41*$D$7 -> 10.61939999999999 | F41: X - Caution! Agate Pass Bridge
A42: =+A41+B42 -> 192.7 | B42: 6.8 | C42: =+A42*$D$7 -> 310.05430000000007 | D42: =+B42*$D$7 -> 10.9412 | E42: #5 | F42: Finish Ferry Terminal Bld.