A1: Seattle Randonneurs 300 km Brevet
A2: Whidbey Island-Bellingham
A4: Created By: | D4: Terry Zmrhal
A5: Verified By: | D5: Terry Zmrhal
A6: Year(s) Used: | D6: ???
A7: Conversion(Mi-Km) | D7: 1.609
A9: Miles | C9: Km
A10: Total | B10: Leg | C10: Total | D10: Leg | E10: Ctrl | F10: Instructions
A11: 0.0 | B11: 0.0 | C11: =+A11*$D$7 -> 0.0 | D11: =+B11*$D$7 -> 0.0 | E11: #1 | F11: #1 Start - Clinton Ferry Terminal - ST on SR525 N
A12: =+A11+B12 -> 22.1 | B12: 22.1 | C12: =+A12*$D$7 -> 35.558900000000001 | D12: =+B12*$D$7 -> 35.558900000000001 | F12: ST (north) onto SR2O E
A13: =+A12+B13 -> 37.1 | B13: 15.0 | C13: =+A13*$D$7 -> 59.693899999999999 | D13: =+B13*$D$7 -> 24.135000000000002 | F13: L @ light on SR20 E
A14: =+A13+B14 -> 37.7 | B14: 00.6 | C14: =+A14*$D$7 -> 60.659300000000002 | D14: =+B14*$D$7 -> 0.96539999999999992 | E14: #2 | F14: Oak Harbor ARCO AM/PM mini-mart
A15: =+A14+B15 -> 53.6 | B15: 15.9 | C15: =+A15*$D$7 -> 86.242400000000004 | D15: =+B15*$D$7 -> 25.583100000000002 | F15: R @ "T" light on SR2 0 E
A16: =+A15+B16 -> 59.0 | B16: 5.4 | C16: =+A16*$D$7 -> 94.930999999999997 | D16: =+B16*$D$7 -> 8.688600000000001 | F16: L @ light onto Bayview-Edison Rd
A17: =+A16+B17 -> 67.1 | B17: 8.1 | C17: =+A17*$D$7 -> 107.9639 | D17: =+B17*$D$7 -> 13.0329 | F17: R @ T " on Bayview-Edison Rd
A18: =+A17+B18 -> 68.8 | B18: 1.7 | C18: =+A18*$D$7 -> 110.69919999999999 | D18: =+B18*$D$7 -> 2.7353000000000001 | F18: L @ "T" stop on Bayview-Edison Rd
A19: =+A18+B19 -> 70.2 | B19: 1.4 | C19: =+A19*$D$7 -> 112.95180000000001 | D19: =+B19*$D$7 -> 2.2525999999999997 | F19: L @ stop onto Chuckanut Dr
A20: =+A19+B20 -> 83.2 | B20: 13.0 | C20: =+A20*$D$7 -> 133.86879999999999 | D20: =+B20*$D$7 -> 20.917000000000002 | F20: ST @ light onto 12th Street
A21: =+A20+B21 -> 83.5 | B21: 00.3 | C21: =+A21*$D$7 -> 134.35149999999999 | D21: =+B21*$D$7 -> 0.48269999999999996 | F21: BL onto Finnegan Way, 11th St, State St
A22: =+A21+B22 -> 85.9 | B22: 2.4 | C22: =+A22*$D$7 -> 138.2131 | D22: =+B22*$D$7 -> 3.8615999999999997 | F22: L @ light onto E & W Holly Sts
A23: =+A22+B23 -> 86.9 | B23: 1.0 | C23: =+A23*$D$7 -> 139.82210000000001 | D23: =+B23*$D$7 -> 1.609 | F23: R @ light onto Boadway
A24: =+A23+B24 -> 87.6 | B24: 00.7 | C24: =+A24*$D$7 -> 140.94840000000002 | D24: =+B24*$D$7 -> 1.1262999999999999 | F24: BR onto Sunset Dr
A25: =+A24+B25 -> 87.8 | B25: 00.2 | C25: =+A25*$D$7 -> 141.27020000000002 | D25: =+B25*$D$7 -> 0.32180000000000003 | F25: ST on Sunset Dr (ignore "DEAD END")
A26: =+A25+B26 -> 87.9 | B26: 00.1 | C26: =+A26*$D$7 -> 141.43110000000001 | D26: =+B26*$D$7 -> 0.16090000000000002 | F26: ST @ auto barricade on Sunset Dr
A27: =+A26+B27 -> 88.4 | B27: 0.5 | C27: =+A27*$D$7 -> 142.23560000000001 | D27: =+B27*$D$7 -> 0.80449999999999999 | F27: ST @ light onto SR542 E
A28: =+A27+B28 -> 98.5 | B28: 10.1 | C28: =+A28*$D$7 -> 158.48650000000001 | D28: =+B28*$D$7 -> 16.250899999999998 | F28: ST on SR542 E and onto SR9 S
A29: =+A28+B29 -> 103.1 | B29: 4.6 | C29: =+A29*$D$7 -> 165.8879 | D29: =+B29*$D$7 -> 7.4013999999999998 | F29: R on SR9 S
A30: =+A29+B30 -> 103.2 | B30: 00.1 | C30: =+A30*$D$7 -> 166.04879999999997 | D30: =+B30*$D$7 -> 0.16090000000000002 | E30: #3 | F30: Nugents Corner IGA
A31: =+A30+B31 -> 110.5 | B31: 7.3 | C31: =+A31*$D$7 -> 177.79449999999997 | D31: =+B31*$D$7 -> 11.745699999999999 | F31: ST across rough RR on SR9 S
A32: =+A31+B32 -> 124.8 | B32: 14.3 | C32: =+A32*$D$7 -> 200.80319999999998 | D32: =+B32*$D$7 -> 23.008700000000001 | F32: R @ light on SR9 S and onto SR20 W
A33: =+A32+B33 -> 126.1 | B33: 1.3 | C33: =+A33*$D$7 -> 202.89489999999998 | D33: =+B33*$D$7 -> 2.0916999999999999 | F33: L @ (2nd) light on SR9 S
A34: =+A33+B34 -> 132.1 | B34: 6.0 | C34: =+A34*$D$7 -> 212.54889999999995 | D34: =+B34*$D$7 -> 9.6539999999999999 | F34: L just after Bidge on SR9 S
A35: =+A34+B35 -> 152.3 | B35: 20.2 | C35: =+A35*$D$7 -> 245.05069999999992 | D35: =+B35*$D$7 -> 32.501799999999996 | F35: L onto E. Burke St
A36: =+A35+B36 -> 152.4 | B36: 00.1 | C36: =+A36*$D$7 -> 245.21159999999992 | D36: =+B36*$D$7 -> 0.16090000000000002 | E36: #4 | F36: Arlington Thriftway, on left
A37: =+A36+B37 -> 152.5 | B37: 00.1 | C37: =+A37*$D$7 -> 245.3725 | D37: =+B37*$D$7 -> 0.16090000000000002 | F37: Return to SR9 South
A38: =+A37+B38 -> 171.9 | B38: 19.4 | C38: =+A38*$D$7 -> 276.58709999999991 | D38: =+B38*$D$7 -> 31.214599999999997 | F38: BR off SR9 S onto Snohomish exit
A39: =+A38+B39 -> 172.2 | B39: 00.3 | C39: =+A39*$D$7 -> 277.06979999999993 | D39: =+B39*$D$7 -> 0.48269999999999996 | F39: L @ "T" stop (onto R iver View Rd)
A40: =+A39+B40 -> 172.2 | B40: 0.0 | C40: =+A40*$D$7 -> 277.06979999999993 | D40: =+B40*$D$7 -> 0.0 | F40: ST under SR9 S (onto 2nd St)
A41: =+A40+B41 -> 172.7 | B41: 0.5 | C41: =+A41*$D$7 -> 277.87429999999995 | D41: =+B41*$D$7 -> 0.80449999999999999 | E41: #5 | F41: Snohomish, 7-11 (X Ave "D")
A42: =+A41+B42 -> 172.7 | B42: 0.0 | C42: =+A42*$D$7 -> 277.87429999999995 | D42: =+B42*$D$7 -> 0.0 | F42: L onto Ave "D" (South)
A43: =+A42+B43 -> 172.8 | B43: 00.1 | C43: =+A43*$D$7 -> 278.03519999999992 | D43: =+B43*$D$7 -> 0.16090000000000002 | F43: ST @ stop toward Bidge
A44: =+A43+B44 -> 173.0 | B44: 00.2 | C44: =+A44*$D$7 -> 278.35699999999991 | D44: =+B44*$D$7 -> 0.32180000000000003 | F44: R on Lowll-Snohomish River Rd
A45: =+A44+B45 -> 178.7 | B45: 5.7 | C45: =+A45*$D$7 -> 287.52829999999989 | D45: =+B45*$D$7 -> 9.1713000000000005 | F45: ST across rough RR onto Lenora St
A46: =+A45+B46 -> 178.8 | B46: 00.1 | C46: =+A46*$D$7 -> 287.68919999999986 | D46: =+B46*$D$7 -> 0.16090000000000002 | F46: R @ stop onto South 2nd Ave
A47: =+A46+B47 -> 179.4 | B47: 00.6 | C47: =+A47*$D$7 -> 288.65459999999985 | D47: =+B47*$D$7 -> 0.96539999999999992 | F47: BR onto South 3rd Ave
A48: =+A47+B48 -> 180.0 | B48: 00.6 | C48: =+A48*$D$7 -> 289.62 | D48: =+B48*$D$7 -> 0.96539999999999992 | F48: L @ stop before I-5 (onto 41st St)
A49: =+A48+B49 -> 180.8 | B49: 00.8 | C49: =+A49*$D$7 -> 290.90719999999988 | D49: =+B49*$D$7 -> 1.2872000000000001 | F49: BL onto Mukilteo Blvd
A50: =+A49+B50 -> 185.7 | B50: 4.9 | C50: =+A50*$D$7 -> 298.79129999999986 | D50: =+B50*$D$7 -> 7.8841000000000001 | F50: R @ stop onto SR525
A51: =+A50+B51 -> 186.0 | B51: 00.3 | C51: =+A51*$D$7 -> 299.27399999999989 | D51: =+B51*$D$7 -> 0.48269999999999996 | F51: L @ stop onto Front St
A52: =+A51+B52 -> 186.1 | B52: 00.1 | C52: =+A52*$D$7 -> 299.43489999999991 | D52: =+B52*$D$7 -> 0.16090000000000002 | E52: #6 | F52: Finish - Cheers Too Tavern on L (355-4488)