A1: Seattle Randonneurs 300 km Brevet
A2: Whidbey Island - Bellingham
A4: Created By: | D4: ???
A5: Verified By: | D5: ???
A6: Year(s) Used: | D6: ???
A7: Conversion(Mi-Km) | D7: 1.609
A9: Miles | C9: Km
A10: Total | B10: Leg | C10: Total | D10: Leg | E10: Ctrl | F10: Instructions
A11: 0.0 | B11: 0.0 | C11: =+A11*$D$7 -> 0.0 | D11: =+B11*$D$7 -> 0.0 | E11: #1 | F11: Clinton Ferry Terminal on Whidbey Island
A12: =+A11+B12 -> 00.4 | B12: 00.4 | C12: =+A12*$D$7 -> 0.64360000000000006 | D12: =+B12*$D$7 -> 0.64360000000000006 | F12: L on Deer Lk Rd
A13: =+A12+B13 -> 2.0 | B13: 1.6 | C13: =+A13*$D$7 -> 3.218 | D13: =+B13*$D$7 -> 2.5744000000000002 | F13: St on Holst Rd
A14: =+A13+B14 -> 4.0 | B14: 2.0 | C14: =+A14*$D$7 -> 6.4359999999999999 | D14: =+B14*$D$7 -> 3.218 | F14: SR on Glendale Rd
A15: =+A14+B15 -> 5.0 | B15: 1.0 | C15: =+A15*$D$7 -> 8.0449999999999999 | D15: =+B15*$D$7 -> 1.609 | F15: L on Cultus Bay Rd
A16: =+A15+B16 -> 5.4 | B16: 00.4 | C16: =+A16*$D$7 -> 8.688600000000001 | D16: =+B16*$D$7 -> 0.64360000000000006 | F16: SR on Bailey Rd
A17: =+A16+B17 -> 7.6 | B17: 2.2 | C17: =+A17*$D$7 -> 12.228400000000001 | D17: =+B17*$D$7 -> 3.5398000000000001 | F17: L on French Rd
A18: =+A17+B18 -> 8.0 | B18: 00.4 | C18: =+A18*$D$7 -> 12.872 | D18: =+B18*$D$7 -> 0.64360000000000006 | F18: St on Sills Rd
A19: =+A18+B19 -> 9.6 | B19: 1.6 | C19: =+A19*$D$7 -> 15.446399999999999 | D19: =+B19*$D$7 -> 2.5744000000000002 | F19: L on Ewing Rd
A20: =+A19+B20 -> 9.9 | B20: 00.3 | C20: =+A20*$D$7 -> 15.9291 | D20: =+B20*$D$7 -> 0.48269999999999996 | F20: VL on Bayview Rd
A21: =+A20+B21 -> 12.1 | B21: 2.2 | C21: =+A21*$D$7 -> 19.468900000000001 | D21: =+B21*$D$7 -> 3.5398000000000001 | F21: L on Rt 525
A22: =+A21+B22 -> 13.4 | B22: 1.3 | C22: =+A22*$D$7 -> 21.560600000000004 | D22: =+B22*$D$7 -> 2.0916999999999999 | F22: L on Useless Bay Rd
A23: =+A22+B23 -> 13.8 | B23: 00.4 | C23: =+A23*$D$7 -> 22.204200000000004 | D23: =+B23*$D$7 -> 0.64360000000000006 | F23: VR on Millman Rd
A24: =+A23+B24 -> 15.0 | B24: 1.2 | C24: =+A24*$D$7 -> 24.135000000000002 | D24: =+B24*$D$7 -> 1.9307999999999998 | F24: St on Lancaster Rd
A25: =+A24+B25 -> 17.8 | B25: 2.8 | C25: =+A25*$D$7 -> 28.6402 | D25: =+B25*$D$7 -> 4.5051999999999994 | F25: St on Mutiny Bay Rd
A26: =+A25+B26 -> 19.6 | B26: 1.8 | C26: =+A26*$D$7 -> 31.5364 | D26: =+B26*$D$7 -> 2.8961999999999999 | F26: L on Bush Point Rd
A27: =+A26+B27 -> 21.6 | B27: 2.0 | C27: =+A27*$D$7 -> 34.754400000000004 | D27: =+B27*$D$7 -> 3.218 | F27: St on Smugglers Cove Rd
A28: =+A27+B28 -> 28.2 | B28: 6.6 | C28: =+A28*$D$7 -> 45.373800000000003 | D28: =+B28*$D$7 -> 10.619399999999999 | F28: R on Rt 525
A29: =+A28+B29 -> 28.4 | B29: 00.2 | C29: =+A29*$D$7 -> 45.695600000000006 | D29: =+B29*$D$7 -> 0.32180000000000003 | F29: L on Wonn Road
A30: =+A29+B30 -> 28.6 | B30: 00.2 | C30: =+A30*$D$7 -> 46.017400000000002 | D30: =+B30*$D$7 -> 0.32180000000000003 | F30: L on North B1uff Rd
A31: =+A30+B31 -> 32.9 | B31: 4.3 | C31: =+A31*$D$7 -> 52.936099999999996 | D31: =+B31*$D$7 -> 6.9186999999999994 | F31: VL on Houston Rd
A32: =+A31+B32 -> 33.4 | B32: 0.5 | C32: =+A32*$D$7 -> 53.740600000000001 | D32: =+B32*$D$7 -> 0.80449999999999999 | F32: R on Rt 525
A33: =+A32+B33 -> 34.9 | B33: 1.5 | C33: =+A33*$D$7 -> 56.1541 | D33: =+B33*$D$7 -> 2.4135 | F33: R on Race Rd
A34: =+A33+B34 -> 37.3 | B34: 2.4 | C34: =+A34*$D$7 -> 60.015699999999995 | D34: =+B34*$D$7 -> 3.8615999999999997 | F34: VR on Harrington Rd
A35: =+A34+B35 -> 38.3 | B35: 1.0 | C35: =+A35*$D$7 -> 61.624699999999997 | D35: =+B35*$D$7 -> 1.609 | F35: St on Morris Rd
A36: =+A35+B36 -> 39.5 | B36: 1.2 | C36: =+A36*$D$7 -> 63.555500000000002 | D36: =+B36*$D$7 -> 1.9307999999999998 | F36: Rt on Rt 525
A37: =+A36+B37 -> 39.5 | B37: 0.0 | C37: =+A37*$D$7 -> 63.555500000000002 | D37: =+B37*$D$7 -> 0.0 | F37: VR on Parker Rd
A38: =+A37+B38 -> 42.3 | B38: 2.8 | C38: =+A38*$D$7 -> 68.060699999999997 | D38: =+B38*$D$7 -> 4.5051999999999994 | F38: St NE 9th Street
A39: =+A38+B39 -> 42.8 | B39: 0.5 | C39: =+A39*$D$7 -> 68.865200000000002 | D39: =+B39*$D$7 -> 0.80449999999999999 | F39: R on North Main Street
A40: =+A39+B40 -> 42.8 | B40: 0.0 | C40: =+A40*$D$7 -> 68.865200000000002 | D40: =+B40*$D$7 -> 0.0 | F40: VL on Coveland Street
A41: =+A40+B41 -> 43.0 | B41: 00.2 | C41: =+A41*$D$7 -> 69.186999999999998 | D41: =+B41*$D$7 -> 0.32180000000000003 | F41: St on Madrona Way
A42: =+A41+B42 -> 46.2 | B42: 3.2 | C42: =+A42*$D$7 -> 74.335800000000006 | D42: =+B42*$D$7 -> 5.1488000000000005 | F42: R on Rt 20
A43: =+A42+B43 -> 47.4 | B43: 1.2 | C43: =+A43*$D$7 -> 76.266600000000011 | D43: =+B43*$D$7 -> 1.9307999999999998 | F43: R Arnold Rd
A44: =+A43+B44 -> 48.4 | B44: 1.0 | C44: =+A44*$D$7 -> 77.875600000000006 | D44: =+B44*$D$7 -> 1.609 | F44: R Gabrielson Ave
A45: =+A44+B45 -> 48.5 | B45: 00.1 | C45: =+A45*$D$7 -> 78.036500000000004 | D45: =+B45*$D$7 -> 0.16090000000000002 | F45: L on Penn Cove Rd
A46: =+A45+B46 -> 50.2 | B46: 1.7 | C46: =+A46*$D$7 -> 80.771800000000013 | D46: =+B46*$D$7 -> 2.7353000000000001 | F46: St Scenic Heights Rd
A47: =+A46+B47 -> 52.7 | B47: 2.5 | C47: =+A47*$D$7 -> 84.794300000000021 | D47: =+B47*$D$7 -> 4.0225 | F47: VL on Miller Rd
A48: =+A47+B48 -> 53.0 | B48: 00.3 | C48: =+A48*$D$7 -> 85.277000000000015 | D48: =+B48*$D$7 -> 0.48269999999999996 | F48: R on Balda Rd
A49: =+A48+B49 -> 53.5 | B49: 0.5 | C49: =+A49*$D$7 -> 86.081500000000005 | D49: =+B49*$D$7 -> 0.80449999999999999 | F49: VL on Scenic Heights Rd
A50: =+A49+B50 -> 55.3 | B50: 1.8 | C50: =+A50*$D$7 -> 88.977700000000013 | D50: =+B50*$D$7 -> 2.8961999999999999 | F50: R on Rt 20
A51: =+A50+B51 -> 55.5 | B51: 00.2 | C51: =+A51*$D$7 -> 89.299500000000009 | D51: =+B51*$D$7 -> 0.32180000000000003 | F51: St on Pioneer Way
A52: =+A51+B52 -> 57.1 | B52: 1.6 | C52: =+A52*$D$7 -> 91.873900000000006 | D52: =+B52*$D$7 -> 2.5744000000000002 | F52: L on NE 70th St
A53: =+A52+B53 -> 58.4 | B53: 1.3 | C53: =+A53*$D$7 -> 93.965600000000009 | D53: =+B53*$D$7 -> 2.0916999999999999 | F53: VR on Crescent Harbor Rd
A54: =+A53+B54 -> 61.9 | B54: 3.5 | C54: =+A54*$D$7 -> 99.597100000000012 | D54: =+B54*$D$7 -> 5.6315 | F54: VR on Reservation Rd
A55: =+A54+B55 -> 70.8 | B55: 8.9 | C55: =+A55*$D$7 -> 113.91720000000002 | D55: =+B55*$D$7 -> 14.3201 | F55: R on Taylor Rd
A56: =+A55+B56 -> 72.6 | B56: 1.8 | C56: =+A56*$D$7 -> 116.81340000000002 | D56: =+B56*$D$7 -> 2.8961999999999999 | F56: VR on Taylor Rd
A57: =+A56+B57 -> 74.5 | B57: 1.9 | C57: =+A57*$D$7 -> 119.87050000000002 | D57: =+B57*$D$7 -> 3.0570999999999997 | F57: L on Frostad (U-turn)
A58: =+A57+B58 -> 74.8 | B58: 00.3 | C58: =+A58*$D$7 -> 120.35320000000002 | D58: =+B58*$D$7 -> 0.48269999999999996 | F58: R on Dike Rd
A59: =+A58+B59 -> 75.5 | B59: 00.7 | C59: =+A59*$D$7 -> 121.47950000000002 | D59: =+B59*$D$7 -> 1.1262999999999999 | F59: R on Dugualla Bay Rd
A60: =+A59+B60 -> 75.8 | B60: 00.3 | C60: =+A60*$D$7 -> 121.96220000000002 | D60: =+B60*$D$7 -> 0.48269999999999996 | F60: L on Henni Rd
A61: =+A60+B61 -> 77.7 | B61: 1.9 | C61: =+A61*$D$7 -> 125.01930000000003 | D61: =+B61*$D$7 -> 3.0570999999999997 | F61: R on Monkey Hill Rd
A62: =+A61+B62 -> 79.4 | B62: 1.7 | C62: =+A62*$D$7 -> 127.75460000000002 | D62: =+B62*$D$7 -> 2.7353000000000001 | F62: VL on Duck Rd
A63: =+A62+B63 -> 86.8 | B63: 7.4 | C63: =+A63*$D$7 -> 139.66120000000004 | D63: =+B63*$D$7 -> 11.906600000000001 | F63: R on Rt 20
A64: =+A63+B64 -> 89.3 | B64: 2.5 | C64: =+A64*$D$7 -> 143.68370000000004 | D64: =+B64*$D$7 -> 4.0225 | F64: L on Bayview-Edison Rd
A65: =+A64+B65 -> 97.4 | B65: 8.1 | C65: =+A65*$D$7 -> 156.71660000000003 | D65: =+B65*$D$7 -> 13.0329 | F65: VR on Bayview-Edison Rd
A66: =+A65+B66 -> 99.0 | B66: 1.6 | C66: =+A66*$D$7 -> 159.29100000000003 | D66: =+B66*$D$7 -> 2.5744000000000002 | F66: L on Bow Hill Rd
A67: =+A66+B67 -> 100.4 | B67: 1.4 | C67: =+A67*$D$7 -> 161.54360000000003 | D67: =+B67*$D$7 -> 2.2525999999999997 | F67: L on Chuckanut Dr
A68: =+A67+B68 -> 113.4 | B68: 13.0 | C68: =+A68*$D$7 -> 182.46060000000003 | D68: =+B68*$D$7 -> 20.917000000000002 | F68: R on Old Fairhaven Pkwy
A69: =+A68+B69 -> 114.5 | B69: 1.1 | C69: =+A69*$D$7 -> 184.23050000000003 | D69: =+B69*$D$7 -> 1.7699 | F69: R on 32nd St
A70: =+A69+B70 -> 115.4 | B70: 00.9 | C70: =+A70*$D$7 -> 185.67860000000002 | D70: =+B70*$D$7 -> 1.4480999999999999 | F70: L on Samish Rd
A71: =+A70+B71 -> 126.4 | B71: 11.0 | C71: =+A71*$D$7 -> 203.37760000000003 | D71: =+B71*$D$7 -> 17.698999999999998 | F71: L on Old Rt 99
A72: =+A71+B72 -> 136.1 | B72: 9.7 | C72: =+A72*$D$7 -> 218.98490000000004 | D72: =+B72*$D$7 -> 15.607299999999999 | F72: L on Rt 11
A73: =+A72+B73 -> 139.4 | B73: 3.3 | C73: =+A73*$D$7 -> 224.29460000000006 | D73: =+B73*$D$7 -> 5.3096999999999994 | F73: R on College Way/Rt 538
A74: =+A73+B74 -> 143.0 | B74: 3.6 | C74: =+A74*$D$7 -> 230.08700000000005 | D74: =+B74*$D$7 -> 5.7923999999999998 | F74: R on Rt 9
A75: =+A74+B75 -> 163.0 | B75: 20.0 | C75: =+A75*$D$7 -> 262.26700000000005 | D75: =+B75*$D$7 -> 32.18 | F75: R on North Av
A76: =+A75+B76 -> 163.1 | B76: 00.1 | C76: =+A76*$D$7 -> 262.42790000000002 | D76: =+B76*$D$7 -> 0.16090000000000002 | F76: L on Rt 9
A77: =+A76+B77 -> 182.6 | B77: 19.5 | C77: =+A77*$D$7 -> 293.80340000000001 | D77: =+B77*$D$7 -> 31.375499999999999 | F77: VR exit ramp to Snohomish
A78: =+A77+B78 -> 183.1 | B78: 0.5 | C78: =+A78*$D$7 -> 294.60790000000003 | D78: =+B78*$D$7 -> 0.80449999999999999 | F78: L on Ave D
A79: =+A78+B79 -> 183.3 | B79: 00.2 | C79: =+A79*$D$7 -> 294.92970000000003 | D79: =+B79*$D$7 -> 0.32180000000000003 | F79: R on Snoqualmie River Rd
A80: =+A79+B80 -> 189.1 | B80: 5.8 | C80: =+A80*$D$7 -> 304.26190000000003 | D80: =+B80*$D$7 -> 9.3322000000000003 | F80: R on 3rd St
A81: =+A80+B81 -> 189.1 | B81: 0.0 | C81: =+A81*$D$7 -> 304.26190000000003 | D81: =+B81*$D$7 -> 0.0 | F81: L on Lowell Rd
A82: =+A81+B82 -> 189.7 | B82: 00.6 | C82: =+A82*$D$7 -> 305.22730000000001 | D82: =+B82*$D$7 -> 0.96539999999999992 | F82: L on Colby Rd
A83: =+A82+B83 -> 190.6 | B83: 00.9 | C83: =+A83*$D$7 -> 306.67540000000002 | D83: =+B83*$D$7 -> 1.4480999999999999 | F83: R on Madison
A84: =+A83+B84 -> 193.1 | B84: 2.5 | C84: =+A84*$D$7 -> 310.69790000000006 | D84: =+B84*$D$7 -> 4.0225 | F84: R on Mukilteo Blvd
A85: =+A84+B85 -> 193.4 | B85: 00.3 | C85: =+A85*$D$7 -> 311.18060000000003 | D85: =+B85*$D$7 -> 0.48269999999999996 | E85: #4 | F85: R into Forest Park