A1: Seattle Randonneurs 300 km Brevet
A2: Whidbey Island/Bellingham/Lake Cavanaugh
A4: Created By: | D4: Ken Carter
A5: Verified By: | D5: Ken Carter
A6: Year(s) Used: | D6: 2000, 2003
A7: Conversion(Mi-Km) | D7: 1.609
A9: Miles | C9: Km
A10: Total | B10: Leg | C10: Total | D10: Leg | E10: Ctrl | F10: Instructions
A11: 0.0 | B11: 0.0 | C11: =+A11*$D$7 -> 0.0 | D11: =+B11*$D$7 -> 0.0 | E11: #1 | F11: Start - Clinton Ferry Terminal - ST on SR525 N
A12: =+A11+B12 -> 22.1 | B12: 22.1 | C12: =+A12*$D$7 -> 35.558900000000001 | D12: =+B12*$D$7 -> 35.558900000000001 | F12: ST (north) onto SR2O E
A13: =+A12+B13 -> 37.1 | B13: 15.0 | C13: =+A13*$D$7 -> 59.693899999999999 | D13: =+B13*$D$7 -> 24.135000000000002 | F13: L @ light on SR20 E
A14: =+A13+B14 -> 37.7 | B14: 00.6 | C14: =+A14*$D$7 -> 60.659300000000002 | D14: =+B14*$D$7 -> 0.96539999999999992 | E14: #2 | F14: Oak Harbor, ARCO AM/PM mini-mart
A15: =+A14+B15 -> 37.7 | B15: 0.0 | C15: =+A15*$D$7 -> 60.659300000000002 | D15: =+B15*$D$7 -> 0.0 | F15: continue N on SR20
A16: =+A15+B16 -> 47.9 | B16: 10.2 | C16: =+A16*$D$7 -> 77.071100000000015 | D16: =+B16*$D$7 -> 16.411799999999999 | F16: Deception Pass Bridge
A17: =+A16+B17 -> 48.3 | B17: 00.4 | C17: =+A17*$D$7 -> 77.714700000000008 | D17: =+B17*$D$7 -> 0.64360000000000006 | F17: L @ Rosario Rd
A18: =+A17+B18 -> 52.2 | B18: 3.9 | C18: =+A18*$D$7 -> 83.989800000000002 | D18: =+B18*$D$7 -> 6.2751000000000001 | F18: R to stay on Rosario Rd
A19: =+A18+B19 -> 53.4 | B19: 1.2 | C19: =+A19*$D$7 -> 85.920600000000007 | D19: =+B19*$D$7 -> 1.9307999999999998 | F19: Rosario Rd. merges into Campbell Lake Rd
A20: =+A19+B20 -> 54.7 | B20: 1.3 | C20: =+A20*$D$7 -> 88.01230000000001 | D20: =+B20*$D$7 -> 2.0916999999999999 | F20: ST @ stop sign onto SR20
A21: =+A20+B21 -> 56.4 | B21: 1.7 | C21: =+A21*$D$7 -> 90.747600000000006 | D21: =+B21*$D$7 -> 2.7353000000000001 | F21: BR @ light onto SR20 E
A22: =+A21+B22 -> 61.8 | B22: 5.4 | C22: =+A22*$D$7 -> 99.436199999999999 | D22: =+B22*$D$7 -> 8.688600000000001 | F22: L @ light onto Bay View-Edison
A23: =+A22+B23 -> 70.0 | B23: 8.2 | C23: =+A23*$D$7 -> 112.63 | D23: =+B23*$D$7 -> 13.1938 | F23: R @ "T" continue on Bay View-Edison Rd
A24: =+A23+B24 -> 71.6 | B24: 1.6 | C24: =+A24*$D$7 -> 115.20439999999999 | D24: =+B24*$D$7 -> 2.5744000000000002 | F24: L @ "T" continue on Bay View-Edison Rd
A25: =+A24+B25 -> 73.1 | B25: 1.5 | C25: =+A25*$D$7 -> 117.61789999999999 | D25: =+B25*$D$7 -> 2.4135 | F25: L @ stop sign onto Chuckanut Dr
A26: =+A25+B26 -> 84.8 | B26: 11.7 | C26: =+A26*$D$7 -> 136.44319999999999 | D26: =+B26*$D$7 -> 18.825299999999999 | F26: R onto Lake Samish Rd
A27: =+A26+B27 -> 89.4 | B27: 4.6 | C27: =+A27*$D$7 -> 143.84459999999999 | D27: =+B27*$D$7 -> 7.4013999999999998 | F27: R onto N. Lake Samish Rd - ( go past old Texaco)
A28: =+A27+B28 -> 90.2 | B28: 00.8 | C28: =+A28*$D$7 -> 145.13179999999997 | D28: =+B28*$D$7 -> 1.2872000000000001 | F28: BL onto E. Lake Samish Rd
A29: =+A28+B29 -> 92.7 | B29: 2.5 | C29: =+A29*$D$7 -> 149.15429999999998 | D29: =+B29*$D$7 -> 4.0225 | F29: R onto Nulle Rd
A30: =+A29+B30 -> 93.7 | B30: 1.0 | C30: =+A30*$D$7 -> 150.76329999999999 | D30: =+B30*$D$7 -> 1.609 | F30: L onto W. Lake Samish Rd
A31: =+A30+B31 -> 95.2 | B31: 1.5 | C31: =+A31*$D$7 -> 153.17679999999999 | D31: =+B31*$D$7 -> 2.4135 | F31: St on W. Lake Samish Rd
A32: =+A31+B32 -> 95.8 | B32: 00.6 | C32: =+A32*$D$7 -> 154.14219999999997 | D32: =+B32*$D$7 -> 0.96539999999999992 | E32: #3 | F32: 24hr New Texaco, Lake Samish Rd.
A33: =+A32+B33 -> 95.8 | B33: 0.0 | C33: =+A33*$D$7 -> 154.14219999999997 | D33: =+B33*$D$7 -> 0.0 | F33: R out of Texaco onto W. Lake Samish Rd.
A34: =+A33+B34 -> 96.0 | B34: 00.2 | C34: =+A34*$D$7 -> 154.46399999999997 | D34: =+B34*$D$7 -> 0.32180000000000003 | F34: R onto Colony Rd.
A35: =+A34+B35 -> 100.0 | B35: 4.0 | C35: =+A35*$D$7 -> 160.9 | D35: =+B35*$D$7 -> 6.4359999999999999 | F35: L onto Ershig Rd
A36: =+A35+B36 -> 103.7 | B36: 3.7 | C36: =+A36*$D$7 -> 166.85329999999999 | D36: =+B36*$D$7 -> 5.9533000000000005 | F36: L Hwy 11 over bridge R onto Avon Allen Rd
A37: =+A36+B37 -> 110.5 | B37: 6.8 | C37: =+A37*$D$7 -> 177.79449999999997 | D37: =+B37*$D$7 -> 10.9412 | F37: L onto McLean Rd.
A38: =+A37+B38 -> 111.9 | B38: 1.4 | C38: =+A38*$D$7 -> 180.04709999999997 | D38: =+B38*$D$7 -> 2.2525999999999997 | F38: L to stay on McLean Rd
A39: =+A38+B39 -> 112.0 | B39: 00.1 | C39: =+A39*$D$7 -> 180.20799999999997 | D39: =+B39*$D$7 -> 0.16090000000000002 | F39: R onto W. Division St.
A40: =+A39+B40 -> 112.5 | B40: 0.5 | C40: =+A40*$D$7 -> 181.01249999999999 | D40: =+B40*$D$7 -> 0.80449999999999999 | F40: R onto 1st St.
A41: =+A40+B41 -> 112.6 | B41: 00.1 | C41: =+A41*$D$7 -> 181.17339999999996 | D41: =+B41*$D$7 -> 0.16090000000000002 | F41: L onto Montgomery
A42: =+A41+B42 -> 112.7 | B42: 00.1 | C42: =+A42*$D$7 -> 181.33429999999996 | D42: =+B42*$D$7 -> 0.16090000000000002 | F42: R onto S. 2nd St.
A43: =+A42+B43 -> 113.4 | B43: 00.7 | C43: =+A43*$D$7 -> 182.46059999999997 | D43: =+B43*$D$7 -> 1.1262999999999999 | F43: BL to stay on S. 2nd St.
A44: =+A43+B44 -> 113.5 | B44: 00.1 | C44: =+A44*$D$7 -> 182.62149999999994 | D44: =+B44*$D$7 -> 0.16090000000000002 | F44: X RR, L onto Blackburn Rd.
A45: =+A44+B45 -> 114.8 | B45: 1.3 | C45: =+A45*$D$7 -> 184.71319999999994 | D45: =+B45*$D$7 -> 2.0916999999999999 | F45: R onto Little Mtn Rd.
A46: =+A45+B46 -> 118.2 | B46: 3.4 | C46: =+A46*$D$7 -> 190.18379999999996 | D46: =+B46*$D$7 -> 5.4706000000000001 | F46: L onto Amick Rd.
A47: =+A46+B47 -> 118.6 | B47: 00.4 | C47: =+A47*$D$7 -> 190.82739999999995 | D47: =+B47*$D$7 -> 0.64360000000000006 | F47: R onto W. Big Lake Blvd
A48: =+A47+B48 -> 122.1 | B48: 3.5 | C48: =+A48*$D$7 -> 196.45889999999997 | D48: =+B48*$D$7 -> 5.6315 | F48: L onto SR 9 N
A49: =+A48+B49 -> 122.6 | B49: 0.5 | C49: =+A49*$D$7 -> 197.26339999999996 | D49: =+B49*$D$7 -> 0.80449999999999999 | F49: R onto Lake Cavanaugh Rd.
A50: =+A49+B50 -> 126.2 | B50: 3.6 | C50: =+A50*$D$7 -> 203.05579999999995 | D50: =+B50*$D$7 -> 5.7923999999999998 | F50: BL to stay on same road
A51: =+A50+B51 -> 132.9 | B51: 6.7 | C51: =+A51*$D$7 -> 213.83609999999996 | D51: =+B51*$D$7 -> 10.7803 | E51: #4 | F51: Lake Cavanaugh, turn around point
A52: =+A51+B52 -> 139.4 | B52: 6.5 | C52: =+A52*$D$7 -> 224.29459999999997 | D52: =+B52*$D$7 -> 10.458500000000001 | F52: L onto Grandstrom Rd.
A53: =+A52+B53 -> 144.5 | B53: 5.1 | C53: =+A53*$D$7 -> 232.50049999999996 | D53: =+B53*$D$7 -> 8.2058999999999997 | F53: L onto SR9 S.
A54: =+A53+B54 -> 150.1 | B54: 5.6 | C54: =+A54*$D$7 -> 241.51089999999994 | D54: =+B54*$D$7 -> 9.0103999999999989 | F54: L onto Hwy 530 - (Thriftway Store)
A55: =+A54+B55 -> 151.1 | B55: 1.0 | C55: =+A55*$D$7 -> 243.11989999999994 | D55: =+B55*$D$7 -> 1.609 | F55: R onto Arlington Heights Rd.
A56: =+A55+B56 -> 152.1 | B56: 1.0 | C56: =+A56*$D$7 -> 244.72889999999995 | D56: =+B56*$D$7 -> 1.609 | F56: R onto Jordan Rd
A57: =+A56+B57 -> 162.1 | B57: 10.0 | C57: =+A57*$D$7 -> 260.81889999999993 | D57: =+B57*$D$7 -> 16.09 | F57: BL to stay on Jordan Rd.
A58: =+A57+B58 -> 164.6 | B58: 2.5 | C58: =+A58*$D$7 -> 264.84139999999996 | D58: =+B58*$D$7 -> 4.0225 | F58: ST on Jordan Rd
A59: =+A58+B59 -> 164.9 | B59: 00.3 | C59: =+A59*$D$7 -> 265.32409999999999 | D59: =+B59*$D$7 -> 0.48269999999999996 | F59: L @ light onto SR 92 E.
A60: =+A59+B60 -> 165.0 | B60: 00.1 | C60: =+A60*$D$7 -> 265.48500000000001 | D60: =+B60*$D$7 -> 0.16090000000000002 | E60: #5 | F60: Granite Falls, Chevron / McDonalds
A61: =+A60+B61 -> 165.0 | B61: 0.0 | C61: =+A61*$D$7 -> 265.48500000000001 | D61: =+B61*$D$7 -> 0.0 | F61: L onto SR 92 W.
A62: =+A61+B62 -> 171.9 | B62: 6.9 | C62: =+A62*$D$7 -> 276.58709999999996 | D62: =+B62*$D$7 -> 11.1021 | F62: R @ light onto SR 9 N.
A63: =+A62+B63 -> 173.7 | B63: 1.8 | C63: =+A63*$D$7 -> 279.48329999999999 | D63: =+B63*$D$7 -> 2.8961999999999999 | F63: L onto Hwy 528 W. (also 64th st.)
A64: =+A63+B64 -> 176.7 | B64: 3.0 | C64: =+A64*$D$7 -> 284.31029999999998 | D64: =+B64*$D$7 -> 4.827 | F64: L @ light onto State Ave. (also Hwy 529 S.)
A65: =+A64+B65 -> 177.1 | B65: 00.4 | C65: =+A65*$D$7 -> 284.95389999999998 | D65: =+B65*$D$7 -> 0.64360000000000006 | F65: Narrow Bridge
A66: =+A65+B66 -> 177.8 | B66: 00.7 | C66: =+A66*$D$7 -> 286.08019999999999 | D66: =+B66*$D$7 -> 1.1262999999999999 | F66: Narrow Bridge
A67: =+A66+B67 -> 178.2 | B67: 00.4 | C67: =+A67*$D$7 -> 286.72379999999998 | D67: =+B67*$D$7 -> 0.64360000000000006 | F67: Narrow Bridge
A68: =+A67+B68 -> 179.0 | B68: 00.8 | C68: =+A68*$D$7 -> 288.01100000000002 | D68: =+B68*$D$7 -> 1.2872000000000001 | F68: Narrow Bridge
A69: =+A68+B69 -> 179.6 | B69: 00.6 | C69: =+A69*$D$7 -> 288.97640000000001 | D69: =+B69*$D$7 -> 0.96539999999999992 | F69: R onto 10th St.
A70: =+A69+B70 -> 180.0 | B70: 00.4 | C70: =+A70*$D$7 -> 289.62 | D70: =+B70*$D$7 -> 0.64360000000000006 | F70: L onto Rucker Ave
A71: =+A70+B71 -> 183.0 | B71: 3.0 | C71: =+A71*$D$7 -> 294.447 | D71: =+B71*$D$7 -> 4.827 | F71: R @ light onto 41st
A72: =+A71+B72 -> 183.2 | B72: 00.2 | C72: =+A72*$D$7 -> 294.7688 | D72: =+B72*$D$7 -> 0.32180000000000003 | F72: BL and merge onto Mukilteo Blvd ( Bike Lane)
A73: =+A72+B73 -> 184.2 | B73: 1.0 | C73: =+A73*$D$7 -> 296.37779999999998 | D73: =+B73*$D$7 -> 1.609 | F73: ST @ light at intersection
A74: =+A73+B74 -> 187.4 | B74: 3.2 | C74: =+A74*$D$7 -> 301.52659999999997 | D74: =+B74*$D$7 -> 5.1488000000000005 | F74: Mukilteo Blvd merges into 5th St.
A75: =+A74+B75 -> 188.1 | B75: 00.7 | C75: =+A75*$D$7 -> 302.65289999999993 | D75: =+B75*$D$7 -> 1.1262999999999999 | F75: R onto Hwy 525 ( also Mukilteo Speedway)
A76: =+A75+B76 -> 188.6 | B76: 0.5 | C76: =+A76*$D$7 -> 303.45739999999995 | D76: =+B76*$D$7 -> 0.80449999999999999 | E76: #6 | F76: L @ light to Cheers II,,,,,,,,,FINISH !!!!!!!!!