A1: SIR 300 K Brevet - Saturday, Mar 25, 2006
A2: MilesTotal | B2: Leg | C2: Instructions | D2: KmTotal | E2: Leg
A3: 0 | B3: 0 | C3: Control #1 Start North on SR 305 | D3: 0.0 | E3: 0.0
A4: =A3+B4 -> 6.8 | B4: 6.8 | C4: Caution! crossing Agate Pass bridge | D4: =D3+E4 -> 10.9412 | E4: =B4*1.609 -> 10.9412
A5: =A4+B5 -> 12.4 | B5: 5.6 | C5: R then L(N) - Little Valley Road @ 4th lite in Poulsbo | D5: =D4+E5 -> 19.951599999999999 | E5: =B5*1.609 -> 9.0103999999999989
A6: =A5+B6 -> 13.1 | B6: 0.7 | C6: Caution! X - @ stop Big valley Road | D6: =D5+E6 -> 21.0779 | E6: =B6*1.609 -> 1.1262999999999999
A7: =A6+B7 -> 18.0 | B7: 4.9 | C7: R(W) on SR 3- @ stop/Chevron | D7: =D6+E7 -> 28.962 | E7: =B7*1.609 -> 7.8841000000000001
A8: =A7+B8 -> 21.2 | B8: 3.2 | C8: L (W) - SR 104 "Hood Canal Bridge" | D8: =D7+E8 -> 34.110799999999998 | E8: =B8*1.609 -> 5.1488000000000005
A9: =A8+B9 -> 23.0 | B9: 1.8 | C9: R (N) - Paradise Bay Rd | D9: =D8+E9 -> 37.006999999999998 | E9: =B9*1.609 -> 2.8961999999999999
A10: =A9+B10 -> 29.0 | B10: 6 | C10: R (E) - Oak Bay Rd (Port Hadlock) | D10: =D9+E10 -> 46.661000000000001 | E10: =B10*1.609 -> 9.6539999999999999
A11: =A10+B11 -> 38.8 | B11: 9.8 | C11: L (SW) Chimacum Rd | D11: =D10+E11 -> 62.429200000000002 | E11: =B11*1.609 -> 15.7682
A12: =A11+B12 -> 38.8 | B12: 0 | C12: Control #2 Pt. Hadlock - Open | D12: =D11+E12 -> 62.429200000000002 | E12: =B12*1.609 -> 0.0
A13: =A12+B13 -> 40.3 | B13: 1.5 | C13: ST - Center Rd | D13: =D12+E13 -> 64.842700000000008 | E13: =B13*1.609 -> 2.4135
A14: =A13+B14 -> 55.4 | B14: 15.1 | C14: L (S) - US 101 - Quilcene | D14: =D13+E14 -> 89.138600000000011 | E14: =B14*1.609 -> 24.2959
A15: =A14+B15 -> 91.9 | B15: 36.5 | C15: Control # 3 Hoodsport - Open | D15: =D14+E15 -> 147.86709999999999 | E15: =B15*1.609 -> 58.728499999999997
A16: =A15+B16 -> 97.6 | B16: 5.7 | C16: L (S) - SR 106 "Union" | D16: =D15+E16 -> 157.0384 | E16: =B16*1.609 -> 9.1713000000000005
A17: =A16+B17 -> 117.7 | B17: 20.1 | C17: L (NW) - SR 3 "Belfair" | D17: =D16+E17 -> 189.3793 | E17: =B17*1.609 -> 32.340900000000005
A18: =A17+B18 -> 119.5 | B18: 1.8 | C18: L (W) - NE Clifton Ln @ light (Safeway) | D18: =D17+E18 -> 192.27549999999999 | E18: =B18*1.609 -> 2.8961999999999999
A19: =A18+B19 -> 119.6 | B19: 0.1 | C19: ST - SR-300 "Tahuya" | D19: =D18+E19 -> 192.43639999999999 | E19: =B19*1.609 -> 0.16090000000000002
A20: =A19+B20 -> 122.8 | B20: 3.2 | C20: ST Becomes NE North Shore Rd DO NOT TURN RIGHT onto Belfair - Tahuya Rd | D20: =D19+E20 -> 197.58519999999999 | E20: =B20*1.609 -> 5.1488000000000005
A21: =A20+B21 -> 134.1 | B21: 11.3 | C21: ** R (N) Belfair - Tahuya Road ("Kay's Corner" sign) ** | D21: =D20+E21 -> 215.76689999999999 | E21: =B21*1.609 -> 18.181699999999999
A22: =A21+B22 -> 134.1 | B22: 0 | C22: Control # 4 | D22: =D21+E22 -> 215.76689999999999 | E22: =B22*1.609 -> 0.0
A23: =A22+B23 -> 134.5 | B23: 0.4 | C23: BR - Tahuya River Rd | D23: =D22+E23 -> 216.41049999999998 | E23: =B23*1.609 -> 0.64360000000000006
A24: =A23+B24 -> 138.4 | B24: 3.9 | C24: R Belfair - Tahuya Rd (at stop sign) | D24: =D23+E24 -> 222.68559999999999 | E24: =B24*1.609 -> 6.2751000000000001
A25: =A24+B25 -> 139.1 | B25: 0.7 | C25: L (W) NE Dewatto Road | D25: =D24+E25 -> 223.81189999999998 | E25: =B25*1.609 -> 1.1262999999999999
A26: =A25+B26 -> 142.4 | B26: 3.3 | C26: CAUTION - dangerous curve on downhill | D26: =D25+E26 -> 229.12159999999997 | E26: =B26*1.609 -> 5.3096999999999994
A27: =A26+B27 -> 142.6 | B27: 0.2 | C27: BR Dewatto - Holly Rd | D27: =D26+E27 -> 229.44339999999997 | E27: =B27*1.609 -> 0.32180000000000003
A28: =A27+B28 -> 149.9 | B28: 7.3 | C28: ST on Dewatto Rd W at Bear Creek Dewatto Rd (no center line) | D28: =D27+E28 -> 241.18909999999997 | E28: =B28*1.609 -> 11.745699999999999
A29: =A28+B29 -> 153.6 | B29: 3.7 | C29: R (N) - Seabeck Holly Rd | D29: =D28+E29 -> 247.14239999999998 | E29: =B29*1.609 -> 5.9533000000000005
A30: =A29+B30 -> 163.8 | B30: 10.2 | C30: Control # 5 Seabeck - Open | D30: =D29+E30 -> 263.55419999999998 | E30: =B30*1.609 -> 16.411799999999999
A31: =A30+B31 -> 166.6 | B31: 2.8 | C31: L (NE) NW Anderson Hill Rd | D31: =D30+E31 -> 268.05939999999998 | E31: =B31*1.609 -> 4.5051999999999994
A32: =A31+B32 -> 169.3 | B32: 2.7 | C32: L (N) Olympic View Rd NW | D32: =D31+E32 -> 272.40369999999996 | E32: =B32*1.609 -> 4.3443000000000005
A33: =A32+B33 -> 169.9 | B33: 0.6 | C33: R (E) - Westgate Rd | D33: =D32+E33 -> 273.36909999999995 | E33: =B33*1.609 -> 0.96539999999999992
A34: =A33+B34 -> 170.9 | B34: 1 | C34: L (N) - Old Frontier Rd at 'T' | D34: =D33+E34 -> 274.97809999999993 | E34: =B34*1.609 -> 1.609
A35: =A34+B35 -> 171.4 | B35: 0.5 | C35: ST across NW Trigger Ave, then Right on Half Mile Rd | D35: =D34+E35 -> 275.78259999999995 | E35: =B35*1.609 -> 0.80449999999999999
A36: =A35+B36 -> 171.9 | B36: 0.5 | C36: L (N) Clear Creek Rd NW | D36: =D35+E36 -> 276.58709999999996 | E36: =B36*1.609 -> 0.80449999999999999
A37: =A36+B37 -> 177.2 | B37: 5.3 | C37: R (E) NW Rude Rd | D37: =D36+E37 -> 285.11479999999995 | E37: =B37*1.609 -> 8.5276999999999994
A38: =A37+B38 -> 179.1 | B38: 1.9 | C38: R (SE) NW Finn Hill Rd | D38: =D37+E38 -> 288.17189999999994 | E38: =B38*1.609 -> 3.0570999999999997
A39: =A38+B39 -> 179.7 | B39: 0.6 | C39: Cross over SR3 | D39: =D38+E39 -> 289.13729999999993 | E39: =B39*1.609 -> 0.96539999999999992
A40: =A39+B40 -> 179.9 | B40: 0.2 | C40: ST Becomes Lindvig Way (crosses Viking Way NW at light) | D40: =D39+E40 -> 289.45909999999992 | E40: =B40*1.609 -> 0.32180000000000003
A41: =A40+B41 -> 180.1 | B41: 0.2 | C41: L Bond Rd NE (at light) | D41: =D40+E41 -> 289.78089999999992 | E41: =B41*1.609 -> 0.32180000000000003
A42: =A41+B42 -> 180.6 | B42: 0.5 | C42: R SR 305 | D42: =D41+E42 -> 290.58539999999994 | E42: =B42*1.609 -> 0.80449999999999999
A43: =A42+B43 -> 186.9 | B43: 6.3 | C43: X - Caution! Agate Pass Bridge | D43: =D42+E43 -> 300.72209999999995 | E43: =B43*1.609 -> 10.136699999999999
A44: =A43+B44 -> 193.7 | B44: 6.8 | C44: Control # 6 Bainbridge Island Ferry Terminal Bld. | D44: =D43+E44 -> 311.66329999999994 | E44: =B44*1.609 -> 10.9412
A45: Jim cell | B45: 206.730.8955
A46: Rick cell | B46: 360.561.3028
A47: Barb cell | B47: 360.561.1611