C1: SIR 300 K Brevet - April 10, 2002
A2: Miles | D2: Km
A3: Total | B3: Leg | C3: Instructions | D3: Total | E3: Leg
A4: 0 | B4: 0 | C4: Control #1 Start North on SR 305 | D4: 0 | E4: 0
A5: 6.8 | B5: =A5-A4 -> 6.8 | C5: Caution! crossing Agate Pass bridge | D5: =A5*1.609 -> 10.9412 | E5: =B5*1.609 -> 10.9412
A6: 12.4 | B6: =A6-A5 -> 5.6 | C6: R then L(N) - Little Valley Road @ 4th lite in Poulsbo | D6: =A6*1.609 -> 19.951599999999999 | E6: =B6*1.609 -> 9.0104000000000006
A7: 13.1 | B7: =A7-A6 -> 0.69999999999999929 | C7: Caution! X - @ stop Big valley Road | D7: =A7*1.609 -> 21.0779 | E7: =B7*1.609 -> 1.1262999999999987
A8: 18.0 | B8: =A8-A7 -> 4.9 | C8: R(W) on SR 3- @ stop/Chevron | D8: =A8*1.609 -> 28.962 | E8: =B8*1.609 -> 7.8841000000000001
A9: 21.2 | B9: =A9-A8 -> 3.2 | C9: L (W) - SR 104 "Hood Canal Bridge" | D9: =A9*1.609 -> 34.110799999999998 | E9: =B9*1.609 -> 5.1487999999999987
A10: 23.0 | B10: =A10-A9 -> 1.8 | C10: R (N) - Paradise Bay Rd | D10: =A10*1.609 -> 37.006999999999998 | E10: =B10*1.609 -> 2.8962000000000012
A11: 29.0 | B11: =A11-A10 -> 6.0 | C11: R (E) - Oak Bay Rd (Port Hadlock) | D11: =A11*1.609 -> 46.661000000000001 | E11: =B11*1.609 -> 9.6539999999999999
A12: 38.8 | B12: =A12-A11 -> 9.8 | C12: L (SW) Chimacum Rd | D12: =A12*1.609 -> 62.429199999999994 | E12: =B12*1.609 -> 15.768199999999995
A13: 38.8 | B13: =A13-A12 -> 0.0 | C13: Control #2 Pt. Hadlock - Open | D13: =A13*1.609 -> 62.429199999999994 | E13: =B13*1.609 -> 0.0
A14: 40.3 | B14: =A14-A12 -> 1.5 | C14: ST - Center Rd | D14: =A14*1.609 -> 64.842699999999994 | E14: =B14*1.609 -> 2.4135
A15: 55.4 | B15: =A15-A14 -> 15.1 | C15: L (S) - US 101 - Quilcene | D15: =A15*1.609 -> 89.138599999999997 | E15: =B15*1.609 -> 24.295900000000003
A16: 91.9 | B16: =A16-A15 -> 36.5 | C16: Control # 3 Hoodsport - Open | D16: =A16*1.609 -> 147.86710000000002 | E16: =B16*1.609 -> 58.728500000000011
A17: 97.6 | B17: =A17-A16 -> 5.6999999999999886 | C17: L (S) - SR 106 "Union" | D17: =A17*1.609 -> 157.0384 | E17: =B17*1.609 -> 9.1712999999999809
A18: 117.7 | B18: =A18-A17 -> 20.1 | C18: L (NW) - SR 3 "Belfair" | D18: =A18*1.609 -> 189.3793 | E18: =B18*1.609 -> 32.340900000000012
A19: 119.5 | B19: =A19-A18 -> 1.8 | C19: L (W) - NE Clifton Ln @ light (Safeway) | D19: =A19*1.609 -> 192.27549999999999 | E19: =B19*1.609 -> 2.8961999999999954
A20: 119.6 | B20: =A20-A19 -> 9.9999999999994316E-2 | C20: ST - SR-300 "Tahuya" | D20: =A20*1.609 -> 192.43639999999999 | E20: =B20*1.609 -> 0.16089999999999086
A21: 122.8 | B21: =A21-A20 -> 3.2 | C21: ST Becomes NE North Shore Rd DO NOT TURN RIGHT onto Belfair - Tahuya Rd | D21: =A21*1.609 -> 197.58519999999999 | E21: =B21*1.609 -> 5.1488000000000049
A22: 134.1 | B22: =A22-A21 -> 11.3 | C22: ** R (N) Belfair - Tahuya Road ("Kay's Corner" sign) ** | D22: =A22*1.609 -> 215.76689999999999 | E22: =B22*1.609 -> 18.181699999999996
A23: 134.1 | B23: =A23-A22 -> 0.0 | C23: Control # 4 | D23: =A23*1.609 -> 215.76689999999999 | E23: =B23*1.609 -> 0.0
A24: 134.5 | B24: =A24-A23 -> 0.40000000000000568 | C24: BR - Tahuya River Rd | D24: =A24*1.609 -> 216.41049999999998 | E24: =B24*1.609 -> 0.64360000000000916
A25: 138.4 | B25: =A25-A24 -> 3.9000000000000057 | C25: R Belfair - Tahuya Rd | D25: =A25*1.609 -> 222.68559999999999 | E25: =B25*1.609 -> 6.275100000000009
A26: 139.1 | B26: =A26-A25 -> 0.69999999999998863 | C26: L (W) NE Dewatto Road | D26: =A26*1.609 -> 223.81189999999998 | E26: =B26*1.609 -> 1.1262999999999816
A27: 142.4 | B27: =A27-A26 -> 3.3000000000000114 | C27: CAUTION - dangerous curve on downhill | D27: =A27*1.609 -> 229.1216 | E27: =B27*1.609 -> 5.3097000000000181
A28: 142.6 | B28: =A28-A27 -> 0.19999999999998863 | C28: BR Dewatto - Holly Rd | D28: =A28*1.609 -> 229.4434 | E28: =B28*1.609 -> 0.32179999999998171
A29: 149.9 | B29: =A29-A28 -> 7.3000000000000114 | C29: ST on Dewatto Rd W at Bear Creek Dewatto Rd (no center line) | D29: =A29*1.609 -> 241.1891 | E29: =B29*1.609 -> 11.745700000000019
A30: 153.6 | B30: =A30-A29 -> 3.6999999999999886 | C30: R (N) - Seabeck Holly Rd | D30: =A30*1.609 -> 247.14239999999998 | E30: =B30*1.609 -> 5.9532999999999818
A31: 163.8 | B31: =A31-A30 -> 10.2 | C31: Control # 5 Seabeck - Open | D31: =A31*1.609 -> 263.55420000000004 | E31: =B31*1.609 -> 16.411800000000028
A32: 166.6 | B32: =A32-A31 -> 2.7999999999999829 | C32: L (NE) NW Anderson Hill Rd | D32: =A32*1.609 -> 268.05939999999998 | E32: =B32*1.609 -> 4.5051999999999728
A33: 169.3 | B33: =A33-A32 -> 2.7000000000000171 | C33: L (N) Olympic View Rd NW | D33: =A33*1.609 -> 272.40370000000001 | E33: =B33*1.609 -> 4.3443000000000271
A34: 169.9 | B34: =A34-A33 -> 0.59999999999999432 | C34: R (E) - Westgate Rd | D34: =A34*1.609 -> 273.3691 | E34: =B34*1.609 -> 0.96539999999999082
A35: 170.9 | B35: =A35-A34 -> 1.0 | C35: L (N) - Old Frontier Rd at 'T' | D35: =A35*1.609 -> 274.97809999999998 | E35: =B35*1.609 -> 1.609
A36: 172.5 | B36: =A36-A35 -> 1.5999999999999943 | C36: R (E) - NW Trigger Ave | D36: =A36*1.609 -> 277.55250000000001 | E36: =B36*1.609 -> 2.5743999999999909
A37: 172.9 | B37: =A37-A36 -> 0.40000000000000568 | C37: L (N) at T - SR 3 "Poulsbo" | D37: =A37*1.609 -> 278.1961 | E37: =B37*1.609 -> 0.64360000000000916
A38: 178.3 | B38: =A38-A37 -> 5.4000000000000057 | C38: Exit SR 305 "Poulsbo, Bainbridge Island" | D38: =A38*1.609 -> 286.88470000000001 | E38: =B38*1.609 -> 8.6886000000000099
A39: 178.8 | B39: =A39-A38 -> 0.5 | C39: R (SE) SR 305 "Poulsbo, Bainbridge Island" | D39: =A39*1.609 -> 287.68920000000003 | E39: =B39*1.609 -> 0.80449999999999999
A40: 185.4 | B40: =A40-A39 -> 6.5999999999999943 | C40: X - Caution! Agate Pass Bridge | D40: =A40*1.609 -> 298.30860000000001 | E40: =B40*1.609 -> 10.61939999999999
A41: 192.2 | B41: =A41-A40 -> 6.7999999999999829 | C41: Control # 6 Bainbridge Island Ferry Terminal Bld. | D41: =A41*1.609 -> 309.24979999999999 | E41: =B41*1.609 -> 10.941199999999972