C1: Seattle International Randonneurs 300 km Brevet - June 12th, 1999
C2: status: all verified by bicycle | D2: 1.609
A3: Miles | B3: Leg | C3: Control# & Instructions | D3: Km | E3: Leg
A4: 0 | B4: 0 | C4: Left from TZ house onto NE 140th St (West) | D4: =+A4 *1.609 -> 0.0 | E4: =+B4 *1.609 -> 0.0
A5: =+A4+B5 -> 00.1 | B5: 00.1 | C5: R - 232nd St NE | D5: =+A5 *1.609 -> 0.16090000000000002 | E5: =+B5 *1.609 -> 0.16090000000000002
A6: =+A5+B6 -> 2.2 | B6: 2.1 | C6: L - Old Woodinville-Duvall Rd | D6: =+A6 *1.609 -> 3.5398 | E6: =+B6 *1.609 -> 3.3789000000000002
A7: =+A6+B7 -> 3.1 | B7: 00.9 | C7: L - Woodinville-Duvall Rd (SS) | D7: =+A7 *1.609 -> 4.9879 | E7: =+B7 *1.609 -> 1.4481
A8: =+A7+B8 -> 4.5 | B8: 1.4 | C8: R - 204th NE/Paradise Lake Rd (TL) | D8: =+A8 *1.609 -> 7.2405 | E8: =+B8 *1.609 -> 2.2525999999999997
A9: =+A8+B9 -> 9.3 | B9: 4.8 | C9: ST - Cross SR522 (TL) | D9: =+A9 *1.609 -> 14.963700000000001 | E9: =+B9 *1.609 -> 7.7231999999999994
A10: =+A9+B10 -> 9.3 | B10: 0 | C10: R - T intersection (unmarked)/Yew Way | D10: =+A10 *1.609 -> 14.963700000000001 | E10: =+B10 *1.609 -> 0.0
A11: =+A10+B11 -> 9.5 | B11: 00.2 | C11: ST/VR - Stop Sign (Yew Way) | D11: =+A11 *1.609 -> 15.285499999999999 | E11: =+B11 *1.609 -> 0.32180000000000003
A12: =+A11+B12 -> 9.8 | B12: 00.3 | C12: VL over RR tracks onto Broadway | D12: =+A12 *1.609 -> 15.7682 | E12: =+B12 *1.609 -> 0.48269999999999996
A13: =+A12+B13 -> 15 | B13: 5.2 | C13: R - Hwy 9 (TL) | D13: =+A13 *1.609 -> 24.135 | E13: =+B13 *1.609 -> 8.3668
A14: =+A13+B14 -> 25.5 | B14: 10.5 | C14: R - Highway 92 (TL) | D14: =+A14 *1.609 -> 41.0295 | E14: =+B14 *1.609 -> 16.8945
A15: =+A14+B15 -> 31.1 | B15: 5.6 | C15: L - 161 Ave. NE | D15: =+A15 *1.609 -> 50.0399 | E15: =+B15 *1.609 -> 9.0103999999999989
A16: =+A15+B16 -> 31.4 | B16: 0.29999999999999716 | C16: L - 163rd Ave. NE | D16: =+A16 *1.609 -> 50.5226 | E16: =+B16 *1.609 -> 0.48269999999999541
A17: =+A16+B17 -> 32.5 | B17: 1.1 | C17: L - Burn Road | D17: =+A17 *1.609 -> 52.2925 | E17: =+B17 *1.609 -> 1.7699
A18: =+A17+B18 -> 33.8 | B18: 1.3 | C18: L - 116 th NE | D18: =+A18 *1.609 -> 54.384199999999993 | E18: =+B18 *1.609 -> 2.0917
A19: =+A18+B19 -> 39.9 | B19: 6.1 | C19: R - Kellogg / Sisco Hights Road (Arlington) | D19: =+A19 *1.609 -> 64.1991 | E19: =+B19 *1.609 -> 9.8149
A20: =+A19+B20 -> 41.9 | B20: 2.0 | C20: L - Highland Drive | D20: =+A20 *1.609 -> 67.417099999999991 | E20: =+B20 *1.609 -> 3.218
A21: =+A20+B21 -> 42.1 | B21: 0.20000000000000284 | C21: R - S. French | D21: =+A21 *1.609 -> 67.7389 | E21: =+B21 *1.609 -> 0.32180000000000458
A22: =+A21+B22 -> 42.6 | B22: 0.5 | C22: L - Third | D22: =+A22 *1.609 -> 68.5434 | E22: =+B22 *1.609 -> 0.8045
A23: =+A22+B23 -> 42.8 | B23: 0.19999999999999929 | C23: R - N. Olympic | D23: =+A23 *1.609 -> 68.8652 | E23: =+B23 *1.609 -> 0.32179999999999886
A24: =+A23+B24 -> 43 | B24: 0.19999999999999929 | C24: R - Division | D24: =+A24 *1.609 -> 69.187 | E24: =+B24 *1.609 -> 0.32179999999999886
A25: =+A24+B25 -> 43.1 | B25: 0.10000000000000142 | C25: L - Broadway | D25: =+A25 *1.609 -> 69.3479 | E25: =+B25 *1.609 -> 0.16090000000000229
A26: =+A25+B26 -> 43.2 | B26: 9.9999999999997868E-2 | C26: #1 - Thrifty Foods - CONTROL | D26: =+A26 *1.609 -> 69.508800000000008 | E26: =+B26 *1.609 -> 0.16089999999999657
A27: =+A26+B27 -> 43.2 | B27: 0.0 | C27: R - East on 530 | D27: =+A27 *1.609 -> 69.508800000000008 | E27: =+B27 *1.609 -> 0.0
A28: =+A27+B28 -> 71.7 | B28: 28.5 | C28: #2 - Darrington - CONTROL | D28: =+A28 *1.609 -> 115.3653 | E28: =+B28 *1.609 -> 45.8565
A29: =+A28+B29 -> 71.7 | B29: 0.0 | C29: U-Turn | D29: =+A29 *1.609 -> 115.3653 | E29: =+B29 *1.609 -> 0.0
A30: =+A29+B30 -> 100.2 | B30: 28.5 | C30: #3 - Thrifty Food - CONTROL | D30: =+A30 *1.609 -> 161.2218 | E30: =+B30 *1.609 -> 45.8565
A31: =+A30+B31 -> 100.2 | B31: 0.0 | C31: U-Turn | D31: =+A31 *1.609 -> 161.2218 | E31: =+B31 *1.609 -> 0.0
A32: =+A31+B32 -> 101 | B32: 00.8 | C32: R - Jordan Road | D32: =+A32 *1.609 -> 162.509 | E32: =+B32 *1.609 -> 1.2872000000000001
A33: =+A32+B33 -> 102 | B33: 1.0 | C33: R - Jordan Road | D33: =+A33 *1.609 -> 164.118 | E33: =+B33 *1.609 -> 1.609
A34: =+A33+B34 -> 113.9 | B34: 11.9 | C34: L - Highway 92 (TL) | D34: =+A34 *1.609 -> 183.26510000000002 | E34: =+B34 *1.609 -> 19.147100000000002
A35: =+A34+B35 -> 114.6 | B35: 0.70000000000000284 | C35: R - Mt. Loop Highway | D35: =+A35 *1.609 -> 184.3914 | E35: =+B35 *1.609 -> 1.1263000000000045
A36: =+A35+B36 -> 114.8 | B36: 0.19999999999999574 | C36: L - Menzel Lake Road | D36: =+A36 *1.609 -> 184.71320000000003 | E36: =+B36 *1.609 -> 0.32179999999999315
A37: =+A36+B37 -> 125.4 | B37: 10.6 | C37: L - Woods Creek Road | D37: =+A37 *1.609 -> 201.76860000000002 | E37: =+B37 *1.609 -> 17.0554
A38: =+A37+B38 -> 132.8 | B38: 7.4 | C38: R - Stay right on Woods Creed Rd. | D38: =+A38 *1.609 -> 213.67520000000002 | E38: =+B38 *1.609 -> 11.906600000000001
A39: =+A38+B39 -> 133.8 | B39: 1.0 | C39: L - Woods Creek Road | D39: =+A39 *1.609 -> 215.28420000000003 | E39: =+B39 *1.609 -> 1.609
A40: =+A39+B40 -> 135.7 | B40: 1.9000000000000057 | C40: L - Oaks Street (0.1 mile before Highway 2) | D40: =+A40 *1.609 -> 218.34130000000002 | E40: =+B40 *1.609 -> 3.057100000000009
A41: =+A40+B41 -> 135.9 | B41: 0.20000000000000284 | C41: R - Stop Sign | D41: =+A41 *1.609 -> 218.66310000000004 | E41: =+B41 *1.609 -> 0.32180000000000458
A42: =+A41+B42 -> 136.1 | B42: 0.19999999999998863 | C42: ST - Cross Hwy 2 (TL) | D42: =+A42 *1.609 -> 218.98490000000004 | E42: =+B42 *1.609 -> 0.32179999999998171
A43: =+A42+B43 -> 136.1 | B43: 0.0 | C43: #4 - Monroe - CONTROL (open) | D43: =+A43 *1.609 -> 218.98490000000004 | E43: =+B43 *1.609 -> 0.0
A44: =+A43+B44 -> 136.5 | B44: 00.4 | C44: L - Lewis St/SR 203 (TL) | D44: =+A44 *1.609 -> 219.62850000000003 | E44: =+B44 *1.609 -> 0.64360000000000006
A45: =+A44+B45 -> 160.3 | B45: 23.8 | C45: R - SR 202 (SS/T-int) | D45: =+A45 *1.609 -> 257.92270000000008 | E45: =+B45 *1.609 -> 38.294200000000004
A46: =+A45+B46 -> 162.7 | B46: 2.4 | C46: L -308th Ave SE (at ballfields) | D46: =+A46 *1.609 -> 261.78430000000009 | E46: =+B46 *1.609 -> 3.8615999999999997
A47: =+A46+B47 -> 163 | B47: 00.3 | C47: R - SE 40th St/Issaquah Fall City Rd | D47: =+A47 *1.609 -> 262.26700000000011 | E47: =+B47 *1.609 -> 0.48269999999999996
A48: =+A47+B48 -> 163.6 | B48: 00.6 | C48: ST - becomes Issaquah Fall City Rd | D48: =+A48 *1.609 -> 263.2324000000001 | E48: =+B48 *1.609 -> 0.96539999999999992
A49: =+A48+B49 -> 166.2 | B49: 2.6 | C49: L - Issaquah Fall City Rd (SS) | D49: =+A49 *1.609 -> 267.41580000000005 | E49: =+B49 *1.609 -> 4.1834
A50: =+A49+B50 -> 168.1 | B50: 1.9 | C50: L - Issaquah Fall City Rd (TL) | D50: =+A50 *1.609 -> 270.4729000000001 | E50: =+B50 *1.609 -> 3.0570999999999997
A51: =+A50+B51 -> 169.2 | B51: 1.1 | C51: R - E Lake Sammamish Parkway SE (TL) | D51: =+A51 *1.609 -> 272.24280000000005 | E51: =+B51 *1.609 -> 1.7699
A52: =+A51+B52 -> 169.9 | B52: 00.7 | C52: L - NW Sammamish Rd (TL) | D52: =+A52 *1.609 -> 273.36910000000006 | E52: =+B52 *1.609 -> 1.1262999999999999
A53: =+A52+B53 -> 169.9 | B53: 0 | C53: #5 - Issaquah - CONTROL | D53: =+A53 *1.609 -> 273.36910000000006 | E53: =+B53 *1.609 -> 0.0
A54: =+A53+B54 -> 170.6 | B54: 00.7 | C54: R - frontage Rd | D54: =+A54 *1.609 -> 274.4954 | E54: =+B54 *1.609 -> 1.1262999999999999
A55: =+A54+B55 -> 172.9 | B55: 2.3 | C55: R (roundabout) W Lake Sammamish Parkway SE | D55: =+A55 *1.609 -> 278.19610000000006 | E55: =+B55 *1.609 -> 3.7007
A56: =+A55+B56 -> 180.4 | B56: 7.5 | C56: R - W Lake Sammamish Parkway SE (TL) | D56: =+A56 *1.609 -> 290.26360000000005 | E56: =+B56 *1.609 -> 12.0675
A57: =+A56+B57 -> 181.9 | B57: 1.5 | C57: R - Leary Way | D57: =+A57 *1.609 -> 292.67710000000005 | E57: =+B57 *1.609 -> 2.4135
A58: =+A57+B58 -> 182.1 | B58: 00.2 | C58: R - Bear Creek Parkway | D58: =+A58 *1.609 -> 292.99890000000005 | E58: =+B58 *1.609 -> 0.32180000000000003
A59: =+A58+B59 -> 183 | B59: 00.9 | C59: ST - across Redmond Way (TL) | D59: =+A59 *1.609 -> 294.44700000000006 | E59: =+B59 *1.609 -> 1.4481
A60: =+A59+B60 -> 183.1 | B60: 00.1 | C60: R - (at Qlube) | D60: =+A60 *1.609 -> 294.60790000000003 | E60: =+B60 *1.609 -> 0.16090000000000002
A61: =+A60+B61 -> 183.6 | B61: 0.5 | C61: ST/VL - Avondale (TL) | D61: =+A61 *1.609 -> 295.41240000000005 | E61: =+B61 *1.609 -> 0.8045
A62: =+A61+B62 -> 186.9 | B62: 3.3 | C62: R - NE 132nd St | D62: =+A62 *1.609 -> 300.72210000000007 | E62: =+B62 *1.609 -> 5.3096999999999994
A63: =+A62+B63 -> 187.2 | B63: 00.3 | C63: R - NE 133rd St | D63: =+A63 *1.609 -> 301.20480000000009 | E63: =+B63 *1.609 -> 0.48269999999999996
A64: =+A63+B64 -> 189.7 | B64: 2.5 | C64: L - 232nd Ave NE | D64: =+A64 *1.609 -> 305.22730000000007 | E64: =+B64 *1.609 -> 4.0225
A65: =+A64+B65 -> 190.3 | B65: 00.6 | C65: R - NE 140th St (end of ride) | D65: =+A65 *1.609 -> 306.19270000000006 | E65: =+B65 *1.609 -> 0.96539999999999992
C66: #6 FINISH - Zmrhal 23441 NE 140th St
A67: Zmrhal - home 425-844-8718
A68: L = left, R = right, BR = bear right, BL = bear left, ST = straight, TA = turn around, X = cross
A69: JR = jog right, JL = jog left, RR = railroad, SR = state route, US = US hwy
A70: N = north, S = south, E = east, W = west