A1: Seattle Randonneurs 600 km Brevet
A2: North Cascades
A4: Created By: | D4: Mark Thomas
A5: Verified By: | D5: Mark Thomas
A6: Year(s) Used: | D6: 2001
A7: Conversion(Mi-Km) | D7: 1.609
A9: Miles | C9: Km
A10: Total | B10: Leg | C10: Total | D10: Leg | E10: Ctrl | F10: Instructions
A11: 0.0 | B11: 0.0 | C11: =+A11*$D$7 -> 0.0 | D11: =+B11*$D$7 -> 0.0 | E11: #1 | F11: START
A12: =+A11+B12 -> 00.2 | B12: 00.2 | C12: =+A12*$D$7 -> 0.32180000000000003 | D12: =+B12*$D$7 -> 0.32180000000000003 | F12: R (South-East) onto Smokey Pt Blvd
A13: =+A12+B13 -> 00.7 | B13: 00.5 | C13: =+A13*$D$7 -> 1.1262999999999999 | D13: =+B13*$D$7 -> 0.80449999999999999 | F13: L (East) onto 204th St NE
A14: =+A13+B14 -> 1.7 | B14: 1.0 | C14: =+A14*$D$7 -> 2.7353000000000001 | D14: =+B14*$D$7 -> 1.609 | F14: R (South) onto 43rd Ave NE (becomes Cemetery Rd)
A15: =+A14+B15 -> 4.1 | B15: 2.4 | C15: =+A15*$D$7 -> 6.5968999999999998 | D15: =+B15*$D$7 -> 3.8615999999999997 | F15: ST across SR-9
A16: =+A15+B16 -> 4.7 | B16: 0.60000000000000053 | C16: =+A16*$D$7 -> 7.5623000000000005 | D16: =+B16*$D$7 -> 0.96540000000000081 | F16: R (South) onto Burn Rd
A17: =+A16+B17 -> 6.5 | B17: 1.8 | C17: =+A17*$D$7 -> 10.458500000000001 | D17: =+B17*$D$7 -> 2.8961999999999999 | F17: L (East) to stay on Burn Rd
A18: =+A17+B18 -> 12.8 | B18: 6.3 | C18: =+A18*$D$7 -> 20.595200000000002 | D18: =+B18*$D$7 -> 10.136699999999999 | F18: R (South) onto 159th Ave NE / Burn Rd
A19: =+A18+B19 -> 13.8 | B19: 1.0 | C19: =+A19*$D$7 -> 22.2042 | D19: =+B19*$D$7 -> 1.609 | F19: L (East) onto Burn Rd (becomes 100th St NE)
A20: =+A19+B20 -> 15.5 | B20: 1.7 | C20: =+A20*$D$7 -> 24.939499999999999 | D20: =+B20*$D$7 -> 2.7353000000000001 | F20: R (South) onto Jordan Rd
A21: =+A20+B21 -> 15.8 | B21: 0.30000000000000071 | C21: =+A21*$D$7 -> 25.4222 | D21: =+B21*$D$7 -> 0.48270000000000113 | F21: L (East) onto SR-92
A22: =+A21+B22 -> 16.4 | B22: 0.59999999999999787 | C22: =+A22*$D$7 -> 26.387599999999999 | D22: =+B22*$D$7 -> 0.96539999999999659 | F22: R (South) onto S Alder Ave (Granite Falls)
A23: =+A22+B23 -> 16.7 | B23: 0.30000000000000071 | C23: =+A23*$D$7 -> 26.8703 | D23: =+B23*$D$7 -> 0.48270000000000113 | F23: L (East) onto E Pioneer Street
A24: =+A23+B24 -> 17.1 | B24: 0.40000000000000213 | C24: =+A24*$D$7 -> 27.513900000000003 | D24: =+B24*$D$7 -> 0.64360000000000339 | F24: BR (South-East) onto Menzel Lake Rd
A25: =+A24+B25 -> 22.9 | B25: 5.8 | C25: =+A25*$D$7 -> 36.8461 | D25: =+B25*$D$7 -> 9.3322000000000003 | F25: BL (South-East) onto N Lake Rosinger Rd
A26: =+A25+B26 -> 27.3 | B26: 4.4 | C26: =+A26*$D$7 -> 43.925700000000006 | D26: =+B26*$D$7 -> 7.0796000000000001 | F26: L (East) onto Woods Creek Rd
A27: =+A26+B27 -> 32.3 | B27: 5.0 | C27: =+A27*$D$7 -> 51.970700000000008 | D27: =+B27*$D$7 -> 8.0449999999999999 | F27: L (South) onto Bollenbaugh Hill Rd
A28: =+A27+B28 -> 33.1 | B28: 0.80000000000000426 | C28: =+A28*$D$7 -> 53.257900000000014 | D28: =+B28*$D$7 -> 1.2872000000000068 | F28: L (East) onto Old Pipeline Rd
A29: =+A28+B29 -> 36.3 | B29: 3.2 | C29: =+A29*$D$7 -> 58.406700000000015 | D29: =+B29*$D$7 -> 5.1488000000000005 | F29: BR (East) onto Reiner Rd
A30: =+A29+B30 -> 39.4 | B30: 3.1 | C30: =+A30*$D$7 -> 63.394600000000018 | D30: =+B30*$D$7 -> 4.9878999999999998 | F30: L (East) onto Old Owen Rd (becomes 299th Ave SE)
A31: =+A30+B31 -> 40.0 | B31: 0.60000000000000142 | C31: =+A31*$D$7 -> 64.36 | D31: =+B31*$D$7 -> 0.96540000000000226 | F31: L (East) onto US-2
A32: =+A31+B32 -> 67.1 | B32: 27.1 | C32: =+A32*$D$7 -> 107.96390000000004 | D32: =+B32*$D$7 -> 43.603900000000003 | E32: #2 | F32: Skykomish
A33: =+A32+B33 -> 82.9 | B33: 15.8 | C33: =+A33*$D$7 -> 133.38610000000003 | D33: =+B33*$D$7 -> 25.4222 | F33: Stevens Pass (4061 ft, Milepost 64.5)
A34: =+A33+B34 -> 118.0 | B34: 35.1 | C34: =+A34*$D$7 -> 189.86200000000005 | D34: =+B34*$D$7 -> 56.475900000000003 | E34: #3 | F34: Leavenworth
A35: =+A34+B35 -> 137.2 | B35: 19.2 | C35: =+A35*$D$7 -> 220.75480000000002 | D35: =+B35*$D$7 -> 30.892799999999998 | F35: Exit RIGHT for US-97/97Alt North (Dir: Okanogan)
A36: =+A35+B36 -> 138.2 | B36: 1.0 | C36: =+A36*$D$7 -> 222.36380000000003 | D36: =+B36*$D$7 -> 1.609 | F36: Exit RIGHT for US-97Alt (Dir: Chelan-Entiat)
A37: =+A36+B37 -> 154.2 | B37: 16.0 | C37: =+A37*$D$7 -> 248.10780000000003 | D37: =+B37*$D$7 -> 25.744 | E37: #4 | F37: Entiat
A38: =+A37+B38 -> 177.1 | B38: 22.9 | C38: =+A38*$D$7 -> 284.95390000000003 | D38: =+B38*$D$7 -> 36.8461 | F38: L (North) onto US-97
A39: =+A38+B39 -> 191.1 | B39: 14.0 | C39: =+A39*$D$7 -> 307.47990000000004 | D39: =+B39*$D$7 -> 22.526 | F39: ST into Pateros (on US-97 across bridge)
A40: =+A39+B40 -> 191.4 | B40: 0.30000000000001137 | C40: =+A40*$D$7 -> 307.96260000000007 | D40: =+B40*$D$7 -> 0.48270000000001828 | E40: #5 | F40: Pateros
A41: =+A40+B41 -> 191.4 | B41: 0.0 | C41: =+A41*$D$7 -> 307.96260000000007 | D41: =+B41*$D$7 -> 0.0 | F41: L (South) onto US-97
A42: =+A41+B42 -> 191.7 | B42: 0.29999999999998295 | C42: =+A42*$D$7 -> 308.44530000000003 | D42: =+B42*$D$7 -> 0.48269999999997254 | F42: R (South-West) onto SR-153
A43: =+A42+B43 -> 222.5 | B43: 30.8 | C43: =+A43*$D$7 -> 358.0025 | D43: =+B43*$D$7 -> 49.557200000000002 | F43: L (West) onto SR-20 (near Twisp)
A44: =+A43+B44 -> 232.9 | B44: 10.4 | C44: =+A44*$D$7 -> 374.73610000000008 | D44: =+B44*$D$7 -> 16.733599999999999 | E44: #6 | F44: Winthrop Virginian Hotel - Cabin #1
A45: =+A44+B45 -> 258.4 | B45: 25.5 | C45: =+A45*$D$7 -> 415.76560000000006 | D45: =+B45*$D$7 -> 41.029499999999999 | F45: Lone Fir Campground (water - camp #26)
A46: =+A45+B46 -> 264.3 | B46: 5.9000000000000341 | C46: =+A46*$D$7 -> 425.25870000000009 | D46: =+B46*$D$7 -> 9.4931000000000552 | F46: Washington Pass (5477 ft, Milepost 162.5)
A47: =+A46+B47 -> 269.1 | B47: 4.8000000000000114 | C47: =+A47*$D$7 -> 432.98190000000011 | D47: =+B47*$D$7 -> 7.7232000000000181 | F47: Rainy Pass (4855 ft, Milepost 157.7)
A48: =+A47+B48 -> 306.2 | B48: 37.1 | C48: =+A48*$D$7 -> 492.67580000000015 | D48: =+B48*$D$7 -> 59.693899999999999 | F48: Newhalem - Skagit General Store / public restrooms
A49: =+A48+B49 -> 320.0 | B49: 13.8 | C49: =+A49*$D$7 -> 514.88 | D49: =+B49*$D$7 -> 22.2042 | E49: #7 | F49: Marblemount
A50: =+A49+B50 -> 328.3 | B50: 8.3000000000000114 | C50: =+A50*$D$7 -> 528.2347000000002 | D50: =+B50*$D$7 -> 13.354700000000019 | F50: L (South) onto SR-530 (Rockport)
A51: =+A50+B51 -> 347.0 | B51: 18.7 | C51: =+A51*$D$7 -> 558.32300000000021 | D51: =+B51*$D$7 -> 30.0883 | F51: R (West) to stay on SR-530 (Darrington)
A52: =+A51+B52 -> 374.9 | B52: 27.9 | C52: =+A52*$D$7 -> 603.21410000000014 | D52: =+B52*$D$7 -> 44.891099999999994 | F52: L (South) on SR-9 / SR-530 (Arlington)
A53: =+A52+B53 -> 375.1 | B53: 0.20000000000004547 | C53: =+A53*$D$7 -> 603.5359000000002 | D53: =+B53*$D$7 -> 0.32180000000007314 | F53: R (West) on SR-530
A54: =+A53+B54 -> 378.8 | B54: 3.6999999999999886 | C54: =+A54*$D$7 -> 609.48920000000021 | D54: =+B54*$D$7 -> 5.9532999999999818 | E54: #8 | F54: Arlington Motor Inn