A1: Seattle Randonneurs 600 km Brevet
A2: Three Passes + Snoq Valley
A4: Created By: | D4: Terry Zmrhal
A5: Verified By: | D5: Terry Zmrhal
A6: Year(s) Used: | D6: 1999.0
A7: Conversion(Mi-Km) | D7: 1.609
A9: Miles | C9: Km
A10: Total | B10: Leg | C10: Total | D10: Leg | E10: Ctrl | F10: Instructions
A11: 0.0 | B11: 0.0 | C11: =+A11*$D$7 -> 0.0 | D11: =+B11*$D$7 -> 0.0 | E11: #1 | F11: Left from TZ house onto NE 140th St (West)
A12: =+A11+B12 -> 00.1 | B12: 00.1 | C12: =+A12*$D$7 -> 0.16090000000000002 | D12: =+B12*$D$7 -> 0.16090000000000002 | F12: R - 232nd St NE
A13: =+A12+B13 -> 2.2 | B13: 2.1 | C13: =+A13*$D$7 -> 3.5398000000000001 | D13: =+B13*$D$7 -> 3.3789000000000002 | F13: L - Old Woodinville-Duvall Rd (course official start)
A14: =+A13+B14 -> 2.2 | B14: 0.0 | C14: =+A14*$D$7 -> 3.5398000000000001 | D14: =+B14*$D$7 -> 0.0 | F14: Official Start
A15: =+A14+B15 -> 2.8 | B15: 00.6 | C15: =+A15*$D$7 -> 4.5052000000000003 | D15: =+B15*$D$7 -> 0.96539999999999992 | F15: R on Woodinville Duvall Rd.
A16: =+A15+B16 -> 4.8 | B16: 2.0 | C16: =+A16*$D$7 -> 7.7232000000000012 | D16: =+B16*$D$7 -> 3.218 | F16: L on Hwy. 203 at the stop light in Duvall
A17: =+A16+B17 -> 13.5 | B17: 8.7 | C17: =+A17*$D$7 -> 21.721499999999999 | D17: =+B17*$D$7 -> 13.998299999999999 | F17: R on Main St. in Monroe, watch out X'ing RR tracks
A18: =+A17+B18 -> 13.8 | B18: 00.3 | C18: =+A18*$D$7 -> 22.2042 | D18: =+B18*$D$7 -> 0.48269999999999996 | F18: VR onto Hwy. 2
A19: =+A18+B19 -> 46.8 | B19: 33.0 | C19: =+A19*$D$7 -> 75.301199999999994 | D19: =+B19*$D$7 -> 53.097000000000001 | E19: #2 | F19: R to Skykomish - Open
A20: =+A19+B20 -> 96.8 | B20: 50.0 | C20: =+A20*$D$7 -> 155.75119999999998 | D20: =+B20*$D$7 -> 80.45 | E20: #3 | F20: L into Chevron Mini Mart in Leavenworth
A21: =+A20+B21 -> 102.8 | B21: 6.0 | C21: =+A21*$D$7 -> 165.40520000000001 | D21: =+B21*$D$7 -> 9.6539999999999999 | F21: R on Hwy. 97 towards Blewitt Pass
A22: =+A21+B22 -> 138.2 | B22: 35.4 | C22: =+A22*$D$7 -> 222.36379999999997 | D22: =+B22*$D$7 -> 56.958599999999997 | F22: VR onto Hwy. 970
A23: =+A22+B23 -> 145.6 | B23: 7.4 | C23: =+A23*$D$7 -> 234.2704 | D23: =+B23*$D$7 -> 11.906600000000001 | F23: ST on Hwy. 10 towards Cle Elum
A24: =+A23+B24 -> 150.2 | B24: 4.6 | C24: =+A24*$D$7 -> 241.67179999999999 | D24: =+B24*$D$7 -> 7.4013999999999998 | E24: #4 | F24: West Cle Elum Safeway
A25: =+A24+B25 -> 150.4 | B25: 00.2 | C25: =+A25*$D$7 -> 241.99359999999996 | D25: =+B25*$D$7 -> 0.32180000000000003 | F25: R onto 1st & I-90, go west and Snoqualmie Pass
A26: =+A25+B26 -> 198.4 | B26: 48.0 | C26: =+A26*$D$7 -> 319.22559999999999 | D26: =+B26*$D$7 -> 77.231999999999999 | F26: R at Edgewick Rd.
A27: =+A26+B27 -> 198.5 | B27: 00.1 | C27: =+A27*$D$7 -> 319.38649999999996 | D27: =+B27*$D$7 -> 0.16090000000000002 | E27: #5 | F27: BP Truck Stop at North Bend
A28: =+A27+B28 -> 198.5 | B28: 0.0 | C28: =+A28*$D$7 -> 319.38649999999996 | D28: =+B28*$D$7 -> 0.0 | F28: R onto SE North Bend Way (West)
A29: =+A28+B29 -> 202.2 | B29: 3.7 | C29: =+A29*$D$7 -> 325.33979999999991 | D29: =+B29*$D$7 -> 5.9533000000000005 | F29: R onto North Bend Way
A30: =+A29+B30 -> 202.3 | B30: 00.1 | C30: =+A30*$D$7 -> 325.50069999999994 | D30: =+B30*$D$7 -> 0.16090000000000002 | F30: VL onto Hwy. 202
A31: =+A30+B31 -> 210.3 | B31: 8.0 | C31: =+A31*$D$7 -> 338.37269999999995 | D31: =+B31*$D$7 -> 12.872 | F31: R onto SR 203
A32: =+A31+B32 -> 217.3 | B32: 7.0 | C32: =+A32*$D$7 -> 349.63569999999993 | D32: =+B32*$D$7 -> 11.263 | F32: L onto Carnation Farms Rd.
A33: =+A32+B33 -> 221.7 | B33: 4.4 | C33: =+A33*$D$7 -> 356.71529999999996 | D33: =+B33*$D$7 -> 7.0796000000000001 | F33: R at NE 80th St.
A34: =+A33+B34 -> 222.5 | B34: 00.8 | C34: =+A34*$D$7 -> 358.0025 | D34: =+B34*$D$7 -> 1.2872000000000001 | F34: VR at West Snoqualmie Valley Rd.
A35: =+A34+B35 -> 232.0 | B35: 9.5 | C35: =+A35*$D$7 -> 373.28799999999995 | D35: =+B35*$D$7 -> 15.285499999999999 | F35: ST - W. Snoqualmie turns into High Bridge Rd.
A36: =+A35+B36 -> 237.2 | B36: 5.2 | C36: =+A36*$D$7 -> 381.65479999999991 | D36: =+B36*$D$7 -> 8.3667999999999996 | F36: L onto Fales Rd.
A37: =+A36+B37 -> 239.2 | B37: 2.0 | C37: =+A37*$D$7 -> 384.87279999999993 | D37: =+B37*$D$7 -> 3.218 | F37: R onto Downe Rd.
A38: =+A37+B38 -> 240.0 | B38: 00.8 | C38: =+A38*$D$7 -> 386.16 | D38: =+B38*$D$7 -> 1.2872000000000001 | F38: L onto Yew Way
A39: =+A38+B39 -> 241.0 | B39: 1.0 | C39: =+A39*$D$7 -> 387.76899999999995 | D39: =+B39*$D$7 -> 1.609 | F39: VL Yew Way
A40: =+A39+B40 -> 241.3 | B40: 00.3 | C40: =+A40*$D$7 -> 388.25169999999997 | D40: =+B40*$D$7 -> 0.48269999999999996 | F40: X Malby Rd.
A41: =+A40+B41 -> 241.4 | B41: 00.1 | C41: =+A41*$D$7 -> 388.41259999999994 | D41: =+B41*$D$7 -> 0.16090000000000002 | F41: L onto Paradise Lk. Rd., X Hwy. 522
A42: =+A41+B42 -> 246.1 | B42: 4.7 | C42: =+A42*$D$7 -> 395.97489999999993 | D42: =+B42*$D$7 -> 7.5623000000000005 | F42: L onto Woodinville-Duvall Rd.
A43: =+A42+B43 -> 247.4 | B43: 1.3 | C43: =+A43*$D$7 -> 398.06659999999994 | D43: =+B43*$D$7 -> 2.0916999999999999 | F43: R onto Old Woodinville-Duvall Rd.
A44: =+A43+B44 -> 248.2 | B44: 00.8 | C44: =+A44*$D$7 -> 399.35379999999998 | D44: =+B44*$D$7 -> 1.2872000000000001 | F44: R onto 232nd Ave.
A45: =+A44+B45 -> 250.2 | B45: 2.0 | C45: =+A45*$D$7 -> 402.5718 | D45: =+B45*$D$7 -> 3.218 | F45: L onto 140th St., (gravel road)
A46: =+A45+B46 -> 250.3 | B46: 00.1 | C46: =+A46*$D$7 -> 402.73269999999997 | D46: =+B46*$D$7 -> 0.16090000000000002 | F46: R into Terry Zmrhal's house
A47: =+A46+B47 -> 250.3 | C47: =+A47*$D$7 -> 402.73269999999997 | D47: =+B47*$D$7 -> 0.0 | E47: #6 | F47: OVERNIGHT STOP - CONTROL
A48: =+A47+B48 -> 250.3 | B48: 0.0 | C48: =+A48*$D$7 -> 402.73269999999997 | D48: =+B48*$D$7 -> 0.0 | F48: Left from TZ house onto NE 140th St (West)
A49: =+A48+B49 -> 250.4 | B49: 00.1 | C49: =+A49*$D$7 -> 402.89359999999994 | D49: =+B49*$D$7 -> 0.16090000000000002 | F49: R - 232nd St NE
A50: =+A49+B50 -> 252.5 | B50: 2.1 | C50: =+A50*$D$7 -> 406.27249999999998 | D50: =+B50*$D$7 -> 3.3789000000000002 | F50: L - Old Woodinville-Duvall Rd
A51: =+A50+B51 -> 253.4 | B51: 00.9 | C51: =+A51*$D$7 -> 407.72059999999993 | D51: =+B51*$D$7 -> 1.4480999999999999 | F51: L - Woodinville-Duvall Rd (SS)
A52: =+A51+B52 -> 254.8 | B52: 1.4 | C52: =+A52*$D$7 -> 409.97319999999996 | D52: =+B52*$D$7 -> 2.2525999999999997 | F52: R - 204th NE/Paradise Lake Rd (TL)
A53: =+A52+B53 -> 259.6 | B53: 4.8 | C53: =+A53*$D$7 -> 417.69639999999993 | D53: =+B53*$D$7 -> 7.7231999999999994 | F53: ST - Cross SR522 (TL)
A54: =+A53+B54 -> 259.6 | B54: 0.0 | C54: =+A54*$D$7 -> 417.69639999999993 | D54: =+B54*$D$7 -> 0.0 | F54: R - T intersection (unmarked)/Yew Way
A55: =+A54+B55 -> 259.8 | B55: 00.2 | C55: =+A55*$D$7 -> 418.01819999999992 | D55: =+B55*$D$7 -> 0.32180000000000003 | F55: ST/VR - Stop Sign (Yew Way)
A56: =+A55+B56 -> 260.1 | B56: 00.3 | C56: =+A56*$D$7 -> 418.50089999999994 | D56: =+B56*$D$7 -> 0.48269999999999996 | F56: VL over RR tracks onto Broadway
A57: =+A56+B57 -> 265.3 | B57: 5.2 | C57: =+A57*$D$7 -> 426.8676999999999 | D57: =+B57*$D$7 -> 8.3667999999999996 | F57: R - Hwy 9 (TL)
A58: =+A57+B58 -> 275.8 | B58: 10.5 | C58: =+A58*$D$7 -> 443.76219999999995 | D58: =+B58*$D$7 -> 16.894500000000001 | F58: R - Highway 92 (TL)
A59: =+A58+B59 -> 281.4 | B59: 5.6 | C59: =+A59*$D$7 -> 452.77259999999995 | D59: =+B59*$D$7 -> 9.0103999999999989 | F59: L - 161 Ave. NE
A60: =+A59+B60 -> 281.7 | B60: 0.29999999999999716 | C60: =+A60*$D$7 -> 453.25529999999998 | D60: =+B60*$D$7 -> 0.48269999999999541 | F60: L - 163rd Ave. NE
A61: =+A60+B61 -> 282.8 | B61: 1.1 | C61: =+A61*$D$7 -> 455.02520000000004 | D61: =+B61*$D$7 -> 1.7699 | F61: L - Burn Road
A62: =+A61+B62 -> 284.1 | B62: 1.3 | C62: =+A62*$D$7 -> 457.11690000000004 | D62: =+B62*$D$7 -> 2.0916999999999999 | F62: L - 116 th NE
A63: =+A62+B63 -> 290.2 | B63: 6.1 | C63: =+A63*$D$7 -> 466.93180000000007 | D63: =+B63*$D$7 -> 9.8148999999999997 | F63: R - Kellogg / Sisco Hights Road (Arlington)
A64: =+A63+B64 -> 292.2 | B64: 2.0 | C64: =+A64*$D$7 -> 470.14980000000008 | D64: =+B64*$D$7 -> 3.218 | F64: L - Highland Drive
A65: =+A64+B65 -> 292.4 | B65: 0.20000000000000284 | C65: =+A65*$D$7 -> 470.47160000000002 | D65: =+B65*$D$7 -> 0.32180000000000458 | F65: R - S. French
A66: =+A65+B66 -> 292.9 | B66: 0.5 | C66: =+A66*$D$7 -> 471.27610000000004 | D66: =+B66*$D$7 -> 0.80449999999999999 | F66: L - Third
A67: =+A66+B67 -> 293.1 | B67: 0.19999999999999929 | C67: =+A67*$D$7 -> 471.59790000000004 | D67: =+B67*$D$7 -> 0.32179999999999886 | F67: R - N. Olympic
A68: =+A67+B68 -> 293.3 | B68: 0.19999999999999929 | C68: =+A68*$D$7 -> 471.91970000000003 | D68: =+B68*$D$7 -> 0.32179999999999886 | F68: R - Division
A69: =+A68+B69 -> 293.4 | B69: 0.10000000000000142 | C69: =+A69*$D$7 -> 472.08060000000006 | D69: =+B69*$D$7 -> 0.16090000000000229 | F69: L - Broadway
A70: =+A69+B70 -> 293.5 | B70: 9.9999999999997868E-2 | C70: =+A70*$D$7 -> 472.24150000000009 | D70: =+B70*$D$7 -> 0.16089999999999657 | E70: #7 | F70: Thrifty Foods
A71: =+A70+B71 -> 293.5 | B71: 0.0 | C71: =+A71*$D$7 -> 472.24150000000009 | D71: =+B71*$D$7 -> 0.0 | F71: R - East on 530
A72: =+A71+B72 -> 294.3 | B72: 0.80000000000000071 | C72: =+A72*$D$7 -> 473.52870000000013 | D72: =+B72*$D$7 -> 1.2872000000000012 | F72: R - Jordan Road
A73: =+A72+B73 -> 295.3 | B73: 1.0 | C73: =+A73*$D$7 -> 475.13770000000011 | D73: =+B73*$D$7 -> 1.609 | F73: R - Jordan Road
A74: =+A73+B74 -> 307.2 | B74: 11.9 | C74: =+A74*$D$7 -> 494.28480000000008 | D74: =+B74*$D$7 -> 19.147100000000002 | F74: L - Highway 92 (TL)
A75: =+A74+B75 -> 307.9 | B75: 0.70000000000000284 | C75: =+A75*$D$7 -> 495.41110000000003 | D75: =+B75*$D$7 -> 1.1263000000000045 | F75: R - Mt. Loop Highway
A76: =+A75+B76 -> 308.1 | B76: 0.19999999999999574 | C76: =+A76*$D$7 -> 495.73290000000003 | D76: =+B76*$D$7 -> 0.32179999999999315 | F76: L - Menzel Lake Road
A77: =+A76+B77 -> 318.7 | B77: 10.6 | C77: =+A77*$D$7 -> 512.78830000000005 | D77: =+B77*$D$7 -> 17.055399999999999 | F77: L - Woods Creek Road
A78: =+A77+B78 -> 326.1 | B78: 7.4 | C78: =+A78*$D$7 -> 524.69490000000008 | D78: =+B78*$D$7 -> 11.906600000000001 | F78: R - Stay right on Woods Creed Rd.
A79: =+A78+B79 -> 327.1 | B79: 1.0 | C79: =+A79*$D$7 -> 526.3039 | D79: =+B79*$D$7 -> 1.609 | F79: L - Woods Creek Road
A80: =+A79+B80 -> 329.0 | B80: 1.9000000000000057 | C80: =+A80*$D$7 -> 529.36099999999999 | D80: =+B80*$D$7 -> 3.057100000000009 | F80: L - Oaks Street (0.1 mile before Highway 2)
A81: =+A80+B81 -> 329.2 | B81: 0.20000000000000284 | C81: =+A81*$D$7 -> 529.68279999999993 | D81: =+B81*$D$7 -> 0.32180000000000458 | F81: R - Stop Sign
A82: =+A81+B82 -> 329.4 | B82: 0.19999999999998863 | C82: =+A82*$D$7 -> 530.00459999999998 | D82: =+B82*$D$7 -> 0.32179999999998171 | F82: ST - Cross Hwy 2 (TL)
A83: =+A82+B83 -> 329.4 | B83: 0.0 | C83: =+A83*$D$7 -> 530.00459999999998 | D83: =+B83*$D$7 -> 0.0 | E83: #8 | F83: Monroe
A84: =+A83+B84 -> 329.8 | B84: 00.4 | C84: =+A84*$D$7 -> 530.64819999999997 | D84: =+B84*$D$7 -> 0.64360000000000006 | F84: L - Lewis St/SR 203 (TL)
A85: =+A84+B85 -> 353.6 | B85: 23.8 | C85: =+A85*$D$7 -> 568.94239999999991 | D85: =+B85*$D$7 -> 38.294200000000004 | F85: R - SR 202 (SS/T-int)
A86: =+A85+B86 -> 356.0 | B86: 2.4 | C86: =+A86*$D$7 -> 572.80399999999986 | D86: =+B86*$D$7 -> 3.8615999999999997 | F86: L -308th Ave SE (at ballfields)
A87: =+A86+B87 -> 356.3 | B87: 00.3 | C87: =+A87*$D$7 -> 573.28669999999988 | D87: =+B87*$D$7 -> 0.48269999999999996 | F87: R - SE 40th St/Issaquah Fall City Rd
A88: =+A87+B88 -> 356.9 | B88: 00.6 | C88: =+A88*$D$7 -> 574.25209999999993 | D88: =+B88*$D$7 -> 0.96539999999999992 | F88: ST - becomes Issaquah Fall City Rd
A89: =+A88+B89 -> 359.5 | B89: 2.6 | C89: =+A89*$D$7 -> 578.43550000000005 | D89: =+B89*$D$7 -> 4.1833999999999998 | F89: L - Issaquah Fall City Rd (SS)
A90: =+A89+B90 -> 361.4 | B90: 1.9 | C90: =+A90*$D$7 -> 581.49259999999992 | D90: =+B90*$D$7 -> 3.0570999999999997 | F90: L - Issaquah Fall City Rd (TL)
A91: =+A90+B91 -> 362.5 | B91: 1.1 | C91: =+A91*$D$7 -> 583.26250000000005 | D91: =+B91*$D$7 -> 1.7699 | F91: R - E Lake Sammamish Parkway SE (TL)
A92: =+A91+B92 -> 363.2 | B92: 00.7 | C92: =+A92*$D$7 -> 584.38879999999995 | D92: =+B92*$D$7 -> 1.1262999999999999 | E92: #9 | F92: Issaquah/Albertson's/McDonalds
A93: =+A92+B93 -> 372.5 | B93: 9.3 | C93: =+A93*$D$7 -> 599.35249999999996 | D93: =+B93*$D$7 -> 14.963700000000001 | F93: L - Redmond Way (TL)
A94: =+A93+B94 -> 372.5 | B94: 0.0 | C94: =+A94*$D$7 -> 599.35249999999996 | D94: =+B94*$D$7 -> 0.0 | F94: R - 180th Ave NE (TL)
A95: =+A94+B95 -> 373.2 | B95: 00.7 | C95: =+A95*$D$7 -> 600.47879999999998 | D95: =+B95*$D$7 -> 1.1262999999999999 | F95: L - Union Hill Rd (TL)
A96: =+A95+B96 -> 373.3 | B96: 00.1 | C96: =+A96*$D$7 -> 600.63970000000006 | D96: =+B96*$D$7 -> 0.16090000000000002 | F96: R - Avondale (TL)
A97: =+A96+B97 -> 376.6 | B97: 3.3 | C97: =+A97*$D$7 -> 605.94940000000008 | D97: =+B97*$D$7 -> 5.3096999999999994 | F97: R - NE 132nd St
A98: =+A97+B98 -> 376.9 | B98: 00.3 | C98: =+A98*$D$7 -> 606.4321000000001 | D98: =+B98*$D$7 -> 0.48269999999999996 | F98: R - NE 133rd St
A99: =+A98+B99 -> 379.4 | B99: 2.5 | C99: =+A99*$D$7 -> 610.45460000000003 | D99: =+B99*$D$7 -> 4.0225 | F99: L - 232nd Ave NE
A100: =+A99+B100 -> 380.0 | B100: 00.6 | C100: =+A100*$D$7 -> 611.42 | D100: =+B100*$D$7 -> 0.96539999999999992 | F100: R - NE 140th St (end of ride)
A101: =+A100+B101 -> 380.0 | C101: =+A101*$D$7 -> 611.42 | D101: =+B101*$D$7 -> 0.0 | E101: #10 | F101: FINISH - Zmrhal 23441 NE 140th St