A1: Seattle Randonneurs 600 km Brevet
A2: Kent-Packwood-Naches
A4: Created By: | D4: Wayne Methner
A5: Verified By: | D5: Wayne Methner
A6: Year(s) Used: | D6: 2000.0
A7: Conversion(Mi-Km) | D7: 1.609
A9: Miles | C9: Km
A10: Total | B10: Leg | C10: Total | D10: Leg | E10: Ctrl | F10: Instructions
A11: 0.0 | B11: 0.0 | C11: =+A11*$D$7 -> 0.0 | D11: =+B11*$D$7 -> 0.0 | E11: #1 | F11: Depart (North) from 145th Ave SE and SE 243rd PL
A12: =+A11+B12 -> 00.2 | B12: 00.2 | C12: =+A12*$D$7 -> 0.32180000000000003 | D12: =+B12*$D$7 -> 0.32180000000000003 | F12: R onto SE 240th
A13: =+A12+B13 -> 0.5 | B13: 00.3 | C13: =+A13*$D$7 -> 0.80449999999999999 | D13: =+B13*$D$7 -> 0.48269999999999996 | F13: BR SE 240th becomes SE244th
A14: =+A13+B14 -> 00.8 | B14: 00.3 | C14: =+A14*$D$7 -> 1.2872000000000001 | D14: =+B14*$D$7 -> 0.48269999999999996 | F14: R onto Soos Creek Bike/Walk Trail at Traffic Signal
A15: =+A14+B15 -> 2.4 | B15: 1.6 | C15: =+A15*$D$7 -> 3.8616000000000006 | D15: =+B15*$D$7 -> 2.5744000000000002 | F15: End of Soos Creek Trail
A16: =+A15+B16 -> 2.4 | B16: 0.0 | C16: =+A16*$D$7 -> 3.8616000000000006 | D16: =+B16*$D$7 -> 0.0 | F16: L onto 148th ave SE
A17: =+A16+B17 -> 2.6 | B17: 00.2 | C17: =+A17*$D$7 -> 4.1834000000000007 | D17: =+B17*$D$7 -> 0.32180000000000003 | F17: 148th ave SE becomes 152nd Way SE
A18: =+A17+B18 -> 2.9 | B18: 00.3 | C18: =+A18*$D$7 -> 4.6661000000000001 | D18: =+B18*$D$7 -> 0.48269999999999996 | F18: ST 152nd Ave SE x Kent-Kangley Rd (Hwy 516)
A19: =+A18+B19 -> 3.6 | B19: 00.7 | C19: =+A19*$D$7 -> 5.7924000000000007 | D19: =+B19*$D$7 -> 1.1262999999999999 | F19: Continue 152nd ave SE becomes Kent-Black Diamond Rd
A20: =+A19+B20 -> 6.9 | B20: 3.3 | C20: =+A20*$D$7 -> 11.1021 | D20: =+B20*$D$7 -> 5.3096999999999994 | F20: Continue Kent-Black Diamond Rd becomes Auburn-Black Diamond Rd
A21: =+A20+B21 -> 9.6 | B21: 2.7 | C21: =+A21*$D$7 -> 15.446400000000002 | D21: =+B21*$D$7 -> 4.3443000000000005 | F21: R onto 218th ave SE
A22: =+A21+B22 -> 11.0 | B22: 1.4 | C22: =+A22*$D$7 -> 17.699000000000002 | D22: =+B22*$D$7 -> 2.2525999999999997 | F22: ST 218th Ave SE becomes 212th Way SE X Green Valley Rd.
A23: =+A22+B23 -> 11.1 | B23: 00.1 | C23: =+A23*$D$7 -> 17.859900000000003 | D23: =+B23*$D$7 -> 0.16090000000000002 | F23: X Green River
A24: =+A23+B24 -> 11.7 | B24: 00.6 | C24: =+A24*$D$7 -> 18.825300000000002 | D24: =+B24*$D$7 -> 0.96539999999999992 | F24: L onto SE 368th Way ***Easy to Miss***
A25: =+A24+B25 -> 13.1 | B25: 1.4 | C25: =+A25*$D$7 -> 21.077900000000003 | D25: =+B25*$D$7 -> 2.2525999999999997 | F25: BR onto 236th Ave SE
A26: =+A25+B26 -> 14.1 | B26: 1.0 | C26: =+A26*$D$7 -> 22.686900000000001 | D26: =+B26*$D$7 -> 1.609 | F26: BL onto SE 384th St
A27: =+A26+B27 -> 14.1 | B27: 0.0 | C27: =+A27*$D$7 -> 22.686900000000001 | D27: =+B27*$D$7 -> 0.0 | F27: immediate R onto 236th Ave SE
A28: =+A27+B28 -> 17.3 | B28: 3.2 | C28: =+A28*$D$7 -> 27.835699999999999 | D28: =+B28*$D$7 -> 5.1488000000000005 | F28: L onto SE 436th St (SR 164)
A29: =+A28+B29 -> 17.8 | B29: 0.5 | C29: =+A29*$D$7 -> 28.6402 | D29: =+B29*$D$7 -> 0.80449999999999999 | F29: R onto 244th Ave SE
A30: =+A29+B30 -> 19.9 | B30: 2.1 | C30: =+A30*$D$7 -> 32.019100000000002 | D30: =+B30*$D$7 -> 3.3789000000000002 | F30: R onto SR-410 (Enumclaw-Buckley Rd) a "T" intersection
A31: =+A30+B31 -> 21.0 | B31: 1.1 | C31: =+A31*$D$7 -> 33.789000000000009 | D31: =+B31*$D$7 -> 1.7699 | F31: L onto Park Ave. At First Traffic Signal
A32: =+A31+B32 -> 21.0 | B32: 0.0 | C32: =+A32*$D$7 -> 33.789000000000009 | D32: =+B32*$D$7 -> 0.0 | F32: Buckley (services)
A33: =+A32+B33 -> 21.1 | B33: 00.1 | C33: =+A33*$D$7 -> 33.949900000000007 | D33: =+B33*$D$7 -> 0.16090000000000002 | F33: R onto S River Ave Towards Museum
A34: =+A33+B34 -> 21.7 | B34: 00.6 | C34: =+A34*$D$7 -> 34.915300000000009 | D34: =+B34*$D$7 -> 0.96539999999999992 | F34: ST S. River Ave becomes SR-165 X Ryan rd
A35: =+A34+B35 -> 23.2 | B35: 1.5 | C35: =+A35*$D$7 -> 37.328800000000008 | D35: =+B35*$D$7 -> 2.4135 | F35: BR onto SR-162 (Pioneer Way) towards South Prairie and Orting
A36: =+A35+B36 -> 25.6 | B36: 2.4 | C36: =+A36*$D$7 -> 41.190400000000011 | D36: =+B36*$D$7 -> 3.8615999999999997 | E36: #2 | F36: South Prairie Texaco
A37: =+A36+B37 -> 25.6 | B37: 0.0 | C37: =+A37*$D$7 -> 41.190400000000011 | D37: =+B37*$D$7 -> 0.0 | F37: R out of the Texaco--continue SR-162 (Pioneer Way)
A38: =+A37+B38 -> 32.1 | B38: 6.5 | C38: =+A38*$D$7 -> 51.648900000000012 | D38: =+B38*$D$7 -> 10.458500000000001 | F38: L onto Orville Rd E. Towards Electron ***** Easy to Miss *****
A39: =+A38+B39 -> 41.3 | B39: 9.2 | C39: =+A39*$D$7 -> 66.451700000000017 | D39: =+B39*$D$7 -> 14.8028 | F39: L onto Orville Rd E. at four way stop at Kapowsin (services)
A40: =+A39+B40 -> 50.2 | B40: 8.9 | C40: =+A40*$D$7 -> 80.771800000000013 | D40: =+B40*$D$7 -> 14.3201 | F40: L onto SR-161
A41: =+A40+B41 -> 51.5 | B41: 1.3 | C41: =+A41*$D$7 -> 82.863500000000016 | D41: =+B41*$D$7 -> 2.0916999999999999 | F41: ST (at the light) Continue on SR 161 Eatonville (services)
A42: =+A41+B42 -> 51.5 | B42: 0.0 | C42: =+A42*$D$7 -> 82.863500000000016 | D42: =+B42*$D$7 -> 0.0 | F42: Follow truck route signs for SR-161 Towards Mt. Rainer and Alder
A43: =+A42+B43 -> 54.5 | B43: 3.0 | C43: =+A43*$D$7 -> 87.690500000000014 | D43: =+B43*$D$7 -> 4.827 | F43: L onto SR-7 a "T" intersection
A44: =+A43+B44 -> 54.8 | B44: 00.3 | C44: =+A44*$D$7 -> 88.173200000000008 | D44: =+B44*$D$7 -> 0.48269999999999996 | F44: Pack Experimental Forest Entrance Restrooms/water
A45: =+A44+B45 -> 64.5 | B45: 9.7 | C45: =+A45*$D$7 -> 103.7805 | D45: =+B45*$D$7 -> 15.607299999999999 | F45: BL onto SR-706 at Elbe (services)
A46: =+A45+B46 -> 72.7 | B46: 8.2 | C46: =+A46*$D$7 -> 116.9743 | D46: =+B46*$D$7 -> 13.1938 | F46: Ashford (services) continue on SR-706
A47: =+A46+B47 -> 74.7 | B47: 2.0 | C47: =+A47*$D$7 -> 120.1923 | D47: =+B47*$D$7 -> 3.218 | F47: R onto USFS Rd 52 towards Packwood (Skate Creek Rd)
A48: =+A47+B48 -> 86.0 | B48: 11.3 | C48: =+A48*$D$7 -> 138.374 | D48: =+B48*$D$7 -> 18.181699999999999 | F48: Skate Creek Summit
A49: =+A48+B49 -> 97.3 | B49: 11.3 | C49: =+A49*$D$7 -> 156.5557 | D49: =+B49*$D$7 -> 18.181699999999999 | E49: #3 | F49: Packwood Texaco
A50: =+A49+B50 -> 97.3 | B50: 0.0 | C50: =+A50*$D$7 -> 156.5557 | D50: =+B50*$D$7 -> 0.0 | F50: R out of the Texaco
A51: =+A50+B51 -> 97.4 | B51: 00.1 | C51: =+A51*$D$7 -> 156.71659999999997 | D51: =+B51*$D$7 -> 0.16090000000000002 | F51: R onto US-12 (West)
A52: =+A51+B52 -> 113.6 | B52: 16.2 | C52: =+A52*$D$7 -> 182.7824 | D52: =+B52*$D$7 -> 26.065799999999999 | F52: Randle (services)
A53: =+A52+B53 -> 113.6 | B53: 0.0 | C53: =+A53*$D$7 -> 182.7824 | D53: =+B53*$D$7 -> 0.0 | F53: L onto SR-131 (USFS 25/23) towards Mount St. Helens Nat'l Monument
A54: =+A53+B54 -> 114.6 | B54: 1.0 | C54: =+A54*$D$7 -> 184.39139999999998 | D54: =+B54*$D$7 -> 1.609 | F54: BR onto USFS 25
A55: =+A54+B55 -> 115.3 | B55: 00.7 | C55: =+A55*$D$7 -> 185.51769999999999 | D55: =+B55*$D$7 -> 1.1262999999999999 | F55: ST continue up USFS 25
A56: =+A55+B56 -> 123.6 | B56: 8.3 | C56: =+A56*$D$7 -> 198.8724 | D56: =+B56*$D$7 -> 13.354700000000001 | F56: BL onto USFS 25
A57: =+A56+B57 -> 124.7 | B57: 1.1 | C57: =+A57*$D$7 -> 200.64229999999998 | D57: =+B57*$D$7 -> 1.7699 | F57: Iron Creek Picnic Area (water) Continue on USFS 25
A58: =+A57+B58 -> 134.6 | B58: 9.9 | C58: =+A58*$D$7 -> 216.57139999999998 | D58: =+B58*$D$7 -> 15.9291 | F58: R onto USFS 99
A59: =+A58+B59 -> 139.1 | B59: 4.5 | C59: =+A59*$D$7 -> 223.81189999999998 | D59: =+B59*$D$7 -> 7.2404999999999999 | F59: Bear Meadow Interpretive Center (high point)
A60: =+A59+B60 -> 144.1 | B60: 5.0 | C60: =+A60*$D$7 -> 231.8569 | D60: =+B60*$D$7 -> 8.0449999999999999 | F60: BL at Meta Lake Continue on USFS 99 ( towards Windy Ridge)
A61: =+A60+B61 -> 145.6 | B61: 1.5 | C61: =+A61*$D$7 -> 234.2704 | D61: =+B61*$D$7 -> 2.4135 | F61: Cascade Viewpoint Store/Water/Bathrooms Continue on USFS 99
A62: =+A61+B62 -> 151.1 | B62: 5.5 | C62: =+A62*$D$7 -> 243.1199 | D62: =+B62*$D$7 -> 8.849499999999999 | E62: #4 | F62: Windy Ridge
A63: =+A62+B63 -> 151.1 | B63: 0.0 | C63: =+A63*$D$7 -> 243.1199 | D63: =+B63*$D$7 -> 0.0 | F63: Turn around return on USFS 99
A64: =+A63+B64 -> 158.1 | B64: 7.0 | C64: =+A64*$D$7 -> 254.38289999999998 | D64: =+B64*$D$7 -> 11.263 | F64: BR to stay on USFS 99 USFS 26 is CLOSED FOR REPAIRS
A65: =+A64+B65 -> 163.1 | B65: 5.0 | C65: =+A65*$D$7 -> 262.42789999999997 | D65: =+B65*$D$7 -> 8.0449999999999999 | F65: Bear Meadow Interpretive Center (high point)
A66: =+A65+B66 -> 167.6 | B66: 4.5 | C66: =+A66*$D$7 -> 269.66839999999996 | D66: =+B66*$D$7 -> 7.2404999999999999 | F66: L onto USFS 25
A67: =+A66+B67 -> 177.5 | B67: 9.9 | C67: =+A67*$D$7 -> 285.59750000000003 | D67: =+B67*$D$7 -> 15.9291 | F67: Iron Creek Picnic Area (water) Continue on USFS 25
A68: =+A67+B68 -> 178.6 | B68: 1.1 | C68: =+A68*$D$7 -> 287.36739999999998 | D68: =+B68*$D$7 -> 1.7699 | F68: BR onto USFS 25
A69: =+A68+B69 -> 187.6 | B69: 9.0 | C69: =+A69*$D$7 -> 301.84839999999997 | D69: =+B69*$D$7 -> 14.481 | F69: BL onto SR-131 (USFS 25/23) towards Randle
A70: =+A69+B70 -> 188.6 | B70: 1.0 | C70: =+A70*$D$7 -> 303.45740000000001 | D70: =+B70*$D$7 -> 1.609 | F70: R onto US-12 (East) Randle (services)
A71: =+A70+B71 -> 204.8 | B71: 16.2 | C71: =+A71*$D$7 -> 329.52319999999997 | D71: =+B71*$D$7 -> 26.065799999999999 | F71: Packwood (services) Continue on US -12 East
A72: =+A71+B72 -> 212.6 | B72: 7.8 | C72: =+A72*$D$7 -> 342.07339999999999 | D72: =+B72*$D$7 -> 12.5502 | F72: BR continue on US-12 (East)
A73: =+A72+B73 -> 225.6 | B73: 13.0 | C73: =+A73*$D$7 -> 362.99039999999997 | D73: =+B73*$D$7 -> 20.917000000000002 | F73: White Pass (Services only until 9:00pm) Cont. US-12 East
A74: =+A73+B74 -> 238.6 | B74: 13.0 | C74: =+A74*$D$7 -> 383.9074 | D74: =+B74*$D$7 -> 20.917000000000002 | F74: Rimrock (Services only until 9:00pm) Cont. US-12 East
A75: =+A74+B75 -> 259.6 | B75: 21.0 | C75: =+A75*$D$7 -> 417.69640000000004 | D75: =+B75*$D$7 -> 33.789000000000001 | F75: R to continue on US-12 (East towards Yakima)
A76: =+A75+B76 -> 264.1 | B76: 4.5 | C76: =+A76*$D$7 -> 424.93690000000004 | D76: =+B76*$D$7 -> 7.2404999999999999 | F76: L onto Naches Ave at the light
A77: =+A76+B77 -> 264.3 | B77: 00.2 | C77: =+A77*$D$7 -> 425.25870000000003 | D77: =+B77*$D$7 -> 0.32180000000000003 | E77: #5 | F77: Naches Hotel, Naches, WA
A78: =+A77+B78 -> 264.3 | B78: 0.0 | C78: =+A78*$D$7 -> 425.25870000000003 | D78: =+B78*$D$7 -> 0.0 | F78: Turn around
A79: =+A78+B79 -> 264.5 | B79: 00.2 | C79: =+A79*$D$7 -> 425.58049999999997 | D79: =+B79*$D$7 -> 0.32180000000000003 | F79: R onto US-12 (West)
A80: =+A79+B80 -> 269.0 | B80: 4.5 | C80: =+A80*$D$7 -> 432.82099999999997 | D80: =+B80*$D$7 -> 7.2404999999999999 | F80: BR onto SR-410 (west) towards Chinook Pass
A81: =+A80+B81 -> 283.3 | B81: 14.3 | C81: =+A81*$D$7 -> 455.8297 | D81: =+B81*$D$7 -> 23.008700000000001 | F81: Squaw Creek Resort (Resturant/Store open 6am to 9pm) cont. 410 west
A82: =+A81+B82 -> 289.1 | B82: 5.8 | C82: =+A82*$D$7 -> 465.16190000000006 | D82: =+B82*$D$7 -> 9.3322000000000003 | F82: Cliffdell (Services from 6am to 10pm) last Services 52 miles
A83: =+A82+B83 -> 316.1 | B83: 27.0 | C83: =+A83*$D$7 -> 508.60490000000004 | D83: =+B83*$D$7 -> 43.442999999999998 | F83: Chinook Pass (elev 5430')
A84: =+A83+B84 -> 319.5 | B84: 3.4 | C84: =+A84*$D$7 -> 514.07550000000003 | D84: =+B84*$D$7 -> 5.4706000000000001 | F84: BR to stay on SR-410 at Cayuse Pass (elev 4675')
A85: =+A84+B85 -> 343.8 | B85: 24.3 | C85: =+A85*$D$7 -> 553.17420000000004 | D85: =+B85*$D$7 -> 39.098700000000001 | F85: Federation Forest State Park (water/restrooms) cont. 410 west
A86: =+A85+B86 -> 359.5 | B86: 15.7 | C86: =+A86*$D$7 -> 578.43550000000005 | D86: =+B86*$D$7 -> 25.261299999999999 | F86: ST SR-410 becomes Roosevelt Ave E.
A87: =+A86+B87 -> 359.5 | B87: 0.0 | C87: =+A87*$D$7 -> 578.43550000000005 | D87: =+B87*$D$7 -> 0.0 | F87: Enumclaw (services)
A88: =+A87+B88 -> 360.4 | B88: 00.9 | C88: =+A88*$D$7 -> 579.8836 | D88: =+B88*$D$7 -> 1.4480999999999999 | F88: BR onto Griffin Ave (SR-164)
A89: =+A88+B89 -> 362.1 | B89: 1.7 | C89: =+A89*$D$7 -> 582.61889999999994 | D89: =+B89*$D$7 -> 2.7353000000000001 | F89: Continue Griffin Ave becomes SE 436th Way
A90: =+A89+B90 -> 362.8 | B90: 00.7 | C90: =+A90*$D$7 -> 583.74519999999995 | D90: =+B90*$D$7 -> 1.1262999999999999 | F90: R onto 236th Ave SE
A91: =+A90+B91 -> 366.0 | B91: 3.2 | C91: =+A91*$D$7 -> 588.89399999999989 | D91: =+B91*$D$7 -> 5.1488000000000005 | F91: L onto SE 384th St
A92: =+A91+B92 -> 366.0 | B92: 0.0 | C92: =+A92*$D$7 -> 588.89399999999989 | D92: =+B92*$D$7 -> 0.0 | F92: BR onto 236th Ave SE
A93: =+A92+B93 -> 367.0 | B93: 1.0 | C93: =+A93*$D$7 -> 590.50299999999993 | D93: =+B93*$D$7 -> 1.609 | F93: BL onto SE 368th St (also Whitney Hill Rd)
A94: =+A93+B94 -> 368.4 | B94: 1.4 | C94: =+A94*$D$7 -> 592.75559999999984 | D94: =+B94*$D$7 -> 2.2525999999999997 | F94: at "T" R onto 212th Way SE
A95: =+A94+B95 -> 369.0 | B95: 00.6 | C95: =+A95*$D$7 -> 593.72099999999989 | D95: =+B95*$D$7 -> 0.96539999999999992 | F95: X Green River
A96: =+A95+B96 -> 369.1 | B96: 00.1 | C96: =+A96*$D$7 -> 593.88189999999997 | D96: =+B96*$D$7 -> 0.16090000000000002 | F96: ST continue 212th Way SE becomes 218th Ave SE X Green Valley Rd.
A97: =+A96+B97 -> 370.5 | B97: 1.4 | C97: =+A97*$D$7 -> 596.13449999999989 | D97: =+B97*$D$7 -> 2.2525999999999997 | F97: L onto Auburn-Black Diamond Rd
A98: =+A97+B98 -> 373.2 | B98: 2.7 | C98: =+A98*$D$7 -> 600.47879999999986 | D98: =+B98*$D$7 -> 4.3443000000000005 | F98: ST continue Auburn-Black Diamond Rd becomes Kent-Black Diamond
A99: =+A98+B99 -> 376.5 | B99: 3.3 | C99: =+A99*$D$7 -> 605.78849999999989 | D99: =+B99*$D$7 -> 5.3096999999999994 | F99: continue Kent-Black Diamond Rd becomes 152nd Ave SE
A100: =+A99+B100 -> 377.2 | B100: 00.7 | C100: =+A100*$D$7 -> 606.9147999999999 | D100: =+B100*$D$7 -> 1.1262999999999999 | F100: X Kent-Kangley Rd (SR-516)
A101: =+A100+B101 -> 377.5 | B101: 00.3 | C101: =+A101*$D$7 -> 607.39750000000004 | D101: =+B101*$D$7 -> 0.48269999999999996 | F101: continue 152nd ave SE becomes 148th ave SE
A102: =+A101+B102 -> 377.7 | B102: 00.2 | C102: =+A102*$D$7 -> 607.71929999999986 | D102: =+B102*$D$7 -> 0.32180000000000003 | F102: R onto Soos Creek Bike/Walk Trail
A103: =+A102+B103 -> 379.3 | B103: 1.6 | C103: =+A103*$D$7 -> 610.29369999999994 | D103: =+B103*$D$7 -> 2.5744000000000002 | F103: L onto SE 244th at Traffic Signal
A104: =+A103+B104 -> 379.6 | B104: 00.3 | C104: =+A104*$D$7 -> 610.77639999999997 | D104: =+B104*$D$7 -> 0.48269999999999996 | F104: BL onto SE240th St.
A105: =+A104+B105 -> 379.9 | B105: 00.3 | C105: =+A105*$D$7 -> 611.25909999999999 | D105: =+B105*$D$7 -> 0.48269999999999996 | F105: L onto144th Ave. SE
A106: =+A105+B106 -> 380.1 | B106: 00.2 | C106: =+A106*$D$7 -> 611.58089999999993 | D106: =+B106*$D$7 -> 0.32180000000000003 | E106: #6 | F106: Finish at 145th Ave SE and SE 243rd Pl