A1: Seattle Randonneurs 600 km Brevet
A2: I-5 Corrider
A4: Created By: | D4: John Wagner
A5: Verified By: | D5: John Wagner
A6: Year(s) Used: | D6: ???
A7: Conversion(Mi-Km) | D7: 1.609
A9: Miles | C9: Km
A10: Total | B10: Leg | C10: Total | D10: Leg | E10: Ctrl | F10: Instructions
A11: 0.0 | B11: 0.0 | C11: =+A11*$D$7 -> 0.0 | D11: =+B11*$D$7 -> 0.0 | E11: #1 | F11: L onto 75th Ave NW
A12: =+A11+B12 -> 0.16200000000000003 | B12: 0.16200000000000003 | C12: =+A12*$D$7 -> 0.26065800000000006 | D12: =+B12*$D$7 -> 0.26065800000000006 | F12: R onto 28th St NW
A13: =+A12+B13 -> 1.782 | B13: 1.62 | C13: =+A13*$D$7 -> 2.867238 | D13: =+B13*$D$7 -> 2.6065800000000001 | F13: L onto Market St
A14: =+A13+B14 -> 2.1059999999999999 | B14: 0.32400000000000007 | C14: =+A14*$D$7 -> 3.3885539999999996 | D14: =+B14*$D$7 -> 0.52131600000000011 | F14: R onto Shilshole Ave NW
A15: =+A14+B15 -> 3.24 | B15: 1.1339999999999999 | C15: =+A15*$D$7 -> 5.2131599999999993 | D15: =+B15*$D$7 -> 1.8246059999999997 | F15: BL onto NW 46th St
A16: =+A15+B16 -> 4.05 | B16: 00.81 | C16: =+A16*$D$7 -> 6.5164499999999999 | D16: =+B16*$D$7 -> 1.3032900000000001 | F16: R onto Leary Way NW
A17: =+A16+B17 -> 5.9939999999999998 | B17: 1.944 | C17: =+A17*$D$7 -> 9.6443459999999988 | D17: =+B17*$D$7 -> 3.1278959999999998 | F17: ST x - onto 35th St
A18: =+A17+B18 -> 6.1559999999999997 | B18: 0.16200000000000003 | C18: =+A18*$D$7 -> 9.9050039999999999 | D18: =+B18*$D$7 -> 0.26065800000000006 | F18: R onto Aurora (under bridge)
A19: =+A18+B19 -> 6.3179999999999996 | B19: 0.16200000000000003 | C19: =+A19*$D$7 -> 10.165661999999999 | D19: =+B19*$D$7 -> 0.26065800000000006 | F19: L onto 34th St
A20: =+A19+B20 -> 6.6419999999999995 | B20: 0.32400000000000007 | C20: =+A20*$D$7 -> 10.686978 | D20: =+B20*$D$7 -> 0.52131600000000011 | F20: R onto Stone Way (Northlake)
A21: =+A20+B21 -> 8.7479999999999993 | B21: 2.1060000000000003 | C21: =+A21*$D$7 -> 14.075531999999999 | D21: =+B21*$D$7 -> 3.3885540000000005 | F21: R onto Pacific St
A22: =+A21+B22 -> 10.206 | B22: 1.4580000000000002 | C22: =+A22*$D$7 -> 16.421454000000001 | D22: =+B22*$D$7 -> 2.3459220000000003 | F22: R onto Montlake Blv NE
A23: =+A22+B23 -> 10.853999999999999 | B23: 0.64800000000000013 | C23: =+A23*$D$7 -> 17.464085999999998 | D23: =+B23*$D$7 -> 1.0426320000000002 | F23: L onto Lake Washigton Blv
A24: =+A23+B24 -> 11.825999999999999 | B24: 0.97199999999999998 | C24: =+A24*$D$7 -> 19.028033999999998 | D24: =+B24*$D$7 -> 1.5639479999999999 | F24: BR stay on Lk Wash Blv (LWB)
A25: =+A24+B25 -> 13.607999999999999 | B25: 1.7820000000000003 | C25: =+A25*$D$7 -> 21.895271999999999 | D25: =+B25*$D$7 -> 2.8672380000000004 | F25: ST x - Madison, stay on LWB
A26: =+A25+B26 -> 14.417999999999999 | B26: 00.81 | C26: =+A26*$D$7 -> 23.198561999999999 | D26: =+B26*$D$7 -> 1.3032900000000001 | F26: BR stay on LWB
A27: =+A26+B27 -> 14.741999999999999 | B27: 0.32400000000000007 | C27: =+A27*$D$7 -> 23.719877999999998 | D27: =+B27*$D$7 -> 0.52131600000000011 | F27: ST x - Gilvra, stay on LWB
A28: =+A27+B28 -> 15.875999999999999 | B28: 1.1339999999999999 | C28: =+A28*$D$7 -> 25.544484000000001 | D28: =+B28*$D$7 -> 1.8246059999999997 | F28: ST x - Madrona Dr, stay on LWB
A29: =+A28+B29 -> 24.137999999999998 | B29: 8.2620000000000005 | C29: =+A29*$D$7 -> 38.838041999999994 | D29: =+B29*$D$7 -> 13.293558000000001 | F29: R onto Juneu St
A30: =+A29+B30 -> 24.3 | B30: 0.16200000000000003 | C30: =+A30*$D$7 -> 39.098699999999994 | D30: =+B30*$D$7 -> 0.26065800000000006 | F30: L onto Seward Park Ave S
A31: =+A30+B31 -> 24.947999999999997 | B31: 0.64800000000000013 | C31: =+A31*$D$7 -> 40.141331999999991 | D31: =+B31*$D$7 -> 1.0426320000000002 | F31: L stay on Lake Wash Blv
A32: =+A31+B32 -> 28.025999999999996 | B32: 3.0779999999999998 | C32: =+A32*$D$7 -> 45.093833999999994 | D32: =+B32*$D$7 -> 4.952502 | F32: L onto Rainier Ave S
A33: =+A32+B33 -> 33.857999999999997 | B33: 5.8320000000000007 | C33: =+A33*$D$7 -> 54.477521999999993 | D33: =+B33*$D$7 -> 9.3836880000000011 | F33: R onto Nelson Pl (bike route)
A34: =+A33+B34 -> 34.181999999999995 | B34: 0.32400000000000007 | C34: =+A34*$D$7 -> 54.998837999999992 | D34: =+B34*$D$7 -> 0.52131600000000011 | F34: R onto Renton Ave
A35: =+A34+B35 -> 34.505999999999993 | B35: 0.32400000000000007 | C35: =+A35*$D$7 -> 55.520153999999991 | D35: =+B35*$D$7 -> 0.52131600000000011 | F35: L onto Hardie Ave Sw
A36: =+A35+B36 -> 34.83 | B36: 0.32400000000000007 | C36: =+A36*$D$7 -> 56.041469999999983 | D36: =+B36*$D$7 -> 0.52131600000000011 | F36: X Sunset (stay on Hardie)
A37: =+A36+B37 -> 35.64 | B37: 00.81 | C37: =+A37*$D$7 -> 57.344759999999987 | D37: =+B37*$D$7 -> 1.3032900000000001 | F37: R onto SW 7th st
A38: =+A37+B38 -> 37.097999999999992 | B38: 1.4580000000000002 | C38: =+A38*$D$7 -> 59.690681999999988 | D38: =+B38*$D$7 -> 2.3459220000000003 | F38: L onto Oaks dale Ave SW
A39: =+A38+B39 -> 37.583999999999989 | B39: 0.48599999999999999 | C39: =+A39*$D$7 -> 60.472655999999979 | D39: =+B39*$D$7 -> 0.78197399999999995 | F39: R onto Grady Way
A40: =+A39+B40 -> 38.717999999999989 | B40: 1.1339999999999999 | C40: =+A40*$D$7 -> 62.297261999999982 | D40: =+B40*$D$7 -> 1.8246059999999997 | F40: L onto Interurban/W. Valley Hwy (SR 181)
A41: =+A40+B41 -> 69.49799999999999 | B41: 30.78 | C41: =+A41*$D$7 -> 111.82228199999999 | D41: =+B41*$D$7 -> 49.525020000000005 | F41: R onto Valley Ave (after x tracks)
A42: =+A41+B42 -> 72.09 | B42: 2.5920000000000005 | C42: =+A42*$D$7 -> 115.99280999999998 | D42: =+B42*$D$7 -> 4.1705280000000009 | F42: L onto Milwaukee Ave E
A43: =+A42+B43 -> 74.195999999999984 | B43: 2.1060000000000003 | C43: =+A43*$D$7 -> 119.38136399999998 | D43: =+B43*$D$7 -> 3.3885540000000005 | F43: R onto Pioneer Ave SW
A44: =+A43+B44 -> 79.703999999999979 | B44: 5.508 | C44: =+A44*$D$7 -> 128.24373599999996 | D44: =+B44*$D$7 -> 8.8623720000000006 | F44: L onto Canyon Rd ** BP Food Mart - Puyallup
A45: =+A44+B45 -> 89.585999999999984 | B45: 9.8819999999999997 | C45: =+A45*$D$7 -> 144.14387399999998 | D45: =+B45*$D$7 -> 15.900138 | F45: R onto Military Rd
A46: =+A45+B46 -> 90.881999999999991 | B46: 1.2960000000000003 | C46: =+A46*$D$7 -> 146.22913799999998 | D46: =+B46*$D$7 -> 2.0852640000000005 | F46: Bl stay on Military Rd
A47: =+A46+B47 -> 94.77 | B47: 3.8879999999999999 | C47: =+A47*$D$7 -> 152.48492999999999 | D47: =+B47*$D$7 -> 6.2557919999999996 | F47: ST turns into 160th St
A48: =+A47+B48 -> 95.74199999999999 | B48: 0.97199999999999998 | C48: =+A48*$D$7 -> 154.04887799999997 | D48: =+B48*$D$7 -> 1.5639479999999999 | F48: L onto Pacific Ave (SR 7)
A49: =+A48+B49 -> 98.981999999999985 | B49: 3.24 | C49: =+A49*$D$7 -> 159.26203799999996 | D49: =+B49*$D$7 -> 5.2131600000000002 | F49: BR onto SR 507 (Pacific Ave S
A50: =+A49+B50 -> 124.25399999999999 | B50: 25.272000000000002 | C50: =+A50*$D$7 -> 199.92468599999998 | D50: =+B50*$D$7 -> 40.662648000000004 | F50: L onto First St/SR 507
A51: =+A50+B51 -> 147.25799999999998 | B51: 23.004000000000001 | C51: =+A51*$D$7 -> 236.93812199999996 | D51: =+B51*$D$7 -> 37.013435999999999 | F51: ** Jack Pot Gas On Left
A52: =+A51+B52 -> 148.39199999999997 | B52: 1.1339999999999999 | C52: =+A52*$D$7 -> 238.76272799999995 | D52: =+B52*$D$7 -> 1.8246059999999997 | F52: ST head to I-5
A53: =+A52+B53 -> 160.86599999999996 | B53: 12.474000000000002 | C53: =+A53*$D$7 -> 258.83339399999994 | D53: =+B53*$D$7 -> 20.070666000000003 | F53: ST cross I-5, turns into SR 12
A54: =+A53+B54 -> 201.85199999999998 | B54: 40.986000000000004 | C54: =+A54*$D$7 -> 324.77986799999996 | D54: =+B54*$D$7 -> 65.946474000000009 | F54: L - stay on 12 thru Aberdeen
A55: =+A54+B55 -> 243.97199999999998 | B55: 42.12 | C55: =+A55*$D$7 -> 392.55094799999995 | D55: =+B55*$D$7 -> 67.771079999999998 | F55: BR onto 101 N (Clinton St)
A56: =+A55+B56 -> 245.43 | B56: 1.4580000000000002 | C56: =+A56*$D$7 -> 394.89686999999998 | D56: =+B56*$D$7 -> 2.3459220000000003 | F56: L stay on 101 N
A57: =+A56+B57 -> 245.91599999999997 | B57: 0.48599999999999999 | C57: =+A57*$D$7 -> 395.67884399999997 | D57: =+B57*$D$7 -> 0.78197399999999995 | F57: ** Stoken Motel - N Hoquiam tel# 532-4300
A58: =+A57+B58 -> 307.476 | B58: 61.56 | C58: =+A58*$D$7 -> 494.72888399999999 | D58: =+B58*$D$7 -> 99.05004000000001 | F58: ** Brannions Groc Amanda Park
A59: =+A58+B59 -> 369.036 | B59: 61.56 | C59: =+A59*$D$7 -> 593.77892399999996 | D59: =+B59*$D$7 -> 99.05004000000001 | F59: ** Stoken Motel
A60: =+A59+B60 -> 369.52199999999999 | B60: 0.48599999999999999 | C60: =+A60*$D$7 -> 594.56089799999995 | D60: =+B60*$D$7 -> 0.78197399999999995 | F60: R stay on 101 S
A61: =+A60+B61 -> 370.98 | B61: 1.4580000000000002 | C61: =+A61*$D$7 -> 596.90682000000004 | D61: =+B61*$D$7 -> 2.3459220000000003 | F61: Turns into SR 12
A62: =+A61+B62 -> 413.1 | B62: 42.12 | C62: =+A62*$D$7 -> 664.67790000000002 | D62: =+B62*$D$7 -> 67.771079999999998 | F62: R - Stay on 12 (exit)
A63: =+A62+B63 -> 454.08600000000001 | B63: 40.986000000000004 | C63: =+A63*$D$7 -> 730.62437399999999 | D63: =+B63*$D$7 -> 65.946474000000009 | F63: ST cross I-5, turns into SR 507
A64: =+A63+B64 -> 466.56 | B64: 12.474000000000002 | C64: =+A64*$D$7 -> 750.69503999999995 | D64: =+B64*$D$7 -> 20.070666000000003 | F64: ST Stay on SR 507
A65: =+A64+B65 -> 467.69400000000002 | B65: 1.1339999999999999 | C65: =+A65*$D$7 -> 752.51964599999997 | D65: =+B65*$D$7 -> 1.8246059999999997 | F65: ** Jack Pot Gas On right
A66: =+A65+B66 -> 490.69800000000004 | B66: 23.004000000000001 | C66: =+A66*$D$7 -> 789.53308200000004 | D66: =+B66*$D$7 -> 37.013435999999999 | F66: R - stay on SR 507
A67: =+A66+B67 -> 515.97 | B67: 25.272000000000002 | C67: =+A67*$D$7 -> 830.19573000000003 | D67: =+B67*$D$7 -> 40.662648000000004 | F67: L onto Pacific Ave (SR 7)
A68: =+A67+B68 -> 519.21 | B68: 3.24 | C68: =+A68*$D$7 -> 835.40889000000004 | D68: =+B68*$D$7 -> 5.2131600000000002 | F68: R onto 160th St
A69: =+A68+B69 -> 520.18200000000002 | B69: 0.97199999999999998 | C69: =+A69*$D$7 -> 836.97283800000002 | D69: =+B69*$D$7 -> 1.5639479999999999 | F69: Turns into Military Rd
A70: =+A69+B70 -> 524.07 | B70: 3.8879999999999999 | C70: =+A70*$D$7 -> 843.22863000000007 | D70: =+B70*$D$7 -> 6.2557919999999996 | F70: BL onto Military Rd
A71: =+A70+B71 -> 525.3660000000001 | B71: 1.2960000000000003 | C71: =+A71*$D$7 -> 845.31389400000012 | D71: =+B71*$D$7 -> 2.0852640000000005 | F71: L onto Canyon Rd
A72: =+A71+B72 -> 535.24800000000005 | B72: 9.8819999999999997 | C72: =+A72*$D$7 -> 861.21403200000009 | D72: =+B72*$D$7 -> 15.900138 | F72: R onto Pioneer Ave SW** BP Food Mart - Puyallup
A73: =+A72+B73 -> 540.75600000000009 | B73: 5.508 | C73: =+A73*$D$7 -> 870.07640400000014 | D73: =+B73*$D$7 -> 8.8623720000000006 | F73: L onto Milwaukee Ave E
A74: =+A73+B74 -> 542.86200000000008 | B74: 2.1060000000000003 | C74: =+A74*$D$7 -> 873.46495800000014 | D74: =+B74*$D$7 -> 3.3885540000000005 | F74: R onto Valley Ave
A75: =+A74+B75 -> 545.45400000000006 | B75: 2.5920000000000005 | C75: =+A75*$D$7 -> 877.63548600000013 | D75: =+B75*$D$7 -> 4.1705280000000009 | F75: L onto W. Valley Hwy (SR 181)(x tracks)
A76: =+A75+B76 -> 576.23400000000004 | B76: 30.78 | C76: =+A76*$D$7 -> 927.16050600000005 | D76: =+B76*$D$7 -> 49.525020000000005 | F76: R onto Grady Way
A77: =+A76+B77 -> 577.36800000000005 | B77: 1.1339999999999999 | C77: =+A77*$D$7 -> 928.98511200000007 | D77: =+B77*$D$7 -> 1.8246059999999997 | F77: L onto Oaks dale Ave SW
A78: =+A77+B78 -> 577.85400000000004 | B78: 0.48599999999999999 | C78: =+A78*$D$7 -> 929.76708600000006 | D78: =+B78*$D$7 -> 0.78197399999999995 | F78: R onto SW 7th st
A79: =+A78+B79 -> 579.31200000000001 | B79: 1.4580000000000002 | C79: =+A79*$D$7 -> 932.11300800000004 | D79: =+B79*$D$7 -> 2.3459220000000003 | F79: L onto Hardie Ave SW
A80: =+A79+B80 -> 580.12199999999996 | B80: 00.81 | C80: =+A80*$D$7 -> 933.41629799999987 | D80: =+B80*$D$7 -> 1.3032900000000001 | F80: X Sunset (stay Hardie)
A81: =+A80+B81 -> 580.44599999999991 | B81: 0.32400000000000007 | C81: =+A81*$D$7 -> 933.93761399999983 | D81: =+B81*$D$7 -> 0.52131600000000011 | F81: R onto Renton Ave
A82: =+A81+B82 -> 580.77 | B82: 0.32400000000000007 | C82: =+A82*$D$7 -> 934.45892999999978 | D82: =+B82*$D$7 -> 0.52131600000000011 | F82: L onto Rainier Ave S
A83: =+A82+B83 -> 586.7639999999999 | B83: 5.9940000000000007 | C83: =+A83*$D$7 -> 944.10327599999982 | D83: =+B83*$D$7 -> 9.6443460000000005 | F83: R onto Seward Park Ave S
A84: =+A83+B84 -> 589.84199999999987 | B84: 3.0779999999999998 | C84: =+A84*$D$7 -> 949.0557779999998 | D84: =+B84*$D$7 -> 4.952502 | F84: R onto Juneu St
A85: =+A84+B85 -> 590.00399999999991 | B85: 0.16200000000000003 | C85: =+A85*$D$7 -> 949.31643599999984 | D85: =+B85*$D$7 -> 0.26065800000000006 | F85: R onto Lake Wash Blv
A86: =+A85+B86 -> 603.2879999999999 | B86: 13.283999999999999 | C86: =+A86*$D$7 -> 970.69039199999986 | D86: =+B86*$D$7 -> 21.373956 | F86: R onto Montlake Blv NE
A87: =+A86+B87 -> 604.26 | B87: 0.97199999999999998 | C87: =+A87*$D$7 -> 972.25433999999984 | D87: =+B87*$D$7 -> 1.5639479999999999 | F87: L onto Pacific St
A88: =+A87+B88 -> 604.9079999999999 | B88: 0.64800000000000013 | C88: =+A88*$D$7 -> 973.29697199999987 | D88: =+B88*$D$7 -> 1.0426320000000002 | F88: BL onto Northlake Way
A89: =+A88+B89 -> 607.0139999999999 | B89: 2.1060000000000003 | C89: =+A89*$D$7 -> 976.68552599999987 | D89: =+B89*$D$7 -> 3.3885540000000005 | F89: L onto 34th St
A90: =+A89+B90 -> 607.33799999999985 | B90: 0.32400000000000007 | C90: =+A90*$D$7 -> 977.20684199999971 | D90: =+B90*$D$7 -> 0.52131600000000011 | F90: R onto Leary Way NW
A91: =+A90+B91 -> 609.28199999999981 | B91: 1.944 | C91: =+A91*$D$7 -> 980.33473799999967 | D91: =+B91*$D$7 -> 3.1278959999999998 | F91: L onto NW 46th St
A92: =+A91+B92 -> 610.09199999999976 | B92: 00.81 | C92: =+A92*$D$7 -> 981.63802799999962 | D92: =+B92*$D$7 -> 1.3032900000000001 | F92: BR onto Shilshole Ave NW
A93: =+A92+B93 -> 611.22599999999977 | B93: 1.1339999999999999 | C93: =+A93*$D$7 -> 983.46263399999964 | D93: =+B93*$D$7 -> 1.8246059999999997 | F93: L onto Market St
A94: =+A93+B94 -> 611.55 | B94: 0.32400000000000007 | C94: =+A94*$D$7 -> 983.9839499999996 | D94: =+B94*$D$7 -> 0.52131600000000011 | F94: R onto 28th St NW
A95: =+A94+B95 -> 613.17 | B95: 1.62 | C95: =+A95*$D$7 -> 986.5905299999996 | D95: =+B95*$D$7 -> 2.6065800000000001 | F95: L onto 75th Ave NW
A96: =+A95+B96 -> 613.33199999999977 | B96: 0.16200000000000003 | C96: =+A96*$D$7 -> 986.85118799999964 | D96: =+B96*$D$7 -> 0.26065800000000006 | F96: 7503 29th Ave NW 782-8965