A1: Seattle Randonneurs 600 km Brevet
A2: Duvall, Rainy Pass, Bellingham
A4: Created By: | D4: Terry Zmrhal
A5: Verified By: | D5: Terry Zmrhal
A6: Year(s) Used: | D6: 1998.0
A7: Conversion(Mi-Km) | D7: 1.609
A9: Miles | C9: Km
A10: Total | B10: Leg | C10: Total | D10: Leg | E10: Ctrl | F10: Instructions
A11: 0.0 | B11: 0.0 | C11: =+A11*$D$7 -> 0.0 | D11: =+B11*$D$7 -> 0.0 | E11: #1 | F11: L from 23441 NE 140th St
A12: =+A11+B12 -> 0.0 | B12: 0.0 | C12: =+A12*$D$7 -> 0.0 | D12: =+B12*$D$7 -> 0.0 | F12: R - 232nd (T-Int)
A13: =+A12+B13 -> 2.1 | B13: 2.1 | C13: =+A13*$D$7 -> 3.3789000000000002 | D13: =+B13*$D$7 -> 3.3789000000000002 | F13: L - Old Woodinville-Duvall Rd (SS T-Int)
A14: =+A13+B14 -> 3.0 | B14: 00.9 | C14: =+A14*$D$7 -> 4.827 | D14: =+B14*$D$7 -> 1.4480999999999999 | F14: L - Woodinville-Duvall Rd (SS)
A15: =+A14+B15 -> 4.4 | B15: 1.4 | C15: =+A15*$D$7 -> 7.0796000000000001 | D15: =+B15*$D$7 -> 2.2525999999999997 | F15: R - Paradise Lake Rd (TL)
A16: =+A15+B16 -> 9.1 | B16: 4.7 | C16: =+A16*$D$7 -> 14.641900000000001 | D16: =+B16*$D$7 -> 7.5623000000000005 | F16: St across Hwy 522 (TL)
A17: =+A16+B17 -> 9.1 | B17: 0.0 | C17: =+A17*$D$7 -> 14.641900000000001 | D17: =+B17*$D$7 -> 0.0 | F17: R - Yew Way
A18: =+A17+B18 -> 9.3 | B18: 00.2 | C18: =+A18*$D$7 -> 14.963700000000001 | D18: =+B18*$D$7 -> 0.32180000000000003 | F18: St at Stop Sign (Yew Way)
A19: =+A18+B19 -> 9.6 | B19: 00.3 | C19: =+A19*$D$7 -> 15.446400000000002 | D19: =+B19*$D$7 -> 0.48269999999999996 | F19: VL over RR onto Broadway Av
A20: =+A19+B20 -> 14.7 | B20: 5.1 | C20: =+A20*$D$7 -> 23.6523 | D20: =+B20*$D$7 -> 8.2058999999999997 | F20: R - Hwy 9 (TL)
A21: =+A20+B21 -> 25.3 | B21: 10.6 | C21: =+A21*$D$7 -> 40.707700000000003 | D21: =+B21*$D$7 -> 17.055399999999999 | F21: R - Highway 92 (TL)
A22: =+A21+B22 -> 30.9 | B22: 5.6 | C22: =+A22*$D$7 -> 49.7181 | D22: =+B22*$D$7 -> 9.0103999999999989 | F22: L - 161 Ave. NE
A23: =+A22+B23 -> 31.2 | B23: 0.29999999999999716 | C23: =+A23*$D$7 -> 50.200799999999994 | D23: =+B23*$D$7 -> 0.48269999999999541 | F23: L - 163rd Ave. NE
A24: =+A23+B24 -> 32.3 | B24: 1.1 | C24: =+A24*$D$7 -> 51.970699999999994 | D24: =+B24*$D$7 -> 1.7699 | F24: L - Burn Road (SS T-Int)
A25: =+A24+B25 -> 33.6 | B25: 1.3 | C25: =+A25*$D$7 -> 54.06239999999999 | D25: =+B25*$D$7 -> 2.0916999999999999 | F25: L - 116 th NE
A26: =+A25+B26 -> 39.7 | B26: 6.1 | C26: =+A26*$D$7 -> 63.877299999999991 | D26: =+B26*$D$7 -> 9.8148999999999997 | F26: R - Kellogg / Sisco Hights Road (Arlington)
A27: =+A26+B27 -> 41.7 | B27: 2.0 | C27: =+A27*$D$7 -> 67.095299999999995 | D27: =+B27*$D$7 -> 3.218 | F27: L - Highland Drive
A28: =+A27+B28 -> 41.9 | B28: 0.20000000000000284 | C28: =+A28*$D$7 -> 67.417099999999991 | D28: =+B28*$D$7 -> 0.32180000000000458 | F28: R - S. French
A29: =+A28+B29 -> 42.4 | B29: 0.5 | C29: =+A29*$D$7 -> 68.221599999999995 | D29: =+B29*$D$7 -> 0.80449999999999999 | F29: L - Third
A30: =+A29+B30 -> 42.6 | B30: 0.19999999999999929 | C30: =+A30*$D$7 -> 68.543399999999991 | D30: =+B30*$D$7 -> 0.32179999999999886 | F30: R - N. Olympic
A31: =+A30+B31 -> 42.8 | B31: 0.19999999999999929 | C31: =+A31*$D$7 -> 68.865200000000002 | D31: =+B31*$D$7 -> 0.32179999999999886 | F31: R - Division
A32: =+A31+B32 -> 42.9 | B32: 0.10000000000000142 | C32: =+A32*$D$7 -> 69.0261 | D32: =+B32*$D$7 -> 0.16090000000000229 | F32: L - Broadway
A33: =+A32+B33 -> 43.0 | B33: 9.9999999999997868E-2 | C33: =+A33*$D$7 -> 69.186999999999998 | D33: =+B33*$D$7 -> 0.16089999999999657 | F33: Thrifty Foods
A34: =+A33+B34 -> 43.0 | C34: =+A34*$D$7 -> 69.186999999999998 | D34: =+B34*$D$7 -> 0.0 | E34: #2 | F34: ARLINGTON
A35: =+A34+B35 -> 43.0 | B35: 0.0 | C35: =+A35*$D$7 -> 69.186999999999998 | D35: =+B35*$D$7 -> 0.0 | F35: R - East on 530
A36: =+A35+B36 -> 71.0 | B36: 28.0 | C36: =+A36*$D$7 -> 114.239 | D36: =+B36*$D$7 -> 45.052 | F36: L - Hwy 530, Darrington (SS)
A37: =+A36+B37 -> 89.0 | B37: 18.0 | C37: =+A37*$D$7 -> 143.20099999999999 | D37: =+B37*$D$7 -> 28.962 | F37: R - Hwy 2, Rockport (SS T-Int)
A38: =+A37+B38 -> 89.0 | C38: =+A38*$D$7 -> 143.20099999999999 | D38: =+B38*$D$7 -> 0.0 | E38: #3 | F38: ROCKPORT
A39: =+A38+B39 -> 146.0 | B39: 57.0 | C39: =+A39*$D$7 -> 234.91399999999999 | D39: =+B39*$D$7 -> 91.712999999999994 | F39: U-turn - Top of Rainy Pass
A40: =+A39+B40 -> 146.0 | C40: =+A40*$D$7 -> 234.91399999999999 | D40: =+B40*$D$7 -> 0.0 | E40: #4 | F40: RAINY PASS
A41: =+A40+B41 -> 203.0 | B41: 57.0 | C41: =+A41*$D$7 -> 326.62700000000001 | D41: =+B41*$D$7 -> 91.712999999999994 | F41: St - Hwy 2, Rockport
A42: =+A41+B42 -> 203.0 | C42: =+A42*$D$7 -> 326.62700000000001 | D42: =+B42*$D$7 -> 0.0 | E42: #5 | F42: ROCKPORT
A43: =+A42+B43 -> 211.0 | B43: 8.0 | C43: =+A43*$D$7 -> 339.49900000000002 | D43: =+B43*$D$7 -> 12.872 | F43: Concrete
A44: =+A43+B44 -> 211.5 | B44: 0.5 | C44: =+A44*$D$7 -> 340.30349999999999 | D44: =+B44*$D$7 -> 0.80449999999999999 | F44: Hotel on Left - North Cascade Inn
A45: =+A44+B45 -> 235.0 | B45: 23.5 | C45: =+A45*$D$7 -> 378.11500000000001 | D45: =+B45*$D$7 -> 37.811500000000002 | F45: R - Hwy 9, Sedro Woolley
A46: =+A45+B46 -> 249.3 | B46: 14.3 | C46: =+A46*$D$7 -> 401.12370000000004 | D46: =+B46*$D$7 -> 23.008700000000001 | F46: St across rough RR on Hwy 9N
A47: =+A46+B47 -> 256.6 | B47: 7.3 | C47: =+A47*$D$7 -> 412.86940000000004 | D47: =+B47*$D$7 -> 11.745699999999999 | F47: St - Hwy 9, Nugents Corner
A48: =+A47+B48 -> 256.7 | B48: 00.1 | C48: =+A48*$D$7 -> 413.03030000000007 | D48: =+B48*$D$7 -> 0.16090000000000002 | F48: L/St - Hwy 542/Hwy 9
A49: =+A48+B49 -> 261.3 | B49: 4.6 | C49: =+A49*$D$7 -> 420.43170000000009 | D49: =+B49*$D$7 -> 7.4013999999999998 | F49: L/St - Hwy 542/Hwy 9
A50: =+A49+B50 -> 271.4 | B50: 10.1 | C50: =+A50*$D$7 -> 436.68260000000015 | D50: =+B50*$D$7 -> 16.250899999999998 | F50: ST @ TL onto Sunset Dr
A51: =+A50+B51 -> 271.4 | C51: =+A51*$D$7 -> 436.68260000000015 | D51: =+B51*$D$7 -> 0.0 | E51: #6 | F51: BELLINGHAM NORTH
A52: =+A51+B52 -> 271.4 | C52: =+A52*$D$7 -> 436.68260000000015 | D52: =+B52*$D$7 -> 0.0 | F52: 24Hr Chevron
A53: =+A52+B53 -> 272.2 | B53: 00.8 | C53: =+A53*$D$7 -> 437.96980000000013 | D53: =+B53*$D$7 -> 1.2872000000000001 | F53: ST @ Do No Enter Sign at Traffic Light for Illinois St.
A54: =+A53+B54 -> 272.5 | B54: 00.3 | C54: =+A54*$D$7 -> 438.45249999999999 | D54: =+B54*$D$7 -> 0.48269999999999996 | F54: BR onto Broadway
A55: =+A54+B55 -> 273.2 | B55: 00.7 | C55: =+A55*$D$7 -> 439.57880000000017 | D55: =+B55*$D$7 -> 1.1262999999999999 | F55: L - E & W Holly Sts (TL)
A56: =+A55+B56 -> 273.8 | B56: 00.6 | C56: =+A56*$D$7 -> 440.54420000000022 | D56: =+B56*$D$7 -> 0.96539999999999992 | F56: R - Bay St (TL)
A57: =+A56+B57 -> 273.9 | B57: 00.1 | C57: =+A57*$D$7 -> 440.70510000000024 | D57: =+B57*$D$7 -> 0.16090000000000002 | F57: L - Chestnut (T-int)
A58: =+A57+B58 -> 274.2 | B58: 00.3 | C58: =+A58*$D$7 -> 441.18780000000027 | D58: =+B58*$D$7 -> 0.48269999999999996 | F58: R - State St
A59: =+A58+B59 -> 276.6 | B59: 2.4 | C59: =+A59*$D$7 -> 445.04940000000022 | D59: =+B59*$D$7 -> 3.8615999999999997 | F59: becomes 12th Street
A60: =+A59+B60 -> 276.7 | B60: 00.1 | C60: =+A60*$D$7 -> 445.21030000000025 | D60: =+B60*$D$7 -> 0.16090000000000002 | F60: BL @ light to Chuckanut Dr
A61: =+A60+B61 -> 289.7 | B61: 13.0 | C61: =+A61*$D$7 -> 466.12730000000028 | D61: =+B61*$D$7 -> 20.917000000000002 | F61: R - Bayview-Edison Rd
A62: =+A61+B62 -> 291.1 | B62: 1.4 | C62: =+A62*$D$7 -> 468.37990000000019 | D62: =+B62*$D$7 -> 2.2525999999999997 | F62: R - Bayview-Edison Rd
A63: =+A62+B63 -> 292.7 | B63: 1.6 | C63: =+A63*$D$7 -> 470.95430000000027 | D63: =+B63*$D$7 -> 2.5744000000000002 | F63: L - Bayview-Edison Rd
A64: =+A63+B64 -> 300.8 | B64: 8.1 | C64: =+A64*$D$7 -> 483.98720000000031 | D64: =+B64*$D$7 -> 13.0329 | F64: ST @ TL at Hwy 20 onto Whitney-Laconner Rd
A65: =+A64+B65 -> 300.8 | C65: =+A65*$D$7 -> 483.98720000000031 | D65: =+B65*$D$7 -> 0.0 | E65: #7 | F65: 24hr TEXACO
A66: =+A65+B66 -> 304.8 | B66: 4.0 | C66: =+A66*$D$7 -> 490.42320000000029 | D66: =+B66*$D$7 -> 6.4359999999999999 | F66: L - Chillberg Rd, Conway
A67: =+A66+B67 -> 307.1 | B67: 2.3 | C67: =+A67*$D$7 -> 494.12390000000033 | D67: =+B67*$D$7 -> 3.7006999999999999 | F67: R - Best/Chillberg Rd (SS)
A68: =+A67+B68 -> 310.2 | B68: 3.1 | C68: =+A68*$D$7 -> 499.11180000000036 | D68: =+B68*$D$7 -> 4.9878999999999998 | F68: R onto Fir Island Rd (at bridge)
A69: =+A68+B69 -> 315.3 | B69: 5.1 | C69: =+A69*$D$7 -> 507.3177000000004 | D69: =+B69*$D$7 -> 8.2058999999999997 | F69: L - Hwy 534
A70: =+A69+B70 -> 323.3 | B70: 8.0 | C70: =+A70*$D$7 -> 520.18970000000036 | D70: =+B70*$D$7 -> 12.872 | F70: R - Hwy 9
A71: =+A70+B71 -> 333.8 | B71: 10.5 | C71: =+A71*$D$7 -> 537.08420000000035 | D71: =+B71*$D$7 -> 16.894500000000001 | F71: L - E Burke St
A72: =+A71+B72 -> 333.9 | B72: 00.1 | C72: =+A72*$D$7 -> 537.24510000000043 | D72: =+B72*$D$7 -> 0.16090000000000002 | F72: Thrifty Foods
A73: =+A72+B73 -> 333.9 | B73: 0.0 | C73: =+A73*$D$7 -> 537.24510000000043 | D73: =+B73*$D$7 -> 0.0 | F73: L - East on 530
A74: =+A73+B74 -> 334.7 | B74: 0.80000000000000071 | C74: =+A74*$D$7 -> 538.53230000000042 | D74: =+B74*$D$7 -> 1.2872000000000012 | F74: R - Jordan Road
A75: =+A74+B75 -> 335.7 | B75: 1.0 | C75: =+A75*$D$7 -> 540.14130000000046 | D75: =+B75*$D$7 -> 1.609 | F75: R - Jordan Road
A76: =+A75+B76 -> 347.6 | B76: 11.9 | C76: =+A76*$D$7 -> 559.28840000000037 | D76: =+B76*$D$7 -> 19.147100000000002 | F76: L - Highway 92
A77: =+A76+B77 -> 347.6 | C77: =+A77*$D$7 -> 559.28840000000037 | D77: =+B77*$D$7 -> 0.0 | E77: #8 | F77: GRANITE FALLS
A78: =+A77+B78 -> 348.3 | B78: 0.70000000000000284 | C78: =+A78*$D$7 -> 560.41470000000038 | D78: =+B78*$D$7 -> 1.1263000000000045 | F78: R - Mt. Loop Highway
A79: =+A78+B79 -> 348.5 | B79: 0.19999999999999574 | C79: =+A79*$D$7 -> 560.73650000000032 | D79: =+B79*$D$7 -> 0.32179999999999315 | F79: L - Menzel Lake Road
A80: =+A79+B80 -> 359.1 | B80: 10.6 | C80: =+A80*$D$7 -> 577.7919000000004 | D80: =+B80*$D$7 -> 17.055399999999999 | F80: L - Woods Creek Road
A81: =+A80+B81 -> 366.5 | B81: 7.4 | C81: =+A81*$D$7 -> 589.69850000000031 | D81: =+B81*$D$7 -> 11.906600000000001 | F81: R - Stay right on Woods Creed Rd.
A82: =+A81+B82 -> 367.5 | B82: 1.0 | C82: =+A82*$D$7 -> 591.3075 | D82: =+B82*$D$7 -> 1.609 | F82: L - Woods Creek Road
A83: =+A82+B83 -> 369.4 | B83: 1.9000000000000057 | C83: =+A83*$D$7 -> 594.36460000000034 | D83: =+B83*$D$7 -> 3.057100000000009 | F83: L - Oaks Street (0.1 mile before Highway 2)
A84: =+A83+B84 -> 369.6 | B84: 0.20000000000000284 | C84: =+A84*$D$7 -> 594.68640000000028 | D84: =+B84*$D$7 -> 0.32180000000000458 | F84: R - Stop Sign
A85: =+A84+B85 -> 369.8 | B85: 0.19999999999998863 | C85: =+A85*$D$7 -> 595.00820000000033 | D85: =+B85*$D$7 -> 0.32179999999998171 | F85: St - Main St (cross Hwy 2) (TL)
A86: =+A85+B86 -> 370.0 | B86: 00.2 | C86: =+A86*$D$7 -> 595.33 | D86: =+B86*$D$7 -> 0.32180000000000003 | F86: L - SR203 (TL)
A87: =+A86+B87 -> 371.5 | B87: 1.5 | C87: =+A87*$D$7 -> 597.74350000000027 | D87: =+B87*$D$7 -> 2.4135 | F87: R - Tualco Rd
A88: =+A87+B88 -> 374.5 | B88: 3.0 | C88: =+A88*$D$7 -> 602.57050000000027 | D88: =+B88*$D$7 -> 4.827 | F88: St - Crescent Lake Rd
A89: =+A88+B89 -> 375.6 | B89: 1.1 | C89: =+A89*$D$7 -> 604.34040000000027 | D89: =+B89*$D$7 -> 1.7699 | F89: L - West Snoqualmie Valley Rd (SS T-Int)
A90: =+A89+B90 -> 379.8 | B90: 4.2 | C90: =+A90*$D$7 -> 611.09820000000025 | D90: =+B90*$D$7 -> 6.7578000000000005 | F90: R - Woodinville-Duvall Rd (SS)
A91: =+A90+B91 -> 380.7 | B91: 00.9 | C91: =+A91*$D$7 -> 612.5463000000002 | D91: =+B91*$D$7 -> 1.4480999999999999 | F91: R - Old Woodinville-Duvall Rd
A92: =+A91+B92 -> 381.4 | B92: 00.7 | C92: =+A92*$D$7 -> 613.67260000000022 | D92: =+B92*$D$7 -> 1.1262999999999999 | F92: L - 232nd
A93: =+A92+B93 -> 383.5 | B93: 2.1 | C93: =+A93*$D$7 -> 617.05150000000026 | D93: =+B93*$D$7 -> 3.3789000000000002 | F93: L - 140th St (gravel)
A94: =+A93+B94 -> 383.5 | B94: 0.0 | C94: =+A94*$D$7 -> 617.05150000000026 | D94: =+B94*$D$7 -> 0.0 | E94: #9 | F94: FINISH - Terry's House