A1: Seattle Randonneurs 600 km Brevet
A2: Snohomish/NorthCascades/Stevens
A4: Created By: | D4: Pat Rodden
A5: Verified By: | D5: Pat Rodden
A6: Year(s) Used: | D6: ???
A7: Conversion(Mi-Km) | D7: 1.609
A9: Miles | C9: Km
A10: Total | B10: Leg | C10: Total | D10: Leg | E10: Ctrl | F10: Instructions
A11: 0.0 | B11: 0.0 | C11: =+A11*$D$7 -> 0.0 | D11: =+B11*$D$7 -> 0.0 | E11: #1 | F11: Start - Snohomish/Rodden
A12: =+A11+B12 -> 00.1 | B12: 00.1 | C12: =+A12*$D$7 -> 0.16090000000000002 | D12: =+B12*$D$7 -> 0.16090000000000002 | F12: L onto 4th St.
A13: =+A12+B13 -> 00.2 | B13: 00.1 | C13: =+A13*$D$7 -> 0.32180000000000003 | D13: =+B13*$D$7 -> 0.16090000000000002 | F13: R onto Ave. C
A14: =+A13+B14 -> 00.4 | B14: 00.2 | C14: =+A14*$D$7 -> 0.64360000000000006 | D14: =+B14*$D$7 -> 0.32180000000000003 | F14: L onto 1st St.
A15: =+A14+B15 -> 00.9 | B15: 0.5 | C15: =+A15*$D$7 -> 1.4480999999999999 | D15: =+B15*$D$7 -> 0.80449999999999999 | F15: BR onto Lincoln (Old Snohomish Hwy)
A16: =+A15+B16 -> 9.3 | B16: 8.4 | C16: =+A16*$D$7 -> 14.963700000000001 | D16: =+B16*$D$7 -> 13.515600000000001 | F16: R onto Hwy 2
A17: =+A16+B17 -> 22.3 | B17: 13.0 | C17: =+A17*$D$7 -> 35.880699999999997 | D17: =+B17*$D$7 -> 20.917000000000002 | F17: GoldBar - BP mini-mart, on left
A18: =+A17+B18 -> 22.3 | B18: 0.0 | C18: =+A18*$D$7 -> 35.880699999999997 | D18: =+B18*$D$7 -> 0.0 | F18: L onto Hwy 2 (East)
A19: =+A18+B19 -> 43.4 | B19: 21.1 | C19: =+A19*$D$7 -> 69.830600000000004 | D19: =+B19*$D$7 -> 33.9499 | E19: #2 | F19: Open, Skykomish
A20: =+A19+B20 -> 95.7 | B20: 52.3 | C20: =+A20*$D$7 -> 153.9813 | D20: =+B20*$D$7 -> 84.150700000000001 | E20: #3 | F20: Chevron mini-mart, on left, Levenworth
A21: =+A20+B21 -> 95.7 | B21: 0.0 | C21: =+A21*$D$7 -> 153.9813 | D21: =+B21*$D$7 -> 0.0 | F21: L onto Hwy 2 (East)
A22: =+A21+B22 -> 115.0 | B22: 19.3 | C22: =+A22*$D$7 -> 185.035 | D22: =+B22*$D$7 -> 31.053699999999999 | F22: BR onto 97/2 (Okanogan)
A23: =+A22+B23 -> 117.2 | B23: 2.2 | C23: =+A23*$D$7 -> 188.57480000000001 | D23: =+B23*$D$7 -> 3.5398000000000001 | F23: L onto 97/2 , after crossing the Columbia Riv.
A24: =+A23+B24 -> 133.2 | B24: 16.0 | C24: =+A24*$D$7 -> 214.31879999999998 | D24: =+B24*$D$7 -> 25.744 | E24: #4 | F24: Pine Canyon Texaco & Grociery, Orando
A25: =+A24+B25 -> 133.2 | B25: 0.0 | C25: =+A25*$D$7 -> 214.31879999999998 | D25: =+B25*$D$7 -> 0.0 | F25: R onto 97 North
A26: =+A25+B26 -> 170.7 | B26: 37.5 | C26: =+A26*$D$7 -> 274.65629999999999 | D26: =+B26*$D$7 -> 60.337499999999999 | E26: #5 | F26: Chevron Super Shop, Pateros
A27: =+A26+B27 -> 170.7 | B27: 0.0 | C27: =+A27*$D$7 -> 274.65629999999999 | D27: =+B27*$D$7 -> 0.0 | F27: Go back to 97 make L
A28: =+A27+B28 -> 171.2 | B28: 0.5 | C28: =+A28*$D$7 -> 275.46080000000001 | D28: =+B28*$D$7 -> 0.80449999999999999 | F28: R onto 153
A29: =+A28+B29 -> 213.2 | B29: 42.0 | C29: =+A29*$D$7 -> 343.03879999999998 | D29: =+B29*$D$7 -> 67.578000000000003 | E29: #6 | F29: Winthrop
A30: =+A29+B30 -> 213.2 | B30: 0.0 | C30: =+A30*$D$7 -> 343.03879999999998 | D30: =+B30*$D$7 -> 0.0 | F30: R onto Hwy 20 head to Washington Pass
A31: =+A30+B31 -> 287.4 | B31: 74.2 | C31: =+A31*$D$7 -> 462.42659999999995 | D31: =+B31*$D$7 -> 119.3878 | E31: #7 | F31: Newhalem Grociery on left
A32: =+A31+B32 -> 287.4 | B32: 0.0 | C32: =+A32*$D$7 -> 462.42659999999995 | D32: =+B32*$D$7 -> 0.0 | F32: L onto Hwt 20
A33: =+A32+B33 -> 310.4 | B33: 23.0 | C33: =+A33*$D$7 -> 499.43359999999996 | D33: =+B33*$D$7 -> 37.006999999999998 | F33: R onto 530, at Rockport
A34: =+A33+B34 -> 331.4 | B34: 21.0 | C34: =+A34*$D$7 -> 533.22259999999994 | D34: =+B34*$D$7 -> 33.789000000000001 | E34: #8 | F34: Texaco deli-mart, on Left, Darrington
A35: =+A34+B35 -> 331.4 | B35: 0.0 | C35: =+A35*$D$7 -> 533.22259999999994 | D35: =+B35*$D$7 -> 0.0 | F35: L onto 530
A36: =+A35+B36 -> 350.3 | B36: 18.9 | C36: =+A36*$D$7 -> 563.63269999999989 | D36: =+B36*$D$7 -> 30.410099999999996 | F36: R onto Arlington Hts Rd.
A37: =+A36+B37 -> 351.3 | B37: 1.0 | C37: =+A37*$D$7 -> 565.24169999999992 | D37: =+B37*$D$7 -> 1.609 | F37: R onto Jordan Rd.
A38: =+A37+B38 -> 363.4 | B38: 12.1 | C38: =+A38*$D$7 -> 584.7106 | D38: =+B38*$D$7 -> 19.468899999999998 | F38: R onto SR92
A39: =+A38+B39 -> 368.6 | B39: 5.2 | C39: =+A39*$D$7 -> 593.0773999999999 | D39: =+B39*$D$7 -> 8.3667999999999996 | F39: L onto Machians Rd.
A40: =+A39+B40 -> 369.9 | B40: 1.3 | C40: =+A40*$D$7 -> 595.16909999999996 | D40: =+B40*$D$7 -> 2.0916999999999999 | F40: R (jog) onto Centenial Trail
A41: =+A40+B41 -> 377.2 | B41: 7.3 | C41: =+A41*$D$7 -> 606.91480000000001 | D41: =+B41*$D$7 -> 11.745699999999999 | F41: R (jog) onto Maple Ave.
A42: =+A41+B42 -> 377.6 | B42: 00.4 | C42: =+A42*$D$7 -> 607.55839999999989 | D42: =+B42*$D$7 -> 0.64360000000000006 | F42: R onto 4th St.
A43: =+A42+B43 -> 378.0 | B43: 00.4 | C43: =+A43*$D$7 -> 608.20199999999988 | D43: =+B43*$D$7 -> 0.64360000000000006 | F43: R into Rodden ally
A44: =+A43+B44 -> 378.1 | B44: 00.1 | C44: =+A44*$D$7 -> 608.36289999999997 | D44: =+B44*$D$7 -> 0.16090000000000002 | E44: #9 | F44: Finish