A1: Seattle Randonneurs 600 km Brevet
A2: Olympic Peninsula
A4: Created By: | D4: Pete Bajema
A5: Verified By: | D5: Pete Bajema
A6: Year(s) Used: | D6: 1999.0
A7: Conversion(Mi-Km) | D7: 1.609
A9: Miles | C9: Km
A10: Total | B10: Leg | C10: Total | D10: Leg | E10: Ctrl | F10: Instructions
A11: 0.0 | B11: 0.0 | C11: =+A11*$D$7 -> 0.0 | D11: =+B11*$D$7 -> 0.0 | E11: #1 | F11: Start at Bremerton Ferry Terminal.
A12: =+A11+B12 -> 0.0 | B12: 0.0 | C12: =+A12*$D$7 -> 0.0 | D12: =+B12*$D$7 -> 0.0 | F12: Exit Bremerton Ferry Terminal onto 1st Street.
A13: =+A12+B13 -> 00.05 | B13: 00.05 | C13: =+A13*$D$7 -> 8.0450000000000008E-2 | D13: =+B13*$D$7 -> 8.0450000000000008E-2 | F13: R(N) Intersection of Washington Avenue and 1st Street. Bremerton.
A14: =+A13+B14 -> 00.1 | B14: 00.05 | C14: =+A14*$D$7 -> 0.16090000000000002 | D14: =+B14*$D$7 -> 8.0450000000000008E-2 | F14: L(W) Intersection of Burwell Street (SR 304W) and 1st Street.
A15: =+A14+B15 -> 1.3 | B15: 1.2 | C15: =+A15*$D$7 -> 2.0916999999999999 | D15: =+B15*$D$7 -> 1.9307999999999998 | F15: R(N) Intersection of Callow Avenue and Burwell Street (SR 304W). Follow sign to Silverdale.
A16: =+A15+B16 -> 2.1 | B16: 00.8 | C16: =+A16*$D$7 -> 3.3789000000000002 | D16: =+B16*$D$7 -> 1.2872000000000001 | F16: L(W) Intersection of 6th Street (SR 310W - Kitsap Hwy.) and Callow Avenue.
A17: =+A16+B17 -> 3.1 | B17: 1.0 | C17: =+A17*$D$7 -> 4.9878999999999998 | D17: =+B17*$D$7 -> 1.609 | F17: R(N) Intersection of SR 3N and SR 310W.
A18: =+A17+B18 -> 17.2 | B18: 14.1 | C18: =+A18*$D$7 -> 27.674799999999998 | D18: =+B18*$D$7 -> 22.686899999999998 | F18: ST Intersection of SR 305E (Poulsbo) and SR 3N.
A19: =+A18+B19 -> 24.2 | B19: 7.0 | C19: =+A19*$D$7 -> 38.937799999999996 | D19: =+B19*$D$7 -> 11.263 | F19: L Hwy. 104 over Hood Canal Bridge
A20: =+A19+B20 -> 40.0 | B20: 15.8 | C20: =+A20*$D$7 -> 64.36 | D20: =+B20*$D$7 -> 25.4222 | F20: BR Merge onto 101
A21: =+A20+B21 -> 61.0 | B21: 21.0 | C21: =+A21*$D$7 -> 98.149000000000001 | D21: =+B21*$D$7 -> 33.789000000000001 | E21: #2 | F21: Sequim; Open
A22: =+A21+B22 -> 76.0 | B22: 15.0 | C22: =+A22*$D$7 -> 122.28399999999999 | D22: =+B22*$D$7 -> 24.135000000000002 | F22: R Port Angeles
A23: =+A22+B23 -> 77.1 | B23: 1.1 | C23: =+A23*$D$7 -> 124.05389999999998 | D23: =+B23*$D$7 -> 1.7699 | F23: L Intersection of S. Lincoln Street to remain on US 101N. Follow signs to Forks.
A24: =+A23+B24 -> 82.8 | B24: 5.7 | C24: =+A24*$D$7 -> 133.2252 | D24: =+B24*$D$7 -> 9.1713000000000005 | F24: R(NW) Intersection of SR 112W/Piedmont Road from US 101N. CAUTION: "Bicyclist Read This Notice".
A25: =+A24+B25 -> 92.8 | B25: 10.0 | C25: =+A25*$D$7 -> 149.3152 | D25: =+B25*$D$7 -> 16.09 | F25: Joyce (Only services on 112 until Clallam Bay)
A26: =+A25+B26 -> 95.2 | B26: 2.4 | C26: =+A26*$D$7 -> 153.17680000000001 | D26: =+B26*$D$7 -> 3.8615999999999997 | F26: CAUTION. One lane gravel road approxiamately 50ft.
A27: =+A26+B27 -> 107.8 | B27: 12.6 | C27: =+A27*$D$7 -> 173.4502 | D27: =+B27*$D$7 -> 20.273399999999999 | F27: CAUTION. 50 ft of Gravel road
A28: =+A27+B28 -> 110.8 | B28: 3.0 | C28: =+A28*$D$7 -> 178.27719999999999 | D28: =+B28*$D$7 -> 4.827 | E28: #3 | F28: Bottom of Hill - Food and Water Available
A29: =+A28+B29 -> 121.1 | B29: 10.3 | C29: =+A29*$D$7 -> 194.84989999999999 | D29: =+B29*$D$7 -> 16.572700000000001 | F29: R Hwy. 112 To Clallam Bay
A30: =+A29+B30 -> 127.1 | B30: 6.0 | C30: =+A30*$D$7 -> 204.50389999999999 | D30: =+B30*$D$7 -> 9.6539999999999999 | F30: ST Clallam Bay (Rest rooms, store, etc.) - Stop here for restroom facilities
A31: =+A30+B31 -> 129.1 | B31: 2.0 | C31: =+A31*$D$7 -> 207.72189999999998 | D31: =+B31*$D$7 -> 3.218 | F31: ST Sekiu
A32: =+A31+B32 -> 136.2 | B32: 7.1 | C32: =+A32*$D$7 -> 219.14579999999998 | D32: =+B32*$D$7 -> 11.4239 | E32: #4 | F32: R Ray's Chevron (Please Note: No bathroom.)
A33: =+A32+B33 -> 136.2 | B33: 0.0 | C33: =+A33*$D$7 -> 219.14579999999998 | D33: =+B33*$D$7 -> 0.0 | F33: L Back to Clallam Bay
A34: =+A33+B34 -> 143.3 | B34: 7.1 | C34: =+A34*$D$7 -> 230.56969999999998 | D34: =+B34*$D$7 -> 11.4239 | F34: ST Sekiu
A35: =+A34+B35 -> 145.3 | B35: 2.0 | C35: =+A35*$D$7 -> 233.78769999999997 | D35: =+B35*$D$7 -> 3.218 | F35: ST Clallam Bay (Rest rooms, store, etc.)
A36: =+A35+B36 -> 151.3 | B36: 6.0 | C36: =+A36*$D$7 -> 243.44169999999997 | D36: =+B36*$D$7 -> 9.6539999999999999 | F36: ST Hwy. 113
A37: =+A36+B37 -> 161.5 | B37: 10.2 | C37: =+A37*$D$7 -> 259.85349999999994 | D37: =+B37*$D$7 -> 16.411799999999999 | F37: R Hwy. 101 Towards Hwy 110
A38: =+A37+B38 -> 171.5 | B38: 10.0 | C38: =+A38*$D$7 -> 275.94349999999997 | D38: =+B38*$D$7 -> 16.09 | F38: R Hwy. 110 to La Push.
A39: =+A38+B39 -> 186.6 | B39: 15.1 | C39: =+A39*$D$7 -> 300.23939999999993 | D39: =+B39*$D$7 -> 24.2959 | E39: #5 | F39: TA La Push Tribal center
A40: =+A39+B40 -> 201.7 | B40: 15.1 | C40: =+A40*$D$7 -> 324.53529999999995 | D40: =+B40*$D$7 -> 24.2959 | F40: L Hwy 101 to Port Angeles
A41: =+A40+B41 -> 213.6 | B41: 11.9 | C41: =+A41*$D$7 -> 343.68239999999992 | D41: =+B41*$D$7 -> 19.147100000000002 | F41: ST Past Hwy. 113 (stay on 101)
A42: =+A41+B42 -> 230.9 | B42: 17.3 | C42: =+A42*$D$7 -> 371.51809999999995 | D42: =+B42*$D$7 -> 27.835699999999999 | F42: ST Bike warning sign
A43: =+A42+B43 -> 242.7 | B43: 11.8 | C43: =+A43*$D$7 -> 390.5043 | D43: =+B43*$D$7 -> 18.9862 | F43: ST Texaco Station
A44: =+A43+B44 -> 256.0 | B44: 13.3 | C44: =+A44*$D$7 -> 411.904 | D44: =+B44*$D$7 -> 21.399699999999999 | F44: ST Go into town (Under bridge)
A45: =+A44+B45 -> 256.9 | B45: 00.9 | C45: =+A45*$D$7 -> 413.35209999999995 | D45: =+B45*$D$7 -> 1.4480999999999999 | F45: BL Stay on 101
A46: =+A45+B46 -> 257.9 | B46: 1.0 | C46: =+A46*$D$7 -> 414.96109999999999 | D46: =+B46*$D$7 -> 1.609 | F46: R First Ave. (Hwy. 101)
A47: =+A46+B47 -> 259.7 | B47: 1.8 | C47: =+A47*$D$7 -> 417.85729999999995 | D47: =+B47*$D$7 -> 2.8961999999999999 | E47: #6 | F47: R Super 8 Motel - Port Angeles
A48: =+A47+B48 -> 259.8 | B48: 00.1 | C48: =+A48*$D$7 -> 418.01820000000004 | D48: =+B48*$D$7 -> 0.16090000000000002 | F48: R Hwy. 101 (to Sequim)
A49: =+A48+B49 -> 274.7 | B49: 14.9 | C49: =+A49*$D$7 -> 441.9923 | D49: =+B49*$D$7 -> 23.9741 | F49: ST Sequim Ave.
A50: =+A49+B50 -> 295.7 | B50: 21.0 | C50: =+A50*$D$7 -> 475.78129999999999 | D50: =+B50*$D$7 -> 33.789000000000001 | F50: ST Stay on 101 S to Quilcene (Jct. of 104 and 101)
A51: =+A50+B51 -> 305.4 | B51: 9.7 | C51: =+A51*$D$7 -> 491.38859999999994 | D51: =+B51*$D$7 -> 15.607299999999999 | E51: #7 | F51: Peninsula Foods. Quilcene. Turn around.
A52: =+A51+B52 -> 305.5 | B52: 00.1 | C52: =+A52*$D$7 -> 491.54950000000002 | D52: =+B52*$D$7 -> 0.16090000000000002 | F52: R(N) Center Road to Chimacum.
A53: =+A52+B53 -> 314.2 | B53: 8.7 | C53: =+A53*$D$7 -> 505.5478 | D53: =+B53*$D$7 -> 13.998299999999999 | F53: ST Cross Hwy. 104
A54: =+A53+B54 -> 321.2 | B54: 7.0 | C54: =+A54*$D$7 -> 516.81079999999997 | D54: =+B54*$D$7 -> 11.263 | F54: L Hwy. 19
A55: =+A54+B55 -> 326.4 | B55: 5.2 | C55: =+A55*$D$7 -> 525.17759999999998 | D55: =+B55*$D$7 -> 8.3667999999999996 | F55: R SR 20E becomes Sims Way at Discovery Road/Glen Cove/Mill Road.
A56: =+A55+B56 -> 331.8 | B56: 5.4 | C56: =+A56*$D$7 -> 533.86619999999994 | D56: =+B56*$D$7 -> 8.688600000000001 | F56: TA Ride on Sims way to Marina - Intersection of Highway 20E(Walter St. and Hudson Place) Turn around
A57: =+A56+B57 -> 333.5 | B57: 1.7 | C57: =+A57*$D$7 -> 536.60149999999987 | D57: =+B57*$D$7 -> 2.7353000000000001 | E57: #8 | F57: Intersection of Haines Place and SR 20E. Safeway and McDonald's. Port Townsend.
A58: =+A57+B58 -> 337.2 | B58: 3.7 | C58: =+A58*$D$7 -> 542.55479999999989 | D58: =+B58*$D$7 -> 5.9533000000000005 | F58: L Hwy. 19
A59: =+A58+B59 -> 347.9 | B59: 10.7 | C59: =+A59*$D$7 -> 559.77109999999982 | D59: =+B59*$D$7 -> 17.2163 | F59: L SR104
A60: =+A59+B60 -> 351.6 | B60: 3.7 | C60: =+A60*$D$7 -> 565.72439999999983 | D60: =+B60*$D$7 -> 5.9533000000000005 | F60: ST Hood Canal Bridge. Watch for Glass on bridge
A61: =+A60+B61 -> 353.3 | B61: 1.7 | C61: =+A61*$D$7 -> 568.45969999999988 | D61: =+B61*$D$7 -> 2.7353000000000001 | F61: R SR 3.
A62: =+A61+B62 -> 360.3 | B62: 7.0 | C62: =+A62*$D$7 -> 579.7226999999998 | D62: =+B62*$D$7 -> 11.263 | F62: Exit R Hwy. 305 to Bainbridge
A63: =+A62+B63 -> 373.6 | B63: 13.3 | C63: =+A63*$D$7 -> 601.12239999999986 | D63: =+B63*$D$7 -> 21.399699999999999 | E63: #9 | F63: Bainbridge ferry