A1: Dist. (Miles) | B1: Leg (Miles) | C1: Turn (Dir) | D1: Route | E1: Dist. (Km) | F1: Leg (Km) | G1: =1.609344 -> 1.609344 | H1: Mileage conversion to Km.
A2: 0.00 | B2: =A3-A2 -> 0.00 | D2: Control #1. Start at Bremerton Ferry Terminal. [Open: 06:30AM. Close: 07:30AM.]Ride Starts at 6:30 am | E2: =A2*$G$1 -> 0.00 | F2: =B2*$G$1 -> 0.00 | G2: 0.27083333333333331 | H2: 0.3125
A3: =A2+B3 -> 0.00 | B3: 0.00 | D3: Exit Bremerton Ferry Terminal onto 1st Street. | E3: =A3*$G$1 -> 0.00 | F3: =B3*$G$1 -> 0.00
A4: =A3+B4 -> 00.05 | B4: 00.05 | C4: R(N) | D4: Intersection of Washington Avenue and 1st Street. Bremerton. | E4: =A4*$G$1 -> 8.0467200000000016E-2 | F4: =B4*$G$1 -> 8.0467200000000016E-2
A5: =A4+B5 -> 00.1 | B5: 00.05 | C5: L(W) | D5: Intersection of Burwell Street (SR 304W) and 1st Street. | E5: =A5*$G$1 -> 0.16093440000000003 | F5: =B5*$G$1 -> 8.0467200000000016E-2
A6: =A5+B6 -> 1.30 | B6: 1.20 | C6: R(N) | D6: Intersection of Callow Avenue and Burwell Street (SR 304W). Follow sign to Silverdale. | E6: =A6*$G$1 -> 2.0921472000000003 | F6: =B6*$G$1 -> 1.9312128
A7: =A6+B7 -> 2.10 | B7: 00.8 | C7: L(W) | D7: Intersection of 6th Street (SR 310W - Kitsap Hwy.) and Callow Avenue. | E7: =A7*$G$1 -> 3.3796224000000006 | F7: =B7*$G$1 -> 1.2874752000000003
A8: =A7+B8 -> 3.10 | B8: 1.00 | C8: R(N) | D8: Intersection of SR 3N and SR 310W. | E8: =A8*$G$1 -> 4.9889664000000007 | F8: =B8*$G$1 -> 1.609344
A9: =A8+B9 -> 17.20 | B9: 14.10 | C9: ST | D9: Intersection of SR 305E (Poulsbo) and SR 3N. | E9: =A9*$G$1 -> 27.6807168 | F9: =B9*$G$1 -> 22.6917504
A10: =A9+B10 -> 24.20 | B10: 7 | C10: L | D10: Hwy. 104 over Hood Canal Bridge | E10: =A10*$G$1 -> 38.9461248 | F10: =B10*$G$1 -> 11.265408
A11: =A10+B11 -> 40 | B11: 15.8 | C11: BR | D11: Merge onto 101 | E11: =A11*$G$1 -> 64.37376 | F11: =B11*$G$1 -> 25.427635200000005
A12: =A11+B12 -> 61 | B12: 21 | D12: Control #2. Sequim; Open Control: [Open:9:23a / Close:1:02p] | E12: =A12*$G$1 -> 98.169984 | F12: =B12*$G$1 -> 33.796224 | G12: =$G$2+ (INT((ROUND(E12,0)/34)) & ":" & ROUND(((ROUND(E12,0)/34) - INT((ROUND(E12,0)/34)))*60,0)) -> 0.39097222222222222 | H12: =$G$2+ (INT((ROUND(E12,0)/15)) & ":" & ROUND(((ROUND(E12,0)/15) - INT((ROUND(E12,0)/15)))*60,0)) -> 0.54305555555555551
A13: =A12+B13 -> 76 | B13: 15 | C13: R | D13: Port Angeles | E13: =A13*$G$1 -> 122.31014400000001 | F13: =B13*$G$1 -> 24.14016
A14: =A13+B14 -> 77.1 | B14: 1.1 | C14: L | D14: Intersection of S. Lincoln Street to remain on US 101N. Follow signs to Forks. | E14: =A14*$G$1 -> 124.0804224 | F14: =B14*$G$1 -> 1.7702784000000003
A15: =A14+B15 -> 82.8 | B15: 5.7 | C15: R(NW) | D15: Intersection of SR 112W/Piedmont Road from US 101N. CAUTION: "Bicyclist Read This Notice". | E15: =A15*$G$1 -> 133.2536832 | F15: =B15*$G$1 -> 9.1732608000000013
A16: =A15+B16 -> 92.8 | B16: 10 | D16: Joyce (Only services on 112 until Clallam Bay) | E16: =A16*$G$1 -> 149.3471232 | F16: =B16*$G$1 -> 16.09344
A17: =A16+B17 -> 95.2 | B17: 2.4 | D17: CAUTION. One lane gravel road approxiamately 50ft. | E17: =A17*$G$1 -> 153.20954880000002 | F17: =B17*$G$1 -> 3.8624256
A18: =A17+B18 -> 107.8 | B18: 12.6 | D18: CAUTION. 50 ft of Gravel road | E18: =A18*G1 -> 173.4872832 | F18: =B18*$G$1 -> 20.2777344
A19: =A18+B19 -> 110.8 | B19: 3.0 | D19: Control #3. Bottom of Hill - Food and Water Available - [Open:11:44p / Close:6:22p] | E19: =A19*G1 -> 178.31531520000001 | F19: =B19*$G$1 -> 4.828032 | G19: =$G$2+ (INT((ROUND(E19,0)/34)) & ":" & ROUND(((ROUND(E19,0)/34) - INT((ROUND(E19,0)/34)))*60,0)) -> 0.48888888888888887 | H19: =$G$2+ (INT((ROUND(E19,0)/15)) & ":" & ROUND(((ROUND(E19,0)/15) - INT((ROUND(E19,0)/15)))*60,0)) -> 0.76527777777777772
A20: =A19+B20 -> 121.1 | B20: 10.3 | C20: R | D20: Hwy. 112 To Clallam Bay | E20: =A20*$G$1 -> 194.8915584 | F20: =B20*$G$1 -> 16.576243200000004
A21: =A20+B21 -> 127.1 | B21: 6 | C21: ST | D21: Clallam Bay (Rest rooms, store, etc.) - Stop here for restroom facilities | E21: =A21*$G$1 -> 204.5476224 | F21: =B21*$G$1 -> 9.656064
A22: =A21+B22 -> 129.1 | B22: 2 | C22: ST | D22: Sekiu | E22: =A22*$G$1 -> 207.7663104 | F22: =B22*$G$1 -> 3.218688
A23: =A22+B23 -> 136.2 | B23: 7.1 | C23: R | D23: Control #4. Ray's Chevron (Please Note: No bathroom.) Store closes 10p [Open: 1:21p. / Close: 9:06p.] | E23: =A23*$G$1 -> 219.1926528 | F23: =B23*$G$1 -> 11.4263424 | G23: =$G$2+ (INT((ROUND(E23,0)/32)) & ":" & ROUND(((ROUND(E23,0)/32) - INT((ROUND(E23,0)/32)))*60,0)) -> 0.55625 | H23: =$G$2+ (INT((ROUND(E23,0)/15)) & ":" & ROUND(((ROUND(E23,0)/15) - INT((ROUND(E23,0)/15)))*60,0)) -> 0.87916666666666665
A24: =A23+B24 -> 136.2 | B24: 0 | C24: L | D24: Back to Clallam Bay | E24: =A24*$G$1 -> 219.1926528 | F24: =B24*$G$1 -> 0.00
A25: =A24+B25 -> 143.3 | B25: 7.1 | C25: ST | D25: Sekiu | E25: =A25*$G$1 -> 230.6189952 | F25: =B25*$G$1 -> 11.4263424
A26: =A25+B26 -> 145.3 | B26: 2 | C26: ST | D26: Clallam Bay (Rest rooms, store, etc.) | E26: =A26*$G$1 -> 233.8376832 | F26: =B26*$G$1 -> 3.218688
A27: =A26+B27 -> 151.3 | B27: 6 | C27: ST | D27: Hwy. 113 | E27: =A27*$G$1 -> 243.4937472 | F27: =B27*$G$1 -> 9.656064
A28: =A27+B28 -> 161.5 | B28: 10.2 | C28: R | D28: Hwy. 101 Towards Hwy 110 | E28: =A28*$G$1 -> 259.90905599999996 | F28: =B28*$G$1 -> 16.4153088
A29: =A28+B29 -> 171.5 | B29: 10 | C29: R | D29: Hwy. 110 to La Push. | E29: =A29*$G$1 -> 276.00249599999995 | F29: =B29*$G$1 -> 16.09344
A30: =A29+B30 -> 186.6 | B30: 15.1 | C30: TA | D30: Control #5. La Push Tribal center [Open: 3:53p / Close: 2:30a Sunday] | E30: =A30*$G$1 -> 300.30359039999996 | F30: =B30*$G$1 -> 24.3010944 | G30: =$G$2+ (INT((ROUND(E30,0)/32)) & ":" & ROUND(((ROUND(E30,0)/32) - INT((ROUND(E30,0)/32)))*60,0)) -> 0.66180555555555554 | H30: =$G$2+ (INT((ROUND(E30,0)/15)) & ":" & ROUND(((ROUND(E30,0)/15) - INT((ROUND(E30,0)/15)))*60,0)) -> 1.1041666666666667
A31: =A30+B31 -> 201.7 | B31: 15.1 | C31: L | D31: Hwy 101 to Port Angeles | E31: =A31*$G$1 -> 324.6046848 | F31: =B31*$G$1 -> 24.3010944
A32: =A31+B32 -> 213.6 | B32: 11.9 | C32: ST | D32: Past Hwy. 113 (stay on 101) | E32: =A32*$G$1 -> 343.7558784 | F32: =B32*$G$1 -> 19.151193600000003
A33: =A32+B33 -> 230.9 | B33: 17.3 | C33: ST | D33: Bike warning sign | E33: =A33*$G$1 -> 371.5975296 | F33: =B33*$G$1 -> 27.841651200000005
A34: =A33+B34 -> 242.7 | B34: 11.8 | C34: ST | D34: Texaco Station | E34: =A34*$G$1 -> 390.5877888 | F34: =B34*$G$1 -> 18.990259200000004
A35: =A34+B35 -> 256 | B35: 13.3 | C35: ST | D35: Go into town (Under bridge) | E35: =A35*$G$1 -> 411.992064 | F35: =B35*$G$1 -> 21.404275200000004
A36: =A35+B36 -> 256.9 | B36: 00.9 | C36: BL | D36: Stay on 101 | E36: =A36*$G$1 -> 413.4404736 | F36: =B36*$G$1 -> 1.4484096000000002
A37: =A36+B37 -> 257.9 | B37: 1 | C37: R | D37: First Ave. (Hwy. 101) | E37: =A37*$G$1 -> 415.0498176 | F37: =B37*$G$1 -> 1.609344
A38: =A37+B38 -> 259.7 | B38: 1.8 | C38: R | D38: Control #6. Super 8 Motel - Port Angeles [Open: 8:26p / 10:22a Sunday] | E38: =A38*$G$1 -> 417.9466368 | F38: =B38*$G$1 -> 2.8968192000000004 | G38: =$G$2+ (INT((ROUND(E38,0)/30)) & ":" & ROUND(((ROUND(E38,0)/30) - INT((ROUND(E38,0)/30)))*60,0)) -> 0.851388888888889 | H38: =$G$2+ (INT((ROUND(E38,0)/15)) & ":" & ROUND(((ROUND(E38,0)/15) - INT((ROUND(E38,0)/15)))*60,0)) -> 1.4319444444444445
A39: =A38+B39 -> 259.8 | B39: 00.1 | C39: R | D39: Hwy. 101 (to Sequim) | E39: =A39*$G$1 -> 418.10757120000005 | F39: =B39*$G$1 -> 0.16093440000000003
A40: =A39+B40 -> 274.7 | B40: 14.9 | C40: ST | D40: Sequim Ave. | E40: =A40*$G$1 -> 442.0867968 | F40: =B40*$G$1 -> 23.979225600000003
A41: =A40+B41 -> 295.7 | B41: 21 | C41: ST | D41: Stay on 101 S to Quilcene (Jct. of 104 and 101) | E41: =A41*$G$1 -> 475.8830208 | F41: =B41*$G$1 -> 33.796224
A42: =A41+B42 -> 305.4 | B42: 9.7 | D42: Control #7. Peninsula Foods. Quilcene. Turn around. [Open:10:52p / Close: 3:14p - Sunday] | E42: =A42*$G$1 -> 491.4936576 | F42: =B42*$G$1 -> 15.6106368 | G42: =$G$2+ (INT((ROUND(E42,0)/30)) & ":" & ROUND(((ROUND(E42,0)/30) - INT((ROUND(E42,0)/30)))*60,0)) -> 0.95277777777777772 | H42: =$G$2+ (INT((ROUND(E42,0)/15)) & ":" & ROUND(((ROUND(E42,0)/15) - INT((ROUND(E42,0)/15)))*60,0)) -> 1.6347222222222222
A43: =A42+B43 -> 305.5 | B43: 00.1 | C43: R(N) | D43: Center Road to Chimacum. | E43: =A43*$G$1 -> 491.65459200000004 | F43: =B43*$G$1 -> 0.16093440000000003
A44: =A43+B44 -> 314.2 | B44: 8.7 | C44: ST | D44: Cross Hwy. 104 | E44: =A44*$G$1 -> 505.6558848 | F44: =B44*$G$1 -> 14.0012928
A45: =A44+B45 -> 321.2 | B45: 7 | C45: L | D45: Hwy. 19 | E45: =A45*$G$1 -> 516.92129280000006 | F45: =B45*$G$1 -> 11.265408
A46: =A45+B46 -> 326.4 | B46: 5.2 | C46: R | D46: SR 20E becomes Sims Way at Discovery Road/Glen Cove/Mill Road. | E46: =A46*$G$1 -> 525.2898816 | F46: =B46*$G$1 -> 8.3685888000000013
A47: =A46+B47 -> 330.1 | B47: 3.7 | C47: TA | D47: Control #8. Intersection of Haines Place and SR 20E. Safeway and McDonald's. Turn around. Port Townsend. [Open:12:12a / Close:5:54p Sunday] | E47: =A47*$G$1 -> 531.2444544 | F47: =B47*$G$1 -> 5.9545728000000011 | G47: =$G$2+ (INT((ROUND(E47,0)/30)) & ":" & ROUND(((ROUND(E47,0)/30) - INT((ROUND(E47,0)/30)))*60,0)) -> 1.0083333333333333 | H47: =$G$2+ (INT((ROUND(E47,0)/15)) & ":" & ROUND(((ROUND(E47,0)/15) - INT((ROUND(E47,0)/15)))*60,0)) -> 1.7458333333333331
A48: =A47+B48 -> 333.8 | B48: 3.7 | C48: L | D48: Hwy. 19 | E48: =A48*$G$1 -> 537.19902719999993 | F48: =B48*$G$1 -> 5.9545728000000011
A49: =A48+B49 -> 344.5 | B49: 10.7 | C49: L | D49: SR104 | E49: =A49*$G$1 -> 554.419008 | F49: =B49*$G$1 -> 17.2199808
A50: =A49+B50 -> 348.2 | B50: 3.7 | C50: ST | D50: Hood Canal Bridge. Watch for Glass on bridge | E50: =A50*$G$1 -> 560.3735807999999 | F50: =B50*$G$1 -> 5.9545728000000011
A51: =A50+B51 -> 349.9 | B51: 1.7 | C51: R | D51: SR 3. | E51: =A51*$G$1 -> 563.10946559999991 | F51: =B51*$G$1 -> 2.7358848
A52: =A51+B52 -> 356.9 | B52: 7 | C52: Exit R | D52: Hwy. 305 to Bainbridge | E52: =A52*$G$1 -> 574.37487359999989 | F52: =B52*$G$1 -> 11.265408
A53: =A52+B53 -> 370.2 | B53: 13.3 | D53: Bainbridge ferry [Open:2:22 AM - Sunday Close:10:30 PM - Sunday.] | E53: =A53*$G$1 -> 595.77914879999992 | F53: =B53*$G$1 -> 21.404275200000004 | G53: =$G$2+ (INT((ROUND(E53,0)/30)) & ":" & ROUND(((ROUND(E53,0)/30) - INT((ROUND(E53,0)/30)))*60,0)) -> 1.0986111111111112 | H53: =$G$2+ (INT((ROUND(E53,0)/15)) & ":" & ROUND(((ROUND(E53,0)/15) - INT((ROUND(E53,0)/15)))*60,0)) -> 1.9263888888888889
B57: =SUM(B2:B56) -> 370.20