A1: Seattle Randonneurs 1000 km Brevet
A2: Olympic Peninsula
A4: Created By: | D4: Terry Zmrhal
A5: Verified By: | D5: Terry Zmrhal
A6: Year(s) Used: | D6: 2001
A7: Conversion(Mi-Km) | D7: 1.609
A9: Miles | C9: Km
A10: Total | B10: Leg | C10: Total | D10: Leg | E10: Ctrl | F10: Instructions
A11: 0.0 | B11: 0.0 | C11: =+A11*$D$7 -> 0.0 | D11: =+B11*$D$7 -> 0.0 | E11: Start | F11: Bainbridge Island - North on SR305
A12: =+A11+B12 -> 6.8 | B12: 6.8 | C12: =+A12*$D$7 -> 10.9412 | D12: =+B12*$D$7 -> 10.9412 | F12: CAUTION - Agate Pass Bridge
A13: =+A12+B13 -> 12.4 | B13: 5.6 | C13: =+A13*$D$7 -> 19.951599999999999 | D13: =+B13*$D$7 -> 9.0103999999999989
A14: =+A13+B14 -> 12.4 | B14: 0.0 | C14: =+A14*$D$7 -> 19.951599999999999 | D14: =+B14*$D$7 -> 0.0 | F14: Little Valley Rd
A15: =+A14+B15 -> 13.1 | B15: 00.7 | C15: =+A15*$D$7 -> 21.077899999999996 | D15: =+B15*$D$7 -> 1.1262999999999999 | F15: Big Valley Rd (cross SR307)
A16: =+A15+B16 -> 17.8 | B16: 4.7 | C16: =+A16*$D$7 -> 28.640199999999997 | D16: =+B16*$D$7 -> 7.5623000000000005 | F16: SR3
A17: =+A16+B17 -> 20.7 | B17: 2.9 | C17: =+A17*$D$7 -> 33.306299999999993 | D17: =+B17*$D$7 -> 4.6661000000000001 | F17: SR104
A18: =+A17+B18 -> 20.7 | C18: =+A18*$D$7 -> 33.306299999999993 | D18: =+B18*$D$7 -> 0.0 | F18: CAUTION - Hood Canal Bridge
A19: =+A18+B19 -> 31.9 | B19: 11.2 | C19: =+A19*$D$7 -> 51.327099999999994 | D19: =+B19*$D$7 -> 18.020799999999998 | F19: Center Rd (to Quilcene) ON A DOWNHILL
A20: =+A19+B20 -> 32.0 | B20: 00.1 | C20: =+A20*$D$7 -> 51.487999999999992 | D20: =+B20*$D$7 -> 0.16090000000000002 | F20: Center Rd
A21: =+A20+B21 -> 40.2 | B21: 8.2 | C21: =+A21*$D$7 -> 64.681799999999996 | D21: =+B21*$D$7 -> 13.1938 | F21: SR101 (Quilcene)
A22: =+A21+B22 -> 40.2 | B22: 0.0 | C22: =+A22*$D$7 -> 64.681799999999996 | D22: =+B22*$D$7 -> 0.0 | E22: #1 | F22: Quilcene (manned) (SR101 West)
A23: =+A22+B23 -> 52.3 | B23: 12.1 | C23: =+A23*$D$7 -> 84.150700000000001 | D23: =+B23*$D$7 -> 19.468899999999998 | F23: SR20 to Port Townsend
A24: =+A23+B24 -> 65.2 | B24: 12.9 | C24: =+A24*$D$7 -> 104.9068 | D24: =+B24*$D$7 -> 20.7561 | F24: Sheridan St
A25: =+A24+B25 -> 65.4 | B25: 00.2 | C25: =+A25*$D$7 -> 105.22860000000001 | D25: =+B25*$D$7 -> 0.32180000000000003 | E25: #2 | F25: QFC (24 Hour)
A26: =+A25+B26 -> 65.6 | B26: 00.2 | C26: =+A26*$D$7 -> 105.55040000000001 | D26: =+B26*$D$7 -> 0.32180000000000003 | F26: SR20
A27: =+A26+B27 -> 78.5 | B27: 12.9 | C27: =+A27*$D$7 -> 126.30650000000003 | D27: =+B27*$D$7 -> 20.7561 | F27: Hwy 101 West
A28: =+A27+B28 -> 93.9 | B28: 15.4 | C28: =+A28*$D$7 -> 151.08510000000004 | D28: =+B28*$D$7 -> 24.778600000000001 | F28: Washington S to downton Sequim
A29: =+A28+B29 -> 97.6 | B29: 3.7 | C29: =+A29*$D$7 -> 157.03840000000002 | D29: =+B29*$D$7 -> 5.9533000000000005 | F29: Hwy 101 West
A30: =+A29+B30 -> 112.5 | B30: 14.9 | C30: =+A30*$D$7 -> 181.01249999999999 | D30: =+B30*$D$7 -> 23.9741 | F30: Hwy 101 West (Lincoln St)
A31: =+A30+B31 -> 169.2 | B31: 56.7 | C31: =+A31*$D$7 -> 272.24280000000005 | D31: =+B31*$D$7 -> 91.2303 | E31: #3 | F31: Forks
A32: =+A31+B32 -> 203.2 | B32: 34.0 | C32: =+A32*$D$7 -> 326.94880000000006 | D32: =+B32*$D$7 -> 54.706000000000003 | F32: Kalaloch Lodge (food)
A33: =+A32+B33 -> 208.7 | B33: 5.5 | C33: =+A33*$D$7 -> 335.7983000000001 | D33: =+B33*$D$7 -> 8.849499999999999 | F33: Queets (gas station)
A34: =+A33+B34 -> 233.7 | B34: 25.0 | C34: =+A34*$D$7 -> 376.02330000000006 | D34: =+B34*$D$7 -> 40.225000000000001 | F34: Amanda Park (food)
A35: =+A34+B35 -> 253.7 | B35: 20.0 | C35: =+A35*$D$7 -> 408.20330000000007 | D35: =+B35*$D$7 -> 32.18 | F35: Humptulips (store)
A36: =+A35+B36 -> 271.4 | B36: 17.7 | C36: =+A36*$D$7 -> 436.68260000000004 | D36: =+B36*$D$7 -> 28.479299999999999 | F36: Hwy 101 (Perry St)
A37: =+A36+B37 -> 271.7 | B37: 00.3 | C37: =+A37*$D$7 -> 437.16530000000006 | D37: =+B37*$D$7 -> 0.48269999999999996 | F37: Hwy 101 (Lincoln St)
A38: =+A37+B38 -> 272.6 | B38: 00.9 | C38: =+A38*$D$7 -> 438.61340000000001 | D38: =+B38*$D$7 -> 1.4480999999999999 | F38: Hwy 101 (5th St)
A39: =+A38+B39 -> 272.7 | B39: 00.1 | C39: =+A39*$D$7 -> 438.7743000000001 | D39: =+B39*$D$7 -> 0.16090000000000002 | F39: Hwy 101 (Simpson St)
A40: =+A39+B40 -> 275.4 | B40: 2.7 | C40: =+A40*$D$7 -> 443.11860000000007 | D40: =+B40*$D$7 -> 4.3443000000000005 | F40: Hwy 101 (Park St)
A41: =+A40+B41 -> 276.0 | B41: 00.6 | C41: =+A41*$D$7 -> 444.08400000000006 | D41: =+B41*$D$7 -> 0.96539999999999992 | F41: Hwy 101 (Heron St)
A42: =+A41+B42 -> 276.0 | B42: 0.0 | C42: =+A42*$D$7 -> 444.08400000000006 | D42: =+B42*$D$7 -> 0.0 | E42: #4 | F42: Aberdeen AM/PM
A43: =+A42+B43 -> 276.0 | C43: =+A43*$D$7 -> 444.08400000000006 | D43: =+B43*$D$7 -> 0.0 | F43: see directions below for Hotel
A44: =+A43+B44 -> 276.6 | B44: 00.6 | C44: =+A44*$D$7 -> 445.04940000000011 | D44: =+B44*$D$7 -> 0.96539999999999992 | F44: Hwy 101 - cross bridge
A45: =+A44+B45 -> 277.5 | B45: 00.9 | C45: =+A45*$D$7 -> 446.4975 | D45: =+B45*$D$7 -> 1.4480999999999999 | F45: Hwy 105
A46: =+A45+B46 -> 295.4 | B46: 17.9 | C46: =+A46*$D$7 -> 475.29860000000008 | D46: =+B46*$D$7 -> 28.801099999999998 | E46: #5 | F46: Westport Texaco (24 Hour)
A47: =+A46+B47 -> 295.9 | B47: 0.5 | C47: =+A47*$D$7 -> 476.10310000000004 | D47: =+B47*$D$7 -> 0.80449999999999999 | F47: Hwy 101
A48: =+A47+B48 -> 325.9 | B48: 30.0 | C48: =+A48*$D$7 -> 524.37310000000002 | D48: =+B48*$D$7 -> 48.27 | F48: Hwy 101 (Raymond)
A49: =+A48+B49 -> 325.9 | C49: =+A49*$D$7 -> 524.37310000000002 | D49: =+B49*$D$7 -> 0.0 | F49: 24 Hour Chevron in Raymond
A50: =+A49+B50 -> 355.5 | B50: 29.6 | C50: =+A50*$D$7 -> 571.99950000000013 | D50: =+B50*$D$7 -> 47.626400000000004 | F50: Hwy 101 (intersection w/ SR4)
A51: =+A50+B51 -> 370.4 | B51: 14.9 | C51: =+A51*$D$7 -> 595.97360000000003 | D51: =+B51*$D$7 -> 23.9741 | F51: Sandridge
A52: =+A51+B52 -> 370.4 | C52: =+A52*$D$7 -> 595.97360000000003 | D52: =+B52*$D$7 -> 0.0 | F52: (24 Hr gas station 0.6mi West)
A53: =+A52+B53 -> 381.9 | B53: 11.5 | C53: =+A53*$D$7 -> 614.47710000000006 | D53: =+B53*$D$7 -> 18.503499999999999 | F53: SR 103 (Bay St)
A54: =+A53+B54 -> 382.7 | B54: 00.8 | C54: =+A54*$D$7 -> 615.76430000000005 | D54: =+B54*$D$7 -> 1.2872000000000001 | E54: #6 | F54: SR 103 (Ocean Park)
A55: =+A54+B55 -> 395.7 | B55: 13.0 | C55: =+A55*$D$7 -> 636.68130000000008 | D55: =+B55*$D$7 -> 20.917000000000002 | F55: Hwy 101 - Ilwaco
A56: =+A55+B56 -> 402.8 | B56: 7.1 | C56: =+A56*$D$7 -> 648.10520000000008 | D56: =+B56*$D$7 -> 11.4239 | E56: #7 | F56: Hwy 101 - Chinook
A57: =+A56+B57 -> 406.8 | B57: 4.0 | C57: =+A57*$D$7 -> 654.54120000000012 | D57: =+B57*$D$7 -> 6.4359999999999999 | F57: SR 401 (rest area in .5 miles)
A58: =+A57+B58 -> 418.9 | B58: 12.1 | C58: =+A58*$D$7 -> 674.01010000000019 | D58: =+B58*$D$7 -> 19.468899999999998 | F58: SR4 (grocery in Naselle)
A59: =+A58+B59 -> 423.6 | B59: 4.7 | C59: =+A59*$D$7 -> 681.57240000000013 | D59: =+B59*$D$7 -> 7.5623000000000005 | F59: Hwy 101
A60: =+A59+B60 -> 453.2 | B60: 29.6 | C60: =+A60*$D$7 -> 729.19880000000012 | D60: =+B60*$D$7 -> 47.626400000000004 | F60: Raymond (24 Hr Chevron)
A61: =+A60+B61 -> 477.9 | B61: 24.7 | C61: =+A61*$D$7 -> 768.94110000000012 | D61: =+B61*$D$7 -> 39.7423 | F61: at stop light across bridge
A62: =+A61+B62 -> 478.4 | B62: 0.5 | C62: =+A62*$D$7 -> 769.74560000000019 | D62: =+B62*$D$7 -> 0.80449999999999999 | E62: #8 | F62: Hwy 12 (Aberdeen)
A63: =+A62+B63 -> 488.5 | B63: 10.1 | C63: =+A63*$D$7 -> 785.9965000000002 | D63: =+B63*$D$7 -> 16.250899999999998 | F63: SR 107 Exit
A64: =+A63+B64 -> 488.8 | B64: 00.3 | C64: =+A64*$D$7 -> 786.47920000000022 | D64: =+B64*$D$7 -> 0.48269999999999996 | F64: SR 107
A65: =+A64+B65 -> 489.1 | B65: 00.3 | C65: =+A65*$D$7 -> 786.96190000000024 | D65: =+B65*$D$7 -> 0.48269999999999996 | F65: Pioneer Ave/Old Hwy 410
A66: =+A65+B66 -> 505.7 | B66: 16.6 | C66: =+A66*$D$7 -> 813.6713000000002 | D66: =+B66*$D$7 -> 26.709400000000002 | F66: SR 108
A67: =+A66+B67 -> 506.7 | B67: 1.0 | C67: =+A67*$D$7 -> 815.28030000000024 | D67: =+B67*$D$7 -> 1.609 | F67: SR 108
A68: =+A67+B68 -> 507.5 | B68: 00.8 | C68: =+A68*$D$7 -> 816.5675 | D68: =+B68*$D$7 -> 1.2872000000000001 | F68: SR 108
A69: =+A68+B69 -> 517.5 | B69: 10.0 | C69: =+A69*$D$7 -> 832.65750000000003 | D69: =+B69*$D$7 -> 16.09 | F69: Hwy 101
A70: =+A69+B70 -> 525.3 | B70: 7.8 | C70: =+A70*$D$7 -> 845.20770000000027 | D70: =+B70*$D$7 -> 12.5502 | E70: #9 | F70: Shelton @ Olympic Highway Exit 9 (AM/PM, Denny's)
A71: =+A70+B71 -> 525.3 | B71: 0.0 | C71: =+A71*$D$7 -> 845.20770000000027 | D71: =+B71*$D$7 -> 0.0 | F71: Hwy 101 - Continue North
A72: =+A71+B72 -> 575.3 | B72: 50.0 | C72: =+A72*$D$7 -> 925.65770000000032 | D72: =+B72*$D$7 -> 80.45 | F72: Center St/Quilcene
A73: =+A72+B73 -> 592.4 | B73: 17.1 | C73: =+A73*$D$7 -> 953.17160000000035 | D73: =+B73*$D$7 -> 27.513900000000003 | E73: #10 | F73: Port Hadlock (QFC 24 Hr)
A74: =+A73+B74 -> 592.4 | B74: 0.0 | C74: =+A74*$D$7 -> 953.17160000000035 | D74: =+B74*$D$7 -> 0.0 | F74: SR116/Oak Bay Rd
A75: =+A74+B75 -> 602.2 | B75: 9.8 | C75: =+A75*$D$7 -> 968.93980000000022 | D75: =+B75*$D$7 -> 15.7682 | F75: Paradise Bay Rd
A76: =+A75+B76 -> 608.2 | B76: 6.0 | C76: =+A76*$D$7 -> 978.59380000000021 | D76: =+B76*$D$7 -> 9.6539999999999999 | F76: SR104
A77: =+A76+B77 -> 608.2 | B77: 0.0 | C77: =+A77*$D$7 -> 978.59380000000021 | D77: =+B77*$D$7 -> 0.0 | F77: CAUTION Hood Canal Bridge
A78: =+A77+B78 -> 610.0 | B78: 1.8 | C78: =+A78*$D$7 -> 981.49 | D78: =+B78*$D$7 -> 2.8961999999999999 | F78: SR3
A79: =+A78+B79 -> 612.9 | B79: 2.9 | C79: =+A79*$D$7 -> 986.15610000000015 | D79: =+B79*$D$7 -> 4.6661000000000001 | F79: Big Valley Rd (at Chevron)
A80: =+A79+B80 -> 617.6 | B80: 4.7 | C80: =+A80*$D$7 -> 993.7184000000002 | D80: =+B80*$D$7 -> 7.5623000000000005 | F80: Little Valley Rd (cross SR307)
A81: =+A80+B81 -> 618.3 | B81: 00.7 | C81: =+A81*$D$7 -> 994.84470000000033 | D81: =+B81*$D$7 -> 1.1262999999999999
A82: =+A81+B82 -> 618.3 | B82: 0.0 | C82: =+A82*$D$7 -> 994.84470000000033 | D82: =+B82*$D$7 -> 0.0 | F82: SR305
A83: =+A82+B83 -> 623.9 | B83: 5.6 | C83: =+A83*$D$7 -> 1003.8551000000003 | D83: =+B83*$D$7 -> 9.0103999999999989 | F83: CAUTION Agate Pass Bridge
A84: =+A83+B84 -> 629.9 | B84: 6.0 | C84: =+A84*$D$7 -> 1013.5091000000003 | D84: =+B84*$D$7 -> 9.6539999999999999 | F84: NE High School Rd
A85: =+A84+B85 -> 630.0 | B85: 00.1 | C85: =+A85*$D$7 -> 1013.67 | D85: =+B85*$D$7 -> 0.16090000000000002 | F85: Hildebrand Ln NE
A86: =+A85+B86 -> 630.2 | B86: 00.2 | C86: =+A86*$D$7 -> 1013.9918000000005 | D86: =+B86*$D$7 -> 0.32180000000000003 | E86: #11 | F86: Island Country Inn (FINSH)