A1: Seattle Randonneurs 1000 km Brevet
A2: Ballard, Portland, Ballard, Sumas, Ballard
A4: Created By: | D4: John Wagner
A5: Verified By: | D5: John Wagner
A6: Year(s) Used: | D6: ???
A7: Conversion(Mi-Km) | D7: 1.609
A9: Miles | C9: Km
A10: Total | B10: Leg | C10: Total | D10: Leg | E10: Ctrl | F10: Instructions
A11: 0.0 | B11: 0.0 | C11: =+A11*$D$7 -> 0.0 | D11: =+B11*$D$7 -> 0.0 | E11: #1 | F11: #1 - L onto 75th Ave NW
A12: =+A11+B12 -> 00.1 | B12: 00.1 | C12: =+A12*$D$7 -> 0.16090000000000002 | D12: =+B12*$D$7 -> 0.16090000000000002 | F12: R onto 28th St NW
A13: =+A12+B13 -> 1.1 | B13: 1.0 | C13: =+A13*$D$7 -> 1.7699 | D13: =+B13*$D$7 -> 1.609 | F13: L onto Market St
A14: =+A13+B14 -> 1.3 | B14: 00.2 | C14: =+A14*$D$7 -> 2.0916999999999999 | D14: =+B14*$D$7 -> 0.32180000000000003 | F14: R onto Shilshole Ave NW
A15: =+A14+B15 -> 2.0 | B15: 00.7 | C15: =+A15*$D$7 -> 3.218 | D15: =+B15*$D$7 -> 1.1262999999999999 | F15: BL onto NW 46th St
A16: =+A15+B16 -> 2.5 | B16: 0.5 | C16: =+A16*$D$7 -> 4.0225 | D16: =+B16*$D$7 -> 0.80449999999999999 | F16: R onto Leary Way NW
A17: =+A16+B17 -> 3.7 | B17: 1.2 | C17: =+A17*$D$7 -> 5.9533000000000005 | D17: =+B17*$D$7 -> 1.9307999999999998 | F17: ST x - onto 35th St
A18: =+A17+B18 -> 3.8 | B18: 00.1 | C18: =+A18*$D$7 -> 6.1142000000000003 | D18: =+B18*$D$7 -> 0.16090000000000002 | F18: R onto Aurora (under bridge)
A19: =+A18+B19 -> 3.9 | B19: 00.1 | C19: =+A19*$D$7 -> 6.2751000000000001 | D19: =+B19*$D$7 -> 0.16090000000000002 | F19: L onto 34th St
A20: =+A19+B20 -> 4.1 | B20: 00.2 | C20: =+A20*$D$7 -> 6.5969000000000007 | D20: =+B20*$D$7 -> 0.32180000000000003 | F20: R onto Stone Way (Northlake)
A21: =+A20+B21 -> 5.4 | B21: 1.3 | C21: =+A21*$D$7 -> 8.688600000000001 | D21: =+B21*$D$7 -> 2.0916999999999999 | F21: R onto Pacific St
A22: =+A21+B22 -> 6.3 | B22: 00.9 | C22: =+A22*$D$7 -> 10.136700000000001 | D22: =+B22*$D$7 -> 1.4480999999999999 | F22: R onto Montlake Blv NE
A23: =+A22+B23 -> 6.7 | B23: 00.4 | C23: =+A23*$D$7 -> 10.780300000000002 | D23: =+B23*$D$7 -> 0.64360000000000006 | F23: L onto Lake Washigton Blv
A24: =+A23+B24 -> 7.3 | B24: 00.6 | C24: =+A24*$D$7 -> 11.745700000000001 | D24: =+B24*$D$7 -> 0.96539999999999992 | F24: BR stay on Lk Wash Blv (LWB)
A25: =+A24+B25 -> 8.4 | B25: 1.1 | C25: =+A25*$D$7 -> 13.515600000000001 | D25: =+B25*$D$7 -> 1.7699 | F25: ST x - Madison, stay on LWB
A26: =+A25+B26 -> 8.9 | B26: 0.5 | C26: =+A26*$D$7 -> 14.3201 | D26: =+B26*$D$7 -> 0.80449999999999999 | F26: BR stay on LWB
A27: =+A26+B27 -> 9.1 | B27: 00.2 | C27: =+A27*$D$7 -> 14.6419 | D27: =+B27*$D$7 -> 0.32180000000000003 | F27: ST x - Gilvra, stay on LWB
A28: =+A27+B28 -> 9.8 | B28: 00.7 | C28: =+A28*$D$7 -> 15.768199999999998 | D28: =+B28*$D$7 -> 1.1262999999999999 | F28: ST x - Madrona Dr, stay on LWB
A29: =+A28+B29 -> 14.9 | B29: 5.1 | C29: =+A29*$D$7 -> 23.974099999999996 | D29: =+B29*$D$7 -> 8.2058999999999997 | F29: R onto Juneu St
A30: =+A29+B30 -> 15.0 | B30: 00.1 | C30: =+A30*$D$7 -> 24.135000000000002 | D30: =+B30*$D$7 -> 0.16090000000000002 | F30: L onto Seward Park Ave S
A31: =+A30+B31 -> 15.4 | B31: 00.4 | C31: =+A31*$D$7 -> 24.778599999999997 | D31: =+B31*$D$7 -> 0.64360000000000006 | F31: L stay on Lake Wash Blv
A32: =+A31+B32 -> 17.3 | B32: 1.9 | C32: =+A32*$D$7 -> 27.835699999999996 | D32: =+B32*$D$7 -> 3.0570999999999997 | F32: L onto Rainier Ave S
A33: =+A32+B33 -> 20.9 | B33: 3.6 | C33: =+A33*$D$7 -> 33.628099999999996 | D33: =+B33*$D$7 -> 5.7923999999999998 | F33: R onto Nelson Pl (bike route)
A34: =+A33+B34 -> 21.1 | B34: 00.2 | C34: =+A34*$D$7 -> 33.9499 | D34: =+B34*$D$7 -> 0.32180000000000003 | F34: R onto Renton Ave
A35: =+A34+B35 -> 21.3 | B35: 00.2 | C35: =+A35*$D$7 -> 34.271699999999996 | D35: =+B35*$D$7 -> 0.32180000000000003 | F35: L onto Hardie Ave Sw
A36: =+A35+B36 -> 21.5 | B36: 00.2 | C36: =+A36*$D$7 -> 34.593499999999992 | D36: =+B36*$D$7 -> 0.32180000000000003 | F36: X Sunset (stay on Hardie)
A37: =+A36+B37 -> 22.0 | B37: 0.5 | C37: =+A37*$D$7 -> 35.397999999999996 | D37: =+B37*$D$7 -> 0.80449999999999999 | F37: R onto SW 7th st
A38: =+A37+B38 -> 22.9 | B38: 00.9 | C38: =+A38*$D$7 -> 36.846099999999993 | D38: =+B38*$D$7 -> 1.4480999999999999 | F38: L onto Oaks dale Ave SW
A39: =+A38+B39 -> 23.2 | B39: 00.3 | C39: =+A39*$D$7 -> 37.328799999999994 | D39: =+B39*$D$7 -> 0.48269999999999996 | F39: R onto Grady Way
A40: =+A39+B40 -> 23.9 | B40: 00.7 | C40: =+A40*$D$7 -> 38.455099999999995 | D40: =+B40*$D$7 -> 1.1262999999999999 | F40: L onto Interurban/W. Valley
A41: =+A40+B41 -> 26.5 | B41: 2.6 | C41: =+A41*$D$7 -> 42.638499999999993 | D41: =+B41*$D$7 -> 4.1833999999999998 | F41: KENT city
A42: =+A41+B42 -> 32.4 | B42: 5.9 | C42: =+A42*$D$7 -> 52.131599999999999 | D42: =+B42*$D$7 -> 9.4931000000000001 | F42: AUBURN city
A43: =+A42+B43 -> 36.1 | B43: 3.7 | C43: =+A43*$D$7 -> 58.084900000000005 | D43: =+B43*$D$7 -> 5.9533000000000005 | F43: ALGONA city
A44: =+A43+B44 -> 37.4 | B44: 1.3 | C44: =+A44*$D$7 -> 60.176600000000001 | D44: =+B44*$D$7 -> 2.0916999999999999 | F44: PACIFIC city
A45: =+A44+B45 -> 41.7 | B45: 4.3 | C45: =+A45*$D$7 -> 67.095299999999995 | D45: =+B45*$D$7 -> 6.9186999999999994 | F45: SUMNER city
A46: =+A45+B46 -> 42.5 | B46: 00.8 | C46: =+A46*$D$7 -> 68.382499999999993 | D46: =+B46*$D$7 -> 1.2872000000000001 | F46: Left at Sumner Hts Dr
A47: =+A46+B47 -> 42.6 | B47: 00.1 | C47: =+A47*$D$7 -> 68.543399999999991 | D47: =+B47*$D$7 -> 0.16090000000000002 | F47: Right at Valley Ave E.
A48: =+A47+B48 -> 44.2 | B48: 1.6 | C48: =+A48*$D$7 -> 71.117799999999988 | D48: =+B48*$D$7 -> 2.5744000000000002 | F48: Left at Milwaukee Ave E .
A49: =+A48+B49 -> 44.8 | B49: 00.6 | C49: =+A49*$D$7 -> 72.083199999999991 | D49: =+B49*$D$7 -> 0.96539999999999992 | F49: PUYALLUP city
A50: =+A49+B50 -> 45.3 | B50: 0.5 | C50: =+A50*$D$7 -> 72.887699999999995 | D50: =+B50*$D$7 -> 0.80449999999999999 | F50: Right at E. Pioneer Ave
A51: =+A50+B51 -> 48.6 | B51: 3.3 | C51: =+A51*$D$7 -> 78.197399999999988 | D51: =+B51*$D$7 -> 5.3096999999999994 | F51: Left onto Canyon Rd E.
A52: =+A51+B52 -> 54.6 | B52: 6.0 | C52: =+A52*$D$7 -> 87.851399999999984 | D52: =+B52*$D$7 -> 9.6539999999999999 | F52: Right onto Military Rd E.
A53: =+A52+B53 -> 55.4 | B53: 00.8 | C53: =+A53*$D$7 -> 89.138599999999983 | D53: =+B53*$D$7 -> 1.2872000000000001 | F53: Left at Y to stay on Military Rd E .
A54: =+A53+B54 -> 57.5 | B54: 2.1 | C54: =+A54*$D$7 -> 92.517499999999998 | D54: =+B54*$D$7 -> 3.3789000000000002 | F54: SPANAWAY city
A55: =+A54+B55 -> 58.6 | B55: 1.1 | C55: =+A55*$D$7 -> 94.287399999999991 | D55: =+B55*$D$7 -> 1.7699 | F55: Left onto Pacific Ave S.
A56: =+A55+B56 -> 60.6 | B56: 2.0 | C56: =+A56*$D$7 -> 97.505399999999995 | D56: =+B56*$D$7 -> 3.218 | F56: Right onto SR 507
A57: =+A56+B57 -> 68.2 | B57: 7.6 | C57: =+A57*$D$7 -> 109.73379999999997 | D57: =+B57*$D$7 -> 12.228399999999999 | F57: ROY city
A58: =+A57+B58 -> 72.9 | B58: 4.7 | C58: =+A58*$D$7 -> 117.29609999999998 | D58: =+B58*$D$7 -> 7.5623000000000005 | F58: McKENNA city
A59: =+A58+B59 -> 75.0 | B59: 2.1 | C59: =+A59*$D$7 -> 120.675 | D59: =+B59*$D$7 -> 3.3789000000000002 | F59: YELM city
A60: =+A59+B60 -> 76.2 | B60: 1.2 | C60: =+A60*$D$7 -> 122.60579999999997 | D60: =+B60*$D$7 -> 1.9307999999999998 | F60: Left on S First St
A61: =+A60+B61 -> 80.3 | B61: 4.1 | C61: =+A61*$D$7 -> 129.20269999999996 | D61: =+B61*$D$7 -> 6.5968999999999998 | F61: RAINIER city
A62: =+A61+B62 -> 88.8 | B62: 8.5 | C62: =+A62*$D$7 -> 142.87919999999997 | D62: =+B62*$D$7 -> 13.676500000000001 | E62: #2 | F62: POINT - TENINO Jackpot Service Station
A63: =+A62+B63 -> 90.4 | B63: 1.6 | C63: =+A63*$D$7 -> 145.45359999999997 | D63: =+B63*$D$7 -> 2.5744000000000002 | F63: Left to stay on SR-507
A64: =+A63+B64 -> 93.8 | B64: 3.4 | C64: =+A64*$D$7 -> 150.92419999999998 | D64: =+B64*$D$7 -> 5.4706000000000001 | F64: BUCODA city
A65: =+A64+B65 -> 99.8 | B65: 6.0 | C65: =+A65*$D$7 -> 160.57819999999998 | D65: =+B65*$D$7 -> 9.6539999999999999 | F65: CENTRALIA city
A66: =+A65+B66 -> 102.2 | B66: 2.4 | C66: =+A66*$D$7 -> 164.43979999999999 | D66: =+B66*$D$7 -> 3.8615999999999997 | F66: Right on W. First St.
A67: =+A66+B67 -> 103.4 | B67: 1.2 | C67: =+A67*$D$7 -> 166.3706 | D67: =+B67*$D$7 -> 1.9307999999999998 | F67: Right on Harrison Ave W
A68: =+A67+B68 -> 103.7 | B68: 00.3 | C68: =+A68*$D$7 -> 166.85329999999999 | D68: =+B68*$D$7 -> 0.48269999999999996 | F68: Left on Harrison Ave E
A69: =+A68+B69 -> 104.8 | B69: 1.1 | C69: =+A69*$D$7 -> 168.62319999999997 | D69: =+B69*$D$7 -> 1.7699 | F69: Right at Yew St
A70: =+A69+B70 -> 105.3 | B70: 0.5 | C70: =+A70*$D$7 -> 169.42769999999996 | D70: =+B70*$D$7 -> 0.80449999999999999 | F70: Right at Mellon St
A71: =+A70+B71 -> 105.6 | B71: 00.3 | C71: =+A71*$D$7 -> 169.91039999999995 | D71: =+B71*$D$7 -> 0.48269999999999996 | F71: Left at NW Airport Rd
A72: =+A71+B72 -> 109.4 | B72: 3.8 | C72: =+A72*$D$7 -> 176.02459999999996 | D72: =+B72*$D$7 -> 6.1141999999999994 | F72: Sharp Right onto NW Louisiana Ave
A73: =+A72+B73 -> 111.2 | B73: 1.8 | C73: =+A73*$D$7 -> 178.92079999999996 | D73: =+B73*$D$7 -> 2.8961999999999999 | F73: Left on Shorey Rd
A74: =+A73+B74 -> 113.2 | B74: 2.0 | C74: =+A74*$D$7 -> 182.13879999999995 | D74: =+B74*$D$7 -> 3.218 | F74: Left onto SR-603
A75: =+A74+B75 -> 117.2 | B75: 4.0 | C75: =+A75*$D$7 -> 188.57479999999995 | D75: =+B75*$D$7 -> 6.4359999999999999 | F75: NAPAVINE city
A76: =+A75+B76 -> 123.2 | B76: 6.0 | C76: =+A76*$D$7 -> 198.22879999999995 | D76: =+B76*$D$7 -> 9.6539999999999999 | F76: WINLOCK city
A77: =+A76+B77 -> 124.2 | B77: 1.0 | C77: =+A77*$D$7 -> 199.83779999999996 | D77: =+B77*$D$7 -> 1.609 | F77: Left on Winlock-Vader Rd
A78: =+A77+B78 -> 131.2 | B78: 7.0 | C78: =+A78*$D$7 -> 211.10079999999999 | D78: =+B78*$D$7 -> 11.263 | F78: VADER city
A79: =+A78+B79 -> 132.2 | B79: 1.0 | C79: =+A79*$D$7 -> 212.70979999999997 | D79: =+B79*$D$7 -> 1.609 | F79: Right onto SR-411
A80: =+A79+B80 -> 147.2 | B80: 15.0 | C80: =+A80*$D$7 -> 236.84479999999999 | D80: =+B80*$D$7 -> 24.135000000000002 | F80: LEXINGTON (unicorp)
A81: =+A80+B81 -> 151.2 | B81: 4.0 | C81: =+A81*$D$7 -> 243.28079999999997 | D81: =+B81*$D$7 -> 6.4359999999999999 | F81: LONGVIEW city
A82: =+A81+B82 -> 152.2 | B82: 1.0 | C82: =+A82*$D$7 -> 244.88979999999998 | D82: =+B82*$D$7 -> 1.609 | F82: KELSO city
A83: =+A82+B83 -> 153.2 | B83: 1.0 | C83: =+A83*$D$7 -> 246.49879999999999 | D83: =+B83*$D$7 -> 1.609 | F83: LONGVIEW city
A84: =+A83+B84 -> 155.2 | B84: 2.0 | C84: =+A84*$D$7 -> 249.71679999999998 | D84: =+B84*$D$7 -> 3.218 | F84: Left onto Oregon Way (SR-433)
A85: =+A84+B85 -> 157.2 | B85: 2.0 | C85: =+A85*$D$7 -> 252.93479999999997 | D85: =+B85*$D$7 -> 3.218 | F85: RAINIER OREGON
A86: =+A85+B86 -> 160.2 | B86: 3.0 | C86: =+A86*$D$7 -> 257.76179999999999 | D86: =+B86*$D$7 -> 4.827 | F86: LINBERG city
A87: =+A86+B87 -> 165.2 | B87: 5.0 | C87: =+A87*$D$7 -> 265.80679999999995 | D87: =+B87*$D$7 -> 8.0449999999999999 | F87: GOBLE city
A88: =+A87+B88 -> 172.2 | B88: 7.0 | C88: =+A88*$D$7 -> 277.06979999999999 | D88: =+B88*$D$7 -> 11.263 | F88: DEER ISLAND
A89: =+A88+B89 -> 179.2 | B89: 7.0 | C89: =+A89*$D$7 -> 288.33279999999996 | D89: =+B89*$D$7 -> 11.263 | F89: ST. HELENS city
A90: =+A89+B90 -> 185.2 | B90: 6.0 | C90: =+A90*$D$7 -> 297.98679999999996 | D90: =+B90*$D$7 -> 9.6539999999999999 | F90: SCAPPOOSE city
A91: =+A90+B91 -> 194.2 | B91: 9.0 | C91: =+A91*$D$7 -> 312.46779999999995 | D91: =+B91*$D$7 -> 14.481 | F91: BURLINGTON city
A92: =+A91+B92 -> 198.0 | B92: 3.8 | C92: =+A92*$D$7 -> 318.58199999999999 | D92: =+B92*$D$7 -> 6.1141999999999994 | E92: #3 | F92: LINNTON city - Seven - 11 on left
A93: =+A92+B93 -> 238.6 | B93: 40.6 | C93: =+A93*$D$7 -> 383.9074 | D93: =+B93*$D$7 -> 65.325400000000002 | F93: Right towards Longview Bridge (return to Seattle)
A94: =+A93+B94 -> 240.9 | B94: 2.3 | C94: =+A94*$D$7 -> 387.60809999999998 | D94: =+B94*$D$7 -> 3.7006999999999999 | F94: Right onto Industrial Way
A95: =+A94+B95 -> 241.9 | B95: 1.0 | C95: =+A95*$D$7 -> 389.21710000000002 | D95: =+B95*$D$7 -> 1.609 | F95: Left turn onto 3rd Ave Becomes 1 st Ave becomes SR411
A96: =+A95+B96 -> 263.7 | B96: 21.8 | C96: =+A96*$D$7 -> 424.29329999999999 | D96: =+B96*$D$7 -> 35.0762 | F96: Left onto SR-506 to Vader
A97: =+A96+B97 -> 264.8 | B97: 1.1 | C97: =+A97*$D$7 -> 426.06319999999999 | D97: =+B97*$D$7 -> 1.7699 | F97: Right onto Vader-Winlock Rd becomes SR-603
A98: =+A97+B98 -> 277.8 | B98: 13.0 | C98: =+A98*$D$7 -> 446.98020000000002 | D98: =+B98*$D$7 -> 20.917000000000002 | F98: Left onto W. Washington (SR-603)
A99: =+A98+B99 -> 282.2 | B99: 4.4 | C99: =+A99*$D$7 -> 454.0598 | D99: =+B99*$D$7 -> 7.0796000000000001 | F99: Right onto Shorey Rd becomes Newaukum
A100: =+A99+B100 -> 285.9 | B100: 3.7 | C100: =+A100*$D$7 -> 460.01309999999995 | D100: =+B100*$D$7 -> 5.9533000000000005 | F100: Left onto Airport Way
A101: =+A100+B101 -> 286.2 | B101: 00.3 | C101: =+A101*$D$7 -> 460.49579999999997 | D101: =+B101*$D$7 -> 0.48269999999999996 | F101: Right to stay on Airport Way
A102: =+A101+B102 -> 289.6 | B102: 3.4 | C102: =+A102*$D$7 -> 465.96639999999996 | D102: =+B102*$D$7 -> 5.4706000000000001 | F102: Right onto SR-507 becomes Mellen Alder then Cherry St
A103: =+A102+B103 -> 290.7 | B103: 1.1 | C103: =+A103*$D$7 -> 467.73629999999997 | D103: =+B103*$D$7 -> 1.7699 | F103: Left at S. Tower (SR-507)
A104: =+A103+B104 -> 291.9 | B104: 1.2 | C104: =+A104*$D$7 -> 469.66709999999995 | D104: =+B104*$D$7 -> 1.9307999999999998 | F104: Left at E. Sixth (SR-507)
A105: =+A104+B105 -> 292.0 | B105: 00.1 | C105: =+A105*$D$7 -> 469.82799999999997 | D105: =+B105*$D$7 -> 0.16090000000000002 | F105: Right at Pearl (SR-507)
A106: =+A105+B106 -> 303.4 | B106: 11.4 | C106: =+A106*$D$7 -> 488.17059999999998 | D106: =+B106*$D$7 -> 18.342600000000001 | E106: #4 | F106: TENINO Jackpot Service Station
A107: =+A106+B107 -> 311.9 | B107: 8.5 | C107: =+A107*$D$7 -> 501.84709999999995 | D107: =+B107*$D$7 -> 13.676500000000001 | F107: RAINIER city
A108: =+A107+B108 -> 317.1 | B108: 5.2 | C108: =+A108*$D$7 -> 510.21389999999997 | D108: =+B108*$D$7 -> 8.3667999999999996 | F108: YELM city
A109: =+A108+B109 -> 319.2 | B109: 2.1 | C109: =+A109*$D$7 -> 513.59280000000001 | D109: =+B109*$D$7 -> 3.3789000000000002 | F109: McKENNA city
A110: =+A109+B110 -> 324.0 | B110: 4.8 | C110: =+A110*$D$7 -> 521.31600000000003 | D110: =+B110*$D$7 -> 7.7231999999999994 | F110: ROY city
A111: =+A110+B111 -> 331.5 | B111: 7.5 | C111: =+A111*$D$7 -> 533.38350000000003 | D111: =+B111*$D$7 -> 12.067500000000001 | F111: Left onto Pacific Ave S
A112: =+A111+B112 -> 334.6 | B112: 3.1 | C112: =+A112*$D$7 -> 538.37139999999999 | D112: =+B112*$D$7 -> 4.9878999999999998 | F112: Right onto Military Rd Spanaway
A113: =+A112+B113 -> 336.7 | B113: 2.1 | C113: =+A113*$D$7 -> 541.75030000000004 | D113: =+B113*$D$7 -> 3.3789000000000002 | F113: Right at Y onto Military Rd
A114: =+A113+B114 -> 337.4 | B114: 00.7 | C114: =+A114*$D$7 -> 542.87660000000005 | D114: =+B114*$D$7 -> 1.1262999999999999 | F114: Left onto Canyon Rd E
A115: =+A114+B115 -> 343.5 | B115: 6.1 | C115: =+A115*$D$7 -> 552.69150000000013 | D115: =+B115*$D$7 -> 9.8148999999999997 | F115: Right down hill becomes Pioneer Ave.
A116: =+A115+B116 -> 346.8 | B116: 3.3 | C116: =+A116*$D$7 -> 558.00120000000015 | D116: =+B116*$D$7 -> 5.3096999999999994 | F116: Left onto Milwaukee Ave E
A117: =+A116+B117 -> 347.3 | B117: 0.5 | C117: =+A117*$D$7 -> 558.80570000000012 | D117: =+B117*$D$7 -> 0.80449999999999999 | F117: PUYALLUP city
A118: =+A117+B118 -> 347.9 | B118: 00.6 | C118: =+A118*$D$7 -> 559.77110000000016 | D118: =+B118*$D$7 -> 0.96539999999999992 | F118: Right at Vailey Ave E.
A119: =+A118+B119 -> 349.6 | B119: 1.7 | C119: =+A119*$D$7 -> 562.5064000000001 | D119: =+B119*$D$7 -> 2.7353000000000001 | F119: Left onto Sumner Hts Dr.
A120: =+A119+B120 -> 350.4 | B120: 00.8 | C120: =+A120*$D$7 -> 563.7936000000002 | D120: =+B120*$D$7 -> 1.2872000000000001 | F120: Right onto West Valley Hwy SUMNER
A121: =+A120+B121 -> 354.7 | B121: 4.3 | C121: =+A121*$D$7 -> 570.71230000000014 | D121: =+B121*$D$7 -> 6.9186999999999994 | F121: PACIFIC city
A122: =+A121+B122 -> 356.0 | B122: 1.3 | C122: =+A122*$D$7 -> 572.8040000000002 | D122: =+B122*$D$7 -> 2.0916999999999999 | F122: ALGONA city
A123: =+A122+B123 -> 359.7 | B123: 3.7 | C123: =+A123*$D$7 -> 578.75730000000021 | D123: =+B123*$D$7 -> 5.9533000000000005 | F123: AUBURN city
A124: =+A123+B124 -> 365.6 | B124: 5.9 | C124: =+A124*$D$7 -> 588.25040000000013 | D124: =+B124*$D$7 -> 9.4931000000000001 | F124: KENT city
A125: =+A124+B125 -> 368.2 | B125: 2.6 | C125: =+A125*$D$7 -> 592.43380000000013 | D125: =+B125*$D$7 -> 4.1833999999999998 | F125: R onto Grady Way
A126: =+A125+B126 -> 368.9 | B126: 00.7 | C126: =+A126*$D$7 -> 593.56010000000015 | D126: =+B126*$D$7 -> 1.1262999999999999 | F126: L onto Oaks dale Ave SW
A127: =+A126+B127 -> 369.2 | B127: 00.3 | C127: =+A127*$D$7 -> 594.04280000000017 | D127: =+B127*$D$7 -> 0.48269999999999996 | F127: R onto SW 7th st
A128: =+A127+B128 -> 370.1 | B128: 00.9 | C128: =+A128*$D$7 -> 595.49090000000012 | D128: =+B128*$D$7 -> 1.4480999999999999 | F128: L onto Hardie Ave SW
A129: =+A128+B129 -> 370.6 | B129: 0.5 | C129: =+A129*$D$7 -> 596.29540000000009 | D129: =+B129*$D$7 -> 0.80449999999999999 | F129: X Sunset (stay Hardie)
A130: =+A129+B130 -> 370.8 | B130: 00.2 | C130: =+A130*$D$7 -> 596.61720000000014 | D130: =+B130*$D$7 -> 0.32180000000000003 | F130: R onto Renton Ave
A131: =+A130+B131 -> 371.0 | B131: 00.2 | C131: =+A131*$D$7 -> 596.93900000000008 | D131: =+B131*$D$7 -> 0.32180000000000003 | F131: L onto Rainier Ave S
A132: =+A131+B132 -> 374.7 | B132: 3.7 | C132: =+A132*$D$7 -> 602.89230000000009 | D132: =+B132*$D$7 -> 5.9533000000000005 | F132: R onto Seward Park Ave S
A133: =+A132+B133 -> 376.6 | B133: 1.9 | C133: =+A133*$D$7 -> 605.94940000000008 | D133: =+B133*$D$7 -> 3.0570999999999997 | F133: R onto Juneu St
A134: =+A133+B134 -> 376.7 | B134: 00.1 | C134: =+A134*$D$7 -> 606.11030000000005 | D134: =+B134*$D$7 -> 0.16090000000000002 | F134: R onto Lake Wash Blv
A135: =+A134+B135 -> 384.9 | B135: 8.2 | C135: =+A135*$D$7 -> 619.30410000000006 | D135: =+B135*$D$7 -> 13.1938 | F135: R onto Montlake Blv NE
A136: =+A135+B136 -> 385.5 | B136: 00.6 | C136: =+A136*$D$7 -> 620.26950000000011 | D136: =+B136*$D$7 -> 0.96539999999999992 | F136: L onto Pacific St
A137: =+A136+B137 -> 385.9 | B137: 00.4 | C137: =+A137*$D$7 -> 620.9131000000001 | D137: =+B137*$D$7 -> 0.64360000000000006 | F137: BL onto Northlake Way
A138: =+A137+B138 -> 387.2 | B138: 1.3 | C138: =+A138*$D$7 -> 623.00480000000005 | D138: =+B138*$D$7 -> 2.0916999999999999 | F138: L onto 34th St
A139: =+A138+B139 -> 387.4 | B139: 00.2 | C139: =+A139*$D$7 -> 623.3266000000001 | D139: =+B139*$D$7 -> 0.32180000000000003 | F139: R onto Leary Way NW
A140: =+A139+B140 -> 388.6 | B140: 1.2 | C140: =+A140*$D$7 -> 625.25740000000008 | D140: =+B140*$D$7 -> 1.9307999999999998 | F140: L onto NW 46th St
A141: =+A140+B141 -> 389.1 | B141: 0.5 | C141: =+A141*$D$7 -> 626.06190000000004 | D141: =+B141*$D$7 -> 0.80449999999999999 | F141: BR onto Shilshole Ave NW
A142: =+A141+B142 -> 389.8 | B142: 00.7 | C142: =+A142*$D$7 -> 627.18820000000005 | D142: =+B142*$D$7 -> 1.1262999999999999 | F142: L onto Market St
A143: =+A142+B143 -> 390.0 | B143: 00.2 | C143: =+A143*$D$7 -> 627.51 | D143: =+B143*$D$7 -> 0.32180000000000003 | F143: R onto 28th St NW
A144: =+A143+B144 -> 391.0 | B144: 1.0 | C144: =+A144*$D$7 -> 629.11900000000003 | D144: =+B144*$D$7 -> 1.609 | F144: L onto 75th Ave NW
A145: =+A144+B145 -> 391.1 | B145: 00.1 | C145: =+A145*$D$7 -> 629.2799 | D145: =+B145*$D$7 -> 0.16090000000000002 | E145: #5 | F145: 7503 29th Ave NW 782-8965
A146: =+A145+B146 -> 391.1 | B146: 0.0 | C146: =+A146*$D$7 -> 629.2799 | D146: =+B146*$D$7 -> 0.0 | F146: L onto 75th
A147: =+A146+B147 -> 392.0 | B147: 00.9 | C147: =+A147*$D$7 -> 630.72799999999995 | D147: =+B147*$D$7 -> 1.4480999999999999 | F147: X - 15 Ave
A148: =+A147+B148 -> 392.9 | B148: 00.9 | C148: =+A148*$D$7 -> 632.17609999999991 | D148: =+B148*$D$7 -> 1.4480999999999999 | F148: X - Greenwood Ave
A149: =+A148+B149 -> 393.3 | B149: 00.4 | C149: =+A149*$D$7 -> 632.8196999999999 | D149: =+B149*$D$7 -> 0.64360000000000006 | F149: R - Linden Ave N, then L onto 74th
A150: =+A149+B150 -> 393.4 | B150: 00.1 | C150: =+A150*$D$7 -> 632.98059999999998 | D150: =+B150*$D$7 -> 0.16090000000000002 | F150: BL - Winona, X Arora Ave N
A151: =+A150+B151 -> 393.7 | B151: 00.3 | C151: =+A151*$D$7 -> 633.4633 | D151: =+B151*$D$7 -> 0.48269999999999996 | F151: Turns into Greenlake Way
A152: =+A151+B152 -> 394.7 | B152: 1.0 | C152: =+A152*$D$7 -> 635.07229999999993 | D152: =+B152*$D$7 -> 1.609 | F152: BL - Revenna Blv.
A153: =+A152+B153 -> 395.1 | B153: 00.4 | C153: =+A153*$D$7 -> 635.71589999999992 | D153: =+B153*$D$7 -> 0.64360000000000006 | F153: X - Under I-5
A154: =+A153+B154 -> 395.7 | B154: 00.6 | C154: =+A154*$D$7 -> 636.68129999999996 | D154: =+B154*$D$7 -> 0.96539999999999992 | F154: X - 15th Ave NE
A155: =+A154+B155 -> 396.2 | B155: 0.5 | C155: =+A155*$D$7 -> 637.48579999999993 | D155: =+B155*$D$7 -> 0.80449999999999999 | F155: L - 54th St , Jog R onto Revenna Pl
A156: =+A155+B156 -> 396.4 | B156: 00.2 | C156: =+A156*$D$7 -> 637.80759999999998 | D156: =+B156*$D$7 -> 0.32180000000000003 | F156: L - Blakeley, X 25th Ave NE, Get on B-G Trail
A157: =+A156+B157 -> 405.4 | B157: 9.0 | C157: =+A157*$D$7 -> 652.28859999999997 | D157: =+B157*$D$7 -> 14.481 | F157: Lake Forest Park and Burke-Gilman Trail continue on bike trail
A158: =+A157+B158 -> 407.9 | B158: 2.5 | C158: =+A158*$D$7 -> 656.31110000000001 | D158: =+B158*$D$7 -> 4.0225 | F158: BOTHELL city
A159: =+A158+B159 -> 409.0 | B159: 1.1 | C159: =+A159*$D$7 -> 658.08100000000002 | D159: =+B159*$D$7 -> 1.7699 | F159: Right at Intersection of SR-527 in Bothell get onto SR-522
A160: =+A159+B160 -> 409.8 | B160: 00.8 | C160: =+A160*$D$7 -> 659.3682 | D160: =+B160*$D$7 -> 1.2872000000000001 | F160: Exit SR-522 to right just beyond "Bicycles must Exit" sign onto Woodinville Drive which becomes Sammamish River Trail
A161: =+A160+B161 -> 411.3 | B161: 1.5 | C161: =+A161*$D$7 -> 661.7817 | D161: =+B161*$D$7 -> 2.4135 | F161: Left off trail after passing under railroad bridge and street bridge.
A162: =+A161+B162 -> 411.4 | B162: 00.1 | C162: =+A162*$D$7 -> 661.94260000000008 | D162: =+B162*$D$7 -> 0.16090000000000002 | F162: Left at Light onto 131 Ave N E
A163: =+A162+B163 -> 411.6 | B163: 00.2 | C163: =+A163*$D$7 -> 662.26440000000002 | D163: =+B163*$D$7 -> 0.32180000000000003 | F163: Right onto SR-522 East
A164: =+A163+B164 -> 413.4 | B164: 1.8 | C164: =+A164*$D$7 -> 665.16060000000004 | D164: =+B164*$D$7 -> 2.8961999999999999 | F164: Exit SR-522 then Left onto SR-9 North
A165: =+A164+B165 -> 417.4 | B165: 4.0 | C165: =+A165*$D$7 -> 671.59660000000008 | D165: =+B165*$D$7 -> 6.4359999999999999 | F165: CLEARVIEW
A166: =+A165+B166 -> 423.4 | B166: 6.0 | C166: =+A166*$D$7 -> 681.25060000000008 | D166: =+B166*$D$7 -> 9.6539999999999999 | F166: SNOHOMISH city
A167: =+A166+B167 -> 444.4 | B167: 21.0 | C167: =+A167*$D$7 -> 715.03960000000006 | D167: =+B167*$D$7 -> 33.789000000000001 | E167: #6 | F167: ARLINGTON city 7-11 at Intersection
A168: =+A167+B168 -> 449.4 | B168: 5.0 | C168: =+A168*$D$7 -> 723.08460000000002 | D168: =+B168*$D$7 -> 8.0449999999999999 | F168: BRYANT city
A169: =+A168+B169 -> 460.4 | B169: 11.0 | C169: =+A169*$D$7 -> 740.78360000000009 | D169: =+B169*$D$7 -> 17.698999999999998 | F169: McMURRAY city
A170: =+A169+B170 -> 470.4 | B170: 10.0 | C170: =+A170*$D$7 -> 756.87360000000001 | D170: =+B170*$D$7 -> 16.09 | F170: BIG LAKE
A171: =+A170+B171 -> 476.4 | B171: 6.0 | C171: =+A171*$D$7 -> 766.52760000000001 | D171: =+B171*$D$7 -> 9.6539999999999999 | F171: CLEAR LAKE
A172: =+A171+B172 -> 480.4 | B172: 4.0 | C172: =+A172*$D$7 -> 772.96360000000004 | D172: =+B172*$D$7 -> 6.4359999999999999 | F172: SEDRO WOOLLEY city
A173: =+A172+B173 -> 490.4 | B173: 10.0 | C173: =+A173*$D$7 -> 789.05360000000007 | D173: =+B173*$D$7 -> 16.09 | F173: WICKERSHAM city
A174: =+A173+B174 -> 495.4 | B174: 5.0 | C174: =+A174*$D$7 -> 797.09860000000003 | D174: =+B174*$D$7 -> 8.0449999999999999 | F174: ACME city
A175: =+A174+B175 -> 497.4 | B175: 2.0 | C175: =+A175*$D$7 -> 800.31659999999999 | D175: =+B175*$D$7 -> 3.218 | F175: CLIPPER city
A176: =+A175+B176 -> 499.4 | B176: 2.0 | C176: =+A176*$D$7 -> 803.53460000000007 | D176: =+B176*$D$7 -> 3.218 | F176: VAN ZANDT city
A177: =+A176+B177 -> 502.4 | B177: 3.0 | C177: =+A177*$D$7 -> 808.36160000000007 | D177: =+B177*$D$7 -> 4.827 | F177: DEMING city
A178: =+A177+B178 -> 507.4 | B178: 5.0 | C178: =+A178*$D$7 -> 816.40660000000003 | D178: =+B178*$D$7 -> 8.0449999999999999 | F178: NUGENTS CORNER
A179: =+A178+B179 -> 513.4 | B179: 6.0 | C179: =+A179*$D$7 -> 826.06060000000014 | D179: =+B179*$D$7 -> 9.6539999999999999 | F179: NOOKSACK city
A180: =+A179+B180 -> 518.4 | B180: 5.0 | C180: =+A180*$D$7 -> 834.10560000000009 | D180: =+B180*$D$7 -> 8.0449999999999999 | E180: #7 | F180: SUMAS city
A181: =+A180+B181 -> 523.4 | B181: 5.0 | C181: =+A181*$D$7 -> 842.15060000000017 | D181: =+B181*$D$7 -> 8.0449999999999999 | F181: NOOKSACK city
A182: =+A181+B182 -> 529.4 | B182: 6.0 | C182: =+A182*$D$7 -> 851.80460000000016 | D182: =+B182*$D$7 -> 9.6539999999999999 | F182: NUGENTS CORNER
A183: =+A182+B183 -> 534.4 | B183: 5.0 | C183: =+A183*$D$7 -> 859.84960000000012 | D183: =+B183*$D$7 -> 8.0449999999999999 | F183: DEMING city
A184: =+A183+B184 -> 537.4 | B184: 3.0 | C184: =+A184*$D$7 -> 864.67660000000012 | D184: =+B184*$D$7 -> 4.827 | F184: VAN ZANDT city
A185: =+A184+B185 -> 539.4 | B185: 2.0 | C185: =+A185*$D$7 -> 867.89460000000008 | D185: =+B185*$D$7 -> 3.218 | F185: CLIPPER city
A186: =+A185+B186 -> 541.4 | B186: 2.0 | C186: =+A186*$D$7 -> 871.11260000000016 | D186: =+B186*$D$7 -> 3.218 | F186: ACME city
A187: =+A186+B187 -> 546.4 | B187: 5.0 | C187: =+A187*$D$7 -> 879.15760000000012 | D187: =+B187*$D$7 -> 8.0449999999999999 | F187: WICKERSHAM city
A188: =+A187+B188 -> 556.4 | B188: 10.0 | C188: =+A188*$D$7 -> 895.24760000000015 | D188: =+B188*$D$7 -> 16.09 | F188: SEDRO WOOLLEY city
A189: =+A188+B189 -> 560.4 | B189: 4.0 | C189: =+A189*$D$7 -> 901.68360000000018 | D189: =+B189*$D$7 -> 6.4359999999999999 | F189: CLEAR LAKE
A190: =+A189+B190 -> 566.4 | B190: 6.0 | C190: =+A190*$D$7 -> 911.33760000000018 | D190: =+B190*$D$7 -> 9.6539999999999999 | F190: BIG LAKE
A191: =+A190+B191 -> 576.4 | B191: 10.0 | C191: =+A191*$D$7 -> 927.4276000000001 | D191: =+B191*$D$7 -> 16.09 | F191: McMURRAY city
A192: =+A191+B192 -> 587.4 | B192: 11.0 | C192: =+A192*$D$7 -> 945.12660000000017 | D192: =+B192*$D$7 -> 17.698999999999998 | F192: BRYANT city
A193: =+A192+B193 -> 591.4 | B193: 4.0 | C193: =+A193*$D$7 -> 951.56260000000009 | D193: =+B193*$D$7 -> 6.4359999999999999 | E193: #8 | F193: ARLINGTON citþ 7-11 at Intersection
A194: =+A193+B194 -> 612.4 | B194: 21.0 | C194: =+A194*$D$7 -> 985.35160000000019 | D194: =+B194*$D$7 -> 33.789000000000001 | F194: SNOHOMISH city
A195: =+A194+B195 -> 618.4 | B195: 6.0 | C195: =+A195*$D$7 -> 995.00560000000019 | D195: =+B195*$D$7 -> 9.6539999999999999 | F195: CLEARVIEW
A196: =+A195+B196 -> 622.4 | B196: 4.0 | C196: =+A196*$D$7 -> 1001.4416000000001 | D196: =+B196*$D$7 -> 6.4359999999999999 | F196: Right onto SR-522
A197: =+A196+B197 -> 624.4 | B197: 2.0 | C197: =+A197*$D$7 -> 1004.6596000000002 | D197: =+B197*$D$7 -> 3.218 | F197: WOODINVILLE city
A198: =+A197+B198 -> 624.5 | B198: 00.1 | C198: =+A198*$D$7 -> 1004.8205000000002 | D198: =+B198*$D$7 -> 0.16090000000000002 | F198: Exit SR-522 Right onto 175th St.
A199: =+A198+B199 -> 624.6 | B199: 00.1 | C199: =+A199*$D$7 -> 1004.9814000000002 | D199: =+B199*$D$7 -> 0.16090000000000002 | F199: Left onto Sammamish River Trail going west
A200: =+A199+B200 -> 624.7 | B200: 00.1 | C200: =+A200*$D$7 -> 1005.1423000000002 | D200: =+B200*$D$7 -> 0.16090000000000002 | F200: Pass under railroad bridge and street bridge on trail and head to Bothell
A201: =+A200+B201 -> 627.4 | B201: 2.7 | C201: =+A201*$D$7 -> 1009.4866000000003 | D201: =+B201*$D$7 -> 4.3443000000000005 | F201: Sammamish River Tral becomes Burke Gilman Trail in Bothell
A202: =+A201+B202 -> 629.9 | B202: 2.5 | C202: =+A202*$D$7 -> 1013.5091000000003 | D202: =+B202*$D$7 -> 4.0225 | F202: Lake Forest Park x Burke Gilman Trail continue on trail into Seattle
A203: =+A202+B203 -> 638.9 | B203: 9.0 | C203: =+A203*$D$7 -> 1027.9901000000002 | D203: =+B203*$D$7 -> 14.481 | F203: X 25th Ave NE, Get OFF B-G Trail
A204: =+A203+B204 -> 639.1 | B204: 00.2 | C204: =+A204*$D$7 -> 1028.3119000000004 | D204: =+B204*$D$7 -> 0.32180000000000003 | F204: L - 54th St , Jog R onto Revenna Pl
A205: =+A204+B205 -> 639.6 | B205: 0.5 | C205: =+A205*$D$7 -> 1029.1164000000003 | D205: =+B205*$D$7 -> 0.80449999999999999 | F205: X - 15th Ave NE
A206: =+A205+B206 -> 640.2 | B206: 00.6 | C206: =+A206*$D$7 -> 1030.0818000000004 | D206: =+B206*$D$7 -> 0.96539999999999992 | F206: X - Under I-5
A207: =+A206+B207 -> 640.6 | B207: 00.4 | C207: =+A207*$D$7 -> 1030.7254000000005 | D207: =+B207*$D$7 -> 0.64360000000000006 | F207: BL - Revenna Blv.
A208: =+A207+B208 -> 641.6 | B208: 1.0 | C208: =+A208*$D$7 -> 1032.3344000000004 | D208: =+B208*$D$7 -> 1.609 | F208: Turns into Greenlake Way
A209: =+A208+B209 -> 641.9 | B209: 00.3 | C209: =+A209*$D$7 -> 1032.8171000000002 | D209: =+B209*$D$7 -> 0.48269999999999996 | F209: BL - Winona, X Arora Ave N
A210: =+A209+B210 -> 642.0 | B210: 00.1 | C210: =+A210*$D$7 -> 1032.9780000000003 | D210: =+B210*$D$7 -> 0.16090000000000002 | F210: R - Linden Ave N, then L onto 74th
A211: =+A210+B211 -> 642.4 | B211: 00.4 | C211: =+A211*$D$7 -> 1033.6216000000004 | D211: =+B211*$D$7 -> 0.64360000000000006 | F211: X - Greenwood Ave
A212: =+A211+B212 -> 643.3 | B212: 00.9 | C212: =+A212*$D$7 -> 1035.0697000000002 | D212: =+B212*$D$7 -> 1.4480999999999999 | F212: X - 15 Ave
A213: =+A212+B213 -> 644.2 | B213: 00.9 | C213: =+A213*$D$7 -> 1036.5178000000003 | D213: =+B213*$D$7 -> 1.4480999999999999 | E213: #9 | F213: Finish - 7503 29th Ave NW