A1: Seattle Randonneurs 1000 km Brevet
A2: Seattle-Portland-Seattle-Sumas-Seattle
A4: Created By: | D4: Dan Wood
A5: Verified By: | D5: Dan Wood
A6: Year(s) Used: | D6: ???
A7: Conversion(Mi-Km) | D7: 1.609
A9: Miles | C9: Km
A10: Total | B10: Leg | C10: Total | D10: Leg | E10: Ctrl | F10: Instructions
A11: 0.0 | B11: 0.0 | C11: =+A11*$D$7 -> 0.0 | D11: =+B11*$D$7 -> 0.0 | E11: #1 | F11: Down University Blvd. to NE Campus Pkwy
A12: =+A11+B12 -> 1.0 | B12: 1.0 | C12: =+A12*$D$7 -> 1.609 | D12: =+B12*$D$7 -> 1.609 | F12: Right onto NE Campus Pkwy
A13: =+A12+B13 -> 1.1 | B13: 00.1 | C13: =+A13*$D$7 -> 1.7699 | D13: =+B13*$D$7 -> 0.16090000000000002 | F13: Follow N E Campus onto University Bridge
A14: =+A13+B14 -> 1.5 | B14: 00.4 | C14: =+A14*$D$7 -> 2.4135 | D14: =+B14*$D$7 -> 0.64360000000000006 | F14: NE Campus becomes Eastlake Ave E
A15: =+A14+B15 -> 2.5 | B15: 1.0 | C15: =+A15*$D$7 -> 4.0225 | D15: =+B15*$D$7 -> 1.609 | F15: Right onto Steward St.
A16: =+A15+B16 -> 3.0 | B16: 0.5 | C16: =+A16*$D$7 -> 4.827 | D16: =+B16*$D$7 -> 0.80449999999999999 | F16: Left onto 5th Ave
A17: =+A16+B17 -> 5.0 | B17: 2.0 | C17: =+A17*$D$7 -> 8.0449999999999999 | D17: =+B17*$D$7 -> 3.218 | F17: 5th Ave becomes Airport Way S .
A18: =+A17+B18 -> 8.5 | B18: 3.5 | C18: =+A18*$D$7 -> 13.676500000000001 | D18: =+B18*$D$7 -> 5.6315 | F18: Left at Y in Georgetown Dist.
A19: =+A18+B19 -> 11.7 | B19: 3.2 | C19: =+A19*$D$7 -> 18.825299999999999 | D19: =+B19*$D$7 -> 5.1488000000000005 | F19: Right onto Boeing Access Rd
A20: =+A19+B20 -> 11.8 | B20: 00.1 | C20: =+A20*$D$7 -> 18.986199999999997 | D20: =+B20*$D$7 -> 0.16090000000000002 | F20: Sharp Left onto E. Marginal Way S .
A21: =+A20+B21 -> 12.3 | B21: 0.5 | C21: =+A21*$D$7 -> 19.790699999999998 | D21: =+B21*$D$7 -> 0.80449999999999999 | F21: Left onto S. 115th St. before bridge
A22: =+A21+B22 -> 13.5 | B22: 1.2 | C22: =+A22*$D$7 -> 21.721499999999995 | D22: =+B22*$D$7 -> 1.9307999999999998 | F22: Left onto Interurban Ave S
A23: =+A22+B23 -> 15.7 | B23: 2.2 | C23: =+A23*$D$7 -> 25.261299999999999 | D23: =+B23*$D$7 -> 3.5398000000000001 | F23: TUKWILA X Green River
A24: =+A23+B24 -> 18.4 | B24: 2.7 | C24: =+A24*$D$7 -> 29.605599999999999 | D24: =+B24*$D$7 -> 4.3443000000000005 | F24: KENT city
A25: =+A24+B25 -> 24.3 | B25: 5.9 | C25: =+A25*$D$7 -> 39.098699999999994 | D25: =+B25*$D$7 -> 9.4931000000000001 | F25: AUBURN city
A26: =+A25+B26 -> 28.0 | B26: 3.7 | C26: =+A26*$D$7 -> 45.051999999999992 | D26: =+B26*$D$7 -> 5.9533000000000005 | F26: ALGONA city
A27: =+A26+B27 -> 29.3 | B27: 1.3 | C27: =+A27*$D$7 -> 47.143699999999995 | D27: =+B27*$D$7 -> 2.0916999999999999 | F27: PACIFIC city
A28: =+A27+B28 -> 33.6 | B28: 4.3 | C28: =+A28*$D$7 -> 54.06239999999999 | D28: =+B28*$D$7 -> 6.9186999999999994 | F28: SUMNER city
A29: =+A28+B29 -> 34.4 | B29: 00.8 | C29: =+A29*$D$7 -> 55.349599999999988 | D29: =+B29*$D$7 -> 1.2872000000000001 | F29: Left at Sumner Hts Dr
A30: =+A29+B30 -> 34.5 | B30: 00.1 | C30: =+A30*$D$7 -> 55.510499999999986 | D30: =+B30*$D$7 -> 0.16090000000000002 | F30: Right at Valley Ave E.
A31: =+A30+B31 -> 36.1 | B31: 1.6 | C31: =+A31*$D$7 -> 58.08489999999999 | D31: =+B31*$D$7 -> 2.5744000000000002 | F31: Left at Milwaukee Ave E .
A32: =+A31+B32 -> 36.7 | B32: 00.6 | C32: =+A32*$D$7 -> 59.050299999999993 | D32: =+B32*$D$7 -> 0.96539999999999992 | F32: PUYALLUP city
A33: =+A32+B33 -> 37.2 | B33: 0.5 | C33: =+A33*$D$7 -> 59.85479999999999 | D33: =+B33*$D$7 -> 0.80449999999999999 | F33: Right at E. Pioneer Ave
A34: =+A33+B34 -> 40.5 | B34: 3.3 | C34: =+A34*$D$7 -> 65.16449999999999 | D34: =+B34*$D$7 -> 5.3096999999999994 | F34: Left onto Canyon Rd E.
A35: =+A34+B35 -> 46.5 | B35: 6.0 | C35: =+A35*$D$7 -> 74.818499999999986 | D35: =+B35*$D$7 -> 9.6539999999999999 | F35: Right onto Military Rd E.
A36: =+A35+B36 -> 47.3 | B36: 00.8 | C36: =+A36*$D$7 -> 76.105699999999985 | D36: =+B36*$D$7 -> 1.2872000000000001 | F36: Left at Y to stay on Military Rd E .
A37: =+A36+B37 -> 49.4 | B37: 2.1 | C37: =+A37*$D$7 -> 79.484599999999986 | D37: =+B37*$D$7 -> 3.3789000000000002 | F37: SPANAWAY city
A38: =+A37+B38 -> 50.5 | B38: 1.1 | C38: =+A38*$D$7 -> 81.254499999999993 | D38: =+B38*$D$7 -> 1.7699 | F38: Left onto Pacific Ave S.
A39: =+A38+B39 -> 52.5 | B39: 2.0 | C39: =+A39*$D$7 -> 84.472499999999997 | D39: =+B39*$D$7 -> 3.218 | F39: Right onto SR 507
A40: =+A39+B40 -> 60.1 | B40: 7.6 | C40: =+A40*$D$7 -> 96.70089999999999 | D40: =+B40*$D$7 -> 12.228399999999999 | F40: ROY city
A41: =+A40+B41 -> 64.8 | B41: 4.7 | C41: =+A41*$D$7 -> 104.2632 | D41: =+B41*$D$7 -> 7.5623000000000005 | F41: McKENNA city
A42: =+A41+B42 -> 66.9 | B42: 2.1 | C42: =+A42*$D$7 -> 107.64209999999999 | D42: =+B42*$D$7 -> 3.3789000000000002 | F42: YELM city
A43: =+A42+B43 -> 68.1 | B43: 1.2 | C43: =+A43*$D$7 -> 109.57289999999999 | D43: =+B43*$D$7 -> 1.9307999999999998 | F43: Left on S First St
A44: =+A43+B44 -> 72.2 | B44: 4.1 | C44: =+A44*$D$7 -> 116.16979999999998 | D44: =+B44*$D$7 -> 6.5968999999999998 | F44: RAINIER city
A45: =+A44+B45 -> 80.7 | B45: 8.5 | C45: =+A45*$D$7 -> 129.84629999999999 | D45: =+B45*$D$7 -> 13.676500000000001 | E45: #2 | F45: TENINO Jackpot Service Station
A46: =+A45+B46 -> 82.3 | B46: 1.6 | C46: =+A46*$D$7 -> 132.42069999999998 | D46: =+B46*$D$7 -> 2.5744000000000002 | F46: Left to stay on SR-507
A47: =+A46+B47 -> 85.7 | B47: 3.4 | C47: =+A47*$D$7 -> 137.89129999999997 | D47: =+B47*$D$7 -> 5.4706000000000001 | F47: BUCODA city
A48: =+A47+B48 -> 91.7 | B48: 6.0 | C48: =+A48*$D$7 -> 147.54529999999997 | D48: =+B48*$D$7 -> 9.6539999999999999 | F48: CENTRALIA city
A49: =+A48+B49 -> 94.1 | B49: 2.4 | C49: =+A49*$D$7 -> 151.40689999999998 | D49: =+B49*$D$7 -> 3.8615999999999997 | F49: Right on W. First St.
A50: =+A49+B50 -> 95.3 | B50: 1.2 | C50: =+A50*$D$7 -> 153.33769999999998 | D50: =+B50*$D$7 -> 1.9307999999999998 | F50: Right on Harrison Ave W
A51: =+A50+B51 -> 95.6 | B51: 00.3 | C51: =+A51*$D$7 -> 153.82039999999998 | D51: =+B51*$D$7 -> 0.48269999999999996 | F51: Left on Harrison Ave E
A52: =+A51+B52 -> 96.7 | B52: 1.1 | C52: =+A52*$D$7 -> 155.59029999999998 | D52: =+B52*$D$7 -> 1.7699 | F52: Right at Yew St
A53: =+A52+B53 -> 97.2 | B53: 0.5 | C53: =+A53*$D$7 -> 156.39479999999998 | D53: =+B53*$D$7 -> 0.80449999999999999 | F53: Right at Mellon St
A54: =+A53+B54 -> 97.5 | B54: 00.3 | C54: =+A54*$D$7 -> 156.8775 | D54: =+B54*$D$7 -> 0.48269999999999996 | F54: Left at NW Airport Rd
A55: =+A54+B55 -> 101.3 | B55: 3.8 | C55: =+A55*$D$7 -> 162.99169999999998 | D55: =+B55*$D$7 -> 6.1141999999999994 | F55: Sharp Right onto NW Louisiana Ave
A56: =+A55+B56 -> 103.1 | B56: 1.8 | C56: =+A56*$D$7 -> 165.88789999999997 | D56: =+B56*$D$7 -> 2.8961999999999999 | F56: Left on Shorey Rd
A57: =+A56+B57 -> 105.1 | B57: 2.0 | C57: =+A57*$D$7 -> 169.10589999999996 | D57: =+B57*$D$7 -> 3.218 | F57: Left onto SR-603
A58: =+A57+B58 -> 109.1 | B58: 4.0 | C58: =+A58*$D$7 -> 175.54189999999997 | D58: =+B58*$D$7 -> 6.4359999999999999 | F58: NAPAVINE city
A59: =+A58+B59 -> 115.1 | B59: 6.0 | C59: =+A59*$D$7 -> 185.19589999999997 | D59: =+B59*$D$7 -> 9.6539999999999999 | F59: WINLOCK city
A60: =+A59+B60 -> 116.1 | B60: 1.0 | C60: =+A60*$D$7 -> 186.80489999999998 | D60: =+B60*$D$7 -> 1.609 | F60: Left on Winlock-Vader Rd
A61: =+A60+B61 -> 123.1 | B61: 7.0 | C61: =+A61*$D$7 -> 198.06789999999998 | D61: =+B61*$D$7 -> 11.263 | F61: VADER city
A62: =+A61+B62 -> 124.1 | B62: 1.0 | C62: =+A62*$D$7 -> 199.67689999999996 | D62: =+B62*$D$7 -> 1.609 | F62: Right onto SR-411
A63: =+A62+B63 -> 139.1 | B63: 15.0 | C63: =+A63*$D$7 -> 223.81189999999995 | D63: =+B63*$D$7 -> 24.135000000000002 | F63: LEXINGTON (unicorp)
A64: =+A63+B64 -> 143.1 | B64: 4.0 | C64: =+A64*$D$7 -> 230.24789999999993 | D64: =+B64*$D$7 -> 6.4359999999999999 | F64: LONGVIEW city
A65: =+A64+B65 -> 144.1 | B65: 1.0 | C65: =+A65*$D$7 -> 231.85689999999994 | D65: =+B65*$D$7 -> 1.609 | F65: KELSO city
A66: =+A65+B66 -> 145.1 | B66: 1.0 | C66: =+A66*$D$7 -> 233.46589999999995 | D66: =+B66*$D$7 -> 1.609 | F66: LONGVIEW city
A67: =+A66+B67 -> 147.1 | B67: 2.0 | C67: =+A67*$D$7 -> 236.68389999999994 | D67: =+B67*$D$7 -> 3.218 | F67: Left onto Oregon Way (SR-433)
A68: =+A67+B68 -> 149.1 | B68: 2.0 | C68: =+A68*$D$7 -> 239.90189999999996 | D68: =+B68*$D$7 -> 3.218 | F68: RAINIER OREGON
A69: =+A68+B69 -> 152.1 | B69: 3.0 | C69: =+A69*$D$7 -> 244.72889999999995 | D69: =+B69*$D$7 -> 4.827 | F69: LINBERG city
A70: =+A69+B70 -> 157.1 | B70: 5.0 | C70: =+A70*$D$7 -> 252.77389999999994 | D70: =+B70*$D$7 -> 8.0449999999999999 | F70: GOBLE city
A71: =+A70+B71 -> 164.1 | B71: 7.0 | C71: =+A71*$D$7 -> 264.03689999999995 | D71: =+B71*$D$7 -> 11.263 | F71: DEER ISLAND
A72: =+A71+B72 -> 171.1 | B72: 7.0 | C72: =+A72*$D$7 -> 275.29989999999992 | D72: =+B72*$D$7 -> 11.263 | F72: ST. HELENS city
A73: =+A72+B73 -> 177.1 | B73: 6.0 | C73: =+A73*$D$7 -> 284.95389999999992 | D73: =+B73*$D$7 -> 9.6539999999999999 | F73: SCAPPOOSE city
A74: =+A73+B74 -> 186.1 | B74: 9.0 | C74: =+A74*$D$7 -> 299.43489999999997 | D74: =+B74*$D$7 -> 14.481 | F74: BURLINGTON city
A75: =+A74+B75 -> 190.1 | B75: 4.0 | C75: =+A75*$D$7 -> 305.87089999999995 | D75: =+B75*$D$7 -> 6.4359999999999999 | F75: LINNTON city
A76: =+A75+B76 -> 191.1 | B76: 1.0 | C76: =+A76*$D$7 -> 307.47989999999993 | D76: =+B76*$D$7 -> 1.609 | F76: Right at St. Johns Bridge approach
A77: =+A76+B77 -> 192.1 | B77: 1.0 | C77: =+A77*$D$7 -> 309.08889999999997 | D77: =+B77*$D$7 -> 1.609 | F77: Left cross St. Johns Bridge
A78: =+A77+B78 -> 192.6 | B78: 0.5 | C78: =+A78*$D$7 -> 309.89339999999993 | D78: =+B78*$D$7 -> 0.80449999999999999 | F78: Right on Syracuse at end of bridge
A79: =+A78+B79 -> 192.6 | B79: 0.0 | C79: =+A79*$D$7 -> 309.89339999999993 | D79: =+B79*$D$7 -> 0.0 | F79: Right onto N. Philadelphia Cross St. Johns Bridge
A80: =+A79+B80 -> 193.3 | B80: 00.7 | C80: =+A80*$D$7 -> 311.01969999999994 | D80: =+B80*$D$7 -> 1.1262999999999999 | F80: Right on NW Bridge
A81: =+A80+B81 -> 193.7 | B81: 00.4 | C81: =+A81*$D$7 -> 311.66329999999994 | D81: =+B81*$D$7 -> 0.64360000000000006 | F81: Left on Hwy 30
A82: =+A81+B82 -> 234.3 | B82: 40.6 | C82: =+A82*$D$7 -> 376.98869999999994 | D82: =+B82*$D$7 -> 65.325400000000002 | F82: Right towards Longview Bridge
A83: =+A82+B83 -> 236.6 | B83: 2.3 | C83: =+A83*$D$7 -> 380.68939999999992 | D83: =+B83*$D$7 -> 3.7006999999999999 | F83: Right onto Industrial Way
A84: =+A83+B84 -> 237.6 | B84: 1.0 | C84: =+A84*$D$7 -> 382.29839999999996 | D84: =+B84*$D$7 -> 1.609 | F84: Left turn onto 3rd Ave Becomes 1 st Ave becomes SR411
A85: =+A84+B85 -> 259.4 | B85: 21.8 | C85: =+A85*$D$7 -> 417.37459999999999 | D85: =+B85*$D$7 -> 35.0762 | F85: Left onto SR-506 to Vader
A86: =+A85+B86 -> 260.5 | B86: 1.1 | C86: =+A86*$D$7 -> 419.14449999999999 | D86: =+B86*$D$7 -> 1.7699 | F86: Right onto Vader-Winlock Rd becomes SR-603
A87: =+A86+B87 -> 273.5 | B87: 13.0 | C87: =+A87*$D$7 -> 440.06150000000002 | D87: =+B87*$D$7 -> 20.917000000000002 | F87: Left onto W. Washington (SR-603)
A88: =+A87+B88 -> 277.9 | B88: 4.4 | C88: =+A88*$D$7 -> 447.14109999999994 | D88: =+B88*$D$7 -> 7.0796000000000001 | F88: Right onto Shorey Rd becomes Newaukum
A89: =+A88+B89 -> 281.6 | B89: 3.7 | C89: =+A89*$D$7 -> 453.09439999999995 | D89: =+B89*$D$7 -> 5.9533000000000005 | F89: Left onto Airport Way
A90: =+A89+B90 -> 281.9 | B90: 00.3 | C90: =+A90*$D$7 -> 453.57709999999997 | D90: =+B90*$D$7 -> 0.48269999999999996 | F90: Right to stay on Airport Way
A91: =+A90+B91 -> 285.3 | B91: 3.4 | C91: =+A91*$D$7 -> 459.04769999999991 | D91: =+B91*$D$7 -> 5.4706000000000001 | F91: Right onto SR-507 becomes Mellen Alder then Cherry St
A92: =+A91+B92 -> 286.4 | B92: 1.1 | C92: =+A92*$D$7 -> 460.81759999999997 | D92: =+B92*$D$7 -> 1.7699 | F92: Left at S. Tower (SR-507)
A93: =+A92+B93 -> 287.6 | B93: 1.2 | C93: =+A93*$D$7 -> 462.74839999999995 | D93: =+B93*$D$7 -> 1.9307999999999998 | F93: Left at E. Sixth (SR-507)
A94: =+A93+B94 -> 287.7 | B94: 00.1 | C94: =+A94*$D$7 -> 462.90929999999997 | D94: =+B94*$D$7 -> 0.16090000000000002 | F94: Right at Pearl (SR-507)
A95: =+A94+B95 -> 299.1 | B95: 11.4 | C95: =+A95*$D$7 -> 481.25189999999992 | D95: =+B95*$D$7 -> 18.342600000000001 | E95: #3 | F95: TENINO Jackpot Service Station
A96: =+A95+B96 -> 307.6 | B96: 8.5 | C96: =+A96*$D$7 -> 494.92839999999995 | D96: =+B96*$D$7 -> 13.676500000000001 | F96: RAINIER city
A97: =+A96+B97 -> 312.8 | B97: 5.2 | C97: =+A97*$D$7 -> 503.29519999999991 | D97: =+B97*$D$7 -> 8.3667999999999996 | F97: YELM city
A98: =+A97+B98 -> 314.9 | B98: 2.1 | C98: =+A98*$D$7 -> 506.67409999999995 | D98: =+B98*$D$7 -> 3.3789000000000002 | F98: McKENNA city
A99: =+A98+B99 -> 319.7 | B99: 4.8 | C99: =+A99*$D$7 -> 514.39729999999997 | D99: =+B99*$D$7 -> 7.7231999999999994 | F99: ROY city
A100: =+A99+B100 -> 327.2 | B100: 7.5 | C100: =+A100*$D$7 -> 526.46479999999997 | D100: =+B100*$D$7 -> 12.067500000000001 | F100: Left onto Pacific Ave S
A101: =+A100+B101 -> 330.3 | B101: 3.1 | C101: =+A101*$D$7 -> 531.45270000000005 | D101: =+B101*$D$7 -> 4.9878999999999998 | F101: Right onto Military Rd Spanaway
A102: =+A101+B102 -> 332.4 | B102: 2.1 | C102: =+A102*$D$7 -> 534.83160000000009 | D102: =+B102*$D$7 -> 3.3789000000000002 | F102: Right at Y onto Military Rd
A103: =+A102+B103 -> 333.1 | B103: 00.7 | C103: =+A103*$D$7 -> 535.9579 | D103: =+B103*$D$7 -> 1.1262999999999999 | F103: Left onto Canyon Rd E
A104: =+A103+B104 -> 339.2 | B104: 6.1 | C104: =+A104*$D$7 -> 545.77280000000007 | D104: =+B104*$D$7 -> 9.8148999999999997 | F104: Right down hill becomes Pioneer Ave.
A105: =+A104+B105 -> 342.5 | B105: 3.3 | C105: =+A105*$D$7 -> 551.08249999999998 | D105: =+B105*$D$7 -> 5.3096999999999994 | F105: Left onto Milwaukee Ave E
A106: =+A105+B106 -> 343.0 | B106: 0.5 | C106: =+A106*$D$7 -> 551.88700000000006 | D106: =+B106*$D$7 -> 0.80449999999999999 | F106: PUYALLUP city
A107: =+A106+B107 -> 343.6 | B107: 00.6 | C107: =+A107*$D$7 -> 552.8524000000001 | D107: =+B107*$D$7 -> 0.96539999999999992 | F107: Right at Vailey Ave E.
A108: =+A107+B108 -> 345.3 | B108: 1.7 | C108: =+A108*$D$7 -> 555.58770000000015 | D108: =+B108*$D$7 -> 2.7353000000000001 | F108: Left onto Sumner Hts Dr.
A109: =+A108+B109 -> 346.1 | B109: 00.8 | C109: =+A109*$D$7 -> 556.87490000000014 | D109: =+B109*$D$7 -> 1.2872000000000001 | F109: Right onto West Valley Hwy SUMNER
A110: =+A109+B110 -> 350.4 | B110: 4.3 | C110: =+A110*$D$7 -> 563.7936000000002 | D110: =+B110*$D$7 -> 6.9186999999999994 | F110: PACIFIC city
A111: =+A110+B111 -> 351.7 | B111: 1.3 | C111: =+A111*$D$7 -> 565.88530000000014 | D111: =+B111*$D$7 -> 2.0916999999999999 | F111: ALGONA city
A112: =+A111+B112 -> 355.4 | B112: 3.7 | C112: =+A112*$D$7 -> 571.83860000000016 | D112: =+B112*$D$7 -> 5.9533000000000005 | F112: AUBURN city
A113: =+A112+B113 -> 361.3 | B113: 5.9 | C113: =+A113*$D$7 -> 581.33170000000007 | D113: =+B113*$D$7 -> 9.4931000000000001 | F113: KENT city
A114: =+A113+B114 -> 364.1 | B114: 2.8 | C114: =+A114*$D$7 -> 585.83690000000013 | D114: =+B114*$D$7 -> 4.5051999999999994 | F114: TUKWILA x Green River becomes Interurban Ave N
A115: =+A114+B115 -> 366.4 | B115: 2.3 | C115: =+A115*$D$7 -> 589.53760000000011 | D115: =+B115*$D$7 -> 3.7006999999999999 | F115: Right onto S. 115th St cross bridge
A116: =+A115+B116 -> 367.6 | B116: 1.2 | C116: =+A116*$D$7 -> 591.46840000000009 | D116: =+B116*$D$7 -> 1.9307999999999998 | F116: Right onto E. Marginal Way N.
A117: =+A116+B117 -> 368.0 | B117: 00.4 | C117: =+A117*$D$7 -> 592.11200000000008 | D117: =+B117*$D$7 -> 0.64360000000000006 | F117: Right onto Boeing Access Rd.
A118: =+A117+B118 -> 368.2 | B118: 00.2 | C118: =+A118*$D$7 -> 592.43380000000002 | D118: =+B118*$D$7 -> 0.32180000000000003 | F118: Right at Y to go onto Airport Way S
A119: =+A118+B119 -> 373.3 | B119: 5.1 | C119: =+A119*$D$7 -> 600.63970000000006 | D119: =+B119*$D$7 -> 8.2058999999999997 | E119: #4 | F119: SEATTLE
A120: =+A119+B120 -> 374.5 | B120: 1.2 | C120: =+A120*$D$7 -> 602.57050000000004 | D120: =+B120*$D$7 -> 1.9307999999999998 | F120: Right at and of Airport Way onto 4th Ave
A121: =+A120+B121 -> 375.3 | B121: 00.8 | C121: =+A121*$D$7 -> 603.85770000000014 | D121: =+B121*$D$7 -> 1.2872000000000001 | F121: Right at 4th Ave and Olive St
A122: =+A121+B122 -> 376.3 | B122: 1.0 | C122: =+A122*$D$7 -> 605.46670000000006 | D122: =+B122*$D$7 -> 1.609 | F122: Left at Y onto Howell St
A123: =+A122+B123 -> 377.3 | B123: 1.0 | C123: =+A123*$D$7 -> 607.0757000000001 | D123: =+B123*$D$7 -> 1.609 | F123: Howell St. becomes Eastlake Ave E
A124: =+A123+B124 -> 378.3 | B124: 1.0 | C124: =+A124*$D$7 -> 608.68470000000013 | D124: =+B124*$D$7 -> 1.609 | F124: Right after crossing University Bridge onto Burke-Gilman Trail
A125: =+A124+B125 -> 388.3 | B125: 10.0 | C125: =+A125*$D$7 -> 624.77470000000005 | D125: =+B125*$D$7 -> 16.09 | F125: Lake Forest Park and Burke-Gilman Trail continue on bike trail
A126: =+A125+B126 -> 390.8 | B126: 2.5 | C126: =+A126*$D$7 -> 628.79720000000009 | D126: =+B126*$D$7 -> 4.0225 | F126: BOTHELL city
A127: =+A126+B127 -> 391.9 | B127: 1.1 | C127: =+A127*$D$7 -> 630.5671000000001 | D127: =+B127*$D$7 -> 1.7699 | F127: Right at Intersection of SR-527 in Bothell get onto SR-522
A128: =+A127+B128 -> 392.7 | B128: 00.8 | C128: =+A128*$D$7 -> 631.85430000000019 | D128: =+B128*$D$7 -> 1.2872000000000001 | F128: Exit SR-522 to right just beyond "Bicyclþ must Exit" sign onto Woodinville Drive which becomes Sammamish River Trail
A129: =+A128+B129 -> 394.2 | B129: 1.5 | C129: =+A129*$D$7 -> 634.26780000000019 | D129: =+B129*$D$7 -> 2.4135 | F129: Left off trail after passing under railroad bridge and street bridge.
A130: =+A129+B130 -> 394.3 | B130: 00.1 | C130: =+A130*$D$7 -> 634.42870000000016 | D130: =+B130*$D$7 -> 0.16090000000000002 | F130: Left at Light onto 131 Ave N E
A131: =+A130+B131 -> 394.5 | B131: 00.2 | C131: =+A131*$D$7 -> 634.75050000000022 | D131: =+B131*$D$7 -> 0.32180000000000003 | F131: Right onto SR-522 East
A132: =+A131+B132 -> 396.3 | B132: 1.8 | C132: =+A132*$D$7 -> 637.64670000000024 | D132: =+B132*$D$7 -> 2.8961999999999999 | F132: Exit SR-522 then Left onto SR-9 North
A133: =+A132+B133 -> 400.3 | B133: 4.0 | C133: =+A133*$D$7 -> 644.08270000000016 | D133: =+B133*$D$7 -> 6.4359999999999999 | F133: CLEARVIEW
A134: =+A133+B134 -> 406.3 | B134: 6.0 | C134: =+A134*$D$7 -> 653.73670000000016 | D134: =+B134*$D$7 -> 9.6539999999999999 | F134: SNOHOMISH city
A135: =+A134+B135 -> 427.3 | B135: 21.0 | C135: =+A135*$D$7 -> 687.52570000000014 | D135: =+B135*$D$7 -> 33.789000000000001 | E135: #5 | F135: ARLINGTON city 7-11 at Intersection
A136: =+A135+B136 -> 432.3 | B136: 5.0 | C136: =+A136*$D$7 -> 695.57070000000022 | D136: =+B136*$D$7 -> 8.0449999999999999 | F136: BRYANT city
A137: =+A136+B137 -> 443.3 | B137: 11.0 | C137: =+A137*$D$7 -> 713.26970000000017 | D137: =+B137*$D$7 -> 17.698999999999998 | F137: McMURRAY city
A138: =+A137+B138 -> 453.3 | B138: 10.0 | C138: =+A138*$D$7 -> 729.3597000000002 | D138: =+B138*$D$7 -> 16.09 | F138: BIG LAKE
A139: =+A138+B139 -> 459.3 | B139: 6.0 | C139: =+A139*$D$7 -> 739.0137000000002 | D139: =+B139*$D$7 -> 9.6539999999999999 | F139: CLEAR LAKE
A140: =+A139+B140 -> 463.3 | B140: 4.0 | C140: =+A140*$D$7 -> 745.44970000000023 | D140: =+B140*$D$7 -> 6.4359999999999999 | F140: SEDRO WOOLLEY city
A141: =+A140+B141 -> 473.3 | B141: 10.0 | C141: =+A141*$D$7 -> 761.53970000000015 | D141: =+B141*$D$7 -> 16.09 | F141: WICKERSHAM city
A142: =+A141+B142 -> 478.3 | B142: 5.0 | C142: =+A142*$D$7 -> 769.58470000000023 | D142: =+B142*$D$7 -> 8.0449999999999999 | F142: ACME city
A143: =+A142+B143 -> 480.3 | B143: 2.0 | C143: =+A143*$D$7 -> 772.80270000000019 | D143: =+B143*$D$7 -> 3.218 | F143: CLIPPER city
A144: =+A143+B144 -> 482.3 | B144: 2.0 | C144: =+A144*$D$7 -> 776.02070000000015 | D144: =+B144*$D$7 -> 3.218 | F144: VAN ZANDT city
A145: =+A144+B145 -> 485.3 | B145: 3.0 | C145: =+A145*$D$7 -> 780.84770000000015 | D145: =+B145*$D$7 -> 4.827 | F145: DEMING city
A146: =+A145+B146 -> 490.3 | B146: 5.0 | C146: =+A146*$D$7 -> 788.89270000000022 | D146: =+B146*$D$7 -> 8.0449999999999999 | F146: NUGENTS CORNER
A147: =+A146+B147 -> 496.3 | B147: 6.0 | C147: =+A147*$D$7 -> 798.54670000000021 | D147: =+B147*$D$7 -> 9.6539999999999999 | F147: NOOKSACK city
A148: =+A147+B148 -> 501.3 | B148: 5.0 | C148: =+A148*$D$7 -> 806.59170000000017 | D148: =+B148*$D$7 -> 8.0449999999999999 | E148: #6 | F148: SUMAS city
A149: =+A148+B149 -> 506.3 | B149: 5.0 | C149: =+A149*$D$7 -> 814.63670000000025 | D149: =+B149*$D$7 -> 8.0449999999999999 | F149: NOOKSACK city
A150: =+A149+B150 -> 512.3 | B150: 6.0 | C150: =+A150*$D$7 -> 824.29070000000024 | D150: =+B150*$D$7 -> 9.6539999999999999 | F150: NUGENTS CORNER
A151: =+A150+B151 -> 517.3 | B151: 5.0 | C151: =+A151*$D$7 -> 832.33570000000032 | D151: =+B151*$D$7 -> 8.0449999999999999 | F151: DEMING city
A152: =+A151+B152 -> 520.3 | B152: 3.0 | C152: =+A152*$D$7 -> 837.16270000000031 | D152: =+B152*$D$7 -> 4.827 | F152: VAN ZANDT city
A153: =+A152+B153 -> 522.3 | B153: 2.0 | C153: =+A153*$D$7 -> 840.38070000000027 | D153: =+B153*$D$7 -> 3.218 | F153: CLIPPER city
A154: =+A153+B154 -> 524.3 | B154: 2.0 | C154: =+A154*$D$7 -> 843.59870000000024 | D154: =+B154*$D$7 -> 3.218 | F154: ACME city
A155: =+A154+B155 -> 529.3 | B155: 5.0 | C155: =+A155*$D$7 -> 851.64370000000031 | D155: =+B155*$D$7 -> 8.0449999999999999 | F155: WICKERSHAM city
A156: =+A155+B156 -> 539.3 | B156: 10.0 | C156: =+A156*$D$7 -> 867.73370000000034 | D156: =+B156*$D$7 -> 16.09 | F156: SEDRO WOOLLEY city
A157: =+A156+B157 -> 543.3 | B157: 4.0 | C157: =+A157*$D$7 -> 874.16970000000026 | D157: =+B157*$D$7 -> 6.4359999999999999 | F157: CLEAR LAKE
A158: =+A157+B158 -> 549.3 | B158: 6.0 | C158: =+A158*$D$7 -> 883.82370000000026 | D158: =+B158*$D$7 -> 9.6539999999999999 | F158: BIG LAKE
A159: =+A158+B159 -> 559.3 | B159: 10.0 | C159: =+A159*$D$7 -> 899.91370000000029 | D159: =+B159*$D$7 -> 16.09 | F159: McMURRAY city
A160: =+A159+B160 -> 570.3 | B160: 11.0 | C160: =+A160*$D$7 -> 917.61270000000025 | D160: =+B160*$D$7 -> 17.698999999999998 | F160: BRYANT city
A161: =+A160+B161 -> 574.3 | B161: 4.0 | C161: =+A161*$D$7 -> 924.04870000000028 | D161: =+B161*$D$7 -> 6.4359999999999999 | E161: #7 | F161: ARLINGTON citþ 7-11 at Intersection
A162: =+A161+B162 -> 595.3 | B162: 21.0 | C162: =+A162*$D$7 -> 957.83770000000027 | D162: =+B162*$D$7 -> 33.789000000000001 | F162: SNOHOMISH city
A163: =+A162+B163 -> 601.3 | B163: 6.0 | C163: =+A163*$D$7 -> 967.49170000000026 | D163: =+B163*$D$7 -> 9.6539999999999999 | F163: CLEARVIEW
A164: =+A163+B164 -> 605.3 | B164: 4.0 | C164: =+A164*$D$7 -> 973.9277000000003 | D164: =+B164*$D$7 -> 6.4359999999999999 | F164: Right onto SR-522
A165: =+A164+B165 -> 607.3 | B165: 2.0 | C165: =+A165*$D$7 -> 977.14570000000026 | D165: =+B165*$D$7 -> 3.218 | F165: WOODINVILLE city
A166: =+A165+B166 -> 607.4 | B166: 00.1 | C166: =+A166*$D$7 -> 977.30660000000034 | D166: =+B166*$D$7 -> 0.16090000000000002 | F166: Exit SR-522 Right onto 175th St.
A167: =+A166+B167 -> 607.5 | B167: 00.1 | C167: =+A167*$D$7 -> 977.46749999999997 | D167: =+B167*$D$7 -> 0.16090000000000002 | F167: Left onto Sammamish Rivþr Trail going west
A168: =+A167+B168 -> 607.6 | B168: 00.1 | C168: =+A168*$D$7 -> 977.6284000000004 | D168: =+B168*$D$7 -> 0.16090000000000002 | F168: Pass under railroad bridge and street bridge on trail and head to Bothell
A169: =+A168+B169 -> 610.3 | B169: 2.7 | C169: =+A169*$D$7 -> 981.97270000000049 | D169: =+B169*$D$7 -> 4.3443000000000005 | F169: Sammamish River Tral becomes Burke Gilman Trail in Bothell
A170: =+A169+B170 -> 612.8 | B170: 2.5 | C170: =+A170*$D$7 -> 985.99520000000052 | D170: =+B170*$D$7 -> 4.0225 | F170: Lake Forest Park x Burke Gilman Trail continue on trail into Seattle
A171: =+A170+B171 -> 613.3 | B171: 0.5 | C171: =+A171*$D$7 -> 986.79970000000048 | D171: =+B171*$D$7 -> 0.80449999999999999 | F171: Open Control Point - Seattle city
A172: =+A171+B172 -> 618.3 | B172: 5.0 | C172: =+A172*$D$7 -> 994.84470000000044 | D172: =+B172*$D$7 -> 8.0449999999999999 | E172: #8 | F172: Right onto University Blvd upto R & E Bicycles