A1: Seattle Randonneurs 1000 km Brevet
A2: North Cascades
A4: Created By: | D4: Ken Carter, Dave Johnson
A5: Verified By: | D5: Ken Carter, Dave Johnson
A6: Year(s) Used:
A7: Conversion(Mi-Km) | D7: 1.609
A9: Miles | C9: Km
A10: Total | B10: Leg | C10: Total | D10: Leg | E10: Ctrl | F10: Instructions
A11: 0.0 | B11: 0.0 | C11: =+A11*$D$7 -> 0.0 | D11: =+B11*$D$7 -> 0.0 | E11: #1 | F11: Control #1 - Texaco Minimart, Duvall
A12: =+A11+B12 -> 0.0 | B12: 0.0 | C12: =+A12*$D$7 -> 0.0 | D12: =+B12*$D$7 -> 0.0 | F12: R onto Hwy 203
A13: =+A12+B13 -> 10.0 | B13: 10.0 | C13: =+A13*$D$7 -> 16.09 | D13: =+B13*$D$7 -> 16.09 | F13: ST @ light, Monroe
A14: =+A13+B14 -> 10.1 | B14: 00.1 | C14: =+A14*$D$7 -> 16.250899999999998 | D14: =+B14*$D$7 -> 0.16090000000000002 | F14: L @ light, Hwy 2 West
A15: =+A14+B15 -> 20.7 | B15: 10.6 | C15: =+A15*$D$7 -> 33.3063 | D15: =+B15*$D$7 -> 17.055399999999999 | F15: R @ Hwy 9 North
A16: =+A15+B16 -> 37.8 | B16: 17.1 | C16: =+A16*$D$7 -> 60.820199999999993 | D16: =+B16*$D$7 -> 27.513900000000003 | F16: Straight @ Hwy 9 N., Arlington
A17: =+A16+B17 -> 56.2 | B17: 18.4 | C17: =+A17*$D$7 -> 90.425799999999995 | D17: =+B17*$D$7 -> 29.605599999999999 | F17: Big Lake Store
A18: =+A17+B18 -> 58.5 | B18: 2.3 | C18: =+A18*$D$7 -> 94.126499999999993 | D18: =+B18*$D$7 -> 3.7006999999999999 | F18: Big Rock Grocery
A19: =+A18+B19 -> 64.4 | B19: 5.9 | C19: =+A19*$D$7 -> 103.61959999999999 | D19: =+B19*$D$7 -> 9.4931000000000001 | F19: Sedro Woolley
A20: =+A19+B20 -> 64.4 | B20: 0.0 | C20: =+A20*$D$7 -> 103.61959999999999 | D20: =+B20*$D$7 -> 0.0 | F20: Straight thru light
A21: =+A20+B21 -> 64.5 | B21: 00.1 | C21: =+A21*$D$7 -> 103.78049999999998 | D21: =+B21*$D$7 -> 0.16090000000000002 | F21: R onto N. Cascades Hwy 20
A22: =+A21+B22 -> 65.8 | B22: 1.3 | C22: =+A22*$D$7 -> 105.87219999999998 | D22: =+B22*$D$7 -> 2.0916999999999999 | F22: L @ Light onto Township St. (Hwy 9 N.)
A23: =+A22+B23 -> 65.8 | B23: 0.0 | C23: =+A23*$D$7 -> 105.87219999999998 | D23: =+B23*$D$7 -> 0.0 | E23: #2 | F23: Control # 2 - Arco station, Sedro Woolley
A24: =+A23+B24 -> 71.5 | B24: 5.7 | C24: =+A24*$D$7 -> 115.04349999999998 | D24: =+B24*$D$7 -> 9.1713000000000005 | F24: RR TRACKS
A25: =+A24+B25 -> 80.5 | B25: 9.0 | C25: =+A25*$D$7 -> 129.52449999999999 | D25: =+B25*$D$7 -> 14.481 | F25: Bad RR TRACKS, ACME, Wa
A26: =+A25+B26 -> 82.5 | B26: 2.0 | C26: =+A26*$D$7 -> 132.74250000000001 | D26: =+B26*$D$7 -> 3.218 | F26: Bad RR TRACKS
A27: =+A26+B27 -> 85.8 | B27: 3.3 | C27: =+A27*$D$7 -> 138.05219999999997 | D27: =+B27*$D$7 -> 5.3096999999999994 | F27: Van Zandt Store
A28: =+A27+B28 -> 85.9 | B28: 00.1 | C28: =+A28*$D$7 -> 138.21309999999997 | D28: =+B28*$D$7 -> 0.16090000000000002 | F28: RR TRACKS
A29: =+A28+B29 -> 87.9 | B29: 2.0 | C29: =+A29*$D$7 -> 141.43109999999996 | D29: =+B29*$D$7 -> 3.218 | F29: L @ SR542 toward Deming
A30: =+A29+B30 -> 91.4 | B30: 3.5 | C30: =+A30*$D$7 -> 147.06259999999997 | D30: =+B30*$D$7 -> 5.6315 | F30: RR TRACKS
A31: =+A30+B31 -> 92.4 | B31: 1.0 | C31: =+A31*$D$7 -> 148.67159999999996 | D31: =+B31*$D$7 -> 1.609 | F31: R @ Nugents Corner
A32: =+A31+B32 -> 93.5 | B32: 1.1 | C32: =+A32*$D$7 -> 150.44149999999996 | D32: =+B32*$D$7 -> 1.7699 | F32: R @ Siper Rd, RR TRACKS
A33: =+A32+B33 -> 95.3 | B33: 1.8 | C33: =+A33*$D$7 -> 153.33769999999996 | D33: =+B33*$D$7 -> 2.8961999999999999 | F33: R @ Hopewell Road
A34: =+A33+B34 -> 95.5 | B34: 00.2 | C34: =+A34*$D$7 -> 153.65949999999995 | D34: =+B34*$D$7 -> 0.32180000000000003 | F34: L @ Goodwin Road
A35: =+A34+B35 -> 99.0 | B35: 3.5 | C35: =+A35*$D$7 -> 159.29099999999994 | D35: =+B35*$D$7 -> 5.6315 | F35: R @ Sorenson Road
A36: =+A35+B36 -> 99.2 | B36: 00.2 | C36: =+A36*$D$7 -> 159.61279999999996 | D36: =+B36*$D$7 -> 0.32180000000000003 | F36: L @ N. Telegraph Road
A37: =+A36+B37 -> 102.4 | B37: 3.2 | C37: =+A37*$D$7 -> 164.76159999999996 | D37: =+B37*$D$7 -> 5.1488000000000005 | F37: Straight, N. Telegraph Rd turns into Hovel Rd
A38: =+A37+B38 -> 103.8 | B38: 1.4 | C38: =+A38*$D$7 -> 167.01419999999996 | D38: =+B38*$D$7 -> 2.2525999999999997 | F38: L @ Front Street
A39: =+A38+B39 -> 104.6 | B39: 00.8 | C39: =+A39*$D$7 -> 168.30139999999997 | D39: =+B39*$D$7 -> 1.2872000000000001 | F39: R @ Cherry
A40: =+A39+B40 -> 105.2 | B40: 00.6 | C40: =+A40*$D$7 -> 169.26679999999996 | D40: =+B40*$D$7 -> 0.96539999999999992 | E40: #3 | F40: Control # 3 - USA Gas Station, Sumas
A41: =+A40+B41 -> 105.3 | B41: 00.1 | C41: =+A41*$D$7 -> 169.42769999999996 | D41: =+B41*$D$7 -> 0.16090000000000002 | F41: USA / Canadian border crossing
A42: =+A41+B42 -> 105.4 | B42: 00.1 | C42: =+A42*$D$7 -> 169.58859999999993 | D42: =+B42*$D$7 -> 0.16090000000000002 | F42: RR TRACKS
A43: =+A42+B43 -> 107.4 | B43: 2.0 | C43: =+A43*$D$7 -> 172.80659999999995 | D43: =+B43*$D$7 -> 3.218 | F43: R @ Route 1 East
A44: =+A43+B44 -> 111.8 | B44: 4.4 | C44: =+A44*$D$7 -> 179.88619999999995 | D44: =+B44*$D$7 -> 7.0796000000000001 | F44: Narrow Bridge, no shoulder
A45: =+A44+B45 -> 116.5 | B45: 4.7 | C45: =+A45*$D$7 -> 187.44849999999994 | D45: =+B45*$D$7 -> 7.5623000000000005 | F45: Narrow Bridge, no shoulder
A46: =+A45+B46 -> 134.1 | B46: 17.6 | C46: =+A46*$D$7 -> 215.76689999999994 | D46: =+B46*$D$7 -> 28.3184 | F46: R @ Exit # 135, Agassiz / Harrison Hot Springs
A47: =+A46+B47 -> 134.2 | B47: 00.1 | C47: =+A47*$D$7 -> 215.92779999999993 | D47: =+B47*$D$7 -> 0.16090000000000002 | F47: R @ Hwy 9 to Agassiz
A48: =+A47+B48 -> 136.0 | B48: 1.8 | C48: =+A48*$D$7 -> 218.82399999999996 | D48: =+B48*$D$7 -> 2.8961999999999999 | F48: Long Narrow Bridge, no shoulder
A49: =+A48+B49 -> 137.9 | B49: 1.9 | C49: =+A49*$D$7 -> 221.88109999999998 | D49: =+B49*$D$7 -> 3.0570999999999997 | F49: turns into Hwy 7 East
A50: =+A49+B50 -> 157.1 | B50: 19.2 | C50: =+A50*$D$7 -> 252.77389999999994 | D50: =+B50*$D$7 -> 30.892799999999998 | F50: L @ Hwy 1 & Hope
A51: =+A50+B51 -> 158.8 | B51: 1.7 | C51: =+A51*$D$7 -> 255.50919999999994 | D51: =+B51*$D$7 -> 2.7353000000000001 | E51: #4 | F51: Control # 4 - Chevron / Town Pantry, Hope, B.C.
A52: =+A51+B52 -> 158.8 | B52: 0.0 | C52: =+A52*$D$7 -> 255.50919999999994 | D52: =+B52*$D$7 -> 0.0 | F52: L out of control
A53: =+A52+B53 -> 159.0 | B53: 00.2 | C53: =+A53*$D$7 -> 255.8309999999999 | D53: =+B53*$D$7 -> 0.32180000000000003 | F53: L @ Old Hope Princeton Way
A54: =+A53+B54 -> 163.0 | B54: 4.0 | C54: =+A54*$D$7 -> 262.26699999999988 | D54: =+B54*$D$7 -> 6.4359999999999999 | F54: R @ Exit # 177 Crowsnest, Hwy 3 East
A55: =+A54+B55 -> 194.9 | B55: 31.9 | C55: =+A55*$D$7 -> 313.59409999999991 | D55: =+B55*$D$7 -> 51.327099999999994 | F55: Allison Summit (1342 m, 4402 ft)
A56: =+A55+B56 -> 200.2 | B56: 5.3 | C56: =+A56*$D$7 -> 322.12179999999995 | D56: =+B56*$D$7 -> 8.5276999999999994 | E56: #5 | F56: Control # 5 - Manning Park Resort
A57: =+A56+B57 -> 200.2 | B57: 0.0 | C57: =+A57*$D$7 -> 322.12179999999995 | D57: =+B57*$D$7 -> 0.0 | F57: R onto Hwy 3 East
A58: =+A57+B58 -> 220.5 | B58: 20.3 | C58: =+A58*$D$7 -> 354.78449999999992 | D58: =+B58*$D$7 -> 32.662700000000001 | F58: Sunday Summit (1282 m, 4206 ft)
A59: =+A58+B59 -> 240.4 | B59: 19.9 | C59: =+A59*$D$7 -> 386.80359999999996 | D59: =+B59*$D$7 -> 32.019099999999995 | E59: #6 | F59: Control # 6 - Mohawk Station, Princeton, B.C.
A60: =+A59+B60 -> 240.4 | B60: 0.0 | C60: =+A60*$D$7 -> 386.80359999999996 | D60: =+B60*$D$7 -> 0.0 | F60: R onto Hwy 3
A61: =+A60+B61 -> 264.8 | B61: 24.4 | C61: =+A61*$D$7 -> 426.06319999999994 | D61: =+B61*$D$7 -> 39.259599999999999 | F61: Hedley, B.C.
A62: =+A61+B62 -> 281.3 | B62: 16.5 | C62: =+A62*$D$7 -> 452.61169999999993 | D62: =+B62*$D$7 -> 26.548500000000001 | F62: Keremeos, B.C.
A63: =+A62+B63 -> 282.3 | B63: 1.0 | C63: =+A63*$D$7 -> 454.22069999999991 | D63: =+B63*$D$7 -> 1.609 | F63: L @ 7th Street
A64: =+A63+B64 -> 283.1 | B64: 00.8 | C64: =+A64*$D$7 -> 455.50789999999995 | D64: =+B64*$D$7 -> 1.2872000000000001 | F64: L past Esso Station onto Hwy 3A to Penticton, B.C.
A65: =+A64+B65 -> 303.1 | B65: 20.0 | C65: =+A65*$D$7 -> 487.68789999999996 | D65: =+B65*$D$7 -> 32.18 | F65: L @ Hwy 97 North
A66: =+A65+B66 -> 312.1 | B66: 9.0 | C66: =+A66*$D$7 -> 502.16889999999995 | D66: =+B66*$D$7 -> 14.481 | E66: #7 | F66: Open Control # 7 - Penticton, B.C.
A67: =+A66+B67 -> 325.1 | B67: 13.0 | C67: =+A67*$D$7 -> 523.08589999999992 | D67: =+B67*$D$7 -> 20.917000000000002 | F67: Okanagon Falls
A68: =+A67+B68 -> 349.1 | B68: 24.0 | C68: =+A68*$D$7 -> 561.70189999999991 | D68: =+B68*$D$7 -> 38.616 | F68: Osoyoos, B.C.
A69: =+A68+B69 -> 352.4 | B69: 3.3 | C69: =+A69*$D$7 -> 567.01159999999993 | D69: =+B69*$D$7 -> 5.3096999999999994 | F69: USA / Canadian border crossing
A70: =+A69+B70 -> 357.8 | B70: 5.4 | C70: =+A70*$D$7 -> 575.70019999999988 | D70: =+B70*$D$7 -> 8.688600000000001 | F70: RR TRACKS
A71: =+A70+B71 -> 372.6 | B71: 14.8 | C71: =+A71*$D$7 -> 599.51339999999993 | D71: =+B71*$D$7 -> 23.813200000000002 | F71: Tonasket, Wa - Texaco Station
A72: =+A71+B72 -> 395.7 | B72: 23.1 | C72: =+A72*$D$7 -> 636.68129999999996 | D72: =+B72*$D$7 -> 37.167900000000003 | E72: #8 | F72: Control # 8 - Texaco, Omak
A73: =+A72+B73 -> 395.7 | C73: =+A73*$D$7 -> 636.68129999999996 | D73: =+B73*$D$7 -> 0.0 | F73: Go thru downtown Omak to Okanagon
A74: =+A73+B74 -> 400.7 | B74: 5.0 | C74: =+A74*$D$7 -> 644.72629999999992 | D74: =+B74*$D$7 -> 8.0449999999999999 | F74: Okanagon
A75: =+A74+B75 -> 401.7 | B75: 1.0 | C75: =+A75*$D$7 -> 646.33529999999996 | D75: =+B75*$D$7 -> 1.609 | F75: Straight onto Hwy 20 W
A76: =+A75+B76 -> 419.7 | B76: 18.0 | C76: =+A76*$D$7 -> 675.29729999999995 | D76: =+B76*$D$7 -> 28.962 | F76: Loup Loup Summit (4020 ft)
A77: =+A76+B77 -> 429.7 | B77: 10.0 | C77: =+A77*$D$7 -> 691.38729999999998 | D77: =+B77*$D$7 -> 16.09 | F77: R @ stop sign
A78: =+A77+B78 -> 431.7 | B78: 2.0 | C78: =+A78*$D$7 -> 694.60529999999994 | D78: =+B78*$D$7 -> 3.218 | F78: Twisp, Wa
A79: =+A78+B79 -> 439.7 | B79: 8.0 | C79: =+A79*$D$7 -> 707.47730000000001 | D79: =+B79*$D$7 -> 12.872 | E79: #9 | F79: Control # 9 - Conoco, Winthrop ( 6am-12am)
A80: =+A79+B80 -> 454.7 | B80: 15.0 | C80: =+A80*$D$7 -> 731.6123 | D80: =+B80*$D$7 -> 24.135000000000002 | F80: Mazama, Wa
A81: =+A80+B81 -> 472.7 | B81: 18.0 | C81: =+A81*$D$7 -> 760.57429999999999 | D81: =+B81*$D$7 -> 28.962 | F81: Washington Pass summit (5477 ft)
A82: =+A81+B82 -> 477.7 | B82: 5.0 | C82: =+A82*$D$7 -> 768.61929999999995 | D82: =+B82*$D$7 -> 8.0449999999999999 | F82: Rainey Pass summit (4855 ft)
A83: =+A82+B83 -> 504.7 | B83: 27.0 | C83: =+A83*$D$7 -> 812.06229999999994 | D83: =+B83*$D$7 -> 43.442999999999998 | F83: Colonial Creek Campgrounds, toilets & water
A84: =+A83+B84 -> 514.7 | B84: 10.0 | C84: =+A84*$D$7 -> 828.15230000000008 | D84: =+B84*$D$7 -> 16.09 | E84: #10 | F84: Control # 10 - NewHalem Store (7:30am-6:00pm)
A85: =+A84+B85 -> 536.7 | B85: 22.0 | C85: =+A85*$D$7 -> 863.55030000000011 | D85: =+B85*$D$7 -> 35.397999999999996 | F85: L @ Rockport onto Hwy 530
A86: =+A85+B86 -> 555.7 | B86: 19.0 | C86: =+A86*$D$7 -> 894.12130000000002 | D86: =+B86*$D$7 -> 30.570999999999998 | E86: #11 | F86: Control # 11 - Shell Station, Darrington
A87: =+A86+B87 -> 571.7 | B87: 16.0 | C87: =+A87*$D$7 -> 919.86530000000005 | D87: =+B87*$D$7 -> 25.744 | F87: Oso Store (1-360-435-6166)
A88: =+A87+B88 -> 579.7 | B88: 8.0 | C88: =+A88*$D$7 -> 932.73730000000012 | D88: =+B88*$D$7 -> 12.872 | F88: Tafton Store (360-435-3418, 6:00am-11:00pm)
A89: =+A88+B89 -> 582.8 | B89: 3.1 | C89: =+A89*$D$7 -> 937.72520000000009 | D89: =+B89*$D$7 -> 4.9878999999999998 | F89: L @ Jordan Rd
A90: =+A89+B90 -> 583.8 | B90: 1.0 | C90: =+A90*$D$7 -> 939.33420000000012 | D90: =+B90*$D$7 -> 1.609 | F90: R @ Jordan Rd
A91: =+A90+B91 -> 596.1 | B91: 12.3 | C91: =+A91*$D$7 -> 959.12490000000003 | D91: =+B91*$D$7 -> 19.790700000000001 | F91: L @ Hwy 92
A92: =+A91+B92 -> 596.2 | B92: 00.1 | C92: =+A92*$D$7 -> 959.28580000000011 | D92: =+B92*$D$7 -> 0.16090000000000002 | E92: #12 | F92: Control #12-Chevron, Granite Falls(360-691-6626)
A93: =+A92+B93 -> 596.8 | B93: 00.6 | C93: =+A93*$D$7 -> 960.25120000000015 | D93: =+B93*$D$7 -> 0.96539999999999992 | F93: R @ Mt. Loop Hwy
A94: =+A93+B94 -> 597.0 | B94: 00.2 | C94: =+A94*$D$7 -> 960.57300000000021 | D94: =+B94*$D$7 -> 0.32180000000000003 | F94: L @ Menzel Lake Rd
A95: =+A94+B95 -> 605.5 | B95: 8.5 | C95: =+A95*$D$7 -> 974.24950000000013 | D95: =+B95*$D$7 -> 13.676500000000001 | F95: Lake Roesiger Store (9:00am-7:00pm)
A96: =+A95+B96 -> 609.0 | B96: 3.5 | C96: =+A96*$D$7 -> 979.8810000000002 | D96: =+B96*$D$7 -> 5.6315 | F96: L @ Woods Creek Rd
A97: =+A96+B97 -> 616.4 | B97: 7.4 | C97: =+A97*$D$7 -> 991.78760000000011 | D97: =+B97*$D$7 -> 11.906600000000001 | F97: R to stay on Woods Creek Rd
A98: =+A97+B98 -> 617.5 | B98: 1.1 | C98: =+A98*$D$7 -> 993.5575 | D98: =+B98*$D$7 -> 1.7699 | F98: L to stay on Woods Creek Rd
A99: =+A98+B99 -> 619.4 | B99: 1.9 | C99: =+A99*$D$7 -> 996.61460000000011 | D99: =+B99*$D$7 -> 3.0570999999999997 | F99: L @ Oaks St. (0.1 mile before Hwy 2)
A100: =+A99+B100 -> 619.6 | B100: 00.2 | C100: =+A100*$D$7 -> 996.93640000000016 | D100: =+B100*$D$7 -> 0.32180000000000003 | F100: R @ Old Owen Rd.
A101: =+A100+B101 -> 619.7 | B101: 00.1 | C101: =+A101*$D$7 -> 997.09730000000025 | D101: =+B101*$D$7 -> 0.16090000000000002 | F101: Straight across Hwy 2
A102: =+A101+B102 -> 620.0 | B102: 00.3 | C102: =+A102*$D$7 -> 997.58 | D102: =+B102*$D$7 -> 0.48269999999999996 | F102: L @ light onto Hwy 203
A103: =+A102+B103 -> 630.0 | B103: 10.0 | C103: =+A103*$D$7 -> 1013.67 | D103: =+B103*$D$7 -> 16.09 | E103: #13 | F103: Control #13 - Texaco Minimart, Duvall