D1: Seattle International Randonneurs 400 km Brevet - June 3-4, 2000
A2: Miles | B2: Leg | D2: Control# & Instructions | E2: Km | F2: Leg
A3: 0.0 | B3: 0.0 | D3: #1 - START - North Bend - Edgewick Inn | E3: =A3*1.609 -> 0.0 | F3: =B3*1.609 -> 0.0
A4: 00.2 | B4: =A4-A3 -> 00.2 | D4: I-90 East | E4: =A4*1.609 -> 0.32180000000000003 | F4: =B4*1.609 -> 0.32180000000000003
A5: 48.7 | B5: =A5-A4 -> 48.5 | D5: Exit 84 (Cle Elum), leads to First Street | E5: =A5*1.609 -> 78.3583 | F5: =B5*1.609 -> 78.036500000000004
A6: 49.9 | B6: =A6-A5 -> 1.2 | D6: #2 - CONTROL - Cle Elum - OPEN | E6: =A6*1.609 -> 80.289099999999991 | F6: =B6*1.609 -> 1.9307999999999932
A7: 54.0 | B7: =A7-A6 -> 4.1 | D7: L onto Hwy 970 | E7: =A7*1.609 -> 86.885999999999996 | F7: =B7*1.609 -> 6.5969000000000024
A8: 61.6 | B8: =A8-A7 -> 7.6 | D8: ST onto US 97 toward Blewett Pass | E8: =A8*1.609 -> 99.114400000000003 | F8: =B8*1.609 -> 12.228400000000002
A9: 97.4 | B9: =A9-A8 -> 35.8 | D9: L onto US 2 | E9: =A9*1.609 -> 156.7166 | F9: =B9*1.609 -> 57.602200000000003
A10: 103.4 | B10: =A10-A9 -> 6.0 | D10: #3 - CONTROL - Leavenworth Chevron Mini Mart | E10: =A10*1.609 -> 166.3706 | F10: =B10*1.609 -> 9.6539999999999999
A11: 152.4 | B11: =A11-A10 -> 49.0 | D11: #4 - CONTROL - Skykomish Chevron | E11: =A11*1.609 -> 245.2116 | F11: =B11*1.609 -> 78.840999999999994
A12: 179.5 | B12: =A12-A11 -> 27.1 | D12: SULTAN (last services until Snohomish) | E12: =A12*1.609 -> 288.81549999999999 | F12: =B12*1.609 -> 43.603899999999989
A13: 180.4 | B13: =A13-A12 -> 0.90000000000000568 | D13: R onto Old Owen Road | E13: =A13*1.609 -> 290.2636 | F13: =B13*1.609 -> 1.448100000000009
A14: 180.9 | B14: =A14-A13 -> 0.5 | D14: R onto Reiner Road | E14: =A14*1.609 -> 291.06810000000002 | F14: =B14*1.609 -> 0.80449999999999999
A15: 184.1 | B15: =A15-A14 -> 3.1999999999999886 | D15: BL to stay on Reiner/Old Pipeline Road (at corner of Lake Champlain Road) | E15: =A15*1.609 -> 296.21690000000001 | F15: =B15*1.609 -> 5.1487999999999818
A16: 184.2 | B16: =A16-A15 -> 9.9999999999994316E-2 | D16: BL to stay on Old Pipeline Road (at unmarked intersection) | E16: =A16*1.609 -> 296.37779999999998 | F16: =B16*1.609 -> 0.16089999999999086
A17: 184.4 | B17: =A17-A16 -> 0.20000000000001705 | D17: ST at stop sign to stay on Old Pipeline Road | E17: =A17*1.609 -> 296.69960000000003 | F17: =B17*1.609 -> 0.32180000000002745
A18: 187.2 | B18: =A18-A17 -> 2.7999999999999829 | D18: R onto Bollenbaugh Hill Road | E18: =A18*1.609 -> 301.20479999999998 | F18: =B18*1.609 -> 4.5051999999999728
A19: 188.1 | B19: =A19-A18 -> 0.90000000000000568 | D19: R onto Woods Creek Road | E19: =A19*1.609 -> 302.65289999999999 | F19: =B19*1.609 -> 1.448100000000009
A20: 193.1 | B20: =A20-A19 -> 5.0 | D20: ST onto Dubuque (at turnoff to Lake Roesiger Road) | E20: =A20*1.609 -> 310.6979 | F20: =B20*1.609 -> 8.0449999999999999
A21: 198.9 | B21: =A21-A20 -> 5.8000000000000114 | D21: L onto 139th Avenue SE (Dubuque Cutoff) | E21: =A21*1.609 -> 320.0301 | F21: =B21*1.609 -> 9.332200000000018
A22: 200.9 | B22: =A22-A21 -> 2.0 | D22: R onto Three Lakes Road | E22: =A22*1.609 -> 323.24810000000002 | F22: =B22*1.609 -> 3.218
A23: 202.3 | B23: =A23-A22 -> 1.4000000000000057 | D23: L onto Orchard Ave (becomes 11th St then Railroad Ave) | E23: =A23*1.609 -> 325.50069999999999 | F23: =B23*1.609 -> 2.252600000000009
A24: 203.2 | B24: =A24-A23 -> 0.89999999999997726 | D24: L onto Maple Avenue | E24: =A24*1.609 -> 326.94880000000001 | F24: =B24*1.609 -> 1.4480999999999633
A25: 204.1 | B25: =A25-A24 -> 0.90000000000000568 | D25: R onto 2nd Street SE | E25: =A25*1.609 -> 328.39689999999996 | F25: =B25*1.609 -> 1.448100000000009
A26: 204.5 | B26: =A26-A25 -> 0.40000000000000568 | D26: L onto Avenue D (24hr 7-Eleven at corner) | E26: =A26*1.609 -> 329.04050000000001 | F26: =B26*1.609 -> 0.64360000000000916
A27: 205.8 | B27: =A27-A26 -> 1.3000000000000114 | D27: L onto Springhetti Road (before Hwy 9) | E27: =A27*1.609 -> 331.13220000000001 | F27: =B27*1.609 -> 2.0917000000000181
A28: 207.8 | B28: =A28-A27 -> 2.0 | D28: L onto Broadway | E28: =A28*1.609 -> 334.35020000000003 | F28: =B28*1.609 -> 3.218
A29: 212.5 | B29: =A29-A28 -> 4.6999999999999886 | D29: BL onto Yew Way | E29: =A29*1.609 -> 341.91250000000002 | F29: =B29*1.609 -> 7.5622999999999818
A30: 212.8 | B30: =A30-A29 -> 0.30000000000001137 | D30: BL onto Yew Way (SR 524) | E30: =A30*1.609 -> 342.39519999999999 | F30: =B30*1.609 -> 0.48270000000001828
A31: 213.1 | B31: =A31-A30 -> 0.29999999999998295 | D31: L onto Paradise Lake Road | E31: =A31*1.609 -> 342.87790000000001 | F31: =B31*1.609 -> 0.48269999999997254
A32: 213.2 | B32: =A32-A31 -> 9.9999999999994316E-2 | D32: #5 - CONTROL - Paradise Lake Road Chevron | E32: =A32*1.609 -> 343.03879999999998 | F32: =B32*1.609 -> 0.16089999999999086
A33: 213.2 | B33: =A33-A32 -> 0.0 | D33: R out of control onto Paradise Lake Road (cross Hwy 522) | E33: =A33*1.609 -> 343.03879999999998 | F33: =B33*1.609 -> 0.0
A34: 217.8 | B34: =A34-A33 -> 4.6000000000000227 | D34: L onto Woodinville Duvall Road | E34: =A34*1.609 -> 350.4402 | F34: =B34*1.609 -> 7.4014000000000362
A35: 221.7 | B35: =A35-A34 -> 3.8999999999999773 | D35: R onto W Snoqualmie Valley Road | E35: =A35*1.609 -> 356.71529999999996 | F35: =B35*1.609 -> 6.2750999999999637
A36: 226.1 | B36: =A36-A35 -> 4.4000000000000057 | D36: L onto NE 100th Street | E36: =A36*1.609 -> 363.79489999999998 | F36: =B36*1.609 -> 7.079600000000009
A37: 227.5 | B37: =A37-A36 -> 1.4000000000000057 | D37: R onto 284th Ave NE | E37: =A37*1.609 -> 366.04750000000001 | F37: =B37*1.609 -> 2.252600000000009
A38: 228.1 | B38: =A38-A37 -> 0.59999999999999432 | D38: L onto NE Carnation Farm Road | E38: =A38*1.609 -> 367.0129 | F38: =B38*1.609 -> 0.96539999999999082
A39: 230.2 | B39: =A39-A38 -> 2.0999999999999943 | D39: R onto 310th Avenue NE (after bridge) | E39: =A39*1.609 -> 370.39179999999999 | F39: =B39*1.609 -> 3.3788999999999909
A40: 231.3 | B40: =A40-A39 -> 1.1000000000000227 | D40: R onto SR-203 | E40: =A40*1.609 -> 372.1617 | F40: =B40*1.609 -> 1.7699000000000367
A41: 231.6 | B41: =A41-A40 -> 0.29999999999998295 | D41: CARNATION (24hr QFC on right) | E41: =A41*1.609 -> 372.64439999999996 | F41: =B41*1.609 -> 0.48269999999997254
A42: 238.1 | B42: =A42-A41 -> 6.5 | D42: L onto SR-202 (just past the turn is a 24 hr Exxon 425-222-7223) | E42: =A42*1.609 -> 383.10289999999998 | F42: =B42*1.609 -> 10.458500000000001
A43: 246.2 | B43: =A43-A42 -> 8.0999999999999943 | D43: L onto North Bend Way | E43: =A43*1.609 -> 396.13579999999996 | F43: =B43*1.609 -> 13.032899999999991
A44: 250.1 | B44: =A44-A43 -> 3.9000000000000057 | D44: END - North Bend - Edgewick Inn | E44: =A44*1.609 -> 402.41089999999997 | F44: =B44*1.609 -> 6.275100000000009
A47: L = left, R = right, BR = bear right, BL = bear left, ST = straight, TA = turn around, X = cross
A48: JR = jog right, JL = jog left, RR = railroad, SR = state route, US = US hwy
A49: N = north, S = south, E = east, W = west