A1: Seattle Randonneurs 400 km Brevet
A2: Three Passes From Duvall
A4: Created By: | D4: Don Harkleroad
A5: Verified By: | D5: Don Harkleroad
A6: Year(s) Used: | D6: 1998.0
A7: Conversion(Mi-Km) | D7: 1.609
A9: Miles | C9: Km
A10: Total | B10: Leg | C10: Total | D10: Leg | E10: Ctrl | F10: Instructions
A11: 0.0 | B11: 0.0 | C11: =+A11*$D$7 -> 0.0 | D11: =+B11*$D$7 -> 0.0 | E11: #1 | F11: Start from Terry Z's house, address: 23441 NE 140TH St. Woodinville, Wa.
A12: =+A11+B12 -> 0.0 | B12: 0.0 | C12: =+A12*$D$7 -> 0.0 | D12: =+B12*$D$7 -> 0.0 | F12: L onto 140th St.
A13: =+A12+B13 -> 00.1 | B13: 00.1 | C13: =+A13*$D$7 -> 0.16090000000000002 | D13: =+B13*$D$7 -> 0.16090000000000002 | F13: R on 232nd St.
A14: =+A13+B14 -> 2.2 | B14: 2.1 | C14: =+A14*$D$7 -> 3.5398000000000001 | D14: =+B14*$D$7 -> 3.3789000000000002 | F14: R on Old Woodinville Duvall Rd.
A15: =+A14+B15 -> 2.8 | B15: 00.6 | C15: =+A15*$D$7 -> 4.5052000000000003 | D15: =+B15*$D$7 -> 0.96539999999999992 | F15: R on Woodinville Duvall Rd.
A16: =+A15+B16 -> 4.8 | B16: 2.0 | C16: =+A16*$D$7 -> 7.7232000000000012 | D16: =+B16*$D$7 -> 3.218 | F16: L on Hwy. 203 at the stop light in Duvall
A17: =+A16+B17 -> 13.5 | B17: 8.7 | C17: =+A17*$D$7 -> 21.721499999999999 | D17: =+B17*$D$7 -> 13.998299999999999 | F17: R on Main St. in Monroe, watch out X'ing RR tracks
A18: =+A17+B18 -> 13.8 | B18: 00.3 | C18: =+A18*$D$7 -> 22.2042 | D18: =+B18*$D$7 -> 0.48269999999999996 | F18: VR onto Hwy. 2
A19: =+A18+B19 -> 46.8 | B19: 33.0 | C19: =+A19*$D$7 -> 75.301199999999994 | D19: =+B19*$D$7 -> 53.097000000000001 | F19: Control #1 - R to Skykomish - Open
A20: =+A19+B20 -> 96.8 | B20: 50.0 | C20: =+A20*$D$7 -> 155.75119999999998 | D20: =+B20*$D$7 -> 80.45 | E20: #2 | F20: Control #2 - L into Chevron Mini Mart in Leavenworth
A21: =+A20+B21 -> 102.8 | B21: 6.0 | C21: =+A21*$D$7 -> 165.40520000000001 | D21: =+B21*$D$7 -> 9.6539999999999999 | F21: R on Hwy. 97 towards Blewitt Pass
A22: =+A21+B22 -> 138.2 | B22: 35.4 | C22: =+A22*$D$7 -> 222.36379999999997 | D22: =+B22*$D$7 -> 56.958599999999997 | F22: VR onto Hwy. 970
A23: =+A22+B23 -> 145.6 | B23: 7.4 | C23: =+A23*$D$7 -> 234.2704 | D23: =+B23*$D$7 -> 11.906600000000001 | F23: ST on Hwy. 10 towards Cle Elum
A24: =+A23+B24 -> 150.2 | B24: 4.6 | C24: =+A24*$D$7 -> 241.67179999999999 | D24: =+B24*$D$7 -> 7.4013999999999998 | E24: #3 | F24: West Cle Elum Safeway
A25: =+A24+B25 -> 150.4 | B25: 00.2 | C25: =+A25*$D$7 -> 241.99359999999996 | D25: =+B25*$D$7 -> 0.32180000000000003 | F25: R onto 1st & I-90, go west and Snoqualmie Pass
A26: =+A25+B26 -> 198.4 | B26: 48.0 | C26: =+A26*$D$7 -> 319.22559999999999 | D26: =+B26*$D$7 -> 77.231999999999999 | F26: R at Edgewick Rd.
A27: =+A26+B27 -> 198.5 | B27: 00.1 | C27: =+A27*$D$7 -> 319.38649999999996 | D27: =+B27*$D$7 -> 0.16090000000000002 | E27: #4 | F27: BP Truck Stop at North Bend
A28: =+A27+B28 -> 198.5 | B28: 0.0 | C28: =+A28*$D$7 -> 319.38649999999996 | D28: =+B28*$D$7 -> 0.0 | F28: R onto SE North Bend Way (West)
A29: =+A28+B29 -> 202.2 | B29: 3.7 | C29: =+A29*$D$7 -> 325.33979999999991 | D29: =+B29*$D$7 -> 5.9533000000000005 | F29: R onto North Bend Way
A30: =+A29+B30 -> 202.3 | B30: 00.1 | C30: =+A30*$D$7 -> 325.50069999999994 | D30: =+B30*$D$7 -> 0.16090000000000002 | F30: VL onto Hwy. 202
A31: =+A30+B31 -> 210.3 | B31: 8.0 | C31: =+A31*$D$7 -> 338.37269999999995 | D31: =+B31*$D$7 -> 12.872 | F31: X Bridge, VR onto SR 202
A32: =+A31+B32 -> 212.7 | B32: 2.4 | C32: =+A32*$D$7 -> 342.23429999999991 | D32: =+B32*$D$7 -> 3.8615999999999997 | F32: R onto 308th Ave.
A33: =+A32+B33 -> 213.5 | B33: 00.8 | C33: =+A33*$D$7 -> 343.52149999999995 | D33: =+B33*$D$7 -> 1.2872000000000001 | F33: L onto West Snoqualmie River Rd.
A34: =+A33+B34 -> 218.2 | B34: 4.7 | C34: =+A34*$D$7 -> 351.08379999999994 | D34: =+B34*$D$7 -> 7.5623000000000005 | F34: R at NE Tolt Hill Rd.
A35: =+A34+B35 -> 219.0 | B35: 00.8 | C35: =+A35*$D$7 -> 352.37099999999992 | D35: =+B35*$D$7 -> 1.2872000000000001 | F35: L onto Hwy. 203, go through Carnation
A36: =+A35+B36 -> 220.8 | B36: 1.8 | C36: =+A36*$D$7 -> 355.26719999999995 | D36: =+B36*$D$7 -> 2.8961999999999999 | F36: L onto Carnation Farms Rd.
A37: =+A36+B37 -> 225.2 | B37: 4.4 | C37: =+A37*$D$7 -> 362.34679999999997 | D37: =+B37*$D$7 -> 7.0796000000000001 | F37: R at NE 80th St.
A38: =+A37+B38 -> 226.0 | B38: 00.8 | C38: =+A38*$D$7 -> 363.63400000000001 | D38: =+B38*$D$7 -> 1.2872000000000001 | F38: VR at West Snoqualmie Valley Rd.
A39: =+A38+B39 -> 235.5 | B39: 9.5 | C39: =+A39*$D$7 -> 378.91949999999997 | D39: =+B39*$D$7 -> 15.285499999999999 | F39: ST - W. Snoqualmie turns into High Bridge Rd.
A40: =+A39+B40 -> 240.7 | B40: 5.2 | C40: =+A40*$D$7 -> 387.28629999999998 | D40: =+B40*$D$7 -> 8.3667999999999996 | F40: L onto Fales Rd.
A41: =+A40+B41 -> 242.7 | B41: 2.0 | C41: =+A41*$D$7 -> 390.5043 | D41: =+B41*$D$7 -> 3.218 | F41: R onto Downe Rd.
A42: =+A41+B42 -> 243.5 | B42: 00.8 | C42: =+A42*$D$7 -> 391.79149999999998 | D42: =+B42*$D$7 -> 1.2872000000000001 | F42: L onto Yew Way
A43: =+A42+B43 -> 244.5 | B43: 1.0 | C43: =+A43*$D$7 -> 393.40050000000002 | D43: =+B43*$D$7 -> 1.609 | F43: VL Yew Way
A44: =+A43+B44 -> 244.8 | B44: 00.3 | C44: =+A44*$D$7 -> 393.88319999999999 | D44: =+B44*$D$7 -> 0.48269999999999996 | F44: X Malby Rd.
A45: =+A44+B45 -> 244.9 | B45: 00.1 | C45: =+A45*$D$7 -> 394.04410000000001 | D45: =+B45*$D$7 -> 0.16090000000000002 | F45: L onto Paradise Lk. Rd., X Hwy. 522
A46: =+A45+B46 -> 249.6 | B46: 4.7 | C46: =+A46*$D$7 -> 401.60640000000001 | D46: =+B46*$D$7 -> 7.5623000000000005 | F46: L onto Woodinville-Duvall Rd.
A47: =+A46+B47 -> 250.9 | B47: 1.3 | C47: =+A47*$D$7 -> 403.69810000000001 | D47: =+B47*$D$7 -> 2.0916999999999999 | F47: R onto Old Woodinville-Duvall Rd.
A48: =+A47+B48 -> 251.7 | B48: 00.8 | C48: =+A48*$D$7 -> 404.98530000000005 | D48: =+B48*$D$7 -> 1.2872000000000001 | F48: R onto 232nd Ave.
A49: =+A48+B49 -> 253.7 | B49: 2.0 | C49: =+A49*$D$7 -> 408.20330000000001 | D49: =+B49*$D$7 -> 3.218 | F49: L onto 140th St., (gravel road)
A50: =+A49+B50 -> 253.8 | B50: 00.1 | C50: =+A50*$D$7 -> 408.36420000000004 | D50: =+B50*$D$7 -> 0.16090000000000002 | E50: #5 | F50: R into Terry Zymrhal's house, FINISH (YEAH!!!)