A1: Seattle Randonneurs 400 km Brevet
A2: Three Passes - Redmond
A4: Created By: | D4: John Wanger
A5: Verified By: | D5: John Wanger
A6: Year(s) Used: | D6: 1994.0
A7: Conversion(Mi-Km) | D7: 1.609
A9: Miles | C9: Km
A10: Total | B10: Leg | C10: Total | D10: Leg | E10: Ctrl | F10: Instructions
A11: 0.0 | B11: 0.0 | C11: =+A11*$D$7 -> 0.0 | D11: =+B11*$D$7 -> 0.0 | E11: #1 | F11: Start - Bear Creek Park & Ride L onto 180th
A12: =+A11+B12 -> 0.5 | B12: 0.5 | C12: =+A12*$D$7 -> 0.80449999999999999 | D12: =+B12*$D$7 -> 0.80449999999999999 | F12: L - onto Rt 202
A13: =+A12+B13 -> 11.9 | B13: 11.4 | C13: =+A13*$D$7 -> 19.147100000000002 | D13: =+B13*$D$7 -> 18.342600000000001 | F13: L - onto 308th, road winds
A14: =+A13+B14 -> 12.7 | B14: 00.8 | C14: =+A14*$D$7 -> 20.4343 | D14: =+B14*$D$7 -> 1.2872000000000001 | F14: L - onto West Snoqualmie River Rd
A15: =+A14+B15 -> 16.7 | B15: 4.0 | C15: =+A15*$D$7 -> 26.870300000000004 | D15: =+B15*$D$7 -> 6.4359999999999999 | F15: R - onto NE Tolt Hill Rd
A16: =+A15+B16 -> 17.5 | B16: 00.8 | C16: =+A16*$D$7 -> 28.157499999999999 | D16: =+B16*$D$7 -> 1.2872000000000001 | F16: L - onto Rt 203
A17: =+A16+B17 -> 19.3 | B17: 1.8 | C17: =+A17*$D$7 -> 31.053700000000006 | D17: =+B17*$D$7 -> 2.8961999999999999 | F17: L - onto Carnation Farms Rd
A18: =+A17+B18 -> 23.7 | B18: 4.4 | C18: =+A18*$D$7 -> 38.133300000000006 | D18: =+B18*$D$7 -> 7.0796000000000001 | F18: R - onto NE 80th St
A19: =+A18+B19 -> 24.5 | B19: 00.8 | C19: =+A19*$D$7 -> 39.420500000000004 | D19: =+B19*$D$7 -> 1.2872000000000001 | F19: BR - at West Snoqualmie Valley Rd
A20: =+A19+B20 -> 34.0 | B20: 9.5 | C20: =+A20*$D$7 -> 54.706000000000003 | D20: =+B20*$D$7 -> 15.285499999999999 | F20: R - onto Crescent Lake Rd
A21: =+A20+B21 -> 35.0 | B21: 1.0 | C21: =+A21*$D$7 -> 56.314999999999998 | D21: =+B21*$D$7 -> 1.609 | F21: St - onto Tualco Rd
A22: =+A21+B22 -> 36.2 | B22: 1.2 | C22: =+A22*$D$7 -> 58.245800000000003 | D22: =+B22*$D$7 -> 1.9307999999999998 | F22: BR - at Taulco Rd
A23: =+A22+B23 -> 36.9 | B23: 00.7 | C23: =+A23*$D$7 -> 59.37210000000001 | D23: =+B23*$D$7 -> 1.1262999999999999 | F23: L - onto Rt 203
A24: =+A23+B24 -> 38.4 | B24: 1.5 | C24: =+A24*$D$7 -> 61.785600000000009 | D24: =+B24*$D$7 -> 2.4135 | F24: R - onto Main St
A25: =+A24+B25 -> 39.0 | B25: 00.6 | C25: =+A25*$D$7 -> 62.751000000000012 | D25: =+B25*$D$7 -> 0.96539999999999992 | E25: #2 | F25: Chevron Min-mart R onto Rt 2
A26: =+A25+B26 -> 72.0 | B26: 33.0 | C26: =+A26*$D$7 -> 115.848 | D26: =+B26*$D$7 -> 53.097000000000001 | E26: #3 | F26: Open, Skyomish
A27: =+A26+B27 -> 122.0 | B27: 50.0 | C27: =+A27*$D$7 -> 196.298 | D27: =+B27*$D$7 -> 80.45 | E27: #4 | F27: Jim's Chevron Food Mart on Left, Levenworth
A28: =+A27+B28 -> 128.0 | B28: 6.0 | C28: =+A28*$D$7 -> 205.952 | D28: =+B28*$D$7 -> 9.6539999999999999 | F28: R - onto Rt 97
A29: =+A28+B29 -> 163.4 | B29: 35.4 | C29: =+A29*$D$7 -> 262.91059999999999 | D29: =+B29*$D$7 -> 56.958599999999997 | F29: VR - onto Rt 970
A30: =+A29+B30 -> 170.8 | B30: 7.4 | C30: =+A30*$D$7 -> 274.81720000000001 | D30: =+B30*$D$7 -> 11.906600000000001 | F30: St - onto Rt10
A31: =+A30+B31 -> 174.9 | B31: 4.1 | C31: =+A31*$D$7 -> 281.41410000000002 | D31: =+B31*$D$7 -> 6.5968999999999998 | F31: St - at Stop sign, stay on 1st street
A32: =+A31+B32 -> 175.4 | B32: 0.5 | C32: =+A32*$D$7 -> 282.21859999999998 | D32: =+B32*$D$7 -> 0.80449999999999999 | E32: #5 | F32: Safeway on Left, Cle Elm
A33: =+A32+B33 -> 175.6 | B33: 00.2 | C33: =+A33*$D$7 -> 282.54039999999998 | D33: =+B33*$D$7 -> 0.32180000000000003 | F33: St - onto I 90
A34: =+A33+B34 -> 223.6 | B34: 48.0 | C34: =+A34*$D$7 -> 359.7724 | D34: =+B34*$D$7 -> 77.231999999999999 | F34: R - onto Edgewick Rd
A35: =+A34+B35 -> 223.7 | B35: 00.1 | C35: =+A35*$D$7 -> 359.93329999999997 | D35: =+B35*$D$7 -> 0.16090000000000002 | E35: #6 | F35: Ken's Truck Stop Resturant, N. Bend
A36: =+A35+B36 -> 227.4 | B36: 3.7 | C36: =+A36*$D$7 -> 365.88659999999999 | D36: =+B36*$D$7 -> 5.9533000000000005 | F36: R - onto Rt 202
A37: =+A36+B37 -> 249.6 | B37: 22.2 | C37: =+A37*$D$7 -> 401.60639999999995 | D37: =+B37*$D$7 -> 35.719799999999999 | F37: R - onto 180th
A38: =+A37+B38 -> 250.1 | B38: 0.5 | C38: =+A38*$D$7 -> 402.41089999999997 | D38: =+B38*$D$7 -> 0.80449999999999999 | E38: #7 | F38: Finish - R into Bear Creek Park & Ride