A1: Seattle Randonneurs 400 km Brevet
A2: Wenatchee - Coulee Dam
A4: Created By: | D4: Ken Brooker
A5: Verified By: | D5: Ken Brooker
A6: Year(s) Used: | D6: 1996.0
A7: Conversion(Mi-Km) | D7: 1.609
A9: Miles | C9: Km
A10: Total | B10: Leg | C10: Total | D10: Leg | E10: Ctrl | F10: Instructions
A11: 0.0 | B11: 0.0 | C11: =+A11*$D$7 -> 0.0 | D11: =+B11*$D$7 -> 0.0 | E11: #1 | F11: CONTROL: SOUTH from The Rivers Inn on Valley Mall Parkway
A12: =+A11+B12 -> 00.4 | B12: 00.4 | C12: =+A12*$D$7 -> 0.64360000000000006 | D12: =+B12*$D$7 -> 0.64360000000000006 | F12: RT @ lite onto Grant Rd then LT @ lite onto SR28 to "Quincy"
A13: =+A12+B13 -> 42.4 | B13: 42.0 | C13: =+A13*$D$7 -> 68.221599999999995 | D13: =+B13*$D$7 -> 67.578000000000003 | F13: LT @ T stop on SR28E to "Ephrata"
A14: =+A13+B14 -> 47.0 | B14: 4.6 | C14: =+A14*$D$7 -> 75.623000000000005 | D14: =+B14*$D$7 -> 7.4013999999999998 | E14: #2 | F14: EXXON/JACKPOT on right on SR28E in "Ephrata"
A15: =+A14+B15 -> 53.2 | B15: 6.2 | C15: =+A15*$D$7 -> 85.598799999999997 | D15: =+B15*$D$7 -> 9.9757999999999996 | F15: CAUTIOUS LT @ flashing lite onto SR17N to "Soap Lake"
A16: =+A15+B16 -> 72.5 | B16: 19.3 | C16: =+A16*$D$7 -> 116.6525 | D16: =+B16*$D$7 -> 31.053699999999999 | F16: MUST STOP @ Dry Falls Visitor Overlook on right!
A17: =+A16+B17 -> 74.6 | B17: 2.1 | C17: =+A17*$D$7 -> 120.03139999999999 | D17: =+B17*$D$7 -> 3.3789000000000002 | F17: RT @ T stop onto US2E "To SR155"
A18: =+A17+B18 -> 78.9 | B18: 4.3 | C18: =+A18*$D$7 -> 126.95009999999999 | D18: =+B18*$D$7 -> 6.9186999999999994 | F18: ST onto SR155N to "Grand Coulee Dam" as US2E turns east
A19: =+A18+B19 -> 106.9 | B19: 28.0 | C19: =+A19*$D$7 -> 172.00209999999998 | D19: =+B19*$D$7 -> 45.052 | E19: #3 | F19: CHEVRON/FdodMart on left on SR155N in Coulee Dam
A20: =+A19+B20 -> 107.2 | B20: 00.3 | C20: =+A20*$D$7 -> 172.48479999999998 | D20: =+B20*$D$7 -> 0.48269999999999996 | F20: CAUTION crossing Columbia River Bridge on SR155N
A21: =+A20+B21 -> 107.4 | B21: 00.2 | C21: =+A21*$D$7 -> 172.80659999999997 | D21: =+B21*$D$7 -> 0.32180000000000003 | F21: LT @ flashing lite on 5R155N to "Omak"
A22: =+A21+B22 -> 123.4 | B22: 16.0 | C22: =+A22*$D$7 -> 198.55059999999997 | D22: =+B22*$D$7 -> 25.744 | F22: CHEVRON/Foodmart till 10pm on right on SR155N in Nespelum (NO SERVICES next 35 miles)
A23: =+A22+B23 -> 136.7 | B23: 13.3 | C23: =+A23*$D$7 -> 219.95029999999997 | D23: =+B23*$D$7 -> 21.399699999999999 | F23: Disautel Summit Elevation 3252 feet & begin 20-mile descent!
A24: =+A23+B24 -> 158.5 | B24: 21.8 | C24: =+A24*$D$7 -> 255.0265 | D24: =+B24*$D$7 -> 35.0762 | F24: CAUTION crossing triple RR tracks on SR155N in Omak
A25: =+A24+B25 -> 158.6 | B25: 00.1 | C25: =+A25*$D$7 -> 255.1874 | D25: =+B25*$D$7 -> 0.16090000000000002 | E25: #4 | F25: 24-hr EXXON/JACKPOT on left on SR155N in Omak
A26: =+A25+B26 -> 159.0 | B26: 00.4 | C26: =+A26*$D$7 -> 255.83099999999999 | D26: =+B26*$D$7 -> 0.64360000000000006 | F26: CAUTIOUS LT onto Dayton Street "To 5R97"
A27: =+A26+B27 -> 159.3 | B27: 00.3 | C27: =+A27*$D$7 -> 256.31370000000004 | D27: =+B27*$D$7 -> 0.48269999999999996 | F27: RT @ T stop onto 5R975 to "Wenatchee"
A28: =+A27+B28 -> 188.0 | B28: 28.7 | C28: =+A28*$D$7 -> 302.49200000000002 | D28: =+B28*$D$7 -> 46.1783 | F28: CAUTION crossing RR tracks on SR97S
A29: =+A28+B29 -> 190.6 | B29: 2.6 | C29: =+A29*$D$7 -> 306.67539999999997 | D29: =+B29*$D$7 -> 4.1833999999999998 | E29: #5 | F29: 24-hr EXXON/Foodmart on right on SR97S in Brewster (LIMITED SERVICES AFTER MIDNITE NEXT 63 MILES)
A30: =+A29+B30 -> 197.0 | B30: 6.4 | C30: =+A30*$D$7 -> 316.97300000000001 | D30: =+B30*$D$7 -> 10.297600000000001 | F30: CHEVRON/Foodmart till Midnite on left on 5R975 in Pateros (NO SERVICES NEXT 57 MILES)
A31: =+A30+B31 -> 215.7 | B31: 18.7 | C31: =+A31*$D$7 -> 347.06129999999996 | D31: =+B31*$D$7 -> 30.0883 | F31: CAUTION crossing Columbia R. Bridge then Park/WATER on right
A32: =+A31+B32 -> 235.2 | B32: 19.5 | C32: =+A32*$D$7 -> 378.43680000000001 | D32: =+B32*$D$7 -> 31.375499999999999 | F32: Park/WATER on right on SR97S
A33: =+A32+B33 -> 249.8 | B33: 14.6 | C33: =+A33*$D$7 -> 401.92819999999995 | D33: =+B33*$D$7 -> 23.491399999999999 | F33: ST @ lite onto SR28E to "East Wenatchee" as SR97S turns west
A34: =+A33+B34 -> 253.0 | B34: 3.2 | C34: =+A34*$D$7 -> 407.07699999999994 | D34: =+B34*$D$7 -> 5.1488000000000005 | F34: CAUTIOUS LT onto "Valley Mall Parkway To City Center"
A35: =+A34+B35 -> 253.7 | B35: 00.7 | C35: =+A35*$D$7 -> 408.20329999999996 | D35: =+B35*$D$7 -> 1.1262999999999999 | E35: #6 | F35: FINAL CONTROL: The Rivers Inn Lobby on right @ (509)884-1474