A1: Seattle Randonneurs 400 km Brevet
A2: Arlington to Sumas
A4: Created By: | D4: Ron Lee
A5: Verified By: | D5: Ron Lee
A6: Year(s) Used: | D6: 1999.0
A7: Conversion(Mi-Km) | D7: 1.609
A9: Miles | C9: Km
A10: Total | B10: Leg | C10: Total | D10: Leg | E10: Ctrl | F10: Instructions
A11: 0.0 | B11: 0.0 | C11: =+A11*$D$7 -> 0.0 | D11: =+B11*$D$7 -> 0.0 | E11: #1 | F11: Start at Arlington Motor Inn at Exit #208 on I-5.
A12: =+A11+B12 -> 0.0 | B12: 0.0 | C12: =+A12*$D$7 -> 0.0 | D12: =+B12*$D$7 -> 0.0 | F12: East on SR 530 toward Arlington.
A13: =+A12+B13 -> 3.9 | B13: 3.9 | C13: =+A13*$D$7 -> 6.2751000000000001 | D13: =+B13*$D$7 -> 6.2751000000000001 | F13: L(N) - Broadway Street. Arlington Thriftway.
A14: =+A13+B14 -> 4.0 | B14: 00.1 | C14: =+A14*$D$7 -> 6.4359999999999999 | D14: =+B14*$D$7 -> 0.16090000000000002 | F14: R(E) - Burke Avenue. Follow SR 530 East signs.
A15: =+A14+B15 -> 31.6 | B15: 27.6 | C15: =+A15*$D$7 -> 50.8444 | D15: =+B15*$D$7 -> 44.4084 | E15: #2 | F15: L(N) - Intersection of Seemann Street and Emens Avenue. REMAIN ON SR 530 EAST. Shell Station on corner.
A16: =+A15+B16 -> 50.3 | B16: 18.7 | C16: =+A16*$D$7 -> 80.932699999999997 | D16: =+B16*$D$7 -> 30.0883 | F16: R(E) - Intersection of SR 530 and SR 20 East [North Cascade Highway].
A17: =+A16+B17 -> 57.1 | B17: 6.8 | C17: =+A17*$D$7 -> 91.873899999999992 | D17: =+B17*$D$7 -> 10.9412 | E17: #3 | F17: (OPEN). "Welcome to Marblemount" Sign on SR 20 East. TURN AROUND POINT.
A18: =+A17+B18 -> 57.1 | B18: 0.0 | C18: =+A18*$D$7 -> 91.873899999999992 | D18: =+B18*$D$7 -> 0.0 | F18: L(W) - TURN AROUND POINT.
A19: =+A18+B19 -> 97.1 | B19: 40.0 | C19: =+A19*$D$7 -> 156.23389999999998 | D19: =+B19*$D$7 -> 64.36 | E19: #4 | F19: RT(N) - Intersection of SR 20 West and SR 9 North. Follow signs to Sumas (42 miles). Sedro Woolley. Begin Climb.
A20: =+A19+B20 -> 113.7 | B20: 16.6 | C20: =+A20*$D$7 -> 182.94329999999999 | D20: =+B20*$D$7 -> 26.709400000000002 | F20: BAD RAIL ROAD TRACKS. USE CAUTION!
A21: =+A20+B21 -> 117.1 | B21: 3.3999999999999915 | C21: =+A21*$D$7 -> 188.41389999999996 | D21: =+B21*$D$7 -> 5.4705999999999859 | F21: R/L(N) - Gas Station.
A22: =+A21+B22 -> 119.2 | B22: 2.1000000000000085 | C22: =+A22*$D$7 -> 191.79279999999997 | D22: =+B22*$D$7 -> 3.3789000000000136 | F22: L(NW) - Intersection of SR 542 and SR 9 North. (SR 542/SR 9)
A23: =+A22+B23 -> 124.0 | B23: 4.8 | C23: =+A23*$D$7 -> 199.51599999999996 | D23: =+B23*$D$7 -> 7.7231999999999994 | F23: RT(N) - REMAIN ON SR 9 North. IGA. DO NOT CROSS THE BRIDGE OVER NOOKSACK RIVER (SR 542).
A24: =+A23+B24 -> 125.1 | B24: 1.0999999999999943 | C24: =+A24*$D$7 -> 201.28589999999997 | D24: =+B24*$D$7 -> 1.7698999999999909 | F24: R(N) - Siper Road.
A25: =+A24+B25 -> 126.8 | B25: 1.7 | C25: =+A25*$D$7 -> 204.02119999999996 | D25: =+B25*$D$7 -> 2.7353000000000001 | F25: R(E) - Hopewell Road.
A26: =+A25+B26 -> 127.1 | B26: 0.29999999999999716 | C26: =+A26*$D$7 -> 204.50389999999996 | D26: =+B26*$D$7 -> 0.48269999999999541 | F26: L(N) - Goodwin Road.
A27: =+A26+B27 -> 130.6 | B27: 3.5 | C27: =+A27*$D$7 -> 210.13539999999995 | D27: =+B27*$D$7 -> 5.6315 | F27: R(E) - Sorenson Road. [2nd Stop Sign]
A28: =+A27+B28 -> 130.8 | B28: 0.20000000000001705 | C28: =+A28*$D$7 -> 210.45719999999997 | D28: =+B28*$D$7 -> 0.32180000000002745 | F28: L(N) - North Telegraph Road.
A29: =+A28+B29 -> 133.8 | B29: 3.0 | C29: =+A29*$D$7 -> 215.28419999999997 | D29: =+B29*$D$7 -> 4.827 | F29: BL(N) - North Telegraph Road becomes Hovel Road.
A30: =+A29+B30 -> 135.2 | B30: 1.3999999999999773 | C30: =+A30*$D$7 -> 217.53679999999994 | D30: =+B30*$D$7 -> 2.2525999999999633 | F30: L(W) - Front Street.
A31: =+A30+B31 -> 135.4 | B31: 0.20000000000001705 | C31: =+A31*$D$7 -> 217.85859999999997 | D31: =+B31*$D$7 -> 0.32180000000002745 | F31: R(N) - Cherry Street, Entering Sumas.
A32: =+A31+B32 -> 136.0 | B32: 0.59999999999999432 | C32: =+A32*$D$7 -> 218.82399999999996 | D32: =+B32*$D$7 -> 0.96539999999999082 | E32: #5 | F32: R(E) - Cleveland Street. USA Gas Station, Border Inn Motel, Border Crossing. TURN AROUND POINT.
A33: =+A32+B33 -> 136.0 | B33: 0.0 | C33: =+A33*$D$7 -> 218.82399999999996 | D33: =+B33*$D$7 -> 0.0 | F33: L(S) - Cherry Street.
A34: =+A33+B34 -> 136.6 | B34: 0.59999999999999432 | C34: =+A34*$D$7 -> 219.78939999999994 | D34: =+B34*$D$7 -> 0.96539999999999082 | F34: R(W) - SR 9 South to Bellingham.
A35: =+A34+B35 -> 137.5 | B35: 0.90000000000000568 | C35: =+A35*$D$7 -> 221.23750000000001 | D35: =+B35*$D$7 -> 1.448100000000009 | F35: L(S) - Halverstick Road (SR 9 South).
A36: =+A35+B36 -> 139.5 | B36: 2.0 | C36: =+A36*$D$7 -> 224.45549999999994 | D36: =+B36*$D$7 -> 3.218 | F36: R(W) - Remain on SR 9 South.
A37: =+A36+B37 -> 140.5 | B37: 1.0 | C37: =+A37*$D$7 -> 226.06449999999995 | D37: =+B37*$D$7 -> 1.609 | F37: ST(W) - SR 546 West (Stop Sign) becomes East Badger Road.
A38: =+A37+B38 -> 154.5 | B38: 14.0 | C38: =+A38*$D$7 -> 248.59049999999996 | D38: =+B38*$D$7 -> 22.526 | F38: L(S) - Delta Line Road. STAY ALERT. Road bends to right and becomes Delta Line Road -- NORTHBOUND.
A39: =+A38+B39 -> 156.6 | B39: 2.0999999999999943 | C39: =+A39*$D$7 -> 251.96939999999995 | D39: =+B39*$D$7 -> 3.3788999999999909 | F39: R(W) - Birch Bay - Lynden Road.
A40: =+A39+B40 -> 162.7 | B40: 6.0999999999999943 | C40: =+A40*$D$7 -> 261.78429999999992 | D40: =+B40*$D$7 -> 9.8148999999999909 | F40: L(S) - Harbor View Road. Lynden Family Medicine.
A41: =+A40+B41 -> 162.8 | B41: 0.10000000000002274 | C41: =+A41*$D$7 -> 261.94519999999994 | D41: =+B41*$D$7 -> 0.16090000000003657 | F41: L(S) - Birch Bay Road into Birch Bay.
A42: =+A41+B42 -> 164.0 | B42: 1.1999999999999886 | C42: =+A42*$D$7 -> 263.87599999999998 | D42: =+B42*$D$7 -> 1.9307999999999816 | F42: R(W)/L(S) - Alderson Road. (Right @stop sign, then Left). "Birch Bay Welcomes You".
A43: =+A42+B43 -> 165.3 | B43: 1.3000000000000114 | C43: =+A43*$D$7 -> 265.96769999999998 | D43: =+B43*$D$7 -> 2.0917000000000181 | E43: #6 | F43: Birch Bay State Park. [FIRST Rest Room Building.]
A44: =+A43+B44 -> 165.9 | B44: 0.59999999999999432 | C44: =+A44*$D$7 -> 266.93309999999997 | D44: =+B44*$D$7 -> 0.96539999999999082 | F44: BL(SE) - Point Whitehorn.
A45: =+A44+B45 -> 166.5 | B45: 0.59999999999999432 | C45: =+A45*$D$7 -> 267.89849999999996 | D45: =+B45*$D$7 -> 0.96539999999999082 | F45: L(E) - Grandview Road (SR 548).
A46: =+A45+B46 -> 168.5 | B46: 2.0 | C46: =+A46*$D$7 -> 271.11649999999997 | D46: =+B46*$D$7 -> 3.218 | F46: R(S) - Kickerville Road.
A47: =+A46+B47 -> 170.49 | B47: 1.9900000000000091 | C47: =+A47*$D$7 -> 274.31840999999997 | D47: =+B47*$D$7 -> 3.2019100000000145 | F47: L(SE) - Rainbow Road.
A48: =+A47+B48 -> 171.67 | B48: 1.1799999999999784 | C48: =+A48*$D$7 -> 276.21702999999991 | D48: =+B48*$D$7 -> 1.8986199999999653 | F48: BL(E) - Mountain View Road becomes Main in Ferndale
A49: =+A48+B49 -> 176.64 | B49: 4.97 | C49: =+A49*$D$7 -> 284.21375999999992 | D49: =+B49*$D$7 -> 7.9967299999999994 | F49: R(SE) - Hovander Road (after bridge before overpass)
A50: =+A49+B50 -> 177.57 | B50: 0.93000000000000682 | C50: =+A50*$D$7 -> 285.71012999999994 | D50: =+B50*$D$7 -> 1.4963700000000109 | F50: BL(E) - Becomes West Smith Road over I-5.
A51: =+A50+B51 -> 179.19 | B51: 1.62 | C51: =+A51*$D$7 -> 288.31670999999994 | D51: =+B51*$D$7 -> 2.6065800000000001 | F51: R(S) - Northwest Drive @ "7-Up" sign.
A52: =+A51+B52 -> 182.54 | B52: 3.3499999999999943 | C52: =+A52*$D$7 -> 293.70685999999995 | D52: =+B52*$D$7 -> 5.3901499999999904 | F52: R(W) - West Bakerview Road.
A53: =+A52+B53 -> 182.85 | B53: 0.31000000000000227 | C53: =+A53*$D$7 -> 294.20564999999993 | D53: =+B53*$D$7 -> 0.49879000000000367 | F53: BL(W) - Over I-5.
A54: =+A53+B54 -> 183.16 | B54: 0.31000000000000227 | C54: =+A54*$D$7 -> 294.70443999999992 | D54: =+B54*$D$7 -> 0.49879000000000367 | F54: L(S) - Bennett Drive.
A55: =+A54+B55 -> 184.41 | B55: 1.25 | C55: =+A55*$D$7 -> 296.71568999999994 | D55: =+B55*$D$7 -> 2.01125 | F55: L(SE) - Marine Drive (Bellingham), becomes Eldridge.
A56: =+A55+B56 -> 185.96 | B56: 1.5500000000000114 | C56: =+A56*$D$7 -> 299.20963999999998 | D56: =+B56*$D$7 -> 2.4939500000000181 | F56: Becomes West Holly Street.
A57: =+A56+B57 -> 186.64 | B57: 0.6799999999999784 | C57: =+A57*$D$7 -> 300.30375999999995 | D57: =+B57*$D$7 -> 1.0941199999999653 | F57: R(SW) - Bay Street.
A58: =+A57+B58 -> 186.77 | B58: 0.13000000000002387 | C58: =+A58*$D$7 -> 300.51292999999998 | D58: =+B58*$D$7 -> 0.20917000000003841 | F58: L(SE) - West Chestnut becomes East Chestnut.
A59: =+A58+B59 -> 187.02 | B59: 0.25 | C59: =+A59*$D$7 -> 300.91517999999996 | D59: =+B59*$D$7 -> 0.40225 | F59: R(SW) - North State Street
A60: =+A59+B60 -> 188.01 | B60: 0.98999999999998067 | C60: =+A60*$D$7 -> 302.50808999999992 | D60: =+B60*$D$7 -> 1.592909999999969 | F60: BR(SW) - Boulevard becomes South State Street.
A61: =+A60+B61 -> 189.38 | B61: 1.37 | C61: =+A61*$D$7 -> 304.71241999999995 | D61: =+B61*$D$7 -> 2.2043300000000001 | F61: 11th Street into Fairhaven, becomes 12th Street.
A62: =+A61+B62 -> 190.25 | B62: 0.87000000000000455 | C62: =+A62*$D$7 -> 306.11224999999996 | D62: =+B62*$D$7 -> 1.3998300000000072 | F62: BL(S) - SR 11, becomes Chuckanut Drive.
A63: =+A62+B63 -> 203.17 | B63: 12.92 | C63: =+A63*$D$7 -> 326.90052999999995 | D63: =+B63*$D$7 -> 20.78828 | F63: R(W) - Bow Hill Road [SR 237] to Bayview.
A64: =+A63+B64 -> 204.57 | B64: 1.4000000000000057 | C64: =+A64*$D$7 -> 329.15312999999992 | D64: =+B64*$D$7 -> 2.252600000000009 | F64: R(W) - Bayview Edison Road / (LT)Cains Ct. / (RT)Gilmore.
A65: =+A64+B65 -> 206.27 | B65: 1.7000000000000171 | C65: =+A65*$D$7 -> 331.88842999999997 | D65: =+B65*$D$7 -> 2.7353000000000276 | F65: L(S) - Bayview Edison Road.
A66: =+A65+B66 -> 218.27 | B66: 12.0 | C66: =+A66*$D$7 -> 351.19642999999996 | D66: =+B66*$D$7 -> 19.308 | F66: R(W) - Chillberg Road/Morris Street. "Welcome to La Conner" sign.
A67: =+A66+B67 -> 218.77 | B67: 0.5 | C67: =+A67*$D$7 -> 352.00092999999998 | D67: =+B67*$D$7 -> 0.80449999999999999 | F67: L(S) - First Avenue. (La Conner)
A68: =+A67+B68 -> 218.87 | B68: 9.9999999999994316E-2 | C68: =+A68*$D$7 -> 352.16182999999995 | D68: =+B68*$D$7 -> 0.16089999999999086 | F68: Public Bathroom on the Left.
A69: =+A68+B69 -> 218.97 | B69: 9.9999999999994316E-2 | C69: =+A69*$D$7 -> 352.32272999999992 | D69: =+B69*$D$7 -> 0.16089999999999086 | E69: #7 | F69: On Right Hand Side - La Conner LEGENDS Native American Cafe. Open Air Restaurant. 710 First Street., La Conner.
A70: =+A69+B70 -> 218.97 | B70: 0.0 | C70: =+A70*$D$7 -> 352.32272999999992 | D70: =+B70*$D$7 -> 0.0 | F70: First Avenue. (La Conner)
A71: =+A70+B71 -> 219.02 | B71: 5.0000000000011369E-2 | C71: =+A71*$D$7 -> 352.40317999999996 | D71: =+B71*$D$7 -> 8.0450000000018285E-2 | F71: L(E) - Commercial Street. Planters Hotel. (La Conner)
A72: =+A71+B72 -> 219.07 | B72: 4.9999999999982947E-2 | C72: =+A72*$D$7 -> 352.48362999999995 | D72: =+B72*$D$7 -> 8.0449999999972557E-2 | F72: L(N) - Second Avenue. (La Conner)
A73: =+A72+B73 -> 219.27 | B73: 0.20000000000001705 | C73: =+A73*$D$7 -> 352.80542999999994 | D73: =+B73*$D$7 -> 0.32180000000002745 | F73: R(E) - Morris Street. La Conner Country Inn.
A74: =+A73+B74 -> 219.67 | B74: 0.39999999999997726 | C74: =+A74*$D$7 -> 353.44902999999994 | D74: =+B74*$D$7 -> 0.64359999999996342 | F74: ST(E) - Chillberg Road (to Conway). Shell Station/General Store.
A75: =+A74+B75 -> 220.37 | B75: 0.70000000000001705 | C75: =+A75*$D$7 -> 354.57532999999995 | D75: =+B75*$D$7 -> 1.1263000000000274 | F75: R(S) - Dodge Valley Road
A76: =+A75+B76 -> 222.87 | B76: 2.5 | C76: =+A76*$D$7 -> 358.59782999999993 | D76: =+B76*$D$7 -> 4.0225 | F76: BL - Dodge Valley Road (at DEAD END SIGN).
A77: =+A76+B77 -> 223.47 | B77: 0.59999999999999432 | C77: =+A77*$D$7 -> 359.56322999999998 | D77: =+B77*$D$7 -> 0.96539999999999082 | F77: R(S) - Best Road. [Stop Sign]
A78: =+A77+B78 -> 224.47 | B78: 1.0 | C78: =+A78*$D$7 -> 361.17222999999996 | D78: =+B78*$D$7 -> 1.609 | F78: R(S) - Moore Road/Fir Island Road (to Conway).
A79: =+A78+B79 -> 225.77 | B79: 1.3000000000000114 | C79: =+A79*$D$7 -> 363.26392999999996 | D79: =+B79*$D$7 -> 2.0917000000000181 | F79: L(E) - Fir Island Road/Maupin Road.
A80: =+A79+B80 -> 229.57 | B80: 3.7999999999999829 | C80: =+A80*$D$7 -> 369.37812999999994 | D80: =+B80*$D$7 -> 6.1141999999999728 | F80: R(S) - Pioneer Highway (SR 530).
A81: =+A80+B81 -> 234.17 | B81: 4.5999999999999943 | C81: =+A81*$D$7 -> 376.77952999999991 | D81: =+B81*$D$7 -> 7.4013999999999909 | F81: R/BL(S) - Old Pacific Hwy. BEFORE HILL. Cross Rail Road Tracks.
A82: =+A81+B82 -> 236.17 | B82: 2.0 | C82: =+A82*$D$7 -> 379.99752999999993 | D82: =+B82*$D$7 -> 3.218 | F82: Bad Rail Road Tracks. Becomes 102nd Avenue NE.
A83: =+A82+B83 -> 236.57 | B83: 0.40000000000000568 | C83: =+A83*$D$7 -> 380.64112999999992 | D83: =+B83*$D$7 -> 0.64360000000000916 | E83: #8 | F83: L(E) - SR 532 East (to Bryant). Bob's Market and Deli. Stanwood.
A84: =+A83+B84 -> 245.22 | B84: 8.6500000000000057 | C84: =+A84*$D$7 -> 394.55897999999996 | D84: =+B84*$D$7 -> 13.917850000000008 | F84: R(S) - SR 9 South at Stop Sign
A85: =+A84+B85 -> 248.52 | B85: 3.3000000000000114 | C85: =+A85*$D$7 -> 399.86867999999998 | D85: =+B85*$D$7 -> 5.3097000000000181 | F85: R(W) - SR 530 West.
A86: =+A85+B86 -> 248.52 | B86: 0.0 | C86: =+A86*$D$7 -> 399.86867999999998 | D86: =+B86*$D$7 -> 0.0 | E86: #9 | F86: L(S) - Arlington Motor Inn. FINISH.