A1: Seattle Randonneurs 400 km Brevet
A2: Three Passes in Reverse from North Bend
A4: Created By: | D4: Mark Thomas
A5: Verified By: | D5: Mark Thomas
A6: Year(s) Used: | D6: 2000.0
A7: Conversion(Mi-Km) | D7: 1.609
A9: Miles | C9: Km
A10: Total | B10: Leg | C10: Total | D10: Leg | E10: Ctrl | F10: Instructions
A11: 0.0 | B11: 0.0 | C11: =+A11*$D$7 -> 0.0 | D11: =+B11*$D$7 -> 0.0 | E11: #1 | F11: START - NB truck stop / motel (Edgewick Inn?)
A12: =+A11+B12 -> 00.2 | B12: 00.2 | C12: =+A12*$D$7 -> 0.32180000000000003 | D12: =+B12*$D$7 -> 0.32180000000000003 | F12: I-90 East
A13: =+A12+B13 -> 48.2 | B13: 48.0 | C13: =+A13*$D$7 -> 77.55380000000001 | D13: =+B13*$D$7 -> 77.231999999999999 | F13: Exit at Cle Elum
A14: =+A13+B14 -> 48.4 | B14: 00.2 | C14: =+A14*$D$7 -> 77.875600000000006 | D14: =+B14*$D$7 -> 0.32180000000000003 | E14: #2 | F14: Cle Elum Safeway
A15: =+A14+B15 -> 53.0 | B15: 4.6 | C15: =+A15*$D$7 -> 85.277000000000015 | D15: =+B15*$D$7 -> 7.4013999999999998 | F15: L onto Hwy 970
A16: =+A15+B16 -> 60.4 | B16: 7.4 | C16: =+A16*$D$7 -> 97.183600000000013 | D16: =+B16*$D$7 -> 11.906600000000001 | F16: BL? onto Hwy 97 toward Blewitt Pass
A17: =+A16+B17 -> 95.8 | B17: 35.4 | C17: =+A17*$D$7 -> 154.14220000000003 | D17: =+B17*$D$7 -> 56.958599999999997 | F17: L onto Hwy 2
A18: =+A17+B18 -> 101.8 | B18: 6.0 | C18: =+A18*$D$7 -> 163.79620000000003 | D18: =+B18*$D$7 -> 9.6539999999999999 | E18: #3 | F18: Leavenworth Chevron Mini Mart
A19: =+A18+B19 -> 151.8 | B19: 50.0 | C19: =+A19*$D$7 -> 244.24620000000002 | D19: =+B19*$D$7 -> 80.45 | E19: #4 | F19: Skykomish Chevron
A20: =+A19+B20 -> 178.4 | B20: 26.6 | C20: =+A20*$D$7 -> 287.04559999999998 | D20: =+B20*$D$7 -> 42.799399999999999 | F20: R (at light in Sultan) onto Old Owen Road
A21: =+A20+B21 -> 185.1 | B21: 6.7 | C21: =+A21*$D$7 -> 297.82589999999999 | D21: =+B21*$D$7 -> 10.7803 | F21: X Hwy 2 onto Main Street
A22: =+A21+B22 -> 187.5 | B22: 2.4 | C22: =+A22*$D$7 -> 301.6875 | D22: =+B22*$D$7 -> 3.8615999999999997 | E22: #5 | F22: West Monroe BP
A23: =+A22+B23 -> 187.5 | B23: 0.0 | C23: =+A23*$D$7 -> 301.6875 | D23: =+B23*$D$7 -> 0.0 | F23: R onto Old Snohomish Monroe Road
A24: =+A23+B24 -> 193.2 | B24: 5.7 | C24: =+A24*$D$7 -> 310.85879999999997 | D24: =+B24*$D$7 -> 9.1713000000000005 | F24: Becomes Lincoln Avenue
A25: =+A24+B25 -> 193.7 | B25: 0.5 | C25: =+A25*$D$7 -> 311.66329999999999 | D25: =+B25*$D$7 -> 0.80449999999999999 | F25: L onto 2nd Street SE
A26: =+A25+B26 -> 193.7 | B26: 0.0 | C26: =+A26*$D$7 -> 311.66329999999999 | D26: =+B26*$D$7 -> 0.0 | F26: R onto Maple Avenue
A27: =+A26+B27 -> 195.0 | B27: 1.3 | C27: =+A27*$D$7 -> 313.755 | D27: =+B27*$D$7 -> 2.0916999999999999 | F27: BR onto S Machias Road
A28: =+A27+B28 -> 198.7 | B28: 3.7 | C28: =+A28*$D$7 -> 319.70829999999995 | D28: =+B28*$D$7 -> 5.9533000000000005 | F28: L onto Machias Cutoff
A29: =+A28+B29 -> 200.1 | B29: 1.4 | C29: =+A29*$D$7 -> 321.96089999999998 | D29: =+B29*$D$7 -> 2.2525999999999997 | F29: R onto Stitch Road
A30: =+A29+B30 -> 200.7 | B30: 00.6 | C30: =+A30*$D$7 -> 322.92629999999997 | D30: =+B30*$D$7 -> 0.96539999999999992 | F30: R onto S. Davies Road
A31: =+A30+B31 -> 202.1 | B31: 1.4 | C31: =+A31*$D$7 -> 325.1789 | D31: =+B31*$D$7 -> 2.2525999999999997 | F31: L onto Vernon Road
A32: =+A31+B32 -> 202.2 | B32: 00.1 | C32: =+A32*$D$7 -> 325.33979999999997 | D32: =+B32*$D$7 -> 0.16090000000000002 | E32: #6 | F32: Lake Stevens Chevron Mini Mart
A33: =+A32+B33 -> 202.2 | B33: 0.0 | C33: =+A33*$D$7 -> 325.33979999999997 | D33: =+B33*$D$7 -> 0.0 | F33: R onto Vernon Road (back the way you came)
A34: =+A33+B34 -> 202.3 | B34: 00.1 | C34: =+A34*$D$7 -> 325.50069999999999 | D34: =+B34*$D$7 -> 0.16090000000000002 | F34: R onto N Davies Road
A35: =+A34+B35 -> 204.4 | B35: 2.1 | C35: =+A35*$D$7 -> 328.87959999999998 | D35: =+B35*$D$7 -> 3.3789000000000002 | F35: BR onto S Lake Stevens Road
A36: =+A35+B36 -> 204.9 | B36: 0.5 | C36: =+A36*$D$7 -> 329.68409999999994 | D36: =+B36*$D$7 -> 0.80449999999999999 | F36: BL onto 103rd Avenue SE
A37: =+A36+B37 -> 206.6 | B37: 1.7 | C37: =+A37*$D$7 -> 332.41939999999994 | D37: =+B37*$D$7 -> 2.7353000000000001 | F37: L onto Bunk Foss Road
A38: =+A37+B38 -> 207.4 | B38: 00.8 | C38: =+A38*$D$7 -> 333.70659999999998 | D38: =+B38*$D$7 -> 1.2872000000000001 | F38: BL onto Ritchey Road
A39: =+A38+B39 -> 207.6 | B39: 00.2 | C39: =+A39*$D$7 -> 334.02839999999992 | D39: =+B39*$D$7 -> 0.32180000000000003 | F39: R onto S Machias Road
A40: =+A39+B40 -> 209.0 | B40: 1.4 | C40: =+A40*$D$7 -> 336.28099999999995 | D40: =+B40*$D$7 -> 2.2525999999999997 | F40: BL onto Maple Avenue
A41: =+A40+B41 -> 210.3 | B41: 1.3 | C41: =+A41*$D$7 -> 338.37269999999995 | D41: =+B41*$D$7 -> 2.0916999999999999 | F41: R onto 2nd Street SE
A42: =+A41+B42 -> 210.7 | B42: 00.4 | C42: =+A42*$D$7 -> 339.0163 | D42: =+B42*$D$7 -> 0.64360000000000006 | F42: L onto Avenue D
A43: =+A42+B43 -> 212.0 | B43: 1.3 | C43: =+A43*$D$7 -> 341.108 | D43: =+B43*$D$7 -> 2.0916999999999999 | F43: BL onto Springhetti
A44: =+A43+B44 -> 214.0 | B44: 2.0 | C44: =+A44*$D$7 -> 344.32600000000002 | D44: =+B44*$D$7 -> 3.218 | F44: BL onto Broadway Avenue
A45: =+A44+B45 -> 215.9 | B45: 1.9 | C45: =+A45*$D$7 -> 347.38310000000001 | D45: =+B45*$D$7 -> 3.0570999999999997 | F45: L onto Elliott Road
A46: =+A45+B46 -> 218.9 | B46: 3.0 | C46: =+A46*$D$7 -> 352.21010000000001 | D46: =+B46*$D$7 -> 4.827 | F46: BL onto High Bridge Road
A47: =+A46+B47 -> 224.3 | B47: 5.4 | C47: =+A47*$D$7 -> 360.89870000000002 | D47: =+B47*$D$7 -> 8.688600000000001 | F47: Continue on W Snoqualmie Valley Road NE
A48: =+A47+B48 -> 231.9 | B48: 7.6 | C48: =+A48*$D$7 -> 373.12709999999998 | D48: =+B48*$D$7 -> 12.228399999999999 | F48: L onto NE 80th Street
A49: =+A48+B49 -> 232.7 | B49: 00.8 | C49: =+A49*$D$7 -> 374.41430000000003 | D49: =+B49*$D$7 -> 1.2872000000000001 | F49: L onto Ames Lake Carnation Road NE
A50: =+A49+B50 -> 236.0 | B50: 3.3 | C50: =+A50*$D$7 -> 379.72400000000005 | D50: =+B50*$D$7 -> 5.3096999999999994 | F50: R onto Hwy 203 to Carnation
A51: =+A50+B51 -> 237.8 | B51: 1.8 | C51: =+A51*$D$7 -> 382.62020000000007 | D51: =+B51*$D$7 -> 2.8961999999999999 | F51: L onto NE Tolt Hill Road
A52: =+A51+B52 -> 238.6 | B52: 00.8 | C52: =+A52*$D$7 -> 383.90740000000005 | D52: =+B52*$D$7 -> 1.2872000000000001 | F52: L onto West Snoqualmie River Road
A53: =+A52+B53 -> 243.3 | B53: 4.7 | C53: =+A53*$D$7 -> 391.46970000000005 | D53: =+B53*$D$7 -> 7.5623000000000005 | F53: R on SE 24th Street
A54: =+A53+B54 -> 244.1 | B54: 00.8 | C54: =+A54*$D$7 -> 392.75690000000009 | D54: =+B54*$D$7 -> 1.2872000000000001 | F54: L onto SR 202
A55: =+A54+B55 -> 254.6 | B55: 10.5 | C55: =+A55*$D$7 -> 409.65140000000008 | D55: =+B55*$D$7 -> 16.894500000000001 | F55: L at light onto North Bend Way
A56: =+A55+B56 -> 258.3 | B56: 3.7 | C56: =+A56*$D$7 -> 415.60470000000009 | D56: =+B56*$D$7 -> 5.9533000000000005 | E56: #7 | F56: END