A1: Seattle Randonneurs 400 km Brevet
A2: Enumclaw-Packwood-Yakima (White, Chinook, Cayuse Pass)
A4: Created By: | D4: Ken Carter
A5: Verified By: | D5: Ken Carter
A6: Year(s) Used: | D6: 2001
A7: Conversion(Mi-Km) | D7: 1.609
A9: Miles | C9: Km
A10: Total | B10: Leg | C10: Total | D10: Leg | E10: Ctrl | F10: Instructions
A11: 0.0 | B11: 0.0 | C11: =+A11*$D$7 -> 0.0 | D11: =+B11*$D$7 -> 0.0 | E11: #1 | F11: ENUMCLAW, WA - Best Western Park Center Hotel
A12: =+A11+B12 -> 0.0 | B12: 0.0 | C12: =+A12*$D$7 -> 0.0 | D12: =+B12*$D$7 -> 0.0 | F12: Best Western Park Center Hotel (1000 Griffin Ave, 1-360-825-4490)
A13: =+A12+B13 -> 00.1 | B13: 00.1 | C13: =+A13*$D$7 -> 0.16090000000000002 | D13: =+B13*$D$7 -> 0.16090000000000002 | F13: RIGHT (North-West) onto Stevenson Ave
A14: =+A13+B14 -> 00.2 | B14: 00.1 | C14: =+A14*$D$7 -> 0.32180000000000003 | D14: =+B14*$D$7 -> 0.16090000000000002 | F14: LEFT (South-West) onto Cole St
A15: =+A14+B15 -> 00.6 | B15: 00.4 | C15: =+A15*$D$7 -> 0.96540000000000015 | D15: =+B15*$D$7 -> 0.64360000000000006 | F15: BR (South-West) onto SR-410
A16: =+A15+B16 -> 3.3 | B16: 2.7 | C16: =+A16*$D$7 -> 5.3097000000000003 | D16: =+B16*$D$7 -> 4.3443000000000005 | F16: LEFT (East) onto Park Ave
A17: =+A16+B17 -> 3.4 | B17: 00.1 | C17: =+A17*$D$7 -> 5.4706000000000001 | D17: =+B17*$D$7 -> 0.16090000000000002 | F17: RIGHT (South-West) onto (N) River Ave [N River Rd]
A18: =+A17+B18 -> 4.1 | B18: 00.7 | C18: =+A18*$D$7 -> 6.5969000000000007 | D18: =+B18*$D$7 -> 1.1262999999999999 | F18: Continue (South-West) on SR-165 [WA-165 E]
A19: =+A18+B19 -> 5.7 | B19: 1.6 | C19: =+A19*$D$7 -> 9.1713000000000022 | D19: =+B19*$D$7 -> 2.5744000000000002 | F19: Continue (West) on SR-162 [Pioneer Way E]
A20: =+A19+B20 -> 8.0 | B20: 2.3 | C20: =+A20*$D$7 -> 12.872 | D20: =+B20*$D$7 -> 3.7006999999999999 | F20: SOUTH PRAIRIE
A21: =+A20+B21 -> 14.5 | B21: 6.5 | C21: =+A21*$D$7 -> 23.330500000000001 | D21: =+B21*$D$7 -> 10.458500000000001 | F21: LEFT (South) onto Orville Rd E
A22: =+A21+B22 -> 32.7 | B22: 18.2 | C22: =+A22*$D$7 -> 52.614300000000007 | D22: =+B22*$D$7 -> 29.283799999999999 | F22: LEFT (East) onto SR-161 (E) [SR-161 E]
A23: =+A22+B23 -> 37.0 | B23: 4.3 | C23: =+A23*$D$7 -> 59.533000000000001 | D23: =+B23*$D$7 -> 6.9186999999999994 | F23: BL (South) onto SR-7 [Mountain Hwy]
A24: =+A23+B24 -> 47.0 | B24: 10.0 | C24: =+A24*$D$7 -> 75.623000000000005 | D24: =+B24*$D$7 -> 16.09 | E24: #2 | F24: Control # 2 ELBE, Open
A25: =+A24+B25 -> 47.0 | B25: 0.0 | C25: =+A25*$D$7 -> 75.623000000000005 | D25: =+B25*$D$7 -> 0.0 | F25: BL (East) onto SR-706 [National Park Hwy]
A26: =+A25+B26 -> 54.8 | B26: 7.8 | C26: =+A26*$D$7 -> 88.173199999999994 | D26: =+B26*$D$7 -> 12.5502 | F26: ASHFORD
A27: =+A26+B27 -> 57.2 | B27: 2.4000000000000057 | C27: =+A27*$D$7 -> 92.034800000000004 | D27: =+B27*$D$7 -> 3.861600000000009 | F27: RIGHT (South) onto FR-52 Rd / Skate Creek Road
A28: =+A27+B28 -> 79.3 | B28: 22.1 | C28: =+A28*$D$7 -> 127.59370000000001 | D28: =+B28*$D$7 -> 35.558900000000001 | E28: #3 | F28: PACKWOOD, Texaco
A29: =+A28+B29 -> 79.3 | B29: 0.0 | C29: =+A29*$D$7 -> 127.59370000000001 | D29: =+B29*$D$7 -> 0.0 | F29: BL (North) onto US-12
A30: =+A29+B30 -> 147.5 | B30: 68.2 | C30: =+A30*$D$7 -> 237.32749999999999 | D30: =+B30*$D$7 -> 109.7338 | F30: At US-12 Fruitvale Blvd Exit, continue (East) on Fruitvale Blvd
A31: =+A30+B31 -> 147.7 | B31: 0.19999999999998863 | C31: =+A31*$D$7 -> 237.64929999999998 | D31: =+B31*$D$7 -> 0.32179999999998171 | E31: #4 | F31: YAKIMA, Open
A32: =+A31+B32 -> 147.7 | B32: 0.0 | C32: =+A32*$D$7 -> 237.64929999999998 | D32: =+B32*$D$7 -> 0.0 | F32: return West on Fruitvale Blvd
A33: =+A32+B33 -> 147.9 | B33: 0.20000000000001705 | C33: =+A33*$D$7 -> 237.97110000000001 | D33: =+B33*$D$7 -> 0.32180000000002745 | F33: At US-12 Fruitvale Blvd Exit, continue (West) on US-12
A34: =+A33+B34 -> 162.3 | B34: 14.4 | C34: =+A34*$D$7 -> 261.14070000000004 | D34: =+B34*$D$7 -> 23.169599999999999 | F34: BR (West) onto SR-410
A35: =+A34+B35 -> 176.8 | B35: 14.5 | C35: =+A35*$D$7 -> 284.47120000000001 | D35: =+B35*$D$7 -> 23.330500000000001 | E35: #5 | F35: SQUAW ROCK RESORT
A36: =+A35+B36 -> 181.6 | B36: 4.7999999999999829 | C36: =+A36*$D$7 -> 292.19439999999997 | D36: =+B36*$D$7 -> 7.7231999999999728 | F36: At near Cliffdell, stay on SR-410 (West)
A37: =+A36+B37 -> 212.8 | B37: 31.2 | C37: =+A37*$D$7 -> 342.39519999999999 | D37: =+B37*$D$7 -> 50.200800000000001 | E37: #6 | F37: CAYUSE PASS, SIR staffed
A38: =+A37+B38 -> 253.6 | B38: 40.8 | C38: =+A38*$D$7 -> 408.04239999999993 | D38: =+B38*$D$7 -> 65.647199999999998 | F38: Bear RIGHT (North-West) onto SR-164 [Griffin Ave]
A39: =+A38+B39 -> 254.0 | B39: 0.40000000000000568 | C39: =+A39*$D$7 -> 408.68599999999998 | D39: =+B39*$D$7 -> 0.64360000000000916 | E39: #7 | F39: FINISH ENUMCLAW, WA - Best Western Park Center Hotel