A1: Seattle Randonneurs 400 km Brevet
A2: Three Passes from Plateau
A4: Created By: | D4: Paul Friedrich
A5: Verified By: | D5: Paul Friedrich
A6: Year(s) Used: | D6: 1997.0
A7: Conversion(Mi-Km) | D7: 1.609
A9: Miles | C9: Km
A10: Total | B10: Leg | C10: Total | D10: Leg | E10: Ctrl | F10: Instructions
A11: 0.0 | B11: 0.0 | C11: =+A11*$D$7 -> 0.0 | D11: =+B11*$D$7 -> 0.0 | E11: #1 | F11: Start - L on to S.E. 30th St
A12: =+A11+B12 -> 00.1 | B12: 00.1 | C12: =+A12*$D$7 -> 0.16090000000000002 | D12: =+B12*$D$7 -> 0.16090000000000002 | F12: L onto 238th Ave S.E.
A13: =+A12+B13 -> 00.2 | B13: 00.1 | C13: =+A13*$D$7 -> 0.32180000000000003 | D13: =+B13*$D$7 -> 0.16090000000000002 | F13: R onto S.E. 32nd Way
A14: =+A13+B14 -> 0.5 | B14: 00.3 | C14: =+A14*$D$7 -> 0.80449999999999999 | D14: =+B14*$D$7 -> 0.48269999999999996 | F14: R onto Issaquah Pine Lake Rd
A15: =+A14+B15 -> 00.9 | B15: 00.4 | C15: =+A15*$D$7 -> 1.4480999999999999 | D15: =+B15*$D$7 -> 0.64360000000000006 | F15: R onto 228th Ave S.E.
A16: =+A15+B16 -> 3.2 | B16: 2.3 | C16: =+A16*$D$7 -> 5.1487999999999996 | D16: =+B16*$D$7 -> 3.7006999999999999 | F16: L onto Inglewood Hill Rd
A17: =+A16+B17 -> 5.0 | B17: 1.8 | C17: =+A17*$D$7 -> 8.0449999999999999 | D17: =+B17*$D$7 -> 2.8961999999999999 | F17: R onto E. Lake Samanish Way
A18: =+A17+B18 -> 8.4 | B18: 3.4 | C18: =+A18*$D$7 -> 13.515600000000001 | D18: =+B18*$D$7 -> 5.4706000000000001 | E18: #2 | F18: Redmond - Texaco Mini-mart
A19: =+A18+B19 -> 8.4 | B19: 0.0 | C19: =+A19*$D$7 -> 13.515600000000001 | D19: =+B19*$D$7 -> 0.0 | F19: R onto Redmond Fall City Rd (SR202)
A20: =+A19+B20 -> 19.6 | B20: 11.2 | C20: =+A20*$D$7 -> 31.5364 | D20: =+B20*$D$7 -> 18.020799999999998 | F20: L onto 308th Ave
A21: =+A20+B21 -> 20.4 | B21: 00.8 | C21: =+A21*$D$7 -> 32.823600000000006 | D21: =+B21*$D$7 -> 1.2872000000000001 | F21: L onto West Snoqualmie River Rd
A22: =+A21+B22 -> 25.1 | B22: 4.7 | C22: =+A22*$D$7 -> 40.385899999999999 | D22: =+B22*$D$7 -> 7.5623000000000005 | F22: R NE Tolt Hill Rd
A23: =+A22+B23 -> 25.9 | B23: 00.8 | C23: =+A23*$D$7 -> 41.673100000000005 | D23: =+B23*$D$7 -> 1.2872000000000001 | F23: L Rt 203
A24: =+A23+B24 -> 27.7 | B24: 1.8 | C24: =+A24*$D$7 -> 44.569300000000005 | D24: =+B24*$D$7 -> 2.8961999999999999 | F24: L Carnation Farms Rd
A25: =+A24+B25 -> 32.1 | B25: 4.4 | C25: =+A25*$D$7 -> 51.648900000000005 | D25: =+B25*$D$7 -> 7.0796000000000001 | F25: R NE 80th St
A26: =+A25+B26 -> 32.9 | B26: 00.8 | C26: =+A26*$D$7 -> 52.936099999999996 | D26: =+B26*$D$7 -> 1.2872000000000001 | F26: VR West Snoqualmie Valley Rd
A27: =+A26+B27 -> 42.4 | B27: 9.5 | C27: =+A27*$D$7 -> 68.221599999999995 | D27: =+B27*$D$7 -> 15.285499999999999 | F27: R Crescent Lake Rd (at Wooden Bridge)
A28: =+A27+B28 -> 43.4 | B28: 1.0 | C28: =+A28*$D$7 -> 69.830600000000004 | D28: =+B28*$D$7 -> 1.609 | F28: St Tualco Rd
A29: =+A28+B29 -> 44.6 | B29: 1.2 | C29: =+A29*$D$7 -> 71.761399999999995 | D29: =+B29*$D$7 -> 1.9307999999999998 | F29: VR Tualco Rd
A30: =+A29+B30 -> 45.3 | B30: 00.7 | C30: =+A30*$D$7 -> 72.887700000000009 | D30: =+B30*$D$7 -> 1.1262999999999999 | F30: L Rt 203
A31: =+A30+B31 -> 46.8 | B31: 1.5 | C31: =+A31*$D$7 -> 75.301200000000009 | D31: =+B31*$D$7 -> 2.4135 | F31: R Main St
A32: =+A31+B32 -> 47.4 | B32: 00.6 | C32: =+A32*$D$7 -> 76.266600000000011 | D32: =+B32*$D$7 -> 0.96539999999999992 | F32: R Rt 2
A33: =+A32+B33 -> 47.4 | B33: 0.0 | C33: =+A33*$D$7 -> 76.266600000000011 | D33: =+B33*$D$7 -> 0.0 | E33: #3 | F33: Monroe - Chevron Mini-mart
A34: =+A33+B34 -> 80.4 | B34: 33.0 | C34: =+A34*$D$7 -> 129.36360000000002 | D34: =+B34*$D$7 -> 53.097000000000001 | E34: #4 | F34: R Skykomish - Open
A35: =+A34+B35 -> 130.4 | B35: 50.0 | C35: =+A35*$D$7 -> 209.81360000000001 | D35: =+B35*$D$7 -> 80.45 | E35: #5 | F35: R Levenworth - Chevron Mini-Mart
A36: =+A35+B36 -> 136.4 | B36: 6.0 | C36: =+A36*$D$7 -> 219.4676 | D36: =+B36*$D$7 -> 9.6539999999999999 | F36: R Rt 97
A37: =+A36+B37 -> 171.8 | B37: 35.4 | C37: =+A37*$D$7 -> 276.42619999999999 | D37: =+B37*$D$7 -> 56.958599999999997 | F37: VR Rt 970
A38: =+A37+B38 -> 179.2 | B38: 7.4 | C38: =+A38*$D$7 -> 288.33280000000002 | D38: =+B38*$D$7 -> 11.906600000000001 | F38: St Rt 10
A39: =+A38+B39 -> 183.3 | B39: 4.1 | C39: =+A39*$D$7 -> 294.92970000000003 | D39: =+B39*$D$7 -> 6.5968999999999998 | F39: St at Stop Stay on 1st street
A40: =+A39+B40 -> 183.8 | B40: 0.5 | C40: =+A40*$D$7 -> 295.73420000000004 | D40: =+B40*$D$7 -> 0.80449999999999999 | E40: #6 | F40: W Cle Elum - Safeway
A41: =+A40+B41 -> 184.0 | B41: 00.2 | C41: =+A41*$D$7 -> 296.05599999999998 | D41: =+B41*$D$7 -> 0.32180000000000003 | F41: R on to 1st & onto I90
A42: =+A41+B42 -> 232.0 | B42: 48.0 | C42: =+A42*$D$7 -> 373.28800000000001 | D42: =+B42*$D$7 -> 77.231999999999999 | F42: R Edgewick Rd
A43: =+A42+B43 -> 232.1 | B43: 00.1 | C43: =+A43*$D$7 -> 373.44889999999998 | D43: =+B43*$D$7 -> 0.16090000000000002 | E43: #7 | F43: E. North Bend - Kens Truck Stop
A44: =+A43+B44 -> 232.1 | B44: 0.0 | C44: =+A44*$D$7 -> 373.44889999999998 | D44: =+B44*$D$7 -> 0.0 | F44: R SE North Bend Way (West)
A45: =+A44+B45 -> 235.8 | B45: 3.7 | C45: =+A45*$D$7 -> 379.40219999999999 | D45: =+B45*$D$7 -> 5.9533000000000005 | F45: R onto North Bend Way
A46: =+A45+B46 -> 235.9 | B46: 00.1 | C46: =+A46*$D$7 -> 379.56309999999996 | D46: =+B46*$D$7 -> 0.16090000000000002 | F46: BL onto SR 202
A47: =+A46+B47 -> 243.9 | B47: 8.0 | C47: =+A47*$D$7 -> 392.43509999999998 | D47: =+B47*$D$7 -> 12.872 | F47: X Bridge, BR on SR 202
A48: =+A47+B48 -> 247.3 | B48: 3.4 | C48: =+A48*$D$7 -> 397.90569999999997 | D48: =+B48*$D$7 -> 5.4706000000000001 | F48: L onto 292 Ave S.E, becomes Duthie Hill Rd
A49: =+A48+B49 -> 249.5 | B49: 2.2 | C49: =+A49*$D$7 -> 401.44549999999992 | D49: =+B49*$D$7 -> 3.5398000000000001 | F49: R onto Issaquah Beaver Lake Rd, becomes S.E 32nd St, becomes 32nd Way
A50: =+A49+B50 -> 251.2 | B50: 1.7 | C50: =+A50*$D$7 -> 404.18079999999992 | D50: =+B50*$D$7 -> 2.7353000000000001 | F50: R onto 238th St
A51: =+A50+B51 -> 251.3 | B51: 00.1 | C51: =+A51*$D$7 -> 404.34169999999995 | D51: =+B51*$D$7 -> 0.16090000000000002 | E51: #8 | F51: Finish - R onto 30th St - FINISH 2341 SE 30th St