C1: SIR 400 km Brevet - White Pass, Chinook & Cayuse
C2: May 26-27th, 2001 Start: 5:00am
A3: Mile | B3: Leg | C3: Instruction | D3: Km | E3: Leg
A5: 0.0 | B5: =A5-A4 -> 0.0 | C5: Control #1 Enumclaw, WA - Best Western Park Center Hotel | D5: =A5*1.609 -> 0.0 | E5: =B5*1.609 -> 0.0
A6: 0.0 | B6: =A6-A5 -> 0.0 | C6: Best Western Park Center Hotel (1000 Griffin Ave, 1-360-825-4490) | D6: =A6*1.609 -> 0.0 | E6: =B6*1.609 -> 0.0
A7: 00.1 | B7: =A7-A6 -> 00.1 | C7: RIGHT (North-West) onto Stevenson Ave | D7: =A7*1.609 -> 0.16090000000000002 | E7: =B7*1.609 -> 0.16090000000000002
A8: 00.2 | B8: =A8-A7 -> 00.1 | C8: LEFT (South-West) onto Cole St | D8: =A8*1.609 -> 0.32180000000000003 | E8: =B8*1.609 -> 0.16090000000000002
A9: 00.6 | B9: =A9-A8 -> 00.4 | C9: BR (South-West) onto SR-410 | D9: =A9*1.609 -> 0.96539999999999992 | E9: =B9*1.609 -> 0.64359999999999995
A10: 3.3 | B10: =A10-A9 -> 2.7 | C10: LEFT (East) onto Park Ave | D10: =A10*1.609 -> 5.3096999999999994 | E10: =B10*1.609 -> 4.3442999999999996
A11: 3.4 | B11: =A11-A10 -> 00.1 | C11: RIGHT (South-West) onto (N) River Ave [N River Rd] | D11: =A11*1.609 -> 5.4706000000000001 | E11: =B11*1.609 -> 0.16090000000000015
A12: 4.1 | B12: =A12-A11 -> 00.7 | C12: Continue (South-West) on SR-165 [WA-165 E] | D12: =A12*1.609 -> 6.5968999999999998 | E12: =B12*1.609 -> 1.1262999999999996
A13: 5.7 | B13: =A13-A12 -> 1.6 | C13: Continue (West) on SR-162 [Pioneer Way E] | D13: =A13*1.609 -> 9.1713000000000005 | E13: =B13*1.609 -> 2.5744000000000007
A14: 8.0 | B14: =A14-A13 -> 2.3 | C14: South Prairie | D14: =A14*1.609 -> 12.872 | E14: =B14*1.609 -> 3.7006999999999999
A15: 14.5 | B15: =A15-A14 -> 6.5 | C15: LEFT (South) onto Orville Rd E | D15: =A15*1.609 -> 23.330500000000001 | E15: =B15*1.609 -> 10.458500000000001
A16: 23.6 | B16: =A16-A15 -> 9.1 | C16: ST (South) @ Stop Sign, Kapawsin Store | D16: =A16*1.609 -> 37.9724 | E16: =B16*1.609 -> 14.641900000000001
A17: 32.7 | B17: =A17-A16 -> 9.1 | C17: LEFT (East) onto SR-161 (E) [SR-161 E] | D17: =A17*1.609 -> 52.614300000000007 | E17: =B17*1.609 -> 14.641900000000001
A18: 36.0 | B18: =A18-A17 -> 3.3 | C18: ST (South) @ Stop Sign, Eatonville | D18: =A18*1.609 -> 57.923999999999999 | E18: =B18*1.609 -> 5.309699999999995
A19: 38.0 | B19: =A19-A18 -> 2.0 | C19: BL (East) onto SR-7 [Mountain Hwy] | D19: =A19*1.609 -> 61.141999999999996 | E19: =B19*1.609 -> 3.218
A20: 50.0 | B20: =A20-A19 -> 12.0 | C20: Control # 2 Elbe, Open | D20: =A20*1.609 -> 80.45 | E20: =B20*1.609 -> 19.308
A21: 50.0 | B21: =A21-A20 -> 0.0 | C21: BL (East) onto SR-706 [National Park Hwy] | D21: =A21*1.609 -> 80.45 | E21: =B21*1.609 -> 0.0
A22: 54.8 | B22: =A22-A21 -> 4.8 | C22: Ashford | D22: =A22*1.609 -> 88.173199999999994 | E22: =B22*1.609 -> 7.723199999999995
A23: 57.2 | B23: =A23-A22 -> 2.4000000000000057 | C23: RIGHT (South) onto FR-52 Rd / Skate Creek Road | D23: =A23*1.609 -> 92.034800000000004 | E23: =B23*1.609 -> 3.861600000000009
A24: 79.3 | B24: =A24-A23 -> 22.1 | C24: Control # 3 Packwood, Texaco | D24: =A24*1.609 -> 127.5937 | E24: =B24*1.609 -> 35.558899999999987
A25: 79.3 | B25: =A25-A24 -> 0.0 | C25: BL (North) onto US-12 | D25: =A25*1.609 -> 127.5937 | E25: =B25*1.609 -> 0.0
A26: 103.0 | B26: =A26-A25 -> 23.7 | C26: White Pass (4500'), Store (closes 7:00pm) | D26: =A26*1.609 -> 165.727 | E26: =B26*1.609 -> 38.133300000000006
A27: 137.0 | B27: =A27-A26 -> 34.0 | C27: R (East) @ Blinking lights, continue to Yakima | D27: =A27*1.609 -> 220.43299999999999 | E27: =B27*1.609 -> 54.706000000000003
A28: 150.0 | B28: =A28-A27 -> 13.0 | C28: L (North) @ Light onto Old Naches Hwy | D28: =A28*1.609 -> 241.35 | E28: =B28*1.609 -> 20.917000000000002
A29: 150.0 | B29: =A29-A28 -> 0.0 | C29: Control # 4 Yakima, Texaco / Sun Tides Market | D29: =A29*1.609 -> 241.35 | E29: =B29*1.609 -> 0.0
A30: 150.0 | B30: =A30-A29 -> 0.0 | C30: Turnaround, Go to same light, Right (West) onto US-12 | D30: =A30*1.609 -> 241.35 | E30: =B30*1.609 -> 0.0
A31: 163.0 | B31: =A31-A30 -> 13.0 | C31: ST (West) onto SR-410 | D31: =A31*1.609 -> 262.267 | E31: =B31*1.609 -> 20.917000000000002
A32: 177.0 | B32: =A32-A31 -> 14.0 | C32: Squaw Rock Resort (open til 8:00pm) | D32: =A32*1.609 -> 284.79300000000001 | E32: =B32*1.609 -> 22.526
A33: 183.0 | B33: =A33-A32 -> 6.0 | C33: Control # 5 Cliffdell, stay on SR-410 (West) (open til 11:00pm) | D33: =A33*1.609 -> 294.447 | E33: =B33*1.609 -> 9.6539999999999999
A34: 210.0 | B34: =A34-A33 -> 27.0 | C34: Chinook Pass (5430') | D34: =A34*1.609 -> 337.89 | E34: =B34*1.609 -> 43.442999999999998
A35: 213.0 | B35: =A35-A34 -> 3.0 | C35: Cayuse Pass (4675') | D35: =A35*1.609 -> 342.71699999999998 | E35: =B35*1.609 -> 4.827
A36: 213.0 | B36: =A36-A35 -> 0.0 | C36: Right (North-West) towards Enumclaw
A37: 221.0 | B37: =A37-A35 -> 8.0 | C37: Control # 6 Crystal Mtn Blvd, SIR staffed | D37: =A37*1.609 -> 355.589 | E37: =B37*1.609 -> 12.872
A38: 236.0 | B38: =A38-A37 -> 15.0 | C38: Greenwater, (store open til 9:00pm, 1-360-663-2357) | D38: =A38*1.609 -> 379.72399999999999 | E38: =B38*1.609 -> 24.135000000000002
A39: 253.0 | B39: =A39-A38 -> 17.0 | C39: BR (North-West) onto SR-164 [Griffin Ave] | D39: =A39*1.609 -> 407.077 | E39: =B39*1.609 -> 27.353000000000002
A40: 254.0 | B40: =A40-A39 -> 1.0 | C40: FINISH !! Enumclaw, WA - Best Western Park Center Hotel | D40: =A40*1.609 -> 408.68599999999998 | E40: =B40*1.609 -> 1.609