C1: Seattle International Randonneurs 400 km Brevet - June 12th, 1999
A2: Miles | B2: Leg | C2: Control# & Instructions | D2: Km | E2: Leg
A3: 0 | B3: 0 | C3: Left from TZ house onto NE 140th St (West) | D3: 0.0 | E3: 0.0
A4: =+A3+B4 -> 00.1 | B4: 00.1 | C4: R - 232nd St NE | D4: 00.16 | E4: 00.16
A5: =+A4+B5 -> 2.2 | B5: 2.1 | C5: L - Old Woodinville-Duvall Rd (course official start) | D5: 3.5 | E5: 3.4
A6: =+A5+B6 -> 2.8 | B6: 00.6 | C6: R on Woodinville Duvall Rd. | D6: 4.5 | E6: 4.4
A7: =+A6+B7 -> 4.8 | B7: 2.0 | C7: L on Hwy. 203 at the stop light in Duvall | D7: 7.7 | E7: 3.2
A8: =+A7+B8 -> 13.5 | B8: 8.7 | C8: R on Main St. in Monroe, watch out X'ing RR tracks | D8: 21.7 | E8: 14.0
A9: =+A8+B9 -> 13.8 | B9: 00.3 | C9: VR onto Hwy. 2 | D9: 22.2 | E9: 0.5
A10: =+A9+B10 -> 46.8 | B10: 33.0 | C10: Control #1 - R to Skykomish - Open | D10: 75.4 | E10: 53.1
A11: =+A10+B11 -> 96.8 | B11: 50.0 | C11: Control #2 - L into Chevron Mini Mart in Leavenworth | D11: 155.9 | E11: 80.5
A12: =+A11+B12 -> 102.8 | B12: 6.0 | C12: R on Hwy. 97 towards Blewitt Pass | D12: 165.5 | E12: 9.7
A13: =+A12+B13 -> 138.2 | B13: 35.4 | C13: VR onto Hwy. 970 | D13: 222.5 | E13: 57.0
A14: =+A13+B14 -> 145.6 | B14: 7.4 | C14: ST on Hwy. 10 towards Cle Elum | D14: 234.2 | E14: 11.9
A15: =+A14+B15 -> 150.2 | B15: 4.6 | C15: Control #3 - West Cle Elum Safeway | D15: 241.8 | E15: 7.4
A16: =+A15+B16 -> 150.4 | B16: 00.2 | C16: R onto 1st & I-90, go west and Snoqualmie Pass | D16: 242.1 | E16: 00.3
A17: =+A16+B17 -> 198.4 | B17: 48.0 | C17: R at Edgewick Rd. | D17: 319.1 | E17: 77.3
A18: =+A17+B18 -> 198.5 | B18: 00.1 | C18: Control #4 - BP Truck Stop at North Bend | D18: 319.3 | E18: 00.16
A19: =+A18+B19 -> 198.5 | B19: 0.0 | C19: R onto SE North Bend Way (West) | D19: 319.3 | E19: 0.0
A20: =+A19+B20 -> 202.2 | B20: 3.7 | C20: R onto North Bend Way | D20: 325.1 | E20: 6.0
A21: =+A20+B21 -> 202.3 | B21: 00.1 | C21: VL onto Hwy. 202 | D21: 325.2 | E21: 00.16
A22: =+A21+B22 -> 210.3 | B22: 8.0 | C22: X Bridge, VR onto SR 202 | D22: 338.1 | E22: 12.9
A23: =+A22+B23 -> 212.7 | B23: 2.4 | C23: R onto 308th Ave. | D23: 342.0 | E23: 3.9
A24: =+A23+B24 -> 213.5 | B24: 00.8 | C24: L onto West Snoqualmie River Rd. | D24: 343.3 | E24: 1.3
A25: =+A24+B25 -> 218.2 | B25: 4.7 | C25: R at NE Tolt Hill Rd. | D25: 350.9 | E25: 7.6
A26: =+A25+B26 -> 219 | B26: 00.8 | C26: L onto Hwy. 203, go through Carnation | D26: 352.1 | E26: 1.3
A27: =+A26+B27 -> 220.8 | B27: 1.8 | C27: L onto Carnation Farms Rd. | D27: 355.0 | E27: 2.9
A28: =+A27+B28 -> 225.2 | B28: 4.4 | C28: R at NE 80th St. | D28: 362.1 | E28: 7.1
A29: =+A28+B29 -> 226 | B29: 00.8 | C29: VR at West Snoqualmie Valley Rd. | D29: 363.4 | E29: 1.3
A30: =+A29+B30 -> 235.5 | B30: 9.5 | C30: ST - W. Snoqualmie turns into High Bridge Rd. | D30: 378.7 | E30: 15.3
A31: =+A30+B31 -> 240.7 | B31: 5.2 | C31: L onto Fales Rd. | D31: 387.0 | E31: 8.4
A32: =+A31+B32 -> 242.7 | B32: 2.0 | C32: R onto Downe Rd. | D32: 390.3 | E32: 3.2
A33: =+A32+B33 -> 243.5 | B33: 00.8 | C33: L onto Yew Way | D33: 391.6 | E33: 1.3
A34: =+A33+B34 -> 244.5 | B34: 1.0 | C34: VL Yew Way | D34: 393.2 | E34: 1.6
A35: =+A34+B35 -> 244.8 | B35: 00.3 | C35: X Malby Rd. | D35: 393.7 | E35: 0.5
A36: =+A35+B36 -> 244.9 | B36: 00.1 | C36: L onto Paradise Lk. Rd., X Hwy. 522 | D36: 393.8 | E36: 00.16
A37: =+A36+B37 -> 249.6 | B37: 4.7 | C37: L onto Woodinville-Duvall Rd. | D37: 401.4 | E37: 7.6
A38: =+A37+B38 -> 250.9 | B38: 1.3 | C38: R onto Old Woodinville-Duvall Rd. | D38: 403.5 | E38: 2.1
A39: =+A38+B39 -> 251.7 | B39: 00.8 | C39: R onto 232nd Ave. | D39: 404.8 | E39: 1.3
A40: =+A39+B40 -> 253.7 | B40: 2.0 | C40: L onto 140th St., (gravel road) | D40: 408.0 | E40: 3.2
A41: =+A40+B41 -> 253.8 | B41: 00.1 | C41: R into Terry Zymrhal's house, FINISH (YEAH!!!) | D41: 408.2 | E41: 00.16
A42: Zmrhal - home 425-844-8718
A43: L = left, R = right, BR = bear right, BL = bear left, ST = straight, TA = turn around, X = cross
A44: JR = jog right, JL = jog left, RR = railroad, SR = state route, US = US hwy
A45: N = north, S = south, E = east, W = west